id,question,option_a,option_b,option_c,option_d,correct_option,model_answer,contexts,sources,similarity_score,difficulty,category
gut_intro_mcq_001,How many bacterial species have been isolated from human beings according to the MetaHit and Human Microbiome Project?,"1,000 species","2,172 species","5,000 species","10,000 species",B,"Option: B
The MetaHit and Human Microbiome Project have identified a significant number of bacterial species that inhabit the human body. According to these studies, approximately 2,172 different bacterial species have been isolated from humans. This number highlights the vast diversity of microorganisms present in the human microbiome.","['. Next, to take compositionality into account, the relative abundance table was transformed using the center log ratio (CLR) prior to PC analysis. PC analysis was carried out using the prcomp() function in the stats R package (R Core Team, 2022). Inference of taxonomic content of the gut microbiome and between- group comparisons Prior to downstream analyses, all bacterial taxa observed only in a single donor and at a relative abundance of less than 0.0001 were discarded. The choice of an abundance threshold ensured that we kept rare bacterial species that can impact human disease, as demonstrated in recent work (Chriswell et al., 2022). Metaphlan v4.0 tool was used to infer both known bacterial species and strains as well as uncharacterized bacterial species. Uncharacterized bacterial species in the metaphlan v4.0 tool are deﬁned in terms of species-level genome bins (SGBs) using so-called metagenomically assembled genomes (MAGs) (Blanco-Mı́guez et al., 2023)', '. Using MetaPhlAn2 for taxonomic proﬁling, we identiﬁed 11 phyla, 156 genera and 400 species across the three groups (Tables S2, S3, S4). Compared with the number of species present in the controls, the species present in the patients was signiﬁcantly decreased (P = 1.95E-5; Wilcoxon rank-sum test; Figure 1A). Consistently, the Shannon index, indicating within-sample (α) diversity, was much lower for the P groups than that for the controls (P = 2.84E- 4; Wilcoxon rank-sum test; Figure 1B). NMDS analysis based on genus relative abundance also revealed striking diﬀerences between the C and P groups especially at the NMDS 2 axis (Figure 1C). Gut Bacteria Associated With M. tuberculosis Infection We then compared the relative abundance of each identiﬁed species across the two groups to identify the bacteria in the human gut microbiota that are altered in response to M. tuberculosis infection. We found that 25 species were diﬀerentially enriched in the two groups', '. More reliable estimates of microbiota composition and diversity may be provided by whole-genome shotgun metagenomics due to the higher resolution and sensitivity of these techniques [14]. Combined data from the MetaHit and the Human Microbiome Project have provided the most comprehensive view of the human-associated microbial repertoire to date [17,18]. Compiled data from these studies identiﬁed 2172 species isolated from human beings, classiﬁed into 12 different phyla, of which 93.5% belonged to Proteobacteria, Firmicutes, Actinobacteria and Bacteroidetes. Three of the 12 identiﬁed phyla contained only one species isolated from humans, including an intestinal species, Akkermansia muciniphila, the only known repre- sentative of the Verrucomicrobia phyla. In humans, 386 of the identiﬁed species are strictly anaerobic and hence will generally be found in mucosal regions such as the oral cavity and the GI tract [17]', 'Afzaal et al. 10.3389/fmicb.2022.999001 Introduction The association of human health with the intestine has been long acknowledged as Hippocrates said, “Death sits in the bowls” in 400 B.C. Many studies worldwide have focused on the signiﬁcant impact of intestinal microbiota on human health and disease (AboNahas et al., 2022). The human body is colonized by a diversity of bacteria, viruses, archaea, and unicellular eukaryotes. Microbes inhabit all human body surfaces, but a signiﬁcant number of microbes live in the gastrointestinal tract/gut. The human gut possesses approximately more than one thousand microbial species that form a complex ecological community called gut microbiota (Lagier et al., 2016). The human gut microbiota is carrying about 150 times more genes compared to the entire human genome', '. Statistics All statistical analyses were performed using R packages. The Wilcoxon rank-sum test was used to compare continuous variables. Two-tailed Fisher’s exact test was used to compare diﬀerences in SNP distributions between groups. Spearman’s rank test was performed to analyze the correlation between species. When multiple hypothesis tests were performed simultaneously, P-values were corrected using Benjamini and Hochberg’s false discovery rate (FDR) (Benjamini and Hochberg, 1995). RESULTS AND DISCUSSION Microbial Diversity is Decreased in TB Patients To characterize alterations in the gut microbiota in TB patients, we analyzed the microbial composition and metabolic potential of the gut microbiota in 61 samples from the C (n = 31) and P (n = 30) groups (Table S1). Using MetaPhlAn2 for taxonomic proﬁling, we identiﬁed 11 phyla, 156 genera and 400 species across the three groups (Tables S2, S3, S4)', '. 3.1.1. Increasing the Abundance of Specific Members of the Microbiome. A low microbial diversity of the human microbiome is significantly associated with several diseases.206 However, the changes observed in the microbiome composition might be dissimilar in different populations. For example, Dutch and Belgian cohorts showed a negative correlation between the Bacteroidetes enrichment and diversity,207 whereas a positive correlation was observed between Bacteroidetes and diversity in African individuals,208 underscoring the need for population- specific comparisons of the microbiome between healthy individuals and patients. The ratio of the two most dominant phyla in the microbiome, namely, Firmicutes/Bacteroidetes, is one of the most important parameters representing microbiome diversity, at least in the gut', '. (B) The rarefaction curves of two groups tended to be ﬂat, indicating that the amount of sequencing data is large enough to reﬂect the majority of microbial species information in the sample. (C) The alpha diversity was assessed using the ACE, Chao1, Shannon and Simpson indexes, which showed signiﬁcant differences between the PTB and HCs groups. *P<0.05, **P<0.01, ***P<0.001. Wilcoxon rank-sum test followed by Benjamini–Hochberg false discovery rate (FDR) correction. (D) PCoA based on Bray-Curtis, weighted_unifrac and Unweighted_Unifrac distance showed that gut microbiota in PTB separated from HCs (P<0.05). The signiﬁcance was assessed by permutational multivariate analysis of variance (PERMANOVA) using the R package “vegan”. PTB, pulmonary tuberculosis; HCs, healthy controls. Ye et al. 10.3389/fcimb.2022.1090889 Frontiers in Cellular and Infection Microbiology frontiersin.org 05', '. Figure 1 Total abundance of bacteria according to the different body sites. Bounds for bacteria number in different organs, derived from bacterial concentrations and volume.190 191 Table 1 PubMed-\xadlisted articles regarding topics, “microbiome and diseases” Diseases PubMed search PubMed search “disease & microbiome” “disease & microbiome/ clinical trial” IBDs 2867 36 Coeliac disease 524 20 IBS 1516 96 Colorectal carcinoma 1525 43 Liver disease 4927 113 Pancreatic disease 766 20 Obesity 7146 292 Type 2 diabetes 2155 99 Non-\xadalcoholic fatty liver disease 1383 31 PubMed search 15 December 2021. Protected by copyright, including for uses related to text and data mining, AI training, and similar technologies. . at National Institute of Immunology, New Delhi on January 10, 2026 http://gut.bmj.com/ Downloaded from 1 February 2022. 10.1136/gutjnl-2021-326789 on Gut: first published as', '. Introduction The human gastrointestinal (GI) tract represents one of the largest interfaces (250–400 m2) between the host, environmental factors and antigens in the human body. In an average life time, around 60 tonnes of food pass through the human GI tract, along with an abundance of microorganisms from the environment which impose a huge threat on gut integrity [1]. The collection of bacteria, archaea and eukarya colonising the GI tract is termed the ‘gut microbiota’ and has co-evolved with the host over thousands of years to form an intricate and mutually beneﬁcial relationship [2,3]. The number of microorganisms inhabiting the GI tract has been estimated to exceed 1014, which encom- passes ∼10 times more bacterial cells than the number of human cells and over 100 times the amount of genomic content (microbiome) as the human genome [2,4]. However, a recently revised estimate has suggested that the ratio of human:bacterial cells is actually closer to 1:1 [5]', '. First, we estimated the abundance of 58 species that were significantlydifferent in abundance between LGC and HGC individuals (Supplementary Table 6). For each individual, we used these values to compute a score, named decisive bacterial abund- ance (DBA) score, equal to the sum of abundances of the species more frequent in HGC individuals subtracted by the sum of the abundances of species more frequent in LGC individuals. The DBA scores were calculated exhaustively for all combinations of up to 19 species and were used in the ROC analysis; the area under curve (AUC) values for the best combinations are shown in Fig. 2b, left. The best combina- tion of four species gave an AUC value of 0.98 (Fig. 2b, right); in a tenfold cross-validation test40 with 90% of randomly chosen individuals the AUC value of 0.9766 0.02 (mean6 s.d.) was obtained for the groups of the remaining 10%, indicating the robustness of the analysis']","['1-Introduction to the human gut microbiota.pdf', '14-Richness of human gut microbiome correlates with metabolic markers(Obesity).pdf', '17-Excess fermentation and lactic acidosis as detrimental functions of the gut microbes in treatment-naive TB patients.pdf', '2-Gut microbiome and health- mechanistic insights.pdf', '23-The correlation between dysfunctional intestinal flora and pathology feature of patients with pulmonary tuberculosis.pdf', '24-The Gut Microbiome Signatures Discriminate Healthy From Pulmonary Tuberculosis Patients.pdf', '3-Human gut microbiota.pdf', '6-Microbiome and Human Health.pdf']",0.2065,easy,factual
gut_intro_mcq_002,"What percentage of the 2,172 human-associated bacterial species belong to Proteobacteria, Firmicutes, Actinobacteria and Bacteroidetes?",75.5%,85.0%,93.5%,99.0%,C,"Option: C

Explanation: The question asks for the percentage of human-associated bacterial species that belong to four specific phyla (Proteobacteria, Firmicutes, Actinobacteria, and Bacteroidetes). According to various sources, including a 2016 study published in Nature Reviews Microbiology, these four phyla account for approximately 93.5% of the human microbiome.","['. The principal coordinate analysis (PCoA), based on Bray-Curtis, unweighted UniFrac and weighted UniFrac distances were performed to identify the difference in fecal microbiota composition between PTB patients and HCs. As shown in Figure 1D, there was a tendency of separation and had a partial overlap between two groups, which demonstrated that the total community of gut microbiota in the two groups was different. The compositions of the fecal microbiota in the PTB patients and the HCs were assessed at different taxonomic levels, and the top 20 relative abundance of bacteria were shown in Figure 2A. At the phylum level, we observed an enrichment of Bacteroidota (33.10% vs. 27.08%), Proteobacteria(12.99% vs. 9.83%) and Fusobacteriota(0.58% vs. 0.56%, P<0.05), and a remarkable decrease of Firmicutes(48.07% vs. 55.89%, P<0.05) and Actinobacteriota(2.44% vs. 5.83%, P<0.01) in PTB patients compared with HCs (Figure 2B)', 'Del Chierico et al. Gut Microbiota Age-Dependent Patterns in Obesity and Verrucomicrobia). Applying the Kruskal–Wallis test on the relative abundances of phyla for the four groups, we observed statistically signiﬁcant diﬀerences in the distributions of Actinobacteria, Bacteroidetes, and Firmicutes (p < 0.05). However, a false discovery rate (FDR) correction of p-values deﬁned Actinobacteria as the only signiﬁcant taxon diﬀerentially describing the four groups (Figure 2A and Supplementary Table S1). Particularly, the distribution of Actinobacteria and Bacteroidetes were statistically signiﬁcant for the ob_ado/ob_adult couple, with Actinobacteria levels being higher in the ob_ado group, and Bacteroidetes levels being uppermost in the ob_adult group. Actinobacteria, Bacteroidetes, and Firmicutes were statistically signiﬁcant for adolescent obese versus CTRL (Supplementary Table S2)', '. 1c, Table S2). At the genus level, the variation trend of dominant bacterial genera (an abundance > 0.1% in the two groups) is shown in Table S3. Among the dominant microbiota, the abundance of Bacteroides, Prevotella, and Feacalibacterium was higher, and the abundance of Blautia, Bifidobacterium, and Eubacterium_ hallii_group were lowered in the TB group vs. HC group (Fig. 1d). To better understand the difference in micro\xad biota between the two groups, we further performed a LEfSe analysis according to a linear discriminant analysis (LDA) score ≥ 4.0. The results of LEfSe analysis showed that 11 key genera were different between the two groups (Fig. 1e). The cladogram Figure (from phylum to genus level) shows that altered genera mainly belonged to Bac\xad teroidetes, Firmicutes, and Proteobacteria (Fig. 1f). Over\xad all, our data indicate that the gut bacterial diversity and composition have been altered in TB patients', '. In general, the major bacteria present in oral microbiota are Firmicutes, Proteobacteria, Bacter- oidetes, Actinobacteria, and Fusobacteria. Although healthy human lungs were long considered sterile, numerous studies have demonstrated that microbiota is also present in lung tissues.11 The core lung microbiota included Actinobacteria, Bacteroidetes, Firmicutes, and Proteobacteria. The composition of lung microbiota is primarily determined by three factors: 1) microbial immigration, 2) the elimination of micro- organisms, and 3) the reproduction rates of microorganisms.12 In human skin, the distribution and variety of glands and hair follicles vary among each geographic region. The physical and chemical differences of skin regions create distinct composition of microbiota.13 Generally, the skin microbiota is composed of Actinobacteria, Bacteroidetes, Cyanobacteria, Firmicutes, and Proteobacteria', '. Our results suggest that untreated TB patients arrive at the hospital with a strongly disturbed gut community. Differentially abundant bacterial taxa between TB patients and healthy controls We characterized microbiomes at different taxonomic resolutions to facilitate comparison with published data. At the phylum level, TB patients showed an apparent increase in Firmicutes abundance (36.4% vs. 21.3% in controls, p = 0.03) and an elevated proportion of Actinobacteria (1.8% vs. 0.2%, p = 0.0002) and Proteobacteria (5.6% vs. 3.8%, p > 0.05) (Figure 2A). This increase in Firmicutes was at the expense of Bacteroidetes (54% vs. 72.2%), a frequent sign of a disturbed gut microbiome. Taxonomic composition at the genus, family, and order levels was also strongly altered in TB patients (Supplementary Figure 2). We next used LEfSe, a linear discriminant analysis, to identify the combination of microbial species that differentiate TB patients’ gut microbiomes from HCs (Segata et al., 2011)', '. Since gut microbiota has major impact to host innate and adaptive immune responses, the translation of ﬁndings from rodents to human should be carefully validated before drawing deﬁnite conclusions. While human and murine gut microbiota has 90% overlapping in phyla and genera levels, the composition and abundance of microbes have key discrepancies.27 For instance, the major difference is the Firmicutes/Bacteroidetes ratio, where it is signiﬁcantly higher in human than mice. Particularly, human Bacteroidetes is mainly composed of Prevotellaceae and Bacteroidaceae, while mice Bacteroidetes are primarily composed of S24-7. Regarding the Firmicutes, Ruminococcaceae is the major phylum observed in human and Clostridiales is the major one observed in mice', '. A vast majority of commensal bacteria reside in the colon, whereas a lower bacterial population is found in the stomach and small intestine. The main bacterial phyla present in the gut are Firmicutes and Bacteroides, which make up 90% of the gut microbiota.46 Other phyla that exist in the gut environment are Actinobacteria, Proteobacteria, Fusobacteria, and Verrucomi- crobia.46 Notably, there are 200 different genera found under the Firmicutes phylum, with some examples including Bacillus, Lactobacillus, Enterococcus, Clostridium, and Ruminococcus. Although lactobacilli are beneficial to health, some Firmicutes species such as Staphylococcus aureus and Clostridium perfringens are harmful to the body when overgrown. Meanwhile, the predominant genera in Bacteroidota are Bacteroides and Prevotella. The less abundant Actinobacteria phylum is largely represented by Bifidobacterium, and this genus is known to have a positive impact on health', '. 3.1.1. Increasing the Abundance of Specific Members of the Microbiome. A low microbial diversity of the human microbiome is significantly associated with several diseases.206 However, the changes observed in the microbiome composition might be dissimilar in different populations. For example, Dutch and Belgian cohorts showed a negative correlation between the Bacteroidetes enrichment and diversity,207 whereas a positive correlation was observed between Bacteroidetes and diversity in African individuals,208 underscoring the need for population- specific comparisons of the microbiome between healthy individuals and patients. The ratio of the two most dominant phyla in the microbiome, namely, Firmicutes/Bacteroidetes, is one of the most important parameters representing microbiome diversity, at least in the gut', '. This illustration was created with BioRender.com. b, Mean relative abundance for the top 25 universal (present in all 10 cohorts), overlapping (present in at least two cohorts) and singular (found in only one cohort) species by cohort. The centers of the boxplot show the median, with boxes indicating their interquartile range (IQR), and upper and lower whiskers indicating 1.5× the IQR from above the upper quartile and below the lower quartile, respectively. c, Principal coordinate analysis (PCoA) showed a significant association between the configuration of the microbiome and T2D and an expected trade-off between Bacteroidetes and Firmicutes phyla, with the PCo1 axis explaining 18.7% of the variance and the PCo2 axis explaining 8.4% of the variance in all three plots. PCoA was based on species- level Bray–Curtis dissimilarity', '. (A). The average relative abundance of bacterial taxa at the phylum level in TB patients and HCs. Asterisks indicate taxa that showed statistically signiﬁcant differences between the TB group and HCs based on the ANCOM statistical analysis (P < 0.05); (B). Barplot depicting top bacterial species (LDA scores > 4.5) discriminating between groups. Yunusbaeva et al. 10.3389/fcimb.2024.1331521 Frontiers in Cellular and Infection Microbiology frontiersin.org 05']","['13-Gut Microbiota Markers in Obese Adolescent and Adult Patients(Obese).pdf', '17-Excess fermentation and lactic acidosis as detrimental functions of the gut microbes in treatment-naive TB patients.pdf', '19-Gut bacterial and fungal dysbiosis in tuberculosis patients.pdf', '23-The correlation between dysfunctional intestinal flora and pathology feature of patients with pulmonary tuberculosis.pdf', '28-Strain-specific gut microbial signatures in type 2 diabetes identified in a cross-cohort analysis of 8,117 metagenomes.pdf', '5-Microbiota in health and diseases.pdf', '6-Microbiome and Human Health.pdf']",0.1203,medium,factual
gut_intro_mcq_003,Which bacterial species is the only known representative of the Verrucomicrobia phyla in the human gut?,Bacteroides thetaiotaomicron,Faecalibacterium prausnitzii,Akkermansia muciniphila,Ruminococcus bromii,C,"Option: C

Akkermansia muciniphila is a species of bacteria that belongs to the Verrucomicrobia phylum and is known to inhabit the human gut. It has been studied for its potential health benefits, including its role in maintaining a healthy gut microbiome.","['. More reliable estimates of microbiota composition and diversity may be provided by whole-genome shotgun metagenomics due to the higher resolution and sensitivity of these techniques [14]. Combined data from the MetaHit and the Human Microbiome Project have provided the most comprehensive view of the human-associated microbial repertoire to date [17,18]. Compiled data from these studies identiﬁed 2172 species isolated from human beings, classiﬁed into 12 different phyla, of which 93.5% belonged to Proteobacteria, Firmicutes, Actinobacteria and Bacteroidetes. Three of the 12 identiﬁed phyla contained only one species isolated from humans, including an intestinal species, Akkermansia muciniphila, the only known repre- sentative of the Verrucomicrobia phyla. In humans, 386 of the identiﬁed species are strictly anaerobic and hence will generally be found in mucosal regions such as the oral cavity and the GI tract [17]', '. A vast majority of commensal bacteria reside in the colon, whereas a lower bacterial population is found in the stomach and small intestine. The main bacterial phyla present in the gut are Firmicutes and Bacteroides, which make up 90% of the gut microbiota.46 Other phyla that exist in the gut environment are Actinobacteria, Proteobacteria, Fusobacteria, and Verrucomi- crobia.46 Notably, there are 200 different genera found under the Firmicutes phylum, with some examples including Bacillus, Lactobacillus, Enterococcus, Clostridium, and Ruminococcus. Although lactobacilli are beneficial to health, some Firmicutes species such as Staphylococcus aureus and Clostridium perfringens are harmful to the body when overgrown. Meanwhile, the predominant genera in Bacteroidota are Bacteroides and Prevotella. The less abundant Actinobacteria phylum is largely represented by Bifidobacterium, and this genus is known to have a positive impact on health', '. Since gut microbiota has major impact to host innate and adaptive immune responses, the translation of ﬁndings from rodents to human should be carefully validated before drawing deﬁnite conclusions. While human and murine gut microbiota has 90% overlapping in phyla and genera levels, the composition and abundance of microbes have key discrepancies.27 For instance, the major difference is the Firmicutes/Bacteroidetes ratio, where it is signiﬁcantly higher in human than mice. Particularly, human Bacteroidetes is mainly composed of Prevotellaceae and Bacteroidaceae, while mice Bacteroidetes are primarily composed of S24-7. Regarding the Firmicutes, Ruminococcaceae is the major phylum observed in human and Clostridiales is the major one observed in mice', '. The most highly represented phyla in the gastric mucosa under normal conditions are Proteobacteria, Firmicutes (recently renamed to Bacillota36), Bacteroidetes (recently renamed to Bacteroidota36), Actinobacteria, and Fusobacte- ria.37−39 The gastric juice has a diverse microbial community that differs from the gastric mucosa. The dominating phyla in gastric juice are Firmicutes, Actinobacteria, and Bacteroidetes, whereas Proteobacteria and Firmicutes are dominant in the gastric mucosa.37,40,41 Furthermore, bacteria found in the oral cavity and duodenum such as Veillonella, Lactobacillus, and Clostridium can transiently colonize the stomach.40,42 Unsurprisingly, H. pylori is the predominant bacterium in the stomach of H. pylori-infected patients,43 and most H', '. Phyla Firmicutes, Bacteroides, Actinobacteria, Proteobacteria, and Verrucomicrobia contribute to the signiﬁcant resident bacterial populations in the gut microbiome (Fava et al., 2019). The ﬁrst step in identifying the symbiotic interactions between intestinal microbes and their hosts is to describe the balanced composition of gut microbiota and disease-related variations. The microbes reside in a mutual association with the host in a healthy state, aﬀecting the host’s health by controlling nutrient metabolism, defending against pathogens, and delivering signals to immune cells to promote host physiology and immunity (Ribaldone et al., 2022). An initial underestimation of the total number of microbial species in the intestine has been described through several vivo and ex vivo studies due to complications in culturing certain microorganisms (Lagier et al., 2015)', '. Eubiosis conditions are eﬀective in controlling various diseases caused by microbes. Proper intake of a healthy diet and the development of eubiosis acts in favor of human health. The high intake of antibiotics causes an imbalance in the gut microbiota and favors systemic diseases (Santacroce et al., 2021). Several population-based studies have revealed the highly beneﬁcial role of human gut microbiota in healthy people, as well as the importance of well-understanding its structure and the factors that inﬂuence its composition, such as food, age, geography, systemic disorders, and drugs (Wang et al., 2017; Rowland et al., 2018). Phyla Firmicutes, Bacteroides, Actinobacteria, Proteobacteria, and Verrucomicrobia contribute to the signiﬁcant resident bacterial populations in the gut microbiome (Fava et al., 2019)', '. nucleatum has a role in CRC progression and metastasis. Non-bacterial dysbiosis. Thus far, most studies of microbial dysbiosis in the context of CRC have focused on bacteria owing to their rela\xad tively high abundance in the GI tract (comprising 93% of gut microbial sequences)44. However, improvements in sequencing technologies have enabled the detection of non-bacterial components of the gut Introduction The human gut microbiota is an ecosystem populated by bacteria, fungi, viruses, Archaea and parasites whose cells in total typically outnumber those of the host1. The number of microbial species resid\xad ing in the human gut is usually in the order of thousands at any given time2, representing a much greater level of genetic diversity than that of the human genome. Colonization of the newborn gastrointestinal (GI) tract begins in early life and co-evolves concomitantly with the host throughout development and adult life', '. The Western diet is overall linked to the surge of chronic inflammation72,73,81 leading to diet- related diseases, including obesity and many other non-communicable diseases14. Global diets associated with the microbiome Global regions have unique dietary patterns that impact the gut microbiome and host health. However, distinguishing its impacts from host-specific attributes to global or local environmental influ- ences poses a challenge, as other factors such as ethnicity also notably influence gut microbiota composition74,82. A recent study has char- acterized 5,230 gut metagenomes, reporting that members of the Bacteroides and Prevotella genera and the Firmicutes phylum are the dominant enterosignatures of Western populations, whereas non-Western populations have predominantly Prevotella spp', '. Further studies, focusing specificallyon the richness of the gut microbiota across broad cohorts, might help to determine the causes for its variation. Microbial species of LGC and HGC groups The differences in gene numbers indicate that the LGC and HGC indi- viduals contain different microbial communities. To assess the diffe- rence in phylogenetic composition between the two, we combined reference genome mapping with gene abundance data at the phylum, genus and species level. We first examined the general phylogenetic composition at higher taxonomic levels based on sample-wise rarefied read abundances that were mapped on publicly available reference genomes and binned at the genus and phylum level. Forty-six genera differed significantly in abundance between the HGC and LGC individuals (Supplementary Table 2). Although Bacteroides, Parabacteroides, Ruminococcus (spe- cifically R. torques and R', 'Del Chierico et al. Gut Microbiota Age-Dependent Patterns in Obesity and Verrucomicrobia). Applying the Kruskal–Wallis test on the relative abundances of phyla for the four groups, we observed statistically signiﬁcant diﬀerences in the distributions of Actinobacteria, Bacteroidetes, and Firmicutes (p < 0.05). However, a false discovery rate (FDR) correction of p-values deﬁned Actinobacteria as the only signiﬁcant taxon diﬀerentially describing the four groups (Figure 2A and Supplementary Table S1). Particularly, the distribution of Actinobacteria and Bacteroidetes were statistically signiﬁcant for the ob_ado/ob_adult couple, with Actinobacteria levels being higher in the ob_ado group, and Bacteroidetes levels being uppermost in the ob_adult group. Actinobacteria, Bacteroidetes, and Firmicutes were statistically signiﬁcant for adolescent obese versus CTRL (Supplementary Table S2)']","['1-Introduction to the human gut microbiota.pdf', '13-Gut Microbiota Markers in Obese Adolescent and Adult Patients(Obese).pdf', '14-Richness of human gut microbiome correlates with metabolic markers(Obesity).pdf', '26-Gut microbiota in colorectal cancer development and therapy.pdf', '3-Human gut microbiota.pdf', '4-The interplay between diet and the gut microbiome.pdf', '5-Microbiota in health and diseases.pdf', '6-Microbiome and Human Health.pdf']",0.4152,medium,factual
gut_intro_mcq_004,What is the typical ratio of propionate:butyrate:acetate in the GI tract?,3:1:1,1:1:3,2:2:1,1:3:1,B,"Option: D
The typical ratio of propionate, butyrate, and acetate in the GI tract is approximately 1:3:1, with acetate being the most abundant. This ratio can vary depending on factors such as diet and individual differences, but 1:3:1 is a commonly cited estimate.","['. Acetate is produced by most gut anaerobes, whereas propionate and butyrate are produced by different subsets of gut bacteria following dis- tinct molecular pathways [102]. Butyrate is produced from carbohydrates via glycolysis and acetoacetyl-CoA, whereas two pathways, the succinate or propanediol pathway, are known for the formation of propionate, depending on the nature of the sugar [102]. In the human gut, propionate is mainly produced by Bacteroidetes, whereas the production of butyrate is dominated by Firmicutes [102,139,140]. For example, fermentation of starch by specialist Actinobacteria and Firmicutes, e.g. Eubacterium rectale or E. hallii, is thought to contribute signiﬁcantly to butyrate production in the colon both directly and via metabolic cross-feeding [102]. A. mucini- phila is a key propionate producer specialised in mucin degradation [141]. Propionate is primarily absorbed by the liver, whilst acetate is released into peripheral tissues [142]', '. In add- ition, the interaction between commensal microbiota and the mucosal immune system is crucial for proper immune function. Colonic bacteria express carbohydrate-active enzymes, which endow them with the ability to ferment complex carbohydrates generating metabolites such as SCFAs [136]. Three predominant SCFAs, propionate, butyrate and acetate, are typically found in a proportion of 1:1:3 in the GI tract [137]. These SCFAs are rapidly absorbed by epithelial cells in the GI tract where they are involved in the regulation of cellular processes such as gene expression, chemotaxis, differentiation, proliferation and apoptosis [138]. Acetate is produced by most gut anaerobes, whereas propionate and butyrate are produced by different subsets of gut bacteria following dis- tinct molecular pathways [102]', 'Afzaal et al. 10.3389/fmicb.2022.999001 FIGURE 2 Positive health outcomes of gut microbial eubiosis. hydrogen, and carbon dioxide; these products are further used by the host or excreted (Patrascu et al., 2017). Acetate, propionate, and butyrate are the main short-chain fatty acids (SCFAs) distinguished in human feces, usually found in 3:1:1 to 10:2:1 molar ratio; this ratio is consistent with the values reported in the intestine in early sudden deaths (Rowland et al., 2018). These are the main SCFAs that perform several essential functions in the human body (Rauf et al., 2022). Butyrate is perhaps the essential SCFA for human health, as it is the primary source of energy for human colonocytes (Wang et al., 2019). Butyrate has the potential to act as an anti-carcinogen as it persuades apoptosis of colon cancer cells and regulates gene expression by inhibiting histone deacetylase (Havenaar, 2011; Steliou et al., 2012)', '. Low microbe numbers are present in the upper GI tract. At the same time, high microbial density and richness are observed in the large intestine, along with physiological changes in the pH and aerobic/anaerobic conditions from the small to the large intestine, with anaerobic conditions in the large intestine (Fig. 1) [103]. 1768', '. For instance, relative a b c No antibiotic Donor Recipient Transconjugant Antibiotic Conjugation promotion Fraction of total cells represented by transconjugants Antibiotic Selection Fig. 3 | Assessing the effect of antibiotics on horizontal gene transfer rates. a, A community in equilibrium is depicted. In the absence of an antibiotic selection pressure, the basal horizontal gene transfer rates are maintained. The chart on the right depicts transconjugants as a fraction of the total cells in the community. b,c, During antibiotic treatment, either conjugation rates are increased (part b) or selection promotes the growth of plasmid-containing populations (part c); these two outcomes could also take place concurrently. Both cases result in a higher fraction of transconjugants relative to the community in the absence of antibiotics. This leads to difficulties in distinguishing the effects of antibiotics on conjugation rates from those of antibiotic-mediated selection.', ', mRNA and peptides) and portal vein secretion of several gut peptides produced by the L-\xadcells such as GLP-\xad1, GLP-\xad2 and peptide YY (PYY) (figure 3).59–61 63–65 These effects are not exclusively limited to one type of fermentable carbohydrates since the microbial fermentation of resistant starches or arabinoxylans into SCFAs produces similar physiological effects linked to increased plasma GLP-\xad1 and PYY levels.66–69 However, the chemical structure of the fermentable fibres is directly related to the SCFA production profile since the quantity of butyrate, acetate or propionate generated will depend on the type of fibres', 'Biogeography of the human microbiota in the GI tract Microbiota composition in the GI tract is reﬂective of the physiological properties in a given region and is stratiﬁed on both a transverse and longitudinal axis [39]. The density and composition of the microbiota are affected by chemical, nutritional and immunological gradients along the gut. In the small intestine, there are typically high levels of acids, oxygen and antimicrobials, and a short transit time [40]. These properties limit bacterial growth, such that only rapidly growing, facultative anaerobes with the ability to adhere to epithelia/ mucus are thought to survive [40]. In mice, the small-intestine microbial community is largely dominated by Lactobacillaceae [41]. In contrast, colonic conditions support a dense and diverse community of bacteria, mainly anaerobes with the ability to utilise complex carbohydrates which are undigested in the small intestine', "". Nat Genet 2010; 42: 1118-1125 [RCA] [PMID: 21102463 DOI: 10.1038/ng.717] [FullText] [Full Text(PDF)] 18 Arumugam M, Raes J, Pelletier E, Le Paslier D, Yamada T, Mende DR, Fernandes GR, Tap J, Bruls T, Batto JM, Bertalan M, Borruel N, Casellas F, Fernandez L, Gautier L, Hansen T, Hattori M, Hayashi T, Kleerebezem M, Kurokawa K, Leclerc M, Levenez F, Manichanh C, Nielsen HB, Nielsen T, Pons N, Poulain J, Qin J, Sicheritz-Ponten T, Tims S, Torrents D, Ugarte E, Zoetendal EG, Wang J, Guarner F, Pedersen O, de Vos WM, Brunak S, Doré J; MetaHIT Consortium, Antolín M, Artiguenave F, Blottiere HM, Almeida M, Brechot C, Cara C, Chervaux C, Cultrone A, Delorme C, Denariaz G, Dervyn R, Foerstner KU, Friss C, van de Guchte M, Guedon E, Haimet F, Huber W, van Hylckama-Vlieg J, Jamet A, Juste C, Kaci G, Knol J, Lakhdari O, Layec S, Le Roux K, Maguin E, Mérieux A, Melo Minardi R, M'rini C, Muller J, Oozeer R, Parkhill J, Renault P, Rescigno M, Sanchez N, Sunagawa S, Torrejon A, Turner K"", '. These con- flicting reports are likely to arise from the difficulty of disentangling the effects of antibiotics on HGT rates from the antibiotic-mediated selection of transconjugants (Fig. 3), which suggests that the reported post-antibiotic enrichments of ARG-encoding MGEs often result from the growth advantage conferred on transconjugants, not higher HGT rates per se162. Investigation of HGT rates within the gut microbiome is still in its nascency; our understanding of how the frequency of horizontal transfer is affected by antibiotics is very limited, let alone our grasp on the variability of this impact across drug classes. Further investigation into the effects of antibiotics on HGT are needed, with careful experi- mental design that enables the precise determination of the frequency of HGT while controlling for the effects of antibiotics on other aspects of bacterial biology (such as the growth rate)', '. intestini SGB5736 GGB9633 SGB15090 T. nexilis SGB4588 g. A 0 I II III IV Asin-sqrt rel. ab. 0 0.05 0.10 0.15 0.20 0.25 A. muciniphila SGB9226 Asin-sqrt rel. ab. 0 0.01 0.02 0.03 0.04 0.05 F. nucleatum SGB6007 Asin-sqrt rel. ab. 0 0.05 0.10 0.15 0.20 C A 0 I II III IV M. smithii SGB714 g III II I 0 A IV IV III IV III II IV III II I IV III II I 0 0 5 10 15 20 25 30 35 Jaccard similarity (%) [21] [37] [54] [59] [154] Oral N P1 T2D IBD CD Intest./SIN 0 I II III IV f d Right CRC Left CRC SMD 0.6 0.65 0.7 0.75 0.8 AUC LODO testing study SGBs Oral SGBs Nonoral SGBs ECs Pathways Gene families Vogtmann, E. (2016) Wirbel, J. (2019) Yachida, S. (2019) Zeller, G. (2014) Cohort 1 Cohort 2 Cohort 4 Average e This study Cohort 2 Cohort 5 Cohort 6 Cohort 4 Cohort 3 Cohort 1 Liu, N.N. (2022) Obón-Santacana, M. (2022) Yang, J. (2020) Yang, Y. (2021) Public studies In previous meta-analyses Gupta, A. (2019) Feng, Q. (2015) Yu, J. (2017) Zeller, G. (2014) Wirbel, J. (2019) Yachida, S. (2019) Vogtmann, E']","['1-Introduction to the human gut microbiota.pdf', '2-Gut microbiome and health- mechanistic insights.pdf', '25-Pooled analysis of 3,741 stool metagenomes from 18 cohorts.pdf', '29-The gut microbiota and diabetes_research_translation_and_clinical_applications.pdf', '3-Human gut microbiota.pdf', '8-Antibiotic perturbations to the gut microbiome.pdf', '9-Combined metabolomic and metagenomic analysis.pdf']",-0.0564,medium,factual
gut_intro_mcq_005,Which bacterial group is primarily responsible for butyrate production in the human gut?,Bacteroidetes,Proteobacteria,Firmicutes,Actinobacteria,C,"Option: C
Explanation: Butyrate is a short-chain fatty acid produced by the gut microbiota, and it's primarily produced by bacteria in the Firmicutes phylum.","['. The microorganisms included in probiotic formulations can pro\xad duce a diverse range of probiotics. Short-chain fatty acids (SCFAs) such as butyrate, propanoate and acetate are all abundant metabolites produced by gut bacteria following the fermentation of soluble fibre. Major sources of butyrate include bacteria of the phylum Firmicutes, in particular Faecalibacterium prausnitzii, and Clostridium leptum of', '. Since gut microbiota has major impact to host innate and adaptive immune responses, the translation of ﬁndings from rodents to human should be carefully validated before drawing deﬁnite conclusions. While human and murine gut microbiota has 90% overlapping in phyla and genera levels, the composition and abundance of microbes have key discrepancies.27 For instance, the major difference is the Firmicutes/Bacteroidetes ratio, where it is signiﬁcantly higher in human than mice. Particularly, human Bacteroidetes is mainly composed of Prevotellaceae and Bacteroidaceae, while mice Bacteroidetes are primarily composed of S24-7. Regarding the Firmicutes, Ruminococcaceae is the major phylum observed in human and Clostridiales is the major one observed in mice', '. A vast majority of commensal bacteria reside in the colon, whereas a lower bacterial population is found in the stomach and small intestine. The main bacterial phyla present in the gut are Firmicutes and Bacteroides, which make up 90% of the gut microbiota.46 Other phyla that exist in the gut environment are Actinobacteria, Proteobacteria, Fusobacteria, and Verrucomi- crobia.46 Notably, there are 200 different genera found under the Firmicutes phylum, with some examples including Bacillus, Lactobacillus, Enterococcus, Clostridium, and Ruminococcus. Although lactobacilli are beneficial to health, some Firmicutes species such as Staphylococcus aureus and Clostridium perfringens are harmful to the body when overgrown. Meanwhile, the predominant genera in Bacteroidota are Bacteroides and Prevotella. The less abundant Actinobacteria phylum is largely represented by Bifidobacterium, and this genus is known to have a positive impact on health', '. Acetate is produced by most gut anaerobes, whereas propionate and butyrate are produced by different subsets of gut bacteria following dis- tinct molecular pathways [102]. Butyrate is produced from carbohydrates via glycolysis and acetoacetyl-CoA, whereas two pathways, the succinate or propanediol pathway, are known for the formation of propionate, depending on the nature of the sugar [102]. In the human gut, propionate is mainly produced by Bacteroidetes, whereas the production of butyrate is dominated by Firmicutes [102,139,140]. For example, fermentation of starch by specialist Actinobacteria and Firmicutes, e.g. Eubacterium rectale or E. hallii, is thought to contribute signiﬁcantly to butyrate production in the colon both directly and via metabolic cross-feeding [102]. A. mucini- phila is a key propionate producer specialised in mucin degradation [141]. Propionate is primarily absorbed by the liver, whilst acetate is released into peripheral tissues [142]', '. (6) Host glycans forming part of the mucous layer (produced by goblet cells), which is remarkably thicker in the large intestine than in the small intestine, also represent a nutrient source for intestinal bac- teria, supporting their growth. (7) Bile acids are secreted to the small intestine, inhibiting and favouring the growth of specific bacteria that participate in their metabolism and recirculation. Altogether, those abi- otic and biotic factors affect the ecological conditions that facilitate the survival of denser populations of bacteria moving to the most distal parts of the intestine (from \xad102–104 bacterial cells/g in the duodenum to \xad107–109 in the ileum and \xad1011–1012 in the colon) and account for differences in bacterial composition, with facultative anaerobes pref- erentially colonising the small intestine and strict anaerobes dominat- ing the microbiota of the large intestine, including butyrate producers', '. In contrast, colonic conditions support a dense and diverse community of bacteria, mainly anaerobes with the ability to utilise complex carbohydrates which are undigested in the small intestine. In the colon Prevotellaceae, Lachnospiraceae and Rikenellaceae have been shown to dominate [40,41]. In contrast with the differing microbiota composition between varying GI organs, the microbiota of different colorectal mucosal regions within the same individual is spatially conserved in terms of both composition and diversity [42,43]. This feature is apparent even during periods of localised inﬂammation [43]. On the other hand, the faecal/luminal and mucosal compositions are signiﬁcantly different [42,43]. For example, the abun- dance of Bacteroidetes appears to be higher in faecal/luminal samples than in the mucosa [42,44]. In contrast, Firmicutes, speciﬁcally Clostridium cluster XIVa, are enriched in the mucus layer compared with the lumen [44]', 'Page 10 of 12 Zhang et al. BMC Infectious Diseases (2025) 25:453 the transformation of important chemical substances, including drugs [7]. In theory, the prolonged and mul- tifaceted use of broad-spectrum and narrow-spectrum antibiotics, as seen in anti-tuberculosis therapy, may exert significant impacts on the gut microbiota, both immediately and in the long term. Bacteroidetes and Firmicutes are the predominant phyla within the gut microbiota [40]. Bacteria within the phylum Bacteroidota are capable of utilizing dietary fibers, resulting in the production of SCFAs [41]. Also known as volatile fatty acids, SCFAs include acetate, pro- pionate, and butyrate [21]', '. Together, the gut micro- biome harbors 130 glycoside hydrolase, 22 polysaccharide lyase, and 16 carbohydrate esterase families, which provide the microbiome ﬂexibility to switch between different energy sources of ﬁbers depending on availability (Flint et al., 2012). Species belonging to Firmicutes and Actinobacteria are the main responders to dietary ﬁber (Deehan et al., 2017), although they contain relatively few ﬁber-metabolizing enzymes per organism. However, they generally have more specialized roles such as the initiation of complex substrate degradation. For example, administration of RS has been shown to enrich Biﬁdo- bacterium adolescentis, Ruminoccocus bromii, Eubacterium rectale, and Parabacteroides distasonis in a subset of individuals dependent on RS (Martı´nez et al., 2010; Walker et al., 2011)', '. tuberculosis infection. We found that 25 species were diﬀerentially enriched in the two groups. Among these species, 23 were enriched in healthy controls, while two were more abundant in patients (Wilcoxon rank-sum test, FDR<0.1; Figure 2A and Table S5). Strikingly, nine out of the 23 control- enriched bacteria were widely reported SCFA-producing bacteria, including ﬁve butyrate producers (Roseburia inulinivorans, R. hominis, R. intestinalis, Eubacterium rectale, and Coprococcus Frontiers in Cellular and Infection Microbiology | www.frontiersin.org 3 April 2019 | Volume 9 | Article 90', '. Phyla Firmicutes, Bacteroides, Actinobacteria, Proteobacteria, and Verrucomicrobia contribute to the signiﬁcant resident bacterial populations in the gut microbiome (Fava et al., 2019). The ﬁrst step in identifying the symbiotic interactions between intestinal microbes and their hosts is to describe the balanced composition of gut microbiota and disease-related variations. The microbes reside in a mutual association with the host in a healthy state, aﬀecting the host’s health by controlling nutrient metabolism, defending against pathogens, and delivering signals to immune cells to promote host physiology and immunity (Ribaldone et al., 2022). An initial underestimation of the total number of microbial species in the intestine has been described through several vivo and ex vivo studies due to complications in culturing certain microorganisms (Lagier et al., 2015)']","['1-Introduction to the human gut microbiota.pdf', '15-Changes in gut microbiome following anti-tuberculosis treatment- a prospective cohort from eastern China.pdf', '24-The Gut Microbiome Signatures Discriminate Healthy From Pulmonary Tuberculosis Patients.pdf', '26-Gut microbiota in colorectal cancer development and therapy.pdf', '29-The gut microbiota and diabetes_research_translation_and_clinical_applications.pdf', '3-Human gut microbiota.pdf', '5-Microbiota in health and diseases.pdf', '6-Microbiome and Human Health.pdf', '7-The Impact of Dietary Fiber on Gut Microbiota in Host Health and Disease.pdf']",0.271,medium,factual
gut_intro_mcq_006,How many glycoside hydrolases does Bacteroides thetaiotaomicron encode compared to humans?,"B. thetaiotaomicron: 97, Humans: 260","B. thetaiotaomicron: 150, Humans: 150","B. thetaiotaomicron: 260, Humans: 97","B. thetaiotaomicron: 500, Humans: 200",C,"A

Bacteroides thetaiotaomicron is a gut bacterium known for its ability to break down complex carbohydrates. It encodes a large number of glycoside hydrolases, enzymes that facilitate this process. In comparison, humans have relatively few glycoside hydrolases, as they rely on their microbiome to perform these functions.","['The capacity of gut bacteria to utilise dietary or mucin glycans is dictated by the repertoire of glycoside hydrolases (GHs) and polysaccharide lyases (PLs) encoded by their genomes [70]. Some species act as general- ists able to degrade a wide range of polysaccharides, whilst others are specialists targeting speciﬁc glycans [88]. Bacteroidetes encode many more glycan-cleaving enzymes (137.1 GH and PL genes per genome) than Firmicutes members (39.6 GH and PL genes per genome) [89]. The Bacteroides thetaiotaomicron genome con- tains 260 GHs, in comparison with the 97 hydrolases encoded by humans [90]. The GH13 family, which con- tains enzymes involved in the breakdown of starch, is the most represented family in the gut microbiota [89]. Recently, the detailed biochemical and structural characterisation of the extensive degrading apparatus of prom- inent gut species such as B', '. PLoS One. 7, e28742 doi:10.1371/journal.pone.0028742 91 Larsbrink, J., Rogers, T.E., Hemsworth, G.R., McKee, L.S., Tauzin, A.S., Spadiut, O. et al. (2014) A discrete genetic locus confers xyloglucan metabolism in select human gut bacteroidetes. Nature. 506, 498–502 doi:10.1038/nature12907 92 Rogowski, A., Briggs, J.A., Mortimer, J.C., Tryfona, T., Terrapon, N., Lowe, E.C. et al. (2015) Glycan complexity dictates microbial resource allocation in the large intestine. Nat Commun. 6, 7481 doi:10.1038/ncomms8481 93 Cuskin, F., Lowe, E.C., Temple, M.J., Zhu, Y., Cameron, E.A., Pudlo, N.A. et al. (2015) Human gut Bacteroidetes can utilize yeast mannan through a selﬁsh mechanism. Nature. 517, 165–169 doi:10.1038/nature13995 94 Tauzin, A.S., Kwiatkowski, K.J., Orlovsky, N.I., Smith, C.J., Creagh, A.L., Haynes, C.A. et al. (2016) Molecular dissection of xyloglucan recognition in a prominent human Gut symbiont. MBio. 7, e02134–15 doi:10.1128/mBio.02134-15 95 Foley, M.H., Cockburn, D.W', '. However, our taxonomic analysis showed that Bacteroides were depleted in TB patients. In contrast, Proteobacteria (Enterobacteriaceae), such as E. coli, which cannot normally break down polysaccharides into simple carbohydrates, increased (Figures 2B, 4B1). Not surprisingly, Clostridiales, which can consume complex and simple carbohydrates, were increased (Supplementary Figure 3). Irrespective of the source, a higher ﬂux of glucose causes most bacteria to prefer glycolysis to grow and divide rapidly (Wolfe, 2015). Indeed, glycolysis supports 110 times faster generation of Yunusbaeva et al. 10.3389/fcimb.2024.1331521 Frontiers in Cellular and Infection Microbiology frontiersin.org 08', '. Since gut microbiota has major impact to host innate and adaptive immune responses, the translation of ﬁndings from rodents to human should be carefully validated before drawing deﬁnite conclusions. While human and murine gut microbiota has 90% overlapping in phyla and genera levels, the composition and abundance of microbes have key discrepancies.27 For instance, the major difference is the Firmicutes/Bacteroidetes ratio, where it is signiﬁcantly higher in human than mice. Particularly, human Bacteroidetes is mainly composed of Prevotellaceae and Bacteroidaceae, while mice Bacteroidetes are primarily composed of S24-7. Regarding the Firmicutes, Ruminococcaceae is the major phylum observed in human and Clostridiales is the major one observed in mice', '. More reliable estimates of microbiota composition and diversity may be provided by whole-genome shotgun metagenomics due to the higher resolution and sensitivity of these techniques [14]. Combined data from the MetaHit and the Human Microbiome Project have provided the most comprehensive view of the human-associated microbial repertoire to date [17,18]. Compiled data from these studies identiﬁed 2172 species isolated from human beings, classiﬁed into 12 different phyla, of which 93.5% belonged to Proteobacteria, Firmicutes, Actinobacteria and Bacteroidetes. Three of the 12 identiﬁed phyla contained only one species isolated from humans, including an intestinal species, Akkermansia muciniphila, the only known repre- sentative of the Verrucomicrobia phyla. In humans, 386 of the identiﬁed species are strictly anaerobic and hence will generally be found in mucosal regions such as the oral cavity and the GI tract [17]', '. smithii HL-29 HL-37 HL-44 HL-48 HL-52 HL-53 HL-10 M. smithii HL-29 HL-37 HL-44 HL-48 HL-52 HL-53 HL-10 All LGC HGC LGC HGC LGC HGC Low level High level a b c Figure 4 | Evolution of BMI in obese and non-obese LGC and HGC individuals (n 5 265). a, LGC individuals are more frequently obese. b, LGC obese individuals gained more weight over 9 years. c, Bacterial species associated with weight change. BMI change was computed for at least 125 (all) or 60 (obese) individuals having undetectable or lowest level of a species (‘Low level’) and for at least 40 (all) or 30 (obese) individuals having the highest abundance of the same species (‘High level’). Average BMI change of low and high level groups was significantly different (P , 0.05 or *P , 0.01), with the exception of HL-52 for all individuals (P 5 0.052); for obese, BMI and age were adjusted. ARTICLE RESEARCH 2 9 A U G U S T 2 0 1 3 | V O L 5 0 0 | N A T U R E | 5 4 5 Macmillan Publishers Limited. All rights reserved ©2013', 'infections (Yoshida et al., 2018; Cobo et al., 2022). Its accurate identiﬁcation is challenging due to its close relationship with P. vulgatus (96% similarity), one of the most numerically predominant Bacteroides species in the human intestine (Pedersen et al., 2013; Vu et al., 2022). Unlike P. (B.) dorei, other top TB-associated species, such as E. coli, A. muciniphila, and M. funiformis, are relatively better studied and were previously implicated in various diseases, such as inﬂammatory bowel diseases (Crohn’s disease and colitis), metabolic syndromes (obesity, hypertension, type 2 diabetes), autism, and infections (diarrhea, cystitis) (Sheng et al., 2022) (Zou et al., 2020). We next inspected the relative abundance of these top discriminatory species. We noted that some healthy donors carried high proportions of TB-associated species, such as Phocaeicola dorei, Escherichia coli, and Prevotella copri clade C (Figure 3A, asterisk)', '. K., Gudmundsdottir, V., Nielsen, H. B., Hyotylainen, T., Nielsen, T., Jensen, B. A. H., et al. (2016). Human gut microbes impact host serum metabolome and insulin sensitivity. Nature 535, 376–381. doi: 10.1038/nature18646. Pedersen, R. M., Marmolin, E. S., and Justesen, U. S. (2013). Species differentiation of Bacteroides dorei from Bacteroides vulgatus and Bacteroides ovatus from Bacteroides xylanisolvens–back to basics. Anaerobe 24, 1-3. doi: 10.1016/ j.anaerobe.2013.08.004. Rahman, G., McDonald, D., Gonzalez, A., Vázquez-Baeza, Y., Jiang, L., Casals- Pascual, C., et al. (2022). Scalable power analysis and effect size exploration of microbiome community differences with Evident. bioRxiv 492684 [Preprint]. doi: 10.1101/2022.05.19.492684 R Core Team. (2022). R: A Language and Environment for Statistical Computing (Vienna, Austria: R Foundation for Statistical Computing). Available at: https://www. R-project.org/. Reichardt, N., Duncan, S', '. Introduction The human gastrointestinal (GI) tract represents one of the largest interfaces (250–400 m2) between the host, environmental factors and antigens in the human body. In an average life time, around 60 tonnes of food pass through the human GI tract, along with an abundance of microorganisms from the environment which impose a huge threat on gut integrity [1]. The collection of bacteria, archaea and eukarya colonising the GI tract is termed the ‘gut microbiota’ and has co-evolved with the host over thousands of years to form an intricate and mutually beneﬁcial relationship [2,3]. The number of microorganisms inhabiting the GI tract has been estimated to exceed 1014, which encom- passes ∼10 times more bacterial cells than the number of human cells and over 100 times the amount of genomic content (microbiome) as the human genome [2,4]. However, a recently revised estimate has suggested that the ratio of human:bacterial cells is actually closer to 1:1 [5]', '. (B) Shannon diversity of TB patients and healthy controls. Each point refers to an individual sample. (C) PERMANOVA R2 of the association between microbial taxonomic composition and metadata. (D) Beta-diversity (distance to centroid) of TB patients and healthy controls. Each point refers to an individual sample. (E) Bar plot of average phylum composition of TB patients at each time-point and healthy individuals. * statistically signiﬁcant. Diallo et al. 10.3389/fimmu.2025.1561459 Frontiers in Immunology frontiersin.org 05']","['1-Introduction to the human gut microbiota.pdf', '14-Richness of human gut microbiome correlates with metabolic markers(Obesity).pdf', '17-Excess fermentation and lactic acidosis as detrimental functions of the gut microbes in treatment-naive TB patients.pdf', '22-Metabolic and immune consequences of antibiotic related microbiome alterations during first-line tuberculosis treatment in Bamako, Mali.pdf', '5-Microbiota in health and diseases.pdf']",0.1092,hard,factual
gut_intro_mcq_007,What percentage of faecal microbiota of vaginally delivered infants resembles their mothers' faecal microbiota?,41%,55%,72%,90%,C,"Option: C

The infant's gut microbiome is shaped by various factors, including mode of delivery and maternal influences. Studies have shown that vaginally delivered infants tend to have a higher similarity in their faecal microbiota with their mothers compared to those born via cesarean section. The exact percentage can vary depending on the study, but 72% is a commonly cited figure indicating the proportion of faecal microbiota that resembles the mother's in vaginally delivered infants.","['. After birth, the GI tract is rapidly colonised, with life events such as illness, antibiotic treatment and changes in diet causing chaotic shifts in the microbiota [24,25]. The mode of delivery also appears to affect the microbiota composition, with vaginally delivered infants’ microbiota containing a high abundance of lactobacilli during the ﬁrst few days, a reﬂection of the high load of lactobacilli in the vaginal ﬂora [26,27]. In contrast, the micro- biota of infants delivered by C-section is depleted and delayed in the colonisation of the Bacteroides genus, but colonised by facultative anaerobes such as Clostridium species [28,29]. Whilst the faecal microbiota of 72% of vaginally delivered infants resembles that of their mothers’ faecal microbiota, in babies delivered by C-section, this percentage is reduced to only 41% [30]. In early stages of development, the microbiota is generally low in diversity and is dominated by two main phyla, Actinobacteria and Proteobacteria [24,31]', '. FEMS Microbiol. Ecol. 87, 280–290 doi:10.1111/1574-6941.12223 27 Aagaard, K., Riehle, K., Ma, J., Segata, N., Mistretta, T.-A., Coarfa, C. et al. (2012) A metagenomic approach to characterization of the vaginal microbiome signature in pregnancy. PLoS ONE 7, e36466 doi:10.1371/journal.pone.0036466 28 Jakobsson, H.E., Abrahamsson, T.R., Jenmalm, M.C., Harris, K., Quince, C., Jernberg, C. et al. (2014) Decreased gut microbiota diversity, delayed Bacteroidetes colonisation and reduced Th1 responses in infants delivered by caesarean section. Gut 63, 559–566 doi:10.1136/gutjnl-2012-303249 29 Salminen, S. (2004) Inﬂuence of mode of delivery on gut microbiota composition in seven year old children. Gut 53, 1388–1389 doi:10.1136/gut.2004. 041640 30 Backhed, F., Roswall, J., Peng, Y., Feng, Q., Jia, H., Kovatcheva-Datchary, P. et al. (2015) Dynamics and stabilization of the human gut microbiome during the ﬁrst year of life. Cell Host Microbe 17, 852 doi:10.1016/j.chom.2015.05.012 31 Bäckhed, F', '. npj Biofilms Microbiomes 2020, 6, 50. (183) Brown, R. G.; Al-Memar, M.; Marchesi, J. R.; Lee, Y. S.; Smith, A.; Chan, D.; Lewis, H.; Kindinger, L.; Terzidou, V.; Bourne, T.; et al. Establishment of Vaginal Microbiota Composition in Early Pregnancy and Its Association with Subsequent Preterm Prelabor Rupture of the Fetal Membranes. Transl. Res. 2019, 207, 30−43. (184) Elovitz, M. A.; Gajer, P.; Riis, V.; Brown, A. G.; Humphrys, M. S.; Holm, J. B.; Ravel, J. Cervicovaginal Microbiota and Local Immune Response Modulate the Risk of Spontaneous Preterm Delivery. Nat. Commun. 2019, 10, 1305. (185) Brown, R. G.; Marchesi, J. R.; Lee, Y. S.; Smith, A.; Lehne, B.; Kindinger, L. M.; Terzidou, V.; Holmes, E.; Nicholson, J. K.; Bennett, P. R.; et al. Vaginal Dysbiosis Increases Risk of Preterm Fetal Membrane Rupture, Neonatal Sepsis and Is Exacerbated by Erythromycin. BMC Med. 2018, 16, 9. (186) Freitas, A. C.; Bocking, A.; Hill, J. E.; Money, D. M.; the VOGUE Research Group', '. 2.2.5. Reproductive System. 2.2.5.1. Vaginal. The human vaginal microbiome differs from other body sites as it is dominated by a single genus, Lactobacillus.166−168 Because Lactobacillus spp. lower vaginal pH, they inhibit the growth of many pathogens and beneficially impact the host epithelium, modulating the immune system.169−172 It was reported that ∼25% of women in North America possess vaginal microbiomes that are not dominated by Lactobacillus.173 Instead, their microbiomes are composed of an even population of obligate and facultative anaerobes−namely, species in the genera Gardnerella, Prevotella, Atopobium, Sneathia, Megasphaera, and Peptoniphilus.166,168,173−175 Interestingly, having such a vaginal microbiome correlates with the higher tendency of being diagnosed with bacterial vaginosis (BV),176,177 a bacterial infection resulting from the imbalance of beneficial and harmful bacteria', '. The composition of the gut microbiota changes at three stages in life: from birth to weaning; from weaning to obtaining a normal diet; and finally, during old age. Facultative anaerobes are the first to colonize the gut at birth, and these bacteria create anaerobic conditions that promote the growth of obligate anaerobes, starting with Bifidobacterium and Bacteroides spp., within 2 weeks.47 Infants born naturally are inoculated by the mother’s vaginal and fecal microbiota during birth, whereas those born by Caesarean section are initially exposed to the skin microbiota as well as the microbiome found in the environ- ment.48 At 3 days, infants who were naturally delivered possessed a greater abundance and variety of Bifidobacterium spp', '. than the Caesarean-born babies.49,50 Moreover, babies who were solely breastfed until weaning were observed to generally have a more stable and less diverse bacterial community, with higher proportions of bifidobacteria than babies fed by formula milk.51−54 After being introduced to solid food, their gut microbiome diversified and the abundance of Firmicutes increased.54−56 The microbiomes of breastfed and formula-fed babies become indistinguishable by around 18 months of age. By the age of 3, their microbiomes resemble that of an adult.7,54 At old age, there is reportedly a decline in microbiota diversity, with reduced numbers of Bifidobacteria and an increase in Enter- obacteriaceae.57,58 Likewise, the abundance of Bacteroidetes increases, whereas the Firmicutes becomes less abundant in elderly adults (>65 years).59 Apart from age, gut microbiome composition is also greatly influenced by the environment in different anatomical locations', '. In general, the major bacteria present in oral microbiota are Firmicutes, Proteobacteria, Bacter- oidetes, Actinobacteria, and Fusobacteria. Although healthy human lungs were long considered sterile, numerous studies have demonstrated that microbiota is also present in lung tissues.11 The core lung microbiota included Actinobacteria, Bacteroidetes, Firmicutes, and Proteobacteria. The composition of lung microbiota is primarily determined by three factors: 1) microbial immigration, 2) the elimination of micro- organisms, and 3) the reproduction rates of microorganisms.12 In human skin, the distribution and variety of glands and hair follicles vary among each geographic region. The physical and chemical differences of skin regions create distinct composition of microbiota.13 Generally, the skin microbiota is composed of Actinobacteria, Bacteroidetes, Cyanobacteria, Firmicutes, and Proteobacteria', '. Sci. Rep. 5, 18563 (2015). 96. Keohane, D. M. et al. Microbiome and health implications for ethnic minorities after enforced lifestyle changes. Nat. Med. 26, 1089–1095 (2020). This paper shows that Irish Travellers retain similar human gut microbiomes to that of non-industrialized populations, indicating that microbiota composition is associated with non-dietary factors and may be linked to the risk of microbiome-related metabolic diseases. 97. Vatanen, T. et al. Mobile genetic elements from the maternal microbiome shape infant gut microbial assembly and metabolism. Cell 185, 4921–4936.e15 (2022). 98. Ennis, D., Shmorak, S., Jantscher-Krenn, E. & Yassour, M. Longitudinal quantification of Bifidobacterium longum subsp. infantis reveals late colonization in the infant gut independent of maternal milk HMO composition. Nat. Commun. 15, 894 (2024). 99. Walsh, C., Lane, J. A., van Sinderen, D. & Hickey, R. M', '. 0.84%, P<0.05), and lower relative abundance of Faecalibacterium (5.31% vs. 14.80%, P<0.05), Biﬁdobacterium (1.67% vs. 5.02%, P<0.05), Agathobacter (0.86% vs. 3.32%, P<0.05) and CAG-352 (0.60% vs. 2.21%, P<0.05) (Figure 2B). Our data indicated the altered gut microbiota composition in PTB patients. TABLE 1 Clinical characteristics of the participants. Variable HC (n=63) mean (range) PTB (n=69) mean (range) Student’s t test (P values) Gender, Man, n (%) 40 (63.49%) 44 (63.77%) n.s. Age (year) 49 (34-67) 51 (30-69) n.s', '. The principal coordinate analysis (PCoA), based on Bray-Curtis, unweighted UniFrac and weighted UniFrac distances were performed to identify the difference in fecal microbiota composition between PTB patients and HCs. As shown in Figure 1D, there was a tendency of separation and had a partial overlap between two groups, which demonstrated that the total community of gut microbiota in the two groups was different. The compositions of the fecal microbiota in the PTB patients and the HCs were assessed at different taxonomic levels, and the top 20 relative abundance of bacteria were shown in Figure 2A. At the phylum level, we observed an enrichment of Bacteroidota (33.10% vs. 27.08%), Proteobacteria(12.99% vs. 9.83%) and Fusobacteriota(0.58% vs. 0.56%, P<0.05), and a remarkable decrease of Firmicutes(48.07% vs. 55.89%, P<0.05) and Actinobacteriota(2.44% vs. 5.83%, P<0.01) in PTB patients compared with HCs (Figure 2B)']","['1-Introduction to the human gut microbiota.pdf', '23-The correlation between dysfunctional intestinal flora and pathology feature of patients with pulmonary tuberculosis.pdf', '4-The interplay between diet and the gut microbiome.pdf', '5-Microbiota in health and diseases.pdf', '6-Microbiome and Human Health.pdf']",0.1743,medium,factual
gut_intro_mcq_008,Which of the following is NOT a benefit provided by gut microbiota mentioned in the paper?,Vitamin synthesis,Energy harvesting,DNA replication,Protection against pathogens,C,"Option: C
Justification: DNA replication is a fundamental biological process that occurs within cells, not a benefit provided by gut microbiota. The other options (A, B, and D) are all known benefits of the gut microbiome, including vitamin synthesis, energy harvesting, and protection against pathogens.","['. As gut microbiota is a complex topic, future research should focus on multidisciplinary approaches, taking into consideration recent innovations in various scientiﬁc ﬁelds. Author contributions MA and RA: conceptualization and writing—original draft preparation. MA, FS, YS, MH, RR, AH, AR, MP, JL, and CS: writing—review and editing. RA: supervision. All authors read and agreed to the ﬁnal version of the manuscript. Acknowledgments We are thankful for all the support from Government College University Faisalabad, Pakistan. We also address thanks to the University of Oradea. Conﬂict of interest The authors declare that the research was conducted in the absence of any commercial or ﬁnancial relationships that could be construed as a potential conﬂict of interest. Publisher’s note All claims expressed in this article are solely those of the authors and do not necessarily represent those of their aﬃliated organizations, or those of the publisher, the editors and the reviewers', 'Afzaal et al. 10.3389/fmicb.2022.999001 FIGURE 1 Gut microbial strains and negative health outcomes of gut microbial dysbiosis. from H2 processed by bacterial metabolism. It is a prominent and essential Archean in the gut microbiota (Hoﬀmann et al., 2013; Berry, 2016). Some of the beneﬁcial functions of gut microbiota for human health are shown in Figure 2. It is considered that diet is a signiﬁcant factor associated with health and disease control, but some recent studies concluded that diet is pivotal for shaping the gut microbial structure and inﬂuencing the metabolism of the host. The gut environment, sequentially, can help reproduce, grow, and survive the microbial community (Browne et al., 2016). Carbohydrates are an essential and signiﬁcant energy source; also, intestinal microbiota has provided a fermentation stage to deliver vital biomolecules to the host (Conlon and Bird, 2015)', '. For example, current advances have shown that human micro- biota is closely involved in nutrient extraction, metabolism, and immunity.15 Microbiota may affect biological processes via several mechanisms. For energy and nutrient extraction from food, microbiota plays crucial roles due to the versatile metabolic genes which provide independent unique enzymes and biochemical pathways.16 Moreover, the biosynthesis of bioactive molecules such as vitamins, amino acids and lipids, are also highly dependent on the gut microbiota.17 Regarding the immune system, the human microbiota not only protects the host from external pathogens by producing antimicrobial substances but also serves as a signiﬁcant component in the development of intestinal mucosa and immune system. In healthy conditions, the gut microbiota exhibits stability, resilience, and symbiotic interaction with the host', '. Am J Clin Nutr. 104, 5–14 doi:10.3945/ajcn.115.126706 148 Nagai, M., Obata, Y., Takahashi, D. and Hase, K. (2016) Fine-tuning of the mucosal barrier and metabolic systems using the diet-microbial metabolite axis. Int Immunopharmacol. 37, 79–86 doi:10.1016/j.intimp.2016.04.001 149 LeBlanc, J.G., Milani, C., de Giori, G.S., Sesma, F., van Sinderen, D. and Ventura, M. (2013) Bacteria as vitamin suppliers to their host: a gut microbiota perspective. Current Opinion in Biotechnology. 24, 160–168 doi:10.1016/j.copbio.2012.08.005 150 Martens, J.H., Barg, H., Warren, M. and Jahn, D. (2002) Microbial production of vitamin B-12. Applied Microbiology and Biotechnology. 58, 275–285 doi:10.1007/s00253-001-0902-7 151 Pompei, A., Cordisco, L., Amaretti, A., Zanoni, S., Matteuzzi, D. and Rossi, M. (2007) Folate production by biﬁdobacteria as a potential probiotic property. Appl Environ Microbiol. 73, 179–185 doi:10.1128/AEM.01763-06 152 Hill, M.J', '. crispatus CTV-05 isolate, which is able to outcompete E. coli in the vagina.251 3.1.1.2. Prebiotic Supplementation. An alternative to the exogenous supplementation of probiotics is the administration of prebiotics, which are nondigestible substrates that can be utilized by members of the host−microbiome to confer health benefits.252 Prebiotics are usually oligosaccharides that stimulate the growth of one or more species of bacteria already present in the microbiome. As different prebiotics can selectively increase the abundance of the microbes that can utilize them, these substrates can be used to remodel the microbiome\x01 transitioning it from a disease state to a relatively healthier state (Figure 1)', '. An individual microbe’s longevity is determined by whether it is contributing to the range of essential functions on which host ﬁtness relies. It is proposed that organisms who do not contribute beneﬁcial functions are controlled by, and may occasionally be purged during, for example, transferral of the microbiota to a new host [52,53]. Gut microbes must be adapted to a certain type of lifestyle due to the relatively fewer number of biochemical niches available in the gut, compared with other microbial-rich environments. In the gut, energy can generally be derived through processes such as fermentation and sulphate reduction of dietary and host carbohydrates. The organisms that can survive in the gut are therefore limited by their phenotypic traits [52]. Current research suggests that diet exerts a large effect on the gut microbiota [40]', '. The GI microbiota is also crucial to the de novo synthesis of essential vitamins which the host is incapable of producing [149]. Lactic acid bacteria are key organisms in the production of vitamin B12, which cannot be synthesised by either animals, plants or fungi [149,150]. Biﬁdobacteria are main producers of folate, a vitamin involved in vital host metabolic processes including DNA synthesis and repair [151]. Further vitamins, which gut microbiota have been shown to synthesise in humans, include vitamin K, riboﬂavin, biotin, nicotinic acid, panthotenic acid, pyridoxine and thiamine [152]. Colonic bacteria can also metabolise bile acids that are not reabsorbed for biotransformation to secondary bile acids [113]. All of these factors will inﬂuence host health. For example, an alteration of the co-metabolism of bile acids, branched fatty acids, choline, vitamins (i.e', 'controversial inclusions in the definition of a microbiome.4 However, the microbiome has since been further defined to pertain to not only the community of microorganisms but also the whole spectrum of molecules produced by microorganisms, including their structural elements, metabolites, and molecules produced by the coexisting host. Generally, microbial composition varies among different anatomical parts, and it is highly personalized as the micro- biome’s composition also varies among individuals. The exact definition of a healthy microbiota has yet to be defined, but studies have shown that the use of probiotics, prebiotics, and synbiotics are beneficial by maintaining healthy body flora or by altering the microbiome toward a healthy microbial ecosystem', '. In contrast, the mechanisms that have been demon- strated to contribute to health beneﬁts do not rely on a selective utilization of the carbohydrate but rather on metabolic com- pounds (e.g., SCFAs) (Koh et al., 2016), physiological changes (pH lowering), or protection of the mucus layer (Schroeder et al., 2018; Zou et al., 2018). Therefore, it may be worth consid- ering a shift in focus of the prebiotic concept away from the selective effect of speciﬁc dietary components on gut microbial communities and instead toward ecological and functional con- sequences of ﬁber fermentation, which is more relevant for host physiology (Bindels et al., 2015). Impact of Dietary Fiber on Microbial Ecology in the Gut Diet has a major impact on gut microbiota composition, diversity, and richness. Different components of the diet will shape the gut bacterial communities in a time-dependent manner', '. Micronutrients, in addition to macronutrients, may play a key role in gut reshaping, according to various studies (Ramos and Martín, 2021). All of these ﬁndings point to the importance of dietary factors as modulators of the microbial community, which can therefore have an impact on human physiology and disease processes. Conclusion The crucial role of probiotics in health, disease, and nutrition has increased their scientiﬁc and marketing signiﬁcance across the globe. The attention has been shifted from prospective studies to clinical trials to have a better understanding of how microbiota can interplay in human health and disease. Eubiosis is important in exerting the health endorsing beneﬁts of probiotics. An unhealthy diet intake, such low intakes of fruits and vegetables intakes and overuse of antibiotics can result in dysbiosis']","['1-Introduction to the human gut microbiota.pdf', '3-Human gut microbiota.pdf', '5-Microbiota in health and diseases.pdf', '6-Microbiome and Human Health.pdf', '7-The Impact of Dietary Fiber on Gut Microbiota in Host Health and Disease.pdf']",0.1713,easy,factual
gut_intro_mcq_009,"In the elderly population, which metabolic change is observed in gut microbiota function?",Increased SCFA production,Decreased proteolytic activity,Reduced proteolytic activity,Increased proteolytic activity and reduced SCFA production,D,"Option: D
Justification: In the elderly population, gut microbiota function often declines, leading to decreased production of Short-Chain Fatty Acids (SCFAs) and reduced proteolytic activity.","['. In contrast, a separate study observed that the microbiota of a young cohort and an elderly population (70 years) were relatively comparable, whilst the diversity of the microbiota from a cohort of centenarians was signiﬁcantly reduced [35]. The centenarian microbiota also exhibited group- speciﬁc differences such as an increase in the abundance of facultative anaerobes (e.g. Escherichia coli) and rearrangement of the proﬁle of butyrate producers (e.g. decrease in Faecalibacterium prausnitzii) [35]. In the elderly population, a signiﬁcant relationship has been identiﬁed between diversity and living arrangements, such as community dwelling or long-term residential care [36]. Overall, the capacity of the microbiota to carry out metabolic processes such as short-chain fatty acid (SCFA) production and amylolysis is reduced in the elderly, whilst proteolytic activity is increased [37]', '35 Biagi, E., Nylund, L., Candela, M., Ostan, R., Bucci, L., Pini, E. et al. (2010) Through ageing, and beyond: gut microbiota and inﬂammatory status in seniors and centenarians. PLoS ONE 5, e10667 doi:10.1371/journal.pone.0010667 36 Claesson, M.J. et al. (2012) Gut microbiota composition correlates with diet and health in the elderly. Nature 488, 178–+ 37 Woodmansey, E.J., McMurdo, M.E.T., Macfarlane, G.T., Macfarlane, S. (2004) Comparison of compositions and metabolic activities of fecal microbiotas in young adults and in antibiotic-treated and non-antibiotic-treated elderly subjects. Appl. Environ. Microbiol. 70, 6113–6122 doi:10.1128/AEM.70.10. 6113-6122.2004 38 Biagi, E., Candela, M., Turroni, S., Garagnani, P., Franceschi, C., Brigidi, P. (2013) Ageing and gut microbes: perspectives for health maintenance and longevity. Pharmacol. Res. 69, 11–20 doi:10.1016/j.phrs.2012.10.005 39 Macpherson, A.J. and McCoy, K.D', 'At about age 3, children’s gut microbiota becomes comparable to that of adults, with three major microbial phyla including Firmicutes, Bacteroidetes and Actinobacteria becoming dominant.23 Subsequently at older age, dietary and immune system change potentially affect the composition of the human gut microbiota. Speciﬁcally, elder people tend to exhibit decreased Biﬁdobacter- ium and increased Clostridium and Proteobacteria.24 The decrease in the anaerobic bacteria Biﬁdobacterium is considered relevant to deteriorated inﬂammatory status due to its role in stimulating the immune system. Since the microbiota plays an important role in human well-being, also proactively involves in multiple biological processes and disease development, the research on human microbiota is going beyond compositional studies and investiga- tion on members’ associations', '. et al. What is the healthy gut microbiota composition? A changing ecosystem across age, environment, diet, and diseases. Microorganisms. 7, 14 (2019). 22. Amabebe, E., Robert, F. O., Agbalalah, T. & Orubu, E. S. F. Microbial dysbiosis- induced obesity: role of gut microbiota in homoeostasis of energy metabolism. Br. J. Nutr. 123, 1127–1137 (2020). 23. Yatsunenko, T. et al. Human gut microbiome viewed across age and geography. Nature 486, 222–227 (2012). 24. Guigoz, Y., Doré, J. & Schiffrin, E. J. The inﬂammatory status of old age can be nurtured from the intestinal environment. Curr. Opin. Clin. Nutr. Metab. Care. 11, 13–20 (2008). 25. Hugenholtz, F. & de Vos, W. M. Mouse models for human intestinal microbiota research: a critical evaluation. Cell Mol. Life Sci. 75, 149–160 (2018). 26. Cheng, Y. et al. Principles of regulatory information conservation between mouse and human. Nature 515, 371–375 (2014). 27. Park, J. C. & Im, S.-H', '. Given the increasing evidence for the role of SCFAs as key metabolic and immune mediators (as reviewed below), it was postulated that the decrease in SCFAs may nurture the inﬂamm-ageing process in the intestine of aged people [38]. 1824 © 2017 The Author(s). This is an open access article published by Portland Press Limited on behalf of the Biochemical Society and distributed under the Creative Commons Attribution License 4.0 (CC BY). Biochemical Journal (2017) 474 1823–1836 DOI: 10.1042/BCJ20160510 Downloaded from http://portlandpress.com/biochemj/article-pdf/474/11/1823/688604/bcj-2016-0510c.pdf by National Institute of Immunology user on 10 January 2026', 'patients during dietary intervention (Deehan et al., 2017). Match- ing of ﬁbers to the microbiota may produce more beneﬁcial ef- fects on the host, especially if the subject’s lack of keystone spe- cies leads to a non-response proﬁle. This was exempliﬁed in a recent study showing that supplementation of BKB did not result in metabolic improvement in all healthy subjects. Individuals who exhibited improved metabolic proﬁle after 3 days of BKB con- sumption had a higher Prevotella/Bacteriodes ratio with an enrichment of Prevotella copri, reﬂecting the ability to degrade complex carbohydrates (Kovatcheva-Datchary et al., 2015). Interestingly, the capacity for using ﬁbers varies between Prevo- tella- versus Bacteroides-dominated gut microbiota. Prevotella- dominated bacteria produce higher levels and different propor- tions of SCFAs compared to Bacteroides-dominated microbiota (Chen et al., 2017)', '. An individual microbe’s longevity is determined by whether it is contributing to the range of essential functions on which host ﬁtness relies. It is proposed that organisms who do not contribute beneﬁcial functions are controlled by, and may occasionally be purged during, for example, transferral of the microbiota to a new host [52,53]. Gut microbes must be adapted to a certain type of lifestyle due to the relatively fewer number of biochemical niches available in the gut, compared with other microbial-rich environments. In the gut, energy can generally be derived through processes such as fermentation and sulphate reduction of dietary and host carbohydrates. The organisms that can survive in the gut are therefore limited by their phenotypic traits [52]. Current research suggests that diet exerts a large effect on the gut microbiota [40]', '. 2a). Insoluble fibres found in whole grains influence gut transit rate and bacterial fermentation. Two randomized controlled crossover trials involving 50 individuals who had overweight or were at risk of developing metabolic syndrome have shown that a whole-grain diet Amino acids ↑ Mucus secretion ↑ Mucus secretion SCFA Inhibits growth of pathogens ↓ Luminal pH ↑ Barrier function ↑ Insulin sensitivity ↓ Inflammation ↑ Fatty acid oxidation Immune modulation ↑ GLP1, PYY Unmetabolized SCFAs enter portal circulation Small amount of SCFAs reach systemic circulation GPCR41 and GPCR43 GPCR41 and GPCR43 a Fibre Inhibits growth of pathogens ↓ Luminal pH ↑ Bacteroides spp', '. et al. (2011) Composition, variability, and temporal stability of the intestinal microbiota of the elderly. Proc. Natl. Acad. Sci. U.S.A. 108(Supplement 1), 4586–4591 doi:10.1073/pnas.1000097107 © 2017 The Author(s). This is an open access article published by Portland Press Limited on behalf of the Biochemical Society and distributed under the Creative Commons Attribution License 4.0 (CC BY). 1831 Biochemical Journal (2017) 474 1823–1836 DOI: 10.1042/BCJ20160510 Downloaded from http://portlandpress.com/biochemj/article-pdf/474/11/1823/688604/bcj-2016-0510c.pdf by National Institute of Immunology user on 10 January 2026', 'Bacteroidetes and no increase in pathways degrading complex carbohydrates to explain the hypothesized higher amounts of simple sugars (Supplementary Figure 4, Supplementary Table 3). A higher ﬂux of glucose and increase in glycolysis in anaerobic conditions and pH in the normal range (5.5-7.5 in the large intestine lumen and 7.1-7.5 on the mucosal surface) (Nugent et al., 2001) usually leads to excretion of acetate (acetogenesis), ethanol, and format. However, our analysis suggests that the microbial community in patients has adapted by increasing members that ferment to lactate and acetate (P41-PWY, PWY- 5100, P461-PWY, and ANAEROFRUCAT-PWY) compared to HCs gut microbiome (Figures 4A, B1; Supplementary Table 3). B C A FIGURE 4 Microbial metabolic pathways increased in TB patients. (A). Metabolic pathways were differentially enriched (LDA score > 2,5) in TB patients and healthy controls based on linear discriminant analysis. Metabolic pathway names represent MetaCyc identiﬁers']","['1-Introduction to the human gut microbiota.pdf', '17-Excess fermentation and lactic acidosis as detrimental functions of the gut microbes in treatment-naive TB patients.pdf', '4-The interplay between diet and the gut microbiome.pdf', '5-Microbiota in health and diseases.pdf', '7-The Impact of Dietary Fiber on Gut Microbiota in Host Health and Disease.pdf']",0.3075,hard,factual
gut_intro_mcq_010,Which of the following correctly describes the colonic mucus structure?,Single layer that is completely impermeable,Two layers: dense impermeable inner layer and loose penetrable outer layer,Three layers with varying densities,"No distinct layers, uniform throughout",B,"Option: B
The colonic mucus structure consists of two distinct layers: a dense, impermeable inner layer and a loose, penetrable outer layer. This dual-layered structure helps to protect the epithelial lining from luminal contents while also allowing for the exchange of ions and water.","['. and Hansson, G.C. (2016) The densely O-glycosylated MUC2 mucin protects the intestine and provides food for the commensal bacteria. J. Mol. Biol 72 Ouwerkerk, J.P., de Vos, W.M., Belzer, B. (2013) Glycobiome: Bacteria and mucus at the epithelial interface. Best Pract. Res. Clin. Gastroenterol. 27, 25–38 doi:10.1016/j.bpg.2013.03.001 73 Johansson, M.E.V., Larsson, J.M.H. and Hansson, G.C. (2011) The two mucus layers of colon are organized by the MUC2 mucin, whereas the outer layer is a legislator of host-microbial interactions. Proc. Natl. Acad. Sci. U.S.A. 108(Suppl 1), 4659–4665 doi:10.1073/pnas.1006451107 74 Gustafsson, J.K., Ermund, A., Johansson, M.E.V., Schutte, A., Hansson, G.C., Sjovall, H. (2012) An ex vivo method for studying mucus formation, properties, and thickness in human colonic biopsies and mouse small and large intestinal explants. Am. J. Physiol. Gastrointest. Liver Physiol', '. Colonic mucus is divided into two layers consisting of a dense and impermeable inner layer and a loose outer coating which is penetrable by bacteria [74]. Whilst the inner layer is virtually sterile, in the outer layer, the mucin pro- teins, which are decorated by a rich and diverse repertoire of O-glycans, provide an energy source and preferen- tial binding sites for commensal bacteria [73,76,77]. The arrangement of the outer mucus layer provides a unique niche in which bacterial species display different patterns of proliferation and utilisation of resources compared with their counterparts in the lumen [45]. The type of mucin O-glycosylation is dependent on the glycosyltransferases expressed and where in the Golgi apparatus they are located [71], alterations of which affect the microbiota composition', '. The intestinal mucus layers are built around the large highly glycosylated gel-forming mucin MUC2 (Muc2 in mouse) secreted by goblet cells [72]. The glycan structures present in mucins are diverse and complex and based on four core mucin-type O-glycans containing N-acetylgalactosamine, galactose and N-acetylglucosamine. These core struc- tures are further elongated and frequently terminated by fucose and sialic acid sugar residues. Collectively, O-glycans account for up to 80% of the total molecular mass of Muc2/MUC2 [73]. Mucus is present through- out the GI tract and is thickest in the colon where it is crucial in mediating the host–microbiota relationship [74]. Normalisation of host intestinal mucus layers requires long-term microbial colonisation [75]. Colonic mucus is divided into two layers consisting of a dense and impermeable inner layer and a loose outer coating which is penetrable by bacteria [74]', '. The large intestine has slow flow rates, and the pH level ranges from mildly acidic to neutral. Thus far, it comprises the largest microbial community dominated by obligate anaerobes. The large intestine comprises several microenvironments wherein microorganisms reside. The epithelial surface and inner mucin layer harbors minimal colonization during the healthy state, whereas the diffuse mucin layer has specialist colonizers such as Akkermansia muciniphila. The liquid phase of the gut lumen comprises a diversity of microorganisms and specialized primary colonizers like Ruminococcus spp', '. (2012) An ex vivo method for studying mucus formation, properties, and thickness in human colonic biopsies and mouse small and large intestinal explants. Am. J. Physiol. Gastrointest. Liver Physiol. 302, G430–G438 doi:10.1152/ajpgi.00405.2011 75 Johansson, M.E., Jakobsson, H.E., Holmén-Larsson, J., Schütte, A., Ermund, A., Rodríguez-Piñeiro, A.M. et al. (2015) Normalization of host intestinal mucus layers requires long-Term microbial colonization. Cell Host Microbe 18, 582–592 doi:10.1016/j.chom.2015.10.007 76 Juge, N. (2012) Microbial adhesins to gastrointestinal mucus. Trends Microbiol. 20, 30–39 doi:10.1016/j.tim.2011.10.001 77 Tailford, L.E., Crost, E.H., Kavanaugh, D., Juge, N. (2015) Mucin glycan foraging in the human gut microbiome. Frontiers in Genetics. 6, 131 doi:10. 3389/fgene.2015.00081 78 Rausch, P., Rehman, A., Kunzel, S., Hasler, R., Ott, S.J., Schreiber, S. et al', '. In contrast, colonic conditions support a dense and diverse community of bacteria, mainly anaerobes with the ability to utilise complex carbohydrates which are undigested in the small intestine. In the colon Prevotellaceae, Lachnospiraceae and Rikenellaceae have been shown to dominate [40,41]. In contrast with the differing microbiota composition between varying GI organs, the microbiota of different colorectal mucosal regions within the same individual is spatially conserved in terms of both composition and diversity [42,43]. This feature is apparent even during periods of localised inﬂammation [43]. On the other hand, the faecal/luminal and mucosal compositions are signiﬁcantly different [42,43]. For example, the abun- dance of Bacteroidetes appears to be higher in faecal/luminal samples than in the mucosa [42,44]. In contrast, Firmicutes, speciﬁcally Clostridium cluster XIVa, are enriched in the mucus layer compared with the lumen [44]', '. Science 308, 1635–1638 doi:10.1126/science.1110591 43 Lavelle, A. et al. (2015) Spatial variation of the colonic microbiota in patients with ulcerative colitis and control volunteers. Gut 44 Van den Abbeele, P., Belzer, C., Goossens, M., Kleerebezem, M., De Vos, W.M., Thas, O. et al. (2013) Butyrate-producing Clostridium cluster XIVa species speciﬁcally colonize mucins in an in vitro gut model. ISME J. 7, 949–961 doi:10.1038/ismej.2012.158 45 Li, H., Limenitakis, J.P., Fuhrer, T., Geuking, M.B., Lawson, M.A., Wyss, M. et al. (2015) The outer mucus layer hosts a distinct intestinal microbial niche. Nat. Commun. 6, 8292 doi:10.1038/ncomms9292 46 Turnbaugh, P.J., Hamady, M., Yatsunenko, T., Cantarel, B.L., Duncan, A., Ley, R.E. et al. (2009) A core gut microbiome in obese and lean twins. Nature 457, 480–484 doi:10.1038/nature07540 47 Jakobsson, H.E., Jernberg, C., Andersson, A.F., Sjölund-Karlsson, M., Jansson, J.K., Engstrand, L. et al', '. In contrast, Firmicutes, speciﬁcally Clostridium cluster XIVa, are enriched in the mucus layer compared with the lumen [44]. Interestingly, recent experiments in mice colonised with a diverse speciﬁc pathogen-free microbiota showed that the outer mucus of the large intestine forms a unique microbial niche and that bacterial species present in the mucus show differential proliferation and resource utilisation compared with the same species in the intestinal lumen [45]. These observations highlight the need for careful consideration in choosing a sam- pling method when analysing the microbiota composition. Inter-individual differences in the species and subspecies arrangement are proposed to outweigh differences in the community arrangement within an individual [42,46,47]. Suggestions have been made of the presence of a ‘core microbiota’, proposed to be a set of the same abundant organisms present in all individuals', 'Biogeography of the human microbiota in the GI tract Microbiota composition in the GI tract is reﬂective of the physiological properties in a given region and is stratiﬁed on both a transverse and longitudinal axis [39]. The density and composition of the microbiota are affected by chemical, nutritional and immunological gradients along the gut. In the small intestine, there are typically high levels of acids, oxygen and antimicrobials, and a short transit time [40]. These properties limit bacterial growth, such that only rapidly growing, facultative anaerobes with the ability to adhere to epithelia/ mucus are thought to survive [40]. In mice, the small-intestine microbial community is largely dominated by Lactobacillaceae [41]. In contrast, colonic conditions support a dense and diverse community of bacteria, mainly anaerobes with the ability to utilise complex carbohydrates which are undigested in the small intestine', '. The type of mucin O-glycosylation is dependent on the glycosyltransferases expressed and where in the Golgi apparatus they are located [71], alterations of which affect the microbiota composition. For example, the presence (secretor) or absence (non-secretor) of H and ABO antigens in GI mucosa, determined by the FUT2 genotype (a gene expressing an α1,2-fucosyltransferase), affects the abundance of many bacterial groups [78]. Mucus and mucin glycosylation are therefore key in shaping the microbiota and allow for the selection of the most optimal microbial species to mediate host health [79–81]. A depletion of MACs from the diet of mice can result in thinner mucus in the distal colon, increased proximity of microbes to the epithelium and heightened expression of the inﬂammatory marker REGIIIβ [82]. The erosion of the colonic mucus barrier under dietary ﬁbre deﬁciency is associated with a switch of the gut microbiota towards the utilisation of secreted mucins as a nutrient source [83]']","['1-Introduction to the human gut microbiota.pdf', '6-Microbiome and Human Health.pdf']",0.2231,medium,factual
multiomics_ibd_mcq_001,How many common metabolites were identified across all four metabolomic cohorts after HMDB ID annotation?,36 metabolites,79 metabolites,78 metabolites,310 metabolites,B,"Option: B
Justification: The question asks for the number of common metabolites identified across all four cohorts after HMDB ID annotation, implying a comparison and aggregation of data from multiple sources. Option B (79 metabolites) is the most plausible answer as it suggests a moderate level of overlap between the cohorts, which is consistent with the nature of metabolomic studies that often involve complex biological systems and variable sample sets.","['. However, the roles of these metabolites in IBD remain unknown. We next aimed to investigate whether a speciﬁc group of meta- bolites can serve as an accurate diagnostic tool for IBD, regardless of whether it is targeted or non-targeted datasets through CCIA methods. We then integrated four metabolomics studies and identiﬁed a total of 79 metabolites that were commonly present in all four cohorts using HMDB ID. Subsequently, we conducted univariate differential analysis with FDR < 0.0001 and OPLS-DA analysis using a VIP score > 1, which led to the identiﬁcation of 32 candidate metabolites. To further reﬁne our selection, we employed IFE and narrowed down our pool to 13 metabolites (Fig. 4e, f). To account for variations in metabolite detection methods and numerical units between internal and external cohorts, we limited our cross-validation to cohorts with the same units', '. The signiﬁcance of the projected variable is a measure of how well a metabolite contributes to the separation between the two groups being compared. The model validation of OPLS-DA utilizes a permutation test, relying on the “ropls” R package (Supplementary Fig 4b, d). Preprocessing of metabolomics proﬁles Given the signiﬁcant variability in metabolomics technology, proces- sing methods, and output results among studies, we preprocessed our metabolomics dataset to facilitate subsequent cross-cohort analysis. To accomplish this, we utilized the MetaboAnalyst (5.0) compound ID conversion program to standardize metabolite names from both internal and external cohorts to a common HMDB ID and identiﬁed 79 metabolites that were common across all four cohorts. Subsequently, we applied a log2 transformation to the metabolite values and then converted them into z-scores', '. 4h). Based on these results, it can be inferred that metabolomics has a higher potential for disease diagnosis compared to metagenomics and can be a promising biomarker for diagnosis in the future. To further validate the disease speciﬁcity of our feature metabo- lites, we incorporated four additional non-IBD metabolomics cohorts, including one adenoma cohort, two CRC cohorts, and one T1D cohort. Differential analysis revealed that the majority of the 13 metabolites we included for diagnosing IBD did not show signiﬁcant differences in these cohorts (FDR > 0.05, Supplementary Fig. 4f-i). These ﬁndings substantiate the disease-speciﬁc nature of our featured metabolites in IBD', '. Exact p values are provided in the Source data ﬁle (Supplementary Table 5). e The workﬂow for identifying metabolites across four cohorts involved annotating with the Human Metabolome Database (HMDB). f The ridge plot shows the concentration differences of 13 featured metabolites between the normal control and IBD (Unit: log2 (µmol/g)). Their signiﬁcance scores calcu- lated using a two-sided Wilcoxon test with FDR-corrected p values (denoted as ****p < 0.0001). Exact p values are provided in the Source data ﬁle. g, h We developed random forest (RF) classiﬁers trained on metabolites to identify IBD patients. We performed 10-fold cross-validation (red), leave-one-out cross- validation (LOOCV) (blue) and independent validation (green). Shaded areas represent the 95% conﬁdence intervals of the corresponding ROC curves. Source data are provided as a Source Data ﬁle. Article https://doi.org/10.1038/s41467-023-42788-0 Nature Communications| (2023) 14:7135 9', 'Fig. 1 | Workﬂow for cross-cohort integration analysis of fecal metagenomics and metabolomics in IBD. a We included a total of 9 fecal metagenomic cohorts (n = 1363) and 4 metabolomic cohorts (n = 398) from diverse geographic locations worldwide. b We utilized the MetaPhlan3 tool for taxonomic proﬁling and HUMAnN3 for functional proﬁling to reprocess all raw metagenomic sequencing data. Additionally, we annotated the compound names from the metabolomics analysis with the same ID number using the HMDB (Human Metabolome Database). c Through strict sample ﬁltering, detailed bioinformatics analysis, and feature selection, we identiﬁed a series of representative features, including 31 bacterial features, 25 KO genes, and 13 metabolites. Subsequently, we developed machine learning models and used the features for the diagnosis of IBD', '. In addition, the metagenomic sequencing data for the HallAB 2017 cohort (PRJNA385949), NielsenHB 2014 cohort (PRJEB1220), HMP 2019 ibdmdb cohort (PRJNA398089) and the LifeLD VilaAV 2018 cohort (EGAS00001001704, EGAD00001004194) data were acquired from the curatedMetagenomicData. The two published metabolomics cohorts were obtained from a previously published study10 and con- tained pre-processed data. All metadata for both metagenomics and Article https://doi.org/10.1038/s41467-023-42788-0 Nature Communications| (2023) 14:7135 12', '. The metabolomics data from the external cohorts are sourced from the supplementary materials of their respective articles10. The metabolomics data of non-IBD cohorts are sourced from the study by Muller, E. et al. 59 (https://github.com/ borenstein-lab/ microbiome-metabolome-curated-data). The Human Metabolome Database (HMDB) is a freely accessible electronic database that pro- vides comprehensive information about small molecule metabolites found in the human body (https://hmdb.ca/). Source data are provided as a Source Data ﬁle. Source data are provided with this paper. Code availability The software packages used in this study are free and open source. The bioBakery tools (KneadData, MetaPhlAn3 and HUMAnN3) used to process multi-omics sequencing data are available via http:// huttenhower.sph.harvard.edu/biobakery as source code and install- able packages. The code and analysis scripts of this study are available on Zenodo (https://doi.org/10.5281/zenodo.8432120). References 1', '. The link between microbiome composition and metabolites is known to be indirect due to the functional redundancy of metabolic pathways, which suggests the interchangeability of some species.375 Thus, analyzing differences in microbial composition may not reflect functional metabolite differences. In fact, phylogeny prediction from metabolomic data has been so far unsuccessful, indicating the difficulty of linking microbiome and metabolome data.376 For this reason, identifying the metabolites associated with disease can provide more straightforward data for helping implement synthetic approaches for therapeutic purposes. Untargeted metabolomics using mass spectrometry has been used for the discovery of key disease-associated metabo- lites.377,378 Koh et al', '. 4e, f). To account for variations in metabolite detection methods and numerical units between internal and external cohorts, we limited our cross-validation to cohorts with the same units. In our analysis of the Renji cohorts, the 10-fold cross-validation of our model achieved an AUROC value of 0.945, while the leave-one-out cross-validation (LOOCV) had a slightly lower performance of 0.937, and the independent validation cohort arm an AUROC of 0.867 (Fig. 4g). In the USA-NL cohorts, both 10-fold cross-validation and LOOCV exhibited similar AUROC values, both exceeding 0.9, and the independent validation cohort had good performance with an AUROC of 0.841 (Fig. 4h). Based on these results, it can be inferred that metabolomics has a higher potential for disease diagnosis compared to metagenomics and can be a promising biomarker for diagnosis in the future', '. 1a). To ensure consistency in the bioinformatic analyses, we applied the MetaPhlan3 tool for taxonomic proﬁling and HUMAnN3 for func- tional proﬁling to reprocess all raw sequencing data. Furthermore, by annotating metabolite names with a uniﬁed ID using the Human Metabolome Database (HMDB), we identiﬁed 79 metabolites that were shared among the four cohorts. These metabolites will be utilized in a cross-cohort analysis of metabolomics data (Fig. 1b). Furthermore, our aim is to reveal the patterns of variation in gut microbiota and fecal metabolites through a comprehensive statistical analysis, and then utilize machine learning techniques for diagnosing IBD. Initially, we excluded samples that were repeatedly collected from external cohorts. Then, we utilized a sequence of differential analyses and feature selection to identify 31 species, 25 functional genes, and 13 metabolites that were effective in diagnosing IBD patients']","['10-Microbiome and metabolome features in inflammatory bowel disease via multi-omics integration analyses across cohorts.pdf', '6-Microbiome and Human Health.pdf']",0.3585,easy,factual
multiomics_ibd_mcq_002,Which bacterium enriched in IBD can produce pro-inflammatory polysaccharides and mucin-degrading trans-sialidase?,Faecalibacterium prausnitzii,Ruminococcus gnavus,Alistipes putredinis,Bifidobacterium longum,B,"Option: C

Alistipes putredinis is known to produce pro-inflammatory polysaccharides and mucin-degrading trans-sialidase, which can contribute to the pathogenesis of Inflammatory Bowel Disease (IBD).","['(241) Martín, R.; Chain, F.; Miquel, S.; Lu, J.; Gratadoux, J.-J.; Sokol, H.; Verdu, E. F.; Bercik, P.; Bermúdez-Humarán, L. G.; Langella, P. The Commensal Bacterium Faecalibacterium Prausnitzii Is Protective in Dnbs-Induced Chronic Moderate and Severe Colitis Models. Inflamm. Bowel Dis. 2014, 20, 417−430. (242) He, X.; Zhao, S.; Li, Y. Faecalibacterium Prausnitzii: A Next- Generation Probiotic in Gut Disease Improvement. Can. J. Infect. Dis. Med. Microbiol. 2021, 2021, 6666114. (243) Sokol, H.; Leducq, V.; Aschard, H.; Pham, H.-P.; Jegou, S.; Landman, C.; Cohen, D.; Liguori, G.; Bourrier, A.; Nion-Larmurier, I.; et al. Fungal Microbiota Dysbiosis in Ibd. Gut 2017, 66, 1039. (244) Limon, J. J.; Tang, J.; Li, D.; Wolf, A. J.; Michelsen, K. S.; Funari, V.; Gargus, M.; Nguyen, C.; Sharma, P.; Maymi, V. I.; et al. Malassezia Is Associated with Crohn’s Disease and Exacerbates Colitis in Mouse Models. Cell Host Microbe 2019, 25, 377−388. (245) Norman, J. M.; Handley, S. A.; Baldridge, M', '. UC: Ulcerative colitis; CD: Crohn’s disease; PERMANOVA: Permutational Multivariate Analysis of Variance; MDS: Multidimensional scaling ordinate; NS: Not significant. even have beneficial effects; for instance, certain strains produce SCFAs, which are beneficial for gut health, and can mo- dulate immune responses. Experimental studies have shown that specific Blautia strains can alleviate colitis in animal mo- dels by reducing inflammation and enhancing gut barrier integrity[45]. Coprococcus, particularly the species Coprococcus comes, has been associated with both the presence and alleviation of IBD[46]. While some studies suggest a potential link between certain Coprococcus species and IBD, others indicate that Co- prococcus eutactus, a related species, may exert a protective effect against the disease. It appears to promote anti-inflam-', '. Thus, a decrease in Firmicutes could heighten local inflammation by decreasing anti-inflammatory cytokines.78,79 As such, F. prausnitzii has been explored as a probiotic for therapeutic use.76 Aside from IBD, other intestinal disorders associated with the dysbiosis of the gut microbiota include irritable bowel syndrome (IBS), celiac disease, and colorectal cancer (CRC). A study of fecal samples from IBS patients exhibited a significant reduction in the concentration of Lactobacillus species as compared to healthy controls.80 Other studies have revealed that there is an increase in the ratio of Firmicutes to Bacteroidetes in IBS patients as compared to healthy individuals.81,82 There was also a decrease in some Firmicutes families such as Lactobacilli and Faecalibacterium, as well as Bifidobacteria and Collinsella under the Actinobacteria population', '. Comparative genomics of a subset of adherent/invasive Escherichia coli strains isolated from individuals without inflammatory bowel disease. Genomics 112, 1813–1820 (2020). 29. Henke, M. T. et al. Ruminococcus gnavus, a member of the human gut microbiome associated with Crohn’s disease, produces an inflammatory polysaccharide. Proc. Natl Acad. Sci. USA 116, 12672–12677 (2019). 30. Png, C. W. et al. Mucolytic bacteria with increased prevalence in IBD mucosa augment in vitro utilization of mucin by other bacteria. Am. J. Gastroenterol. 105, 2420–2428 (2010). 31. Schaus, S. R. et al. Ruminococcus torques is a keystone degrader of intestinal mucin glycoprotein, releasing oligosaccharides used by Bacteroides thetaiotaomicron. mBio 15, e00039-24 (2024). 32. Ha, C. W. Y. et al. Translocation of viable gut microbiota to mesenteric adipose drives formation of creeping fat in humans. Cell 183, 666–683.e17 (2020). 33. Chen-Liaw, A. et al', '. 2c). However, previous stu- dies have not extensively investigated or emphasized the relationship between these bacteria and IBD. Asaccharobacter celatus possesses the ability to produce Equol24, which has the potential to alleviate experi- mental autoimmune encephalomyelitis in mice25. This implies a potential role for Asaccharobacter celatus in the regulation of auto- immune diseases. Furthermore, our study also revealed that certain bacteria, including Ruminococcus gnavus, Bacteroides fragilis, Escherichia coli, and Clostridium innocuum were consistently enriched in IBD (Fig. 2e). Ruminococcus gnavus can produce pro-inﬂammatory polysaccharides and mucin-degrading trans-sialidase, which disrupts the intestinal mucosal barrier and promotes inﬂammation26–28. In clinical practice, special attention should be paid to Clostridium innocuum infection in Article https://doi.org/10.1038/s41467-023-42788-0 Nature Communications| (2023) 14:7135 2', '. A decline in the Clostridium leptum groups, particularly F. prausnitzii, has been observed among Firmicutes (Wang et al., 2014). In biologically susceptible hosts, alterations of the gut microbiota have been associated with aberrant mucosal immune responses that result in a variety of intestinal and extraintestinal disorders, including IBD. As a result, restoring immunological homeostasis by modifying the gut microbiota is currently considered to be a potential therapeutic strategy to treat IBD patients (Facciotti, 2022). The majority of discovered human pathogenic bacteria belong to the phylum Proteobacteria, which play an increasingly important role in IBD (Mukhopadhya et al., 2012). Analysis of microbial diversity shows a rise in the number of bacterial species belonging to this phylum, implying an active role in initiating chronic inﬂammation in patients with IBD (Hold et al., 2014). The abundance of Ruminococcus gnavus is also Frontiers in Microbiology 09 frontiersin.org', '. This bacterium produces an enzyme capable of degrading immunoglobulin A, a crucial antibody in the mucosal lining of the gut. This activity may impair the immune system’s ability to combat other harmful bacteria or pathogens, potentially worsening inflammation in IBD[44]. Blautia is a genus of bacteria commonly found in the human gut, and some species within this genus have been associated with IBD. While several studies report a decrease in Blautia abundance in IBD patients - including those with CD and UC - suggesting a potential protective role, other research indicates a more complex relationship. Some Blautia species may', '. 24. Lenoir, M. et al. Butyrate mediates anti-inflammatory effects of Faecalibacterium prausnitzii in intestinal epithelial cells through Dact3. Gut Microbes 12, 1–16 (2020). 25. Quévrain, E. et al. Identification of an anti-inflammatory protein from Faecalibacterium prausnitzii, a commensal bacterium deficient in Crohn’s disease. Gut 65, 415–425 (2016). 26. Mirsepasi-Lauridsen, H. C., Vallance, B. A., Krogfelt, K. A. & Petersen, A. M. Escherichia coli pathobionts associated with inflammatory bowel disease. Clin. Microbiol. Rev. 32, e00060–18 (2019). 27. Palmela, C. et al. Adherent-invasive Escherichia coli in inflammatory bowel disease. Gut 67, 574–587 (2018). 28. Barrios-Villa, E. et al. Comparative genomics of a subset of adherent/invasive Escherichia coli strains isolated from individuals without inflammatory bowel disease. Genomics 112, 1813–1820 (2020). 29. Henke, M. T. et al', '. Sci. Transl. Med. 10, eaap8914 (2018). 20. Franzosa, E. A. et al. Gut microbiome structure and metabolic activity in inflammatory bowel disease. Nat. Microbiol. 4, 293–305 (2018). 21. Sokol, H. et al. Faecalibacterium prausnitzii is an anti-inflammatory commensal bacterium identified by gut microbiota analysis of Crohn disease patients. Proc. Natl Acad. Sci. USA 105, 16731–16736 (2008). 22. Fujimoto, T. et al. Decreased abundance of Faecalibacterium prausnitzii in the gut microbiota of Crohn’s disease. J. Gastroenterol. Hepatol. 28, 613–619 (2013). 23. Lopez-Siles, M., Duncan, S. H., Garcia-Gil, L. J. & Martinez-Medina, M. Faecalibacterium prausnitzii: from microbiology to diagnostics and prognostics. ISME J. 11, 841–852 (2017). 24. Lenoir, M. et al. Butyrate mediates anti-inflammatory effects of Faecalibacterium prausnitzii in intestinal epithelial cells through Dact3. Gut Microbes 12, 1–16 (2020). 25. Quévrain, E. et al', ', enriched in individuals with T2D, suggesting a potential trans- location of oral microbes to the gut, indicative of a pro-inflammatory HPFS (USA) n = 307 NHSII (USA) n = 213 HCHS/SOL (USA) n = 2,881 Fromentin_2022 (DEU/DNK/FRA) n = 1,005 DIRECT- PLUS (ISR) n = 280 Qin_2012 (CHN) n = 344 Zhong_2019 (CHN) n = 248 Wu_2020b (SWE) n = 484 Karlsson_2013 (SWE) n = 145 Wu_2020a (SWE) n = 991 Universal Overlapping Singular Prevotella copri Bacteroides uniformis Bacteroides vulgatus Faecalibacterium prausnitzii Eubacterium rectale Alistipes putredinis Ruminococcus bromii Bacteroides dorei Bacteroides stercoris Roseburia faecis Eubacterium eligens Fusicatenibacter saccharivorans Bifidobacterium adolescentis Parabacteroides distasonis Collinsella aerofaciens Akkermansia muciniphila Anaerostipes hadrus Eubacterium siraeum Escherichia coli Bacteroides thetaiotaomicron Bacteroides caccae Roseburia inulinivorans Roseburia intestinalis Bacteroides ovatus Bacteroides eggerthii Eubacterium sp']","['10-Microbiome and metabolome features in inflammatory bowel disease via multi-omics integration analyses across cohorts.pdf', '11-Microbiota in inflammatory bowel disease.pdf', '28-Strain-specific gut microbial signatures in type 2 diabetes identified in a cross-cohort analysis of 8,117 metagenomes.pdf', '3-Human gut microbiota.pdf', '6-Microbiome and Human Health.pdf', '9-Combined metabolomic and metagenomic analysis.pdf']",0.191,easy,factual
multiomics_ibd_mcq_003,What was the primary method used for feature selection in machine learning models?,Recursive Feature Elimination (RFE),Iterative Feature Elimination (IFE),Principal Component Analysis (PCA),Lasso Regression,B,"Option: A
Explanation: Recursive Feature Elimination (RFE) is a popular method used for feature selection in machine learning models, as it recursively eliminates the least important features until a specified number of features are retained. It's widely used due to its simplicity and effectiveness in reducing dimensionality while retaining relevant information.","['. Prioritizing feature selection to reduce dataset dimensionality helps mitigate overfitting and enhances model performance. Ensuring dataset balance and external validation with independent datasets, as well as the inclusion of demographic and clinical variables, can lead to improved model generalizability and clinical applicability. Overall, there', '. Subsequently, we applied a log2 transformation to the metabolite values and then converted them into z-scores. Iterative feature elimination To improve the reliability and robustness of our model and reduce its size and complexity, we used the Iterative Feature Elimination (IFE) feature selection method in Python55. First, we performed a differential feature analysis to identify potential features. Subsequently, we uti- lized the scikit-learn package to train a random forest (RF) model, which was then subjected to stratiﬁed 10-fold cross-validation to dis- tinguish between IBD and normal controls. We implemented stratiﬁed 10-fold cross-validation to allocate training and testing datasets appropriately. Next, we applied the Iterative Feature Elimination (IFE) step to enhance the performance of subsequent RF models. Finally, we selected the top features from the best-performing model (the model with the highest AURCO value) as the ﬁnal features for modeling', 'Elimination (IFE) technique to perform feature selection. As a result, we rigorously selected 31 feature species from the 74 differentially abundant species (Fig. 2e), mainly from the phylum Firmicutes, for modeling analysis (Supplementary Fig. 2e). We initially developed a random forest model using 10-fold cross-validation with 31 signature species from the 6 cohorts, which demonstrated strong ability to detect IBD across all cohorts, with AUROC ranging from 0.66 to 0.95 (Fig. 2f). However, upon analyzing the performance of the classiﬁers on the six cohorts, we found that the IBDMDB cohort exhibited sig- niﬁcantly worse results than the other ﬁve cohorts. This variation in results may be due to the fact that the patients were from different medical centers, despite being from the same country. Such variability and heterogeneity in the data may have contributed to the reduced accuracy of the classiﬁers', '. Subsequently, we utilized a machine learning method (Random Forest, RF), for the diagnosis of IBD. To enhance the accuracy and interpretability of our model, as well as minimize the impact of redundant and irrelevant features, we utilized the Iterative Feature Article https://doi.org/10.1038/s41467-023-42788-0 Nature Communications| (2023) 14:7135 4', '. 44. To train the models, we used all the observations from the HRZE/NTZ trial and from the longitudinal observational cohort for a total of 34 paired samples (Fig. 1). We ﬁt a model for each inﬂammatory pathway using all the data from the two long- itudinal cohorts (HRZE/NTZ trial, and HRZE longitudinal observational cohort) because we wanted to ﬁnd patterns that are general across multiple datasets. Each model was trained using 5000 trees and with a train-validation partitioning of 80–20% of the data. We reasoned that this approach was appropriately suited for this type of “large p, small n” multi-omics dataset common in clinical research45. Importantly RFR modeling has signiﬁcant advantages compared to traditional multi-linear regression tech- niques, because it is agnostic to model structure (e.g., non- parametric regression), it does not need to meet common assumptions underlying classical regression techniques, and is able to intrinsically perform ranked feature selection', '. Additionally, the high specificity displayed in these models might not indicate a good performance when classifying negatives, but rather a bias towards negative classification, which would entail a high number of false negatives. This poor performance suggests that the bigger dataset used for model training produced overfitted models. The reduction of the dataset to 500 and 100 features produced better-\xadfitted models after modulating the classification threshold and iterations maxit. In this case, reducing the dataset size by eliminating irrelevant or redundant features may have led to better-\xadfitted ML models by mitigating overfitting, reducing multicollinearity and mitigating data sparsity. Sensitivity increased by 74% from 0.46 to 0.80 for the RF models of status, while AUC increased from 0.76 to 0.77 after the dataset was reduced to 500 features. Other studies have used similar approaches to classify diabetes', '. We then expanded each posi- tion into five features using one-hot encoding, one for each nucleo- tide and one representing a gap. The value in each of these features can be either 1 when the corresponding nucleotide or gap is present in that position, or 0 otherwise. In this way, we obtained a total of 1,382,825 features across all the SGBs. Given the large number of fea- tures produced, we then applied an additional set of thresholds based on prevalence and removing collinear ones. In particular, features with <20% prevalence or prevalence >80% in the controls and CRC samples were removed, ensuring that very rare or too common base prefer- ences were not considered, thus obtaining 42,094 features. We then removed features highly correlated (Pearson correlation >0.5) with any other feature, selecting the first occurrence as the representative and discarding all other features that correlated with it with a higher', '. For diabetes type classification, EN (0.66±0.011) and RF (0.64±0.012) performed best when trained on the 500 features dataset, but sensitivity was consistently low. Specificity was overall high across all models, reflecting a low false positive rate, meaning that', '. While this approach aimed to reflect real-\xadworld diversity, it may allow underlying demographic biases from the original dataset to persist. Overall, future studies will benefit from increased sample sizes, better-\xadbalanced datasets [59] and the inclusion of other widely used patient variable features as predictors [42]. Despite these limitations, this study is an exploratory step for the use of gut microbiome features for diabetes classification and for the construction of robust and clinically applicable predictive models. Here, we used high-\xadvariance sOTU features to train ML models for classification of diabetes status. This study demonstrates that high-\xadvariance metagenomic features derived from gut microbiome data can effectively train ML models for diabetes classification. Prioritizing feature selection to reduce dataset dimensionality helps mitigate overfitting and enhances model performance', '. Machine learning approaches For the ML analysis, we used the random forest classifier as imple- mented in the metaml tool (https://github.com/SegataLab/metaml)29. An ensemble of 1,000 trees with a minimum of 5 samples per leaf (grid-search optimal max features per split to consider in CV, and no other normalization performed) was trained and tested in the follow- ing settings on the data: (1) per-dataset CV (10-fold CV repeated 20 times); (2) across-study prediction (for each pair of studies the classi- fier is trained on one and tested on the other); and (3) LODO approach (each cohort becomes the testing set while all the others are used for training). CV comparisons were considered when presenting at least 15 samples for each class in one cohort, whereas between-dataset CV and LODO comparisons were considered when 15 samples were avail- able in each class both in the training and validation sets']","['10-Microbiome and metabolome features in inflammatory bowel disease via multi-omics integration analyses across cohorts.pdf', '18-Gastrointestinal microbiota composition predicts peripheral inflammatory state during treatment of human tuberculosis.pdf', '25-Pooled analysis of 3,741 stool metagenomes from 18 cohorts.pdf', '30-Using gut microbiome metagenomic hypervariable features for diabetes screening and typing through supervised machine learning.pdf']",0.074,easy,factual
multiomics_ibd_mcq_004,How many KO genes were identified in the intersection analysis between metabolic-related genes and differential KO genes?,25 KO genes,162 KO genes,8 differential KO genes,736 KO genes,C,"Unfortunately, I don't have the specific information about the intersection analysis between metabolic-related genes and differential KO genes to provide a precise answer.

However, since you asked for a strict answer format with options provided, I will choose an option that seems plausible given the context of gene expression and knockout (KO) studies. Keep in mind this is a guess without further information:

Option: B","['. In our study, we ﬁrst annotated gene families obtained from metagenomic analysis as KO genes using the KEGG orthology data- base, resulting in 9,270 KO genes. We applied a low-abundance ﬁlter- ing step to obtain a ﬁnal set of 3,732 KO genes, followed by differential abundance analysis using the same method as earlier. To avoid over- ﬁtting of the model, we used a strict FDR approach (CCIA analysis FDR < 1×10−12), which led to the identiﬁcation of 162 differentially expressed KO genes between normal and IBD patients (Fig. 3a and Supplementary Tables 3). Most of these KO genes are classiﬁed as potentially coding for metabolic enzymes, particularly those involved in amino acid and other metabolism. This indicates a strong associa- tion between gut microbiota and their metabolic activities. Subsequently, an enrichment analysis was conducted on these genes, uncovering 12 pathways with potential implications for both gut microbiota and disease (FDR < 0.05)', 'Fig. 5 | Construction of multi-omics biological correlation (MOBC) maps of gut microbiota in IBD. a 4 IBD cohorts are available for integrative analysis (n = 391). b Flowchart for the identiﬁcation of 8 different KO genes related to metabolism and disease phenotypes to construct multi-omics biological correlation (MOBC) maps. c–j MOBC maps of the 8 KO genes. The reaction equation below each image represents a reaction process corresponding to a KO gene. The bolded metabolites and KO genes represent those that have been validated and show signiﬁcant dif- ferences in our metagenomics and metabolomics analyses. The red color indicates enrichment in IBD, while blue represents depletion. The bar chart in the top half of each image represents the top 5 contributors of gut bacteria carrying this KO gene. Source data are provided as a Source Data ﬁle. Article https://doi.org/10.1038/s41467-023-42788-0 Nature Communications| (2023) 14:7135 10', '. 4e). This effort led to the identiﬁcation of 736 KO genes (Supplementary Table 6). Addi- tionally, we conducted an intersection analysis, comparing these metabolic-related genes with the 162 KO genes identiﬁed in our pre- vious differential analysis of 6 IBD metagenomic cohorts (Fig. 3a). As a result, our investigation unveiled 8 differential KO genes with asso- ciations to both metabolism and disease phenotypes. (Fig. 5b and Supplementary Fig. 5a-h). Further research on these genes and their roles in metabolic pathways could provide signiﬁcant insights into the underlying mechanisms of IBD. The K22477 (argO, N-acetylglutamate synthase) is responsible for producing N-acetylglutamate (NAG) from glutamate and acetyl-CoA. Fig. 3 | Identiﬁcation of IBD diagnostic markers by demonstrating variations of Kyoto Encyclopedia of Genes and Genomes (KEGG) orthology (KO) across different IBD cohorts', '. Fig. 3 | Identiﬁcation of IBD diagnostic markers by demonstrating variations of Kyoto Encyclopedia of Genes and Genomes (KEGG) orthology (KO) across different IBD cohorts. a The circular complex heatmap displays the 162 most signiﬁcant KO genes (P < 1×10−12), as calculated using a two-sided Wilcoxon test with FDR-corrected P values in the cross-cohort analysis. The inner-circle heatmap shows the generalized fold change (gFC) values of these 162 KO genes, with red indicating enriched and blue indicating depleted in IBD. The outer-circle bar chart displays the p-values of 25 featured KO genes in each cohort used for modeling. b The IBD classiﬁcation accuracy was measured using AUROC for classiﬁers trained on the KO genes abundance proﬁles. The classiﬁcation accuracy was evaluated using 10-fold cross-validation within each cohort (gray boxes along the diagonal) and cohort-to-cohort model transfer (external validations off-diagonal)', '2017 cohort that displayed excellent diagnostic performance (AUROC: 0.98), showed a decrease in AUROC values compared to bacterial species models. The cohort-to-cohort transfer analysis demonstrated that the mean AUROC values for all cohorts ranged from 0.74 to 0.81 (Fig. 3b). Consistent with bacterial species models, the LOCO analysis showed that the diagnostic value of KO genes was slightly higher than in the cohort-to-cohort transfer analysis (Fig. 3c). In general, while the diagnostic performance of KO gene models is somewhat lower than that of bacterial species models, their diagnostic sensitivity is still acceptable. Furthermore, to validate the diagnostic potential of the 25 KO genes, we applied them to the above independent cohorts. In cohort- to-cohort transfer models, the AUROCs ranged from 0.71 to 0.96, while in LOCO classiﬁcation models, the AUROCs ranged from 0.61 to 0.87 Article https://doi.org/10.1038/s41467-023-42788-0 Nature Communications| (2023) 14:7135 6', '. Selection of the most distinctive species on the entire cohort does not seem to lead to a significant over-fit, as the algorithm established with one cohort gives comparably high AUC values with an unrelated cohort24. Future work, searching for correlations of gene abundances and gene counts without separation of individuals into the LGC and HGCgroups,mayallowidentifyingadditionalspeciesthatexplainvaria- tion of gene numbers. Microbial metabolism of LGC and HGC groups Through the functional annotation of the reference gene catalogue to KEGG Orthology (KO) groups, abundances of KO groups were deter- mined for the LGC and HGC individuals as in ref. 22. Using the enzyme annotations of the different KO groups, 51 manually defined gut metabolic pathway modules (Supplementary Table 7) differed sig- nificantly in abundance between both groups (Methods)', '. et al., manuscript in preparation). The relative pathway/module abundance of higher order functional categories were calculated from rarefied KO abundances. Modules were deemed present when $30% of the enzymes were recovered, after manual removing of overly ‘promiscuous’ enzymes (that is, present in multiple modules) before abundance calculation.Forhigher-levelfunctionalassignments,KOabundancesweresummed anddistributedevenlywhenKOgroupsappearedinmultiplecategories.Functional differences were calculated with a Wilcoxon rank-sum test and multiple testing corrections were performed using the Benjamini–Hochberg method40 (q ,0.05). Genes significantly different in groups of individuals. Genes significantly diffe- rent in abundance between groups of individuals were identified by the Wilcoxon rank-sum test coupled to a bootstrapping approach', '. Additionally, we used a generalized fold change (gFC) approach to calculate the magnitude of differences between control and IBD samples. KEGG Orthology Enrichment Analysis (KOEA) were conducted for KO genes using the R package “clusterProﬁler”54. Identiﬁcation of IBD-related differential metabolites We identiﬁed differential metabolites based on two criteria: (1). False discovery rate (FDR) < 0.0001, using nonparametric univariate method (Wilcoxon rank-sum test). The P value for each metabolite was corrected for FDR using the false discovery rate method (2). Sig- niﬁcance of the projected variable (VIP score) > 1 using OPLS-DA model. OPLS-DA stands for Orthogonal Projections to Latent Struc- tures Discriminant Analysis, which is a multivariate statistical method used to analyze data with multiple variables. The signiﬁcance of the projected variable is a measure of how well a metabolite contributes to the separation between the two groups being compared', '. Additionally, we sought to assess the potential diagnostic use- fulness of the KO genes in IBD. We utilized the IFE method for feature selection and identiﬁed 25 KO genes as features for random forest modeling out of the 162 KO genes. After conducting a 10-fold cross- validation analysis, we observed that all cohorts, except for the HeQ Fig. 2 | Identiﬁcation of bacterial biomarkers at the species level for diagnosing IBD through cross-cohorts. a Overall composition of the population across 9 metagenomic datasets (n = 1363). b, c The alpha diversity of IBD (red, n = 795) and control (blue, n = 395) was measured using the Shannon index and Simpson index. The adjusted p value (two-sided test) was calculated using MMUPHin tools. The data in boxplots is represented using interquartile ranges (IQRs), with the median shown as a horizontal line, and the whiskers extending to the most extreme points within 1.5 times the IQR. Exact p values are provided in the Source data ﬁle', '. Functional annotation. BLASTP was used to search the protein sequences of the predicted genes in the eggNOG database56 and KEGG database57 with E # 1025 as described previously8, and the NOG/KEGG OG of the best hit was assigned to each gene. The genes annotated by COG were classified into the 25 COG cat- egories, and genes that were annotated by KEGG were assigned to a set of manu- ally determined gut metabolic modules (G.W. et al., manuscript in preparation). The relative pathway/module abundance of higher order functional categories were calculated from rarefied KO abundances']","['10-Microbiome and metabolome features in inflammatory bowel disease via multi-omics integration analyses across cohorts.pdf', '14-Richness of human gut microbiome correlates with metabolic markers(Obesity).pdf']",0.2822,medium,factual
multiomics_ibd_mcq_005,What was the false positive rate (FPR) range for metagenomic classifiers on non-IBD disease datasets?,FPR ranging from 0.08 to 0.15,FPR ranging from 0.20 to 0.30,FPR ranging from 0.04 to 0.13,FPR ranging from 0.15 to 0.25,A,"Option: C
Justification: Based on the general understanding of metagenomic classifiers and their performance on non-IBD disease datasets, a false positive rate (FPR) range from 0.04 to 0.13 is considered relatively low and acceptable for such applications. This range suggests that the classifiers are able to accurately identify true positives while minimizing false alarms.","['. Exact p values are provided in the Source data ﬁle (Supplementary Table 5). e The workﬂow for identifying metabolites across four cohorts involved annotating with the Human Metabolome Database (HMDB). f The ridge plot shows the concentration differences of 13 featured metabolites between the normal control and IBD (Unit: log2 (µmol/g)). Their signiﬁcance scores calcu- lated using a two-sided Wilcoxon test with FDR-corrected p values (denoted as ****p < 0.0001). Exact p values are provided in the Source data ﬁle. g, h We developed random forest (RF) classiﬁers trained on metabolites to identify IBD patients. We performed 10-fold cross-validation (red), leave-one-out cross- validation (LOOCV) (blue) and independent validation (green). Shaded areas represent the 95% conﬁdence intervals of the corresponding ROC curves. Source data are provided as a Source Data ﬁle. Article https://doi.org/10.1038/s41467-023-42788-0 Nature Communications| (2023) 14:7135 9', '. 2a). Speciﬁcally, the HallAB 2017 cohort had an average AUROC of 0.70, the FranzosaEA 2019B cohort had an average AUROC of 0.90, and the Pudong cohort had an average AUROC of 0.89 (Supplementary Fig. 2f). However, the AUROCs for the LOCO analysis slightly improved, with HallAB 2017 at 0.72, FranzosaEA 2019B at 0.96, and the Pudong cohort at 0.91 (Supplementary Fig. 2f). If we consider the HallAB 2017 cohort as an outlier, the independent validation of our models can result in an AUROC of approximately 0.90. Since previous research has revealed that changes in the micro- biome can be associated with various diseases, emphasizing the importance of identifying disease-speciﬁc microbiome signatures. We next investigated the false positive rate (FPR) of our metagenomic classiﬁers by analyzing metagenomes from patients with gastro- intestinal (GI) diseases, such as adenoma and colorectal cancer (CRC), as well as non-GI diseases like type 2 diabetes (T2D)', '(Supplementary Fig. 3d). We also tested for FPR by analyzing other disease datasets, including adenoma, CRC and T2D. The FPR of these KO genes on non-IBD cohorts were also relatively low, with adenoma at 0.04, CRC at 0.13 and T2D at 0.07 (Supplementary Fig. 3e), indicating their excellent disease speciﬁcity. We also utilized the EggNOG orthologous gene classiﬁcation method for diagnosing IBD (Supplementary Fig. 3f and Supplementary Table 4), but the accuracy of IBD detection was slightly lower com- pared to using the KO models. The AUROC values ranged from 0.63 to 0.80 for cohort-to-cohort transfer validation (Supplementary Fig. 3g) and from 0.65 to 0.92 in LOCO validation (Supplementary Fig. 3h). After considering the accuracy and interpretability of the results, we decided to use only the annotated results from the KO database in subsequent analyses', '. The data preprocessing, model building, and model evaluation were performed utilizing the following R packages: SIAMCAT (v.1.14.0), caret (v.6.0.90), randomForest (v. 4.7.1.1), pROC (v.1.18.0), and ROCR (v.1.0.11). Independent validation with external metagenomic cohorts To ensure the reliability of metagenomic features as diagnostic mar- kers for IBD, we validated our ﬁndings using three independent data- sets from both the USA and China (Fig. 2a). We performed cohort-to- cohort and leave-one-cohort-out (LOCO) analyses to evaluate the strength and consistency of the identiﬁed markers, following the same process used to construct the model in the discovery cohorts. Validation of microbial biomarkers’ speciﬁcity in non-IBD cohorts To minimize the risk of misdiagnosing IBD, we assessed the speciﬁcity of metagenomic markers by analyzing the AUROC values of models constructed using the most effective panel of features', '. Therefore, we utilized LOCO classiﬁcation models of species, calibrated to achieve a FPR of 0.08 and 0.13 on CRC datasets (Supplementary Fig. 2g), respectively. We found that the FPRs on the other disease datasets were also relatively low, with adenoma at 0.15 and T2D at 0.11 (Sup- plementary Fig. 2g). These results suggest that our models have excellent disease speciﬁcity. Overall, our ﬁndings demonstrate that our model has excellent speciﬁcity and can accurately identify disease- speciﬁc microbiome signatures. Identiﬁcation of IBD diagnostic markers by demonstrating var- iations of Kyoto Encyclopedia of Genes and Genomes (KEGG) orthology (KO) across different IBD cohorts Metagenomic functional analysis plays a critical role in understanding the complex interactions between the gut microbiome and human health. In our study, we ﬁrst annotated gene families obtained from metagenomic analysis as KO genes using the KEGG orthology data- base, resulting in 9,270 KO genes', '. 4e, f). To account for variations in metabolite detection methods and numerical units between internal and external cohorts, we limited our cross-validation to cohorts with the same units. In our analysis of the Renji cohorts, the 10-fold cross-validation of our model achieved an AUROC value of 0.945, while the leave-one-out cross-validation (LOOCV) had a slightly lower performance of 0.937, and the independent validation cohort arm an AUROC of 0.867 (Fig. 4g). In the USA-NL cohorts, both 10-fold cross-validation and LOOCV exhibited similar AUROC values, both exceeding 0.9, and the independent validation cohort had good performance with an AUROC of 0.841 (Fig. 4h). Based on these results, it can be inferred that metabolomics has a higher potential for disease diagnosis compared to metagenomics and can be a promising biomarker for diagnosis in the future', '. However, the roles of these metabolites in IBD remain unknown. We next aimed to investigate whether a speciﬁc group of meta- bolites can serve as an accurate diagnostic tool for IBD, regardless of whether it is targeted or non-targeted datasets through CCIA methods. We then integrated four metabolomics studies and identiﬁed a total of 79 metabolites that were commonly present in all four cohorts using HMDB ID. Subsequently, we conducted univariate differential analysis with FDR < 0.0001 and OPLS-DA analysis using a VIP score > 1, which led to the identiﬁcation of 32 candidate metabolites. To further reﬁne our selection, we employed IFE and narrowed down our pool to 13 metabolites (Fig. 4e, f). To account for variations in metabolite detection methods and numerical units between internal and external cohorts, we limited our cross-validation to cohorts with the same units', '. 6h). Our results indicate that combining species, KO genes, and metabolites can signiﬁcantly enhance the diagnostic performance of our model in fecal metagenomic and metabolomic analysis. Identiﬁcation of multi-omics biomarkers for distinguishing subtypes of IBD As the treatment strategies for UC and CD differ signiﬁcantly, we next aimed to identify a subset of markers from the multi-omics panel mentioned above that could distinguish between the two subtypes of IBD. Using the IFE approach, we selected 12 features from the multi- omics panel (Supplementary Fig. 6a). The RF model revealed that the 12 selected markers could effectively differentiate between UC and CD. The AUROC values for 10-fold cross-validation and LOOCV were approximately 0.8 in both internal and external cohorts, with inde- pendent validation achieving values above 0.7 (Supplementary Fig. 6b, c). This sub-panel can aid clinicians in further categorizing the disease following the diagnosis of IBD', '. 4h). Based on these results, it can be inferred that metabolomics has a higher potential for disease diagnosis compared to metagenomics and can be a promising biomarker for diagnosis in the future. To further validate the disease speciﬁcity of our feature metabo- lites, we incorporated four additional non-IBD metabolomics cohorts, including one adenoma cohort, two CRC cohorts, and one T1D cohort. Differential analysis revealed that the majority of the 13 metabolites we included for diagnosing IBD did not show signiﬁcant differences in these cohorts (FDR > 0.05, Supplementary Fig. 4f-i). These ﬁndings substantiate the disease-speciﬁc nature of our featured metabolites in IBD', '. 4a). Among these datasets, four datasets contained both metagenomic and metabolomic data (Fig. 5a). Considering that some subjects were sampled at different time points, we only retained the data from the ﬁrst sampling to ensure the accuracy of the diagnostic model. Addi- tionally, as country or region is a major confounding factor, we only included subjects from the same country in each dataset to minimize confounding effects. Furthermore, because there were signiﬁcantly more normal controls than IBD cases in the LifeLD VilaAV 2018 cohort, we randomly removed some of the normal controls to maintain a ratio of 1:2 to 1:3 between normal controls and IBD cases for precision of the study. Metagenomic sequencing The DNA from the stool samples was extracted utilizing the HiPure Stool DNA Mini Kit (Magen Biotechnology, China). The quality, size, and concentration of the extracted DNA were evaluated via agarose gel electrophoresis and the Qubit™4 Fluorometer (Thermo Fisher Scien- tiﬁc, USA)']",['10-Microbiome and metabolome features in inflammatory bowel disease via multi-omics integration analyses across cohorts.pdf'],0.1767,medium,factual
multiomics_ibd_mcq_006,Which metabolite class showed carnitine compounds and 1-Methylhistidine as biomarkers in IBD?,Biomarkers associated with vegetable consumption,Biomarkers associated with meat consumption,Biomarkers associated with dairy consumption,Biomarkers associated with grain consumption,B,"The correct answer is B.

1-Methylhistidine and carnitine compounds are biomarkers of meat consumption, as they are found in high amounts in animal-derived foods. Inflammatory bowel disease (IBD) has been associated with changes in gut microbiota and metabolism, which can be influenced by diet. Therefore, it's reasonable to conclude that these biomarkers are related to meat consumption.","['. Interestingly, we alsoobserved that various organic acids related to the tricarboxylic acid cycle, such as Pyruvic acid, Fumaric acid, Malonic acid, and Oxoglutaric acid, were enriched in IBD patients, indicating abnormal energy metabolism of intestinal microbiota. Furthermore, among these 78 differential fecal metabolites, 36 are unique to the in- house dataset (Supplementary Fig. 4e), such as some amino acids (1- Methylhistidine, Acetylglycine, N-Acetylglutamine, N-Acetylserine Dimethylglycine and 4-Hydroxyproline) and benzenoids (Phe- nylpyruvic acid, 3-Hydroxyphenylacetic acid, Protocatechuic acid and 3-Aminosalicylic acid). Especially, carnitines compounds and 1-Methylhistidine are biomarkers associated with meat consumption40 and its signiﬁcant elevation in the gut of IBD patients is in line with well- established dietary risk factors for IBD, such as the consumption of red and processed meats41. However, the roles of these metabolites in IBD remain unknown', '. 4b, c and Supplementary Fig, 4a, b). Our ﬁndings indicate that no particular group of metabolites was superior in distinguishing between patients with IBD and healthy individuals than the collective set of all metabolites. (Supplementary Fig. 4c, d). To further understand the differences in metabolites between IBD patients and healthy controls, we performed a differential analysis and identiﬁed 78 metabolites (Fig. 4d and Supplementary Tables 5). Most of these metabolites were found to be enriched in IBD patients, with only a few being depleted. The majority of these differential metabo- lites belong to the three major nutrient metabolism categories, including amino acids, carbohydrates, and fatty acids. Notably, amino acids such as Tryptophan, Glutamine, Arginine, and 5-Hydro- xytryptophan, Histidine were found to be enriched in the intestines of IBD patients, thisisconsistent with the results of the previous studies39', '. However, the roles of these metabolites in IBD remain unknown. We next aimed to investigate whether a speciﬁc group of meta- bolites can serve as an accurate diagnostic tool for IBD, regardless of whether it is targeted or non-targeted datasets through CCIA methods. We then integrated four metabolomics studies and identiﬁed a total of 79 metabolites that were commonly present in all four cohorts using HMDB ID. Subsequently, we conducted univariate differential analysis with FDR < 0.0001 and OPLS-DA analysis using a VIP score > 1, which led to the identiﬁcation of 32 candidate metabolites. To further reﬁne our selection, we employed IFE and narrowed down our pool to 13 metabolites (Fig. 4e, f). To account for variations in metabolite detection methods and numerical units between internal and external cohorts, we limited our cross-validation to cohorts with the same units', '. 4h). Based on these results, it can be inferred that metabolomics has a higher potential for disease diagnosis compared to metagenomics and can be a promising biomarker for diagnosis in the future. To further validate the disease speciﬁcity of our feature metabo- lites, we incorporated four additional non-IBD metabolomics cohorts, including one adenoma cohort, two CRC cohorts, and one T1D cohort. Differential analysis revealed that the majority of the 13 metabolites we included for diagnosing IBD did not show signiﬁcant differences in these cohorts (FDR > 0.05, Supplementary Fig. 4f-i). These ﬁndings substantiate the disease-speciﬁc nature of our featured metabolites in IBD', '. Exact p values are provided in the Source data ﬁle (Supplementary Table 5). e The workﬂow for identifying metabolites across four cohorts involved annotating with the Human Metabolome Database (HMDB). f The ridge plot shows the concentration differences of 13 featured metabolites between the normal control and IBD (Unit: log2 (µmol/g)). Their signiﬁcance scores calcu- lated using a two-sided Wilcoxon test with FDR-corrected p values (denoted as ****p < 0.0001). Exact p values are provided in the Source data ﬁle. g, h We developed random forest (RF) classiﬁers trained on metabolites to identify IBD patients. We performed 10-fold cross-validation (red), leave-one-out cross- validation (LOOCV) (blue) and independent validation (green). Shaded areas represent the 95% conﬁdence intervals of the corresponding ROC curves. Source data are provided as a Source Data ﬁle. Article https://doi.org/10.1038/s41467-023-42788-0 Nature Communications| (2023) 14:7135 9', '. Raw metabolome data are available in Supplementary Table 2-2. A minimum of 60% of the stable compounds identified were utilized for the meta- bolomic profile comparison. The most frequently observed compounds that met the screening criteria are presented in Table 1. Among the identified compounds, SCFAs, medium- and long-chain fatty acids, and amino acid derivatives were observed. This investigation employed comprehensive volatile metabolomic profiling to characterize pediatric IBDs, with particular focus on CD. At the first stage, a verification metabolomic analysis was carried out, which allowed for to identi- fication of the spectrum of compounds in pediatric and adult IBD groups compared to the control. Based on the data ob- tained, the profile of all detectable (Figure 1A and B) and stably detectable (Figure 1C and D) metabolites revealed in the IBD group was significantly different from that of the control group', '. This discovery offers a promising potential for a non-invasive biomarker that could play a pivotal role in clinically categorizing distinct sub- types of IBD. Fig. 4 | Demonstration of Metabolomic Alterations across Different IBD Cohorts and Utilization of Signature Metabolites for IBD Diagnosis. a Overall composition of the population across 4 metabolomics datasets (n = 398). b A principal coordinates analysis (PCoA) was performed on individuals from the Puxi cohort. The analysis showed signiﬁcant differences in metabolites composition between control (n = 25) and IBD (n = 83) (P = 0.001), as determined by PERMA- NOVA using Bray-Curtis distance with 999 permutations (two-sided test). c Orthogonal Partial Least Squares Discriminant Analysis (OPLS-DA) model of Puxi cohort individuals based on gut metabolomic proﬁles (Q2Y: 0.618)', '. Millions of people worldwide are affected by IBD, and its inci- dence is shifting from developed to developing countries, highlighting the importance of early diagnosis5–7. The utilization of fecal shotgun metagenomics provides a powerful means to identify disease- associated species and understand co-metabolism between the host and microbiota at a higher taxonomic resolution8, while metabolomics reveals changes in gut metabolites as a messenger of information exchange between the gut microbiota and the host9. Combining metagenomics and metabolomics presents a promising approach for understanding the development of IBD and related gut environment alterations and offers a non-invasive biomarker for IBD. Received: 24 May 2023 Accepted: 20 October 2023 Check for updates A full list of afﬁliations appears at the end of the paper. e-mail: haoyanchen@sjtu.edu.cn; jiehong97@sjtu.edu.cn Nature Communications| (2023) 14:7135 1 1234567890():,; 1234567890():,;', '. 3h). After considering the accuracy and interpretability of the results, we decided to use only the annotated results from the KO database in subsequent analyses. Demonstration of Metabolomic Alterations across Different IBD Cohorts and Utilization of Signature Metabolites for IBD Diagnosis Intrigued by the intricate interplay between gut microbiota and host co-metabolism38,we further sought to explore the spectrum of chan- ges in fecal metabolites through metabolomics. Using targeted meta- bolomics, we examined the differences in fecal metabolites between IBD patients and healthy individuals (Fig. 4a). We performed Principal Coordinate Analysis (PCoA) and constructed Orthogonal Partial Least Squares Discriminant Analysis (OPLS-DA) models, revealing sub- stantial differentiation in the metabolomic proﬁles between the two groups (Fig. 4b, c and Supplementary Fig, 4a, b)', '. 6h). Our results indicate that combining species, KO genes, and metabolites can signiﬁcantly enhance the diagnostic performance of our model in fecal metagenomic and metabolomic analysis. Identiﬁcation of multi-omics biomarkers for distinguishing subtypes of IBD As the treatment strategies for UC and CD differ signiﬁcantly, we next aimed to identify a subset of markers from the multi-omics panel mentioned above that could distinguish between the two subtypes of IBD. Using the IFE approach, we selected 12 features from the multi- omics panel (Supplementary Fig. 6a). The RF model revealed that the 12 selected markers could effectively differentiate between UC and CD. The AUROC values for 10-fold cross-validation and LOOCV were approximately 0.8 in both internal and external cohorts, with inde- pendent validation achieving values above 0.7 (Supplementary Fig. 6b, c). This sub-panel can aid clinicians in further categorizing the disease following the diagnosis of IBD']","['10-Microbiome and metabolome features in inflammatory bowel disease via multi-omics integration analyses across cohorts.pdf', '9-Combined metabolomic and metagenomic analysis.pdf']",0.3069,medium,factual
multiomics_ibd_mcq_007,"Which bacteria showed negative correlation with Candida albicans colonization, which is enriched in IBD?",Faecalibacterium prausnitzii,Ruminococcus gnavus,Alistipes putredinis,Escherichia coli,C,"Option: C
Alistipes putredinis is known to have a negative correlation with Candida albicans colonization, which is often enriched in Inflammatory Bowel Disease (IBD) patients.","['. 2e). In addition, our study suggests that certain bacteria involved in other intestinal metabolism, including those associated with mineral meta- bolism (such as Collinsella aerofaciens involved in iron metabolism19), bile acid metabolism20 (such as Ruminococcus torques), and urea cycle metabolism21 (such as Biﬁdobacterium longum), all of which demon- strate a signiﬁcant decrease (Fig. 2e). Some bacteria that antagonize pro-inﬂammatory microorganisms are also signiﬁcantly reduced. Alistipes putredinis showed a negative correlation with the colonization of Candida albicans, which is enriched in the gut of IBD patients and exacerbates intestinal inﬂammation by inducing Th17 cell differentiation22,23. Notably, through a comprehensive analysis, we have successfully identiﬁed two speciﬁc microbial species, Asacchar- obacter celatus and Gemmiger formicilis, which are depleted across six distinct IBD cohorts (Supplementary Fig. 2c)', 'such as Lachnospiraceae_NK4A136_group, Faecalibacterium, Dorea, Butyricicoccus and Biﬁdobacterium (P<0.001), and negatively associated with Lactobacillus, Erysipelatoclostridium, Megasphaera and Sellimonas, most of which were enriched in PTB patients. Moreover, Cr was positively correlated with some bacteria enriched in HCs, and negatively correlated with bacteria enriched in PTB group (P<0.05). Besides, WBC had no direct relation with the genera in our study. It is also unusual in that A B C FIGURE 2 Relative abundance and LEfSe analysis of intestinal microbiota. (A) The relative abundance of intestinal ﬂora between the PTB patients (red) and HCs (blue) at the phylum level, the family level and the genus level. (B) The statistical difference of intestinal ﬂora between two groups. *P<0.05, **P<0.01, ***P<0.001. The signiﬁcance was assessed by Student’s t test. (C) The cladogram identiﬁed the differentially abundant taxa between the PTB patients and HCs', 'Nature Reviews Microbiology | Volume 23 | August 2025 | 509–524 512 Review article UC are affected by drastic mycobiota changes, active inflammation, bacterial community and dietary changes appear to be among the fac- tors affecting mycobiota composition in IBD38–49. Similar to advances in our understanding of the relationship between bacteria and IBD, where increasing importance has been placed on strain variations and functional characteristics, strain-specific features of common fungi, such as C. albicans in the gut of individuals with IBD, play a key role in inflammation46. Indeed, highly damaging C. albicans strains, producing the toxin candidalysin, have been identified in the gut of individuals with UC46 (Fig. 1). Candidalysin induces intestinal inflammation by damaging epithelial membranes and activating the MAPK pathway54, leading to the recruitment of T helper 17 (TH17) cells, neutrophils and pro-inflammatory cytokines46,55,56', ', enriched in individuals with T2D, suggesting a potential trans- location of oral microbes to the gut, indicative of a pro-inflammatory HPFS (USA) n = 307 NHSII (USA) n = 213 HCHS/SOL (USA) n = 2,881 Fromentin_2022 (DEU/DNK/FRA) n = 1,005 DIRECT- PLUS (ISR) n = 280 Qin_2012 (CHN) n = 344 Zhong_2019 (CHN) n = 248 Wu_2020b (SWE) n = 484 Karlsson_2013 (SWE) n = 145 Wu_2020a (SWE) n = 991 Universal Overlapping Singular Prevotella copri Bacteroides uniformis Bacteroides vulgatus Faecalibacterium prausnitzii Eubacterium rectale Alistipes putredinis Ruminococcus bromii Bacteroides dorei Bacteroides stercoris Roseburia faecis Eubacterium eligens Fusicatenibacter saccharivorans Bifidobacterium adolescentis Parabacteroides distasonis Collinsella aerofaciens Akkermansia muciniphila Anaerostipes hadrus Eubacterium siraeum Escherichia coli Bacteroides thetaiotaomicron Bacteroides caccae Roseburia inulinivorans Roseburia intestinalis Bacteroides ovatus Bacteroides eggerthii Eubacterium sp', '. Fungi Fungi are ubiquitous in the environment and present on all body sur- faces, including the gastrointestinal tract38–50. Gut mycobiome com- position is highly variable between and within individuals, as diet and environmental exposure (Box 1) change constantly51,52. Nevertheless, exploration of the mycobiome in IBD cohorts has determined the common presence of species from several genera including Candida, Saccharomyces, Cladosporium, Malassezia, Pichia, Aspergillus and Peni- cillium, with Candida species and Candida albicans found to be altered across multiple studies38–49(Table 1). Malassezia spp. and Debaryomyces spp. have also been linked to CD48,53', '. Through CCIA with an FDR less than 0.0001, 74 microbial species were identiﬁed to have signiﬁcantly different abundances in the gut microbiomes (Fig. 2e and Supple- mentary Table 2). Despite signiﬁcant differences in diet and genetics among IBD patients from various regions or countries, a consistent pattern of alteration in their gut microbiota was observed. Our results suggest that IBD patients exhibit a signiﬁcant reduction in commensal gut microbiota, which are crucial for various activities of their hosts. Several species, known to produce butyric acid17,18, were found to be depleted in the gut microbiota of IBD, including Faecalibacterium prausnitzii, Roseburia intestinalis, Eubacterium hallii, Gemmiger for- micilis, Eubacterium rectale, and Ruminococcus bromii (Fig. 2e)', '. Suggestions have been made of the presence of a ‘core microbiota’, proposed to be a set of the same abundant organisms present in all individuals. However, more similarity can be observed in the repertoire of microbial genes present between individuals than the taxonomic proﬁle, suggesting that the core microbiota may be better deﬁned at a functional rather than organism level [46]. Recently, it has been possible to classify individual microbiota arrangements into ‘community types’ that can be predictive of each other and are associated with background [48]. Multi-dimensional analysis of 33 samples from different nationalities revealed the presence of three enterotypes identiﬁable by variations in the level of one of three genera: Bacteroides (enterotype 1), Prevotella (enterotype 2) and Ruminococcus (enterotype 3) [49]. However, evidence surrounding the existence and formation of these enterotypes is controversial, as thoroughly reviewed in [50]', '. (Clostrid- ium hathewayi and Clostridium bolteae) and R. gnavus during IBD progression, indicated that these bacteria may be involved in disease pathogenesis15. R. gnavus and Ruminococcus torques glucorhamnan has been linked to inflammation in CD29 and an antagonistic relationship with the potentially beneficial species Akkermansia muciniphila30,31. Other Clostridium spp. such as Clostridium innocuum and Clostridium symbiosum can even translocate into mesenteric adipose tissues of individuals with CD32. The gut microbiome composition of individu- als with IBD would periodically resemble that of healthy individuals, following a dysbiotic deviation that precedes the disease relapse16. Fur- thermore, the overall balance and composition of the gut microbiota Introduction Inflammatory bowel disease (IBD) is a heterogeneous group of inflammatory diseases affecting an estimated 0.3–0.5% of the global population1', '. A decline in the Clostridium leptum groups, particularly F. prausnitzii, has been observed among Firmicutes (Wang et al., 2014). In biologically susceptible hosts, alterations of the gut microbiota have been associated with aberrant mucosal immune responses that result in a variety of intestinal and extraintestinal disorders, including IBD. As a result, restoring immunological homeostasis by modifying the gut microbiota is currently considered to be a potential therapeutic strategy to treat IBD patients (Facciotti, 2022). The majority of discovered human pathogenic bacteria belong to the phylum Proteobacteria, which play an increasingly important role in IBD (Mukhopadhya et al., 2012). Analysis of microbial diversity shows a rise in the number of bacterial species belonging to this phylum, implying an active role in initiating chronic inﬂammation in patients with IBD (Hold et al., 2014). The abundance of Ruminococcus gnavus is also Frontiers in Microbiology 09 frontiersin.org', '. Therefore, further delin\xad eation of IBD requires a greater level of microorganism differentiation analysis as well as taking into account environmental, lifestyle and genetic factors. Previous studies have characterized gut microbiomes in patients with UC and CD, however, these few stud\xad ies have been performed on populations not from the Middle East. Given cultural and dietary dissimilarities in Middle Eastern versus Western populations, we hypothe\xad sized that key IBD-associated microbes may be distinctly different in Middle Eastern study participants. Indeed, in our study of Saudi Arabian participants we observed a number of microbial genera that were not well charac\xad terized in prior IBD studies']","['1-Introduction to the human gut microbiota.pdf', '10-Microbiome and metabolome features in inflammatory bowel disease via multi-omics integration analyses across cohorts.pdf', '11-Microbiota in inflammatory bowel disease.pdf', '12-Gut microbiota analyses of inflammatory bowel diseases.pdf', '23-The correlation between dysfunctional intestinal flora and pathology feature of patients with pulmonary tuberculosis.pdf', '28-Strain-specific gut microbial signatures in type 2 diabetes identified in a cross-cohort analysis of 8,117 metagenomes.pdf', '3-Human gut microbiota.pdf']",0.073,medium,mechanism
multiomics_ibd_mcq_008,What diagnostic approach achieved the highest AUROC in the Renji cohort for IBD detection?,Species-only model (AUROC 0.95),KO genes-only model (AUROC 0.98),Metabolites-only model (AUROC 0.945),Combined multi-omics model (AUROC 0.98),D,"Option: D

The combined multi-omics model achieved the highest AUROC in the Renji cohort for IBD detection, outperforming other models that focused solely on species, KO genes, or metabolites.","['(Supplementary Fig. 3d). We also tested for FPR by analyzing other disease datasets, including adenoma, CRC and T2D. The FPR of these KO genes on non-IBD cohorts were also relatively low, with adenoma at 0.04, CRC at 0.13 and T2D at 0.07 (Supplementary Fig. 3e), indicating their excellent disease speciﬁcity. We also utilized the EggNOG orthologous gene classiﬁcation method for diagnosing IBD (Supplementary Fig. 3f and Supplementary Table 4), but the accuracy of IBD detection was slightly lower com- pared to using the KO models. The AUROC values ranged from 0.63 to 0.80 for cohort-to-cohort transfer validation (Supplementary Fig. 3g) and from 0.65 to 0.92 in LOCO validation (Supplementary Fig. 3h). After considering the accuracy and interpretability of the results, we decided to use only the annotated results from the KO database in subsequent analyses', '. 6h). Our results indicate that combining species, KO genes, and metabolites can signiﬁcantly enhance the diagnostic performance of our model in fecal metagenomic and metabolomic analysis. Identiﬁcation of multi-omics biomarkers for distinguishing subtypes of IBD As the treatment strategies for UC and CD differ signiﬁcantly, we next aimed to identify a subset of markers from the multi-omics panel mentioned above that could distinguish between the two subtypes of IBD. Using the IFE approach, we selected 12 features from the multi- omics panel (Supplementary Fig. 6a). The RF model revealed that the 12 selected markers could effectively differentiate between UC and CD. The AUROC values for 10-fold cross-validation and LOOCV were approximately 0.8 in both internal and external cohorts, with inde- pendent validation achieving values above 0.7 (Supplementary Fig. 6b, c). This sub-panel can aid clinicians in further categorizing the disease following the diagnosis of IBD', '. These bio- markers demonstrate robust reproducibility across various cohorts. In contrast to the current invasive gold standard for diagnosing IBD, colonoscopic examination, we have demonstrated the potential of utilizing gut fecal microbiota and metabolites as a non-invasive approach to diagnosis, which contributes to the early detection and prediction of IBD, facilitating timely interventions and reducing the risk of complications. Moreover, through the integration of diverse omics data, we have achieved a signiﬁcant enhancement in the per- formance of our machine learning models for diagnosing IBD, achieving an AUROC value of 0.98 in Renji cohorts, compared to previous non-invasive diagnostic models9,10. Furthermore, we have successfully pinpointed a subset of markers from the multi-omics panel that exhibit the remarkable ability to distinguish between UC and CD with an impressive average AUROC value of up to 0.8', '. To investigate if the integration of multiple data sources could improve diagnostic accu- racy, we further examined the interplay between gut microbiota and their metabolites. We ﬁrst combined species and KO genes to differ- entiate IBD and obtained a satisfactory diagnostic performance in both 10-fold cross-validation and LOOCV. The Renji cohort showed an AUROC value above 0.97, while the USA-NL cohort increased to above 0.9 (in comparison to using single species or KO genes), and the independent validation of these panels exhibited AUROC values above 0.9 (Fig. 6a, d). After that, we combined species and metabolites, metabolites and KO genes, and found that their diagnostic perfor- mance was generally above 0.9 (AUROC) (Fig. 6b, c, e, f). Particularly, the combination of species and metabolites presented the best per- formance among the combined panels, and both outperformed the diagnostic performance of the individual panels', '. In the combined analysis cohorts (Fig. 5a), a total of 171 participants were incorporated, consisting of 130 patients with IBD and 41 age- and gender-matched healthy control subjects. Among them, the Puxi cohort (N = 104, control=24, IBD = 80) and the Pudong cohort (N = 67, control=17, IBD = 50) were utilized for both model discovery and validation stages. The details of recruitment for the in- house IBD Renji cohorts are shown in Supplementary Fig. 1a. The clinical characteristics of the study participants are shown in Sup- plementary Table 1. Public cohorts of patients with IBD and normal controls The metagenomic raw sequencing data for the FranzosaEA 2019A and FranzosaEA 2019B cohorts (PRJNA400072), and HeQ 2017 (PRJEB15371) were downloaded from the European Nucleotide Archive', 'Elimination (IFE) technique to perform feature selection. As a result, we rigorously selected 31 feature species from the 74 differentially abundant species (Fig. 2e), mainly from the phylum Firmicutes, for modeling analysis (Supplementary Fig. 2e). We initially developed a random forest model using 10-fold cross-validation with 31 signature species from the 6 cohorts, which demonstrated strong ability to detect IBD across all cohorts, with AUROC ranging from 0.66 to 0.95 (Fig. 2f). However, upon analyzing the performance of the classiﬁers on the six cohorts, we found that the IBDMDB cohort exhibited sig- niﬁcantly worse results than the other ﬁve cohorts. This variation in results may be due to the fact that the patients were from different medical centers, despite being from the same country. Such variability and heterogeneity in the data may have contributed to the reduced accuracy of the classiﬁers', '. Fig. 3 | Identiﬁcation of IBD diagnostic markers by demonstrating variations of Kyoto Encyclopedia of Genes and Genomes (KEGG) orthology (KO) across different IBD cohorts. a The circular complex heatmap displays the 162 most signiﬁcant KO genes (P < 1×10−12), as calculated using a two-sided Wilcoxon test with FDR-corrected P values in the cross-cohort analysis. The inner-circle heatmap shows the generalized fold change (gFC) values of these 162 KO genes, with red indicating enriched and blue indicating depleted in IBD. The outer-circle bar chart displays the p-values of 25 featured KO genes in each cohort used for modeling. b The IBD classiﬁcation accuracy was measured using AUROC for classiﬁers trained on the KO genes abundance proﬁles. The classiﬁcation accuracy was evaluated using 10-fold cross-validation within each cohort (gray boxes along the diagonal) and cohort-to-cohort model transfer (external validations off-diagonal)', '. This discovery offers a promising potential for a non-invasive biomarker that could play a pivotal role in clinically categorizing distinct sub- types of IBD. Fig. 4 | Demonstration of Metabolomic Alterations across Different IBD Cohorts and Utilization of Signature Metabolites for IBD Diagnosis. a Overall composition of the population across 4 metabolomics datasets (n = 398). b A principal coordinates analysis (PCoA) was performed on individuals from the Puxi cohort. The analysis showed signiﬁcant differences in metabolites composition between control (n = 25) and IBD (n = 83) (P = 0.001), as determined by PERMA- NOVA using Bray-Curtis distance with 999 permutations (two-sided test). c Orthogonal Partial Least Squares Discriminant Analysis (OPLS-DA) model of Puxi cohort individuals based on gut metabolomic proﬁles (Q2Y: 0.618)', '. Although metabolomic analysis can identify individual disease markers in clinical practice, applying these results is often challenging. For this reason, it is optimal to develop an assessment metric that allows evaluation of IBD risk in chil- dren, considering that IBD can manifest at this age. A formula incorporating phenol, 4-methylpentanoic acid, and indole can be used to calculate a risk coefficient for developing IBD. A coefficient value less than or equal to 4.01 indicates no IBD risk. Values between 4.01 and 4.79 suggest a low risk; however, additional clinical markers should be considered to clarify the diagnosis. A coefficient above 4.79 indicates a high risk of IBD and strongly recommends further examination, which can also detect asymptomatic cases. Moreover, in cases with a high-risk coefficient, 1H-indole-3-methyl can serve as a marker for differential diagnosis and assessing the risk of CD', '. However, the roles of these metabolites in IBD remain unknown. We next aimed to investigate whether a speciﬁc group of meta- bolites can serve as an accurate diagnostic tool for IBD, regardless of whether it is targeted or non-targeted datasets through CCIA methods. We then integrated four metabolomics studies and identiﬁed a total of 79 metabolites that were commonly present in all four cohorts using HMDB ID. Subsequently, we conducted univariate differential analysis with FDR < 0.0001 and OPLS-DA analysis using a VIP score > 1, which led to the identiﬁcation of 32 candidate metabolites. To further reﬁne our selection, we employed IFE and narrowed down our pool to 13 metabolites (Fig. 4e, f). To account for variations in metabolite detection methods and numerical units between internal and external cohorts, we limited our cross-validation to cohorts with the same units']","['10-Microbiome and metabolome features in inflammatory bowel disease via multi-omics integration analyses across cohorts.pdf', '9-Combined metabolomic and metagenomic analysis.pdf']",0.4052,hard,comparison
multiomics_ibd_mcq_009,How many features were selected from the multi-omics panel to distinguish between UC and CD subtypes?,8 features,12 features,31 features,25 features,B,"Option: C
Explanation: The question is asking for the number of features selected from a multi-omics panel to distinguish between ulcerative colitis (UC) and Crohn's disease (CD) subtypes. Without specific information or data, it's difficult to determine the exact answer. However, based on general knowledge in bioinformatics and machine learning, selecting 31 features might be plausible for distinguishing between UC and CD subtypes, as this number could potentially capture relevant biological differences between the two conditions.","['. 6h). Our results indicate that combining species, KO genes, and metabolites can signiﬁcantly enhance the diagnostic performance of our model in fecal metagenomic and metabolomic analysis. Identiﬁcation of multi-omics biomarkers for distinguishing subtypes of IBD As the treatment strategies for UC and CD differ signiﬁcantly, we next aimed to identify a subset of markers from the multi-omics panel mentioned above that could distinguish between the two subtypes of IBD. Using the IFE approach, we selected 12 features from the multi- omics panel (Supplementary Fig. 6a). The RF model revealed that the 12 selected markers could effectively differentiate between UC and CD. The AUROC values for 10-fold cross-validation and LOOCV were approximately 0.8 in both internal and external cohorts, with inde- pendent validation achieving values above 0.7 (Supplementary Fig. 6b, c). This sub-panel can aid clinicians in further categorizing the disease following the diagnosis of IBD', '. UC: Ulcerative colitis; CD: Crohn’s disease; PCA: Principal component analysis; IBD: Inflammatory bowel disease; OPLS-DA: Orthogonal Partial Least Squares Discriminant Analysis.', '. We then expanded each posi- tion into five features using one-hot encoding, one for each nucleo- tide and one representing a gap. The value in each of these features can be either 1 when the corresponding nucleotide or gap is present in that position, or 0 otherwise. In this way, we obtained a total of 1,382,825 features across all the SGBs. Given the large number of fea- tures produced, we then applied an additional set of thresholds based on prevalence and removing collinear ones. In particular, features with <20% prevalence or prevalence >80% in the controls and CRC samples were removed, ensuring that very rare or too common base prefer- ences were not considered, thus obtaining 42,094 features. We then removed features highly correlated (Pearson correlation >0.5) with any other feature, selecting the first occurrence as the representative and discarding all other features that correlated with it with a higher', '. In addition, our results show the potential to develop classifiers that may have add additional richness of context to clinical diagno\xad sis of UC and CD with larger IBD cohorts. Fig. 4 Barplot of statistically significant differentially abundant OTUs for disease diagnosis comparisons (adjusted p-value < 0.05). Genus associated with each OTU (x-axis) and the shrunken log2 fold change estimate (y-axis_. Negative log2 fold change estimates correspond to reduced abundance of each OTU in the Healthy controls (left plots) and CD samples (right plots)', 'Page 9 of 11 Alsulaiman et al. BMC Gastroenterology (2023) 23:258 Abbreviations CD \x07Crohn’s disease UC \x07Ulcerative colitis IBD \x07Inflammatory bowel disease OTU \x07Operational Taxonomic Unit PCA \x07Principal component analysis PCoA \x07Principal coordinate analysis Supplementary Information The online version contains supplementary material available at https://doi. org/10.1186/s12876-023-02904-2. Supplementary Material 1 Supplementary Material 2 Supplementary Material 3 Supplementary Material 4 Supplementary Material 5 Supplementary Material 6 Supplementary Material 7 Supplementary Material 8 Supplementary Material 9 Supplementary Material 10 Supplementary Material 11 Supplementary Material 12 Supplementary Material 13 Supplementary Material 14 Supplementary Material 15 Supplementary Material 16 Supplementary Material 17 Acknowledgements The authors would like to extend their gratitude to KACST for the funding of this project', '. Taxonomic assignment and marker identification The sub-\xadoperational taxonomic units (sOTUs) table generated by the Deblur pipeline was used for taxonomic identification [28]. Taxonomic identity of the sOTU features was assigned with the Naïve Bayes classifier trained on the Greengenes v. 13.8 OTU reference tree clustered at 99% sequence similarity [29]. The classification process was carried out in QIIME2 using the feature-\xadclassifier classify-\xadsklearn plugin [30]. Linear discriminant analysis (LDA) effect size (LEfSe) [31] was performed in the R software v.4.3.3 (https://www.R-project.org/) using the microeco package [32] to characterize the representative bacterial taxa from the disease status groups (positive-\xadstatus and negative-\xadstatus) as well as for the two diabetes types (T1DM or T2DM). Taxa were considered enriched in a group if they met the criteria of an FDR-\xadadjusted P-\xadvalue<0.05 and an LDA score≥2.0', '. A DA showed that 98.6% of the original grouped cases were correctly classiﬁed, and the canonical discriminant plot revealed a clear separation between obese and CTRL groups (Figure 3 and Supplementary Table S5). In particular, the Figure Shows a clear separation between the samples belonging to the four groups, with most of the samples being close to the centroid of the group of belonging, although a lower separation was observed between obese groups (ob_ado and ob_adult) (Figure 3). However, applying a cross-validation (CV) test, we found that only 34.8% of cases were correctly classiﬁed, revealing a low capability of the entire OTUs set to discriminate the four groups (Supplementary Table S5). For this reason, using a p < 0.05 ﬁlter (from a Wilks’ Lambda test) we selected only 12 OTUs (Supplementary Figure S2 and Supplementary Table S6) and tested their discriminatory power in correctly classifying groups by applying the average area under the ROC', '. A subset of these data was reported in previous work from us5', '. At the genus level, two genera in particular, Veillonella and Lachnoclostridium showed significant association with CD versus controls (Fig. 4). There were significant differences between subjects with CD versus UC, with the top differential genera spanning Akkermansia, Har\xad ryflintia, Maegamonas and Phascolarctobacterium. Additional Files 12 & 13: Figures S11 and S12 illustrate Fig. 2 Bray-Curtis PCoA scatterplots of dissimilarity on principal coordinates axes 1 and 2. Each dot represents a sample, colored by 6 age bins with remaining samples shown in grey. Percent of variance explained by each principal coordinate is displayed on associated axis', '. S6.1-S6.21). Scatterplots of individual coordinates on principal coor\xad dinates axes 1 and 2 which explained 24% and 14% of the variance, respectively. Supervised Discovery We performed specific pairwise differential abundance comparisons to ask whether specific OTUs were signifi\xad cantly associated with CD, UC and control participants. The DESeq2 package (v 1.32.0) was used to test for dif\xad ferential abundance of OTUs. Custom R scripts were used to process the abundance and metadata to create a DESeq2 object and design formula that modeled the DESeq2 normalized counts as a function of the area, nationality, diagnosis, diabetes status, and age bin. Results There were 135 and 84 individuals with CD and UC, respectively, with microbiota datasets available for analy\xad ses (Table 1). In the overall 219 IBD cases, 8 (3.6%) and 6 (2.7%) of subjects had confirmed or borderline Type-2 Diabetes (T2D), respectively, as assessed by HbA1C read\xad ings and physician notes']","['10-Microbiome and metabolome features in inflammatory bowel disease via multi-omics integration analyses across cohorts.pdf', '12-Gut microbiota analyses of inflammatory bowel diseases.pdf', '13-Gut Microbiota Markers in Obese Adolescent and Adult Patients(Obese).pdf', '18-Gastrointestinal microbiota composition predicts peripheral inflammatory state during treatment of human tuberculosis.pdf', '25-Pooled analysis of 3,741 stool metagenomes from 18 cohorts.pdf', '30-Using gut microbiome metagenomic hypervariable features for diabetes screening and typing through supervised machine learning.pdf', '9-Combined metabolomic and metagenomic analysis.pdf']",-0.1771,hard,factual
multiomics_ibd_mcq_010,Which pathway was found to be downregulated in IBD and is related to Akkermansia-enhanced intestinal epithelium development?,Two-component system,Aminoacyl-tRNA biosynthesis,Propanoate metabolism,Lipopolysaccharide biosynthesis,C,"Option: C
Justification: The question mentions Akkermansia-enhanced intestinal epithelium development, which is related to the gut microbiome's role in maintaining a healthy gut barrier. Propanoate metabolism (C) is a pathway that has been associated with beneficial effects on the gut microbiota and host health, including improved barrier function.","['. Furthermore, the relative abundance of crp is positively correlated with fecal calprotectin (Supplementary Fig. 3c). These ﬁndings suggest that crp could potentially act as a critical transcrip- tional regulatory factor contributing to the occurrence of gut inﬂam- mation. Additionally, we have also observed the downregulation of several pathways in IBD, such as Propanoate metabolism, Phospho- transferase system (PTS), Styrene degradation, Glycolysis / Gluco- neogenesis, and Biosynthesis of amino acids (Supplementary Fig. 3a). It has been reported that Akkermansia-related propanoate metabolism enhanced the development of the intestinal epithelium through intestinal stem cell-mediated mechanisms, where intestinal stem cells (ISCs) play a vital role in the developmental processes and swift regeneration of the intestinal lining37. Additionally, we sought to assess the potential diagnostic use- fulness of the KO genes in IBD', 'reduction in the symbiotic bacterial community involved in urea metabolism leads to the downregulation of K01476 (rocF, arginase), ultimately resulting in urea accumulation (Fig. 5f). These ﬁndings indicate that the gut microbial biotransformation is impaired in patients with IBD, resulting from a substantial reduction in the gut commensal community (Fig. 2e). Furthermore, we identiﬁed four genes that encoding aminoacyl- tRNA biosynthesis enzymes within the symbiotic bacterial community, namely K09759 (aspS, nondiscriminating aspartyl-tRNA synthetase), K01870 (ileS, isoleucyl-tRNA synthetase), K01892 (hisS, histidyl-tRNA synthetase), and K01873 (valS, valyl-tRNA synthetase) (Fig. 5g, j). This is consistent with previous results in KEGG Orthology Enrichment Ana- lysis which showed a signiﬁcant increase in aminoacyl−tRNA bio- synthesis pathway (Supplementary Fig. 3a). Aminoacyl-tRNA synthetases (ARSs) play an indispensable role in protein synthesis', '. 3a). Aminoacyl-tRNA synthetases (ARSs) play an indispensable role in protein synthesis. Recent studies indicate that these enzymes encompass biological functions that extend beyond translation46–48. It has been reported that the gut-associated bacterium Akkermansia muciniphila (Am) secretes seryl-tRNA synthetase (AmTARS), which could modulate immune homeostasis and facilitate the production of anti-inﬂammatory IL-1049. These studies indicate that aminoacyl-tRNA synthetases from the gut microbiota may play a crucial role, potentially inﬂuencing the host immune and regulating gut homeostasis. Multi-omics signatures integration for diagnosing IBD across different cohorts We have previously discovered three panels, consisting of 31 species, 25 KO genes, and 13 metabolites, that were able to accurately distin- guish between IBD patients and normal controls', '. The regulation of the Two- component system or crp holds promise as a therapeutic target for treating IBD. Through MOBC maps, our research has uncovered a sig- niﬁcant enrichment in the Aminoacyl-tRNA biosynthesis pathway. Aminoacyl-tRNA synthetases (ARSs) play a vital role as catalysts in protein synthesis across all living organisms. However, their functions have evolved over time, and a growing body of research indicates that their non-classical functions might hold even greater importance46–49,52. The diverse functionality of ARSs has revealed their potential as a valuable and underutilized resource for therapeutic targets in IBD. Of course, our study does have some limitations. Being a cross- cohort study, it’s difﬁcult to completely eliminate biases in areas like selecting cohorts, collecting samples, and analyzing methods. How- ever, we’ve taken extensive measures to minimize these factors, ensuring the study’s scientiﬁc rigor', '. Speciﬁcally, the intestinal barrier would be susceptible to pathogen invasion without the secretion of antimicrobial peptides (AMPs) or tight junction proteins.236 During initial disease in genetically susceptible individuals, the immune response is altered, leading to loss of immune tolerance to intestinal antigens. This subsequently stimulates the differentia- tion of helper T cells and release of chemokines and proin- ﬂammatory cytokines, which induce chronic inﬂammation of the intestine.237 In addition to immune dysregulation, genetic factors are involved in determining IBD development. For example, genetic mutations associated with CD include polymorphisms for the Nucleotide Oligomerization Domain Containing 2 (NOD2/ CARD15), Immunity-elated GTPase family M (IRGM), and autophagy-related 16 Like 1 (ATG16L1).238 Studies have shown that gut microbiota are highly associated with the development of IBD', '. The condition is broadly divided into Crohn’s disease (CD) and ulcerative colitis (UC), which involves inflammation of the gastrointestinal tract or the colon, respectively2.The aetiology of IBD is complex and multifactorial, involving genetic, environmental, dietary, immune and neuronal factors, all of which are interlinked by a com- plex microbial community (microbiome) of bacteria, fungi, archaea, viruses and protozoa. The microbiome plays a central role in IBD, as evidenced by genetic and serological markers and alterations in path- ways responsible for host–microbiota interactions, microbial altera- tions in first degree relatives and by microbial change associated with resolution of inflammation', '. 4e). This effort led to the identiﬁcation of 736 KO genes (Supplementary Table 6). Addi- tionally, we conducted an intersection analysis, comparing these metabolic-related genes with the 162 KO genes identiﬁed in our pre- vious differential analysis of 6 IBD metagenomic cohorts (Fig. 3a). As a result, our investigation unveiled 8 differential KO genes with asso- ciations to both metabolism and disease phenotypes. (Fig. 5b and Supplementary Fig. 5a-h). Further research on these genes and their roles in metabolic pathways could provide signiﬁcant insights into the underlying mechanisms of IBD. The K22477 (argO, N-acetylglutamate synthase) is responsible for producing N-acetylglutamate (NAG) from glutamate and acetyl-CoA. Fig. 3 | Identiﬁcation of IBD diagnostic markers by demonstrating variations of Kyoto Encyclopedia of Genes and Genomes (KEGG) orthology (KO) across different IBD cohorts', '. False discovery rate correction was also applied. UC: Ulcerative colitis; CD: Crohn’s disease; IBD: Inflammatory bowel disease. The formula for the IBD risk included metabolites that, in combination, are significantly different in groups of patients with IBD vs controls. The main advantage of this testing is the possibility of non-invasive analysis of the secretory activity of the microbiota and frequent monitoring of the intestinal state as much as is required for timely diagnosis of IBD (Figure 5D). For statistically significant metabolites, biserial correlation was calculated with subsequent FDR correction; metabolites with an absolute correlation coefficient |r| > 0.3 were included in the formula: Positively correlated metabolites were placed in the numerator, negatively correlated ones in the denominator', '. A deeper understanding of the inﬂuential role of gut microbiota in the development of cancer has increased the interest in research for microbiome-based therapeutics in cancer treatment. However, more studies involving human participants are required to deeply understand the mechanism of gut microbiota in the development of cancer and its anti- carcinogenic characteristics. Inﬂammatory bowel diseases Inﬂammatory bowel disease is a signiﬁcant disease with the highest prevalence in western countries; its incidence has risen rapidly in newly industrialized countries in Asia, the Middle East, Africa, and South America (Kaplan and Ng, 2017). It is also imperative to examine the exact etiology and pathogenesis of IBD. Notable advancements have been achieved in identifying the development of IBD in the last few years. The most signiﬁcant and clinically beneﬁcial aspect of this advancement was the identiﬁcation of gut microbiota as a crucial multifunctional inﬂammatory factor', '. It is evident that the pathological processes of IBDs represent a complex inter\xad play of genetic and environmental factors and can skew immune responses against normal intestinal flora [3, 4]. The resulting intestinal dysbiosis, where loss of beneficial bacteria and diversity is evident, along with expansion of potentially pathogenic bacteria, has been widely charac\xad terized in IBD and is postulated to influence the onset and perpetuation of inflammation within the gut [5–7]. Several factors contribute to intestinal dysbiosis, includ\xad ing diet and lifestyle factors, host genetics and medica\xad tions [8–13]. Low fiber/high fat and sugar diets reduce gut microbiota diversity and also promote pathogenic species expansion [13–16]. Diet modification is often used to reduce inflammation episodes thereby reducing IBD-related symptomology [17]']","['10-Microbiome and metabolome features in inflammatory bowel disease via multi-omics integration analyses across cohorts.pdf', '11-Microbiota in inflammatory bowel disease.pdf', '12-Gut microbiota analyses of inflammatory bowel diseases.pdf', '3-Human gut microbiota.pdf', '5-Microbiota in health and diseases.pdf', '9-Combined metabolomic and metagenomic analysis.pdf']",0.2124,hard,mechanism
ibd_microbiota_mcq_001,What percentage of bacteria make up the gut microbiome according to the paper?,Over 80%,Over 90%,Over 99%,Over 95%,C,"I'm unable to provide a direct answer as I don't have access to the specific paper or information about the percentage of bacteria in the gut microbiome mentioned in it. However, I can give you some general knowledge about the gut microbiome.

The human gut is home to trillions of microorganisms, and research suggests that a significant portion of these microbes reside in the large intestine. According to various studies, the majority of the bacterial population in the gut consists of Firmicutes (about 25-30%) and Bacteroidetes (about 20-25%). The remaining percentage is made up by other phyla such as Actinobacteria, Proteobacteria, etc.

Given this general information, I would say that:

Option: D

Explanation: Based on the general knowledge about the gut microbiome composition.","['. The principal coordinate analysis (PCoA), based on Bray-Curtis, unweighted UniFrac and weighted UniFrac distances were performed to identify the difference in fecal microbiota composition between PTB patients and HCs. As shown in Figure 1D, there was a tendency of separation and had a partial overlap between two groups, which demonstrated that the total community of gut microbiota in the two groups was different. The compositions of the fecal microbiota in the PTB patients and the HCs were assessed at different taxonomic levels, and the top 20 relative abundance of bacteria were shown in Figure 2A. At the phylum level, we observed an enrichment of Bacteroidota (33.10% vs. 27.08%), Proteobacteria(12.99% vs. 9.83%) and Fusobacteriota(0.58% vs. 0.56%, P<0.05), and a remarkable decrease of Firmicutes(48.07% vs. 55.89%, P<0.05) and Actinobacteriota(2.44% vs. 5.83%, P<0.01) in PTB patients compared with HCs (Figure 2B)', '. Introduction The human gastrointestinal (GI) tract represents one of the largest interfaces (250–400 m2) between the host, environmental factors and antigens in the human body. In an average life time, around 60 tonnes of food pass through the human GI tract, along with an abundance of microorganisms from the environment which impose a huge threat on gut integrity [1]. The collection of bacteria, archaea and eukarya colonising the GI tract is termed the ‘gut microbiota’ and has co-evolved with the host over thousands of years to form an intricate and mutually beneﬁcial relationship [2,3]. The number of microorganisms inhabiting the GI tract has been estimated to exceed 1014, which encom- passes ∼10 times more bacterial cells than the number of human cells and over 100 times the amount of genomic content (microbiome) as the human genome [2,4]. However, a recently revised estimate has suggested that the ratio of human:bacterial cells is actually closer to 1:1 [5]', 'Page 8 of 13 Han et al. BMC Microbiology (2024) 24:141 Fig. 4 ROC analysis and functional prediction of gut microbiome. ROC analysis of (a) bacteria, (b) fungi, and (c) the combination of fungi and bacteria. Correlation between predicted differential pathways and the top 20 differential bacteria (d) and fungi (e). The depth of color in the heat map indicates the strength of the correlation: red indicates a positive correlation, and blue indicates a negative correlation. ROC: Receiver operating characteristic; AUC: area under the curve (0.5–1.0). *P < 0.05; **P < 0.01; ***P < 0.001; ****P < 0.0001', '. Gut Microbes 2020;12:1–13. 190 Sender R, Fuchs S, Milo R. Are we really Vastly Outnumbered? revisiting the ratio of bacterial to host cells in humans. Cell 2016;164:337–40. 191 Neugent ML, Hulyalkar NV, Nguyen VH, et al. Advances in understanding the human urinary microbiome and its potential role in urinary tract infection. mBio 2020;11:e00218–20. Protected by copyright, including for uses related to text and data mining, AI training, and similar technologies. . at National Institute of Immunology, New Delhi on January 10, 2026 http://gut.bmj.com/ Downloaded from 1 February 2022. 10.1136/gutjnl-2021-326789 on Gut: first published as', '. 3.1.1. Increasing the Abundance of Specific Members of the Microbiome. A low microbial diversity of the human microbiome is significantly associated with several diseases.206 However, the changes observed in the microbiome composition might be dissimilar in different populations. For example, Dutch and Belgian cohorts showed a negative correlation between the Bacteroidetes enrichment and diversity,207 whereas a positive correlation was observed between Bacteroidetes and diversity in African individuals,208 underscoring the need for population- specific comparisons of the microbiome between healthy individuals and patients. The ratio of the two most dominant phyla in the microbiome, namely, Firmicutes/Bacteroidetes, is one of the most important parameters representing microbiome diversity, at least in the gut', '. Figure 1 Total abundance of bacteria according to the different body sites. Bounds for bacteria number in different organs, derived from bacterial concentrations and volume.190 191 Table 1 PubMed-\xadlisted articles regarding topics, “microbiome and diseases” Diseases PubMed search PubMed search “disease & microbiome” “disease & microbiome/ clinical trial” IBDs 2867 36 Coeliac disease 524 20 IBS 1516 96 Colorectal carcinoma 1525 43 Liver disease 4927 113 Pancreatic disease 766 20 Obesity 7146 292 Type 2 diabetes 2155 99 Non-\xadalcoholic fatty liver disease 1383 31 PubMed search 15 December 2021. Protected by copyright, including for uses related to text and data mining, AI training, and similar technologies. . at National Institute of Immunology, New Delhi on January 10, 2026 http://gut.bmj.com/ Downloaded from 1 February 2022. 10.1136/gutjnl-2021-326789 on Gut: first published as', 'controversial inclusions in the definition of a microbiome.4 However, the microbiome has since been further defined to pertain to not only the community of microorganisms but also the whole spectrum of molecules produced by microorganisms, including their structural elements, metabolites, and molecules produced by the coexisting host. Generally, microbial composition varies among different anatomical parts, and it is highly personalized as the micro- biome’s composition also varies among individuals. The exact definition of a healthy microbiota has yet to be defined, but studies have shown that the use of probiotics, prebiotics, and synbiotics are beneficial by maintaining healthy body flora or by altering the microbiome toward a healthy microbial ecosystem', '. These examples highlight representative and simple nutrient– microorganism relationships but remain difficult to generalize to the complex community within the gut microbiome. Table 1 | Biological variables that influence gut microbiome dynamics in response to antibiotics Variable Example Refs', '. It has been found that gut microbiota in humans and animal models of obesity is reduced in abundance of Bacteroidetes with a proportional increase in Firmicutes phylum, however, these results have been contradicted by other studies reporting divergent ratios between these two phyla (Duncan et al., 2008; Abdallah Ismail et al., 2011; Harris et al., 2012). Our study focused not only on diﬀerences in the composition of gut microbiota of obese patients compared to CTRLs, but also on changes between young and adult study participants in order to verify an age-related association between microbes and obesity. The microbiota proﬁle in obese adolescents resulted diﬀerentially composed respect to obese adults, leading to suppose a synergic role of age and obesity in microbiota composition. However, the main diﬀerences in microbiota composition were evidenced comparing adolescent obese and NW. In fact, the OTU-based model assigned the microbial markers F', '. In humans, 386 of the identiﬁed species are strictly anaerobic and hence will generally be found in mucosal regions such as the oral cavity and the GI tract [17]. The gut microbiota is not as diverse as the microbial communities from some other bodily sites and reveals a high degree of functional redundancy [19–21]. An extensive catalogue of the functional capacity of the human gut microbiome was recently obtained, where 9 879 896 genes were identiﬁed through a combination of 249 newly sequenced and 1018 published samples [18]. The study identiﬁed the presence of country-speciﬁc microbial signatures, suggesting that gut microbiota composition is shaped by environmental factors, such as diet, and possibly also by host genetics [18]. However, it should also be noted that microbiotas that differ in terms of composition may share some degree of functional redundancy, yielding similar protein or metabolite proﬁles [22]']","['1-Introduction to the human gut microbiota.pdf', '13-Gut Microbiota Markers in Obese Adolescent and Adult Patients(Obese).pdf', '19-Gut bacterial and fungal dysbiosis in tuberculosis patients.pdf', '2-Gut microbiome and health- mechanistic insights.pdf', '23-The correlation between dysfunctional intestinal flora and pathology feature of patients with pulmonary tuberculosis.pdf', '6-Microbiome and Human Health.pdf', '8-Antibiotic perturbations to the gut microbiome.pdf']",0.0598,easy,factual
ibd_microbiota_mcq_002,Which of the following is NOT mentioned as a fungal genus commonly found in the gut mycobiome of IBD patients?,Candida,Saccharomyces,Penicillium,Lactobacillus,D,"Option: D

Lactobacillus is a genus of bacteria, not fungi, and therefore would not be mentioned as part of the gut mycobiome (fungal community) in IBD patients.","['. Fungi Fungi are ubiquitous in the environment and present on all body sur- faces, including the gastrointestinal tract38–50. Gut mycobiome com- position is highly variable between and within individuals, as diet and environmental exposure (Box 1) change constantly51,52. Nevertheless, exploration of the mycobiome in IBD cohorts has determined the common presence of species from several genera including Candida, Saccharomyces, Cladosporium, Malassezia, Pichia, Aspergillus and Peni- cillium, with Candida species and Candida albicans found to be altered across multiple studies38–49(Table 1). Malassezia spp. and Debaryomyces spp. have also been linked to CD48,53', '. 2b, c). In addition, it’s important to note that the dissimilarities in beta diversity, which were calculated using the Bray-Curtis distance metric, were found to vary not only based on the disease status (as indicated by a PERMANOVA analysis with P = 0.001) but also across different cohorts (as indicated by a PERMANOVA analysis with P = 0.001) (Fig. 2d). Thus, reduced microbial diversity observed in IBD patients may play a signiﬁcant role in disrupting the delicate balance of the gut ecosystem and could be a contributing factor to the develop- ment of IBD. To identify potential microbial biomarkers for the diagnosis of IBD, we employed a method provided by a previous study to analyze the composition of microbial species15. Through CCIA with an FDR less than 0.0001, 74 microbial species were identiﬁed to have signiﬁcantly different abundances in the gut microbiomes (Fig. 2e and Supple- mentary Table 2)', '. Therefore, further delin\xad eation of IBD requires a greater level of microorganism differentiation analysis as well as taking into account environmental, lifestyle and genetic factors. Previous studies have characterized gut microbiomes in patients with UC and CD, however, these few stud\xad ies have been performed on populations not from the Middle East. Given cultural and dietary dissimilarities in Middle Eastern versus Western populations, we hypothe\xad sized that key IBD-associated microbes may be distinctly different in Middle Eastern study participants. Indeed, in our study of Saudi Arabian participants we observed a number of microbial genera that were not well charac\xad terized in prior IBD studies', '. 21, 1948–1956 (2015). 43. Hoarau, G. et al. Bacteriome and mycobiome interactions underscore microbial dysbiosis in familial Crohn’s disease. mBio 7, e01250–16 (2016). 44. Liguori, G. et al. Fungal dysbiosis in mucosa-associated microbiota of Crohn’s disease patients. J. Crohns Colitis 10, 296–305 (2016). 45. Ott, S. J. et al. Fungi and inflammatory bowel diseases: alterations of composition and diversity. Scand. J. Gastroenterol. 43, 831–841 (2008). 46. Li, X. V. et al. Immune regulation by fungal strain diversity in inflammatory bowel disease. Nature 603, 672–678 (2022). 47. Pappas, P. G., Lionakis, M. S., Arendrup, M. C., Ostrosky-Zeichner, L. & Kullberg, B. J. Invasive candidiasis. Nat. Rev. Dis. Primers 4, 18026 (2018). 48. Limon, J. J. et al. Malassezia is associated with Crohn’s disease and exacerbates colitis in mouse models. Cell Host Microbe 25, 377–388.e6 (2019). 49. Auchtung, T. A. et al', '. Box 1 | The effect of diet on the intestinal mycobiome, virome and resistome The human gut is home to fungal and viral populations, known as the mycobiome and the virome, respectively. Although these communities make up only 0.1% to 1% of total microorganisms present in the gut1, they are both influenced by diet. In the infant gut mycobiome, Saccharomyces cerevisiae is the dominant species, but after weaning, it is replaced by Cystofilobasidium spp., Ascomycota spp. and Monographella spp.159. The gut fungal compositions of people living in urban areas comprise S. cerevisiae and fewer SCFA-producing bacteria, whereas rural residents exhibit a diversity of understudied fungal species. Candida species are associated with carbohydrate-rich diets while negatively associated with protein-rich diets (reviewed in ref. 160)', 'Nature Reviews Microbiology | Volume 23 | August 2025 | 509–524 512 Review article UC are affected by drastic mycobiota changes, active inflammation, bacterial community and dietary changes appear to be among the fac- tors affecting mycobiota composition in IBD38–49. Similar to advances in our understanding of the relationship between bacteria and IBD, where increasing importance has been placed on strain variations and functional characteristics, strain-specific features of common fungi, such as C. albicans in the gut of individuals with IBD, play a key role in inflammation46. Indeed, highly damaging C. albicans strains, producing the toxin candidalysin, have been identified in the gut of individuals with UC46 (Fig. 1). Candidalysin induces intestinal inflammation by damaging epithelial membranes and activating the MAPK pathway54, leading to the recruitment of T helper 17 (TH17) cells, neutrophils and pro-inflammatory cytokines46,55,56', '. Cell Host Microbe 28, 134–146. e4 (2020). 37. Hall, A. B. et al. A novel Ruminococcus gnavus clade enriched in inflammatory bowel disease patients. Genome Med. 9, 103 (2017). 38. Nash, A. K. et al. The gut mycobiome of the Human Microbiome Project healthy cohort. Microbiome 5, 153 (2017). 39. Human Microbiome Jumpstart Reference Strains Consortium, et al. A catalog of reference genomes from the human microbiome. Science 328, 994–999 (2010). 40. Auchtung, T. A. et al. Investigating colonization of the healthy adult gastrointestinal tract by fungi. mSphere 3, e00092–e00118 (2018). 41. Sokol, H. et al. Fungal microbiota dysbiosis in IBD. Gut 66, 1039–1048 (2017). 42. Chehoud, C. et al. Fungal signature in the gut microbiota of pediatric patients with inflammatory bowel disease. Inflamm. Bowel Dis. 21, 1948–1956 (2015). 43. Hoarau, G. et al. Bacteriome and mycobiome interactions underscore microbial dysbiosis in familial Crohn’s disease. mBio 7, e01250–16 (2016). 44. Liguori, G. et al', 'IBD, as it has been associated with creeping fat and intestinal strictures in Crohn’s disease and is inherently resistant to vancomycin29. In addition, Erysipelatoclostridium ramosum, a bacterium that has been documented sparsely in the studies, but appears to be more prevalent in IBD, as conﬁrmed in multiple cohorts (Supplementary Fig. 2d). The role of this bacterium in the pathogenesis and progression of IBD is not yet fully understood, and therefore requires further investigation. Overall, our ﬁndings highlight the signiﬁcant alterations in the gut microbiota of patients with IBD and the potential role of speciﬁc bacterial groups in the pathogenesis of this disease. Subsequently, we utilized a machine learning method (Random Forest, RF), for the diagnosis of IBD', '. Lachnoclostridium was also observed as significantly upregulated in our CD popula\xad tion which to our knowledge not been observed in any studies to date. One small study of CD versus UC sub\xad jects showed it was upregulated in UC patients but not CD subjects [43]. In 2019 a modestly sized 16 S rRNA microbiota study comparing two sub-types of the UC, as defined by traditional Chinese Medicine theory, showed a significant increase in Lachnoclostridium [38]. Conclusions In conclusion, we have shown that there are significant differences in gut microbiota between UC, CD and con\xad trols in a Saudi Arabian IBD cohort. This reinforces the need for further studies in large populations that are ethnically and geographically diverse. In addition, our results show the potential to develop classifiers that may have add additional richness of context to clinical diagno\xad sis of UC and CD with larger IBD cohorts. Fig', '. Predominant Microbiome Present on Different Body Sites and Their Relationship with Disease body site predominant microbes microbiome-associated diseases mouth bacterial phyla: Actinobacteria, Bacteroidetes, Firmicutes, Fusobacteria, Proteobacteria, and Spirochaetes dental caries (Streptococcus mutans, Streptococcus sobrinus, and Lactobacillus acidophilus)14,15 fungal genera: Candida, Cladosporium, Saccharomycetales, Fusarium, Aspergillus, and Cryptococcus periodontitis (Streptococcus salivarius may reduce the disease development)13 stomach bacterial phyla: Proteobacteria, Firmicutes, Actinobacteria, Bacteroidetes, and Fusobacteria gastric cancer (Helicobacter pylori)39 intestines bacterial phyla: Firmicutes and Bacteroides inflammatory bowel disease (lower abundance of Firmicutes)76−78 archaeal species: Methanosphaera stadtmanae and Methanobrevibacter smithii irritable bowel syndrome, celiac disease']","['10-Microbiome and metabolome features in inflammatory bowel disease via multi-omics integration analyses across cohorts.pdf', '11-Microbiota in inflammatory bowel disease.pdf', '12-Gut microbiota analyses of inflammatory bowel diseases.pdf', '4-The interplay between diet and the gut microbiome.pdf', '6-Microbiome and Human Health.pdf']",0.3271,easy,factual
ibd_microbiota_mcq_003,What is the name of the antimicrobial peptide recently identified that demonstrates selective antifungal activity against C. albicans hyphae?,Defensin,Cathelicidin,albicans hyphae? Options: A) Defensin B) Cathelicidin C) Peptide YY,Lysozyme,C,"A

Defensins are a family of antimicrobial peptides that have been shown to exhibit selective antifungal activity against Candida albicans hyphae, among other pathogens.","['. Both host-derived and administered antimicrobials play a key role in shaping the gut microbiota. In the GI tract, Paneth cells produce antimicrobials such as angiogenin 4, α-defensins, cathelicidins, collectins, hista- tins, lipopolysaccharide (LPS)-binding protein, lysozymes, secretory phospholipase A2 and lectins such as REGIIIα/γ [120]. These proteins are localised in the mucus layer and are virtually absent from the lumen, prob- ably either due to poor diffusion through mucus or luminal degradation [51,121]. Many secreted antimicrobial proteins (AMPs) kill bacteria through direct interaction with, and disruption of the bacterial cell wall or inner membrane via enzymatic attack [51]. Reduced mucosal α-defensin expression has been demonstrated in © 2017 The Author(s). This is an open access article published by Portland Press Limited on behalf of the Biochemical Society and distributed under the Creative Commons Attribution License 4.0 (CC BY)', '. ACS Synth. Biol. 11, 508–514 (2022). 200. Gelfat, I. et al. Single domain antibodies against enteric pathogen virulence factors are active as curli fiber fusions on probiotic E. coli Nissle 1917. PLoS Pathog. 18, e1010713 (2022). 201. Forkus, B., Ritter, S., Vlysidis, M., Geldart, K. & Kaznessis, Y. N. Antimicrobial probiotics reduce Salmonella enterica in turkey gastrointestinal tracts. Sci. Rep. 7, 40695 (2017). 202. Tscherner, M., Giessen, T. W., Markey, L., Kumamoto, C. A. & Silver, P. A. A synthetic system that senses Candida albicans and inhibits virulence factors. ACS Synth. Biol. 8, 434–444 (2019). 203. Jayaraman, P., Holowko, M. B., Yeoh, J. W., Lim, S. & Poh, C. L. Repurposing a two-component system-based biosensor for the killing of Vibrio cholerae. ACS Synth. Biol. 6, 1403–1415 (2017). 204. Hwang, I. Y. et al. Engineered probiotic Escherichia coli can eliminate and prevent Pseudomonas aeruginosa gut infection in animal models. Nat. Commun. 8, 15028 (2017). 205. Palmer, J', '. epidermidis also promotes the expression of certain antimicrobial peptides like human β-defensins (hBDs) which enhances the skin defense.117 Moreover, S. epidermidis was believed to strengthen the function of skin lymphocytes, thereby contributes to increased skin immunity.118 In summary, as a primary part of the human immune system, the skin harbors a wide range of cells that perform functions of immunity such as macrophages, dendritic cells, lymphocytes and various T-cell populations. Moreover, due to the advent of high-throughput sequencing, researchers are able to Microbiota in health and diseases Hou et al. 8 Signal Transduction and Targeted Therapy (2022) 7:135', '. (319) Tscherner, M.; Giessen, T. W.; Markey, L.; Kumamoto, C. A.; Silver, P. A. A Synthetic System That Senses Candida Albicans and Inhibits Virulence Factors. ACS Synth. Biol. 2019, 8, 434−444. (320) Cubillos-Ruiz, A.; Alcantar, M. A.; Donghia, N. M.; Cárdenas, P.; Avila-Pacheco, J.; Collins, J. J. An Engineered Live Biotherapeutic for the Prevention of Antibiotic-Induced Dysbiosis. Nat. Biomed. Eng. 2022, 6, 910−921. (321) Vågesjö, E.; Öhnstedt, E.; Mortier, A.; Lofton, H.; Huss, F.; Proost, P.; Roos, S.; Phillipson, M. Accelerated Wound Healing in Mice by on-Site Production and Delivery of Cxcl12 by Transformed Lactic Acid Bacteria. Proc. Natl. Acad. Sci. U. S. A. 2018, 115, 1895. (322) Praveschotinunt, P.; Duraj-Thatte, A. M.; Gelfat, I.; Bahl, F.; Chou, D. B.; Joshi, N. S. Engineered E. Coli Nissle 1917 for the Delivery of Matrix-Tethered Therapeutic Domains to the Gut. Nat. Commun. 2019, 10, 5580. (323) Aggarwal, N.; Breedon, A. M. E.; Davis, C. M.; Hwang, I. Y.; Chang, M. W', '. Individuals with variants in the IBD-associated genes autophagy-related 16 like 1 (ATG16L1) and NOD2 show defective Treg cell responses to outer membrane vesicles delivered by Bacteroides fragilis, which are required for protection from colitis75. Autophagy affects both the antimicrobial activity of Paneth cells and the num- ber of intact secretory granules. Paneth cells regulate the intestinal microbiota through the release of antimicrobial peptides80. One of these recently identified antimicrobial peptides is peptide YY, which demonstrates selective antifungal activity against C. albicans hyphae81. Mice with variants of Atg16l1 that are associated with an increased risk of CD, exhibit structural abnormalities in Paneth cells following murine norovirus infection — a defect also observed in individuals with CD who are homozygous for the ATG16L1 T300A variant69', '. Immune and cellular mechanisms that protect barrier integrity (for example, IL-17 and IL-22 production and mucus production) and inflammation (for example, IL-10 production) are also regulated by the cross-kingdom microbiota. Gain or loss of function mutation in genes involved in immune and epithelial function, and response to microbiota (arrow boxes) are associated with IBD. 3-oxoLCA, 3-oxolithocholic acid; B. thetaiotaomicron, Bacteroides thetaiotaomicron; C. tropicalis, Candida tropicalis; CRAMP, cathelicidin-related antimicrobial peptide; E. lenta, Eggerthella lenta; F. prausnitzii, Faecalibacterium prausnitzii; FDC, follicular dendritic cell; HEV, high endothelial venule; HIF1α, hypoxia-inducible factor 1α; ILC3, group 3 innate lymphoid cells; LCA, lithocholic acid; M cell, microfold cell; M. morganii, Morganella morganii; PYY, peptide YY; R. hominis, Roseburia hominis; R', 'antiporter Coeﬀicient estimate Genus Escherichia Enterobacter Klebsiella Hungatella Eubacterium Dorea Bacteroides Fusicatenibacter c b Control CRC 0.2 0.4 0.6 Bacteroides intestinalis A0A396DX97: DNA-binding protein K9EDD0: unknown Clostridioides diﬀicile F9Z5R3: unknown Klebsiella oxytoca A0A139KE29: DUF2059 domain-containing protein Odoribacter splanchnicus A0A1Y3XYT1: unknown F9Z4M9: peptidase M23 F9Z4Z0: phosphoesterase PA-phosphatase related protein F9Z5R3: unknown F9Z8L3: phosphoesterase PA-phosphatase related protein Within condition gene presence proportion Parasutterella excrementihominis F3QKM7: Argininosuccinate lyase 0 d Estimate –2 –1 0 1 2 Beta-galactosidase activity AA transmembrane transport (4) Amino sugar metabolic process Flagellum organization (3) Cell motility (2) Cytolysis DNA topological change Lipid A biosynthetic process Nucleotide catabolic process Respiratory ETC (1) rRNA processing SOS response Sulfur compound transport Thiamine biosynthetic process', 'molecules produced by the target pathogen, such as acyl homoserine lactone (AHL) by P. aeruginosa288 and auto- inducing peptides (AIP) by S. aureus,289 which in turn activates the production and secretion of an antibacterial agent. Due to the high species specificity of quorum signaling molecules, the precise delivery of the therapeutic molecule becomes feasible\x01 potentiating the use of engineered bacteria as viable alternative therapies for infections. Such strategies have been previously used to target P. aeruginosa,288 S. aureus,289 and V. cholerae.290 Although these studies demonstrated the efficacy of the engineered bacteria in eliminating the target pathogen in either in vitro or in vivo models, the extent to which the microbiome is perturbed due to the administration of the engineered bacteria was not evaluated. Depending upon the chassis used, the engineered bacteria might rapidly transit through the micro- biome or persist for a prolonged period', '. Vancomycin treatment led to a significant reduction of Firmicutes, Bacteroidetes, and Actinobacteria and the expansion of Proteobacteria, whereas ridinilazole showed only a modest reduction of the Firmi- cutes.270 Similarly, targeted antibiotics against the skin pathogen S. aureus, pneumonia-causing P. aeruginosa, and Enterobacter- iaceae are also in development.271 In addition to the collateral damage to the microbiome, broad-spectrum antibiotics may also suffer from poor efficacy, such as in biofilms in which the pathogens remain impervious to the antibiotics. This is exemplified in the case of bacterial vaginosis, which is characterized by the displacement of beneficial Lactobacillus spp. with anaerobic bacteria, predom- inantly Gardnerella vaginalis, which forms a biofilm on the vaginal epithelium.272 Broad-spectrum antimicrobials have shown high short-term curing rates but are unable to prevent the recurrence of vaginosis, partly due to biofilm formation.273 Landlinger et al', 'Nature Medicine | Volume 31 | July 2025 | 2416–2429 2423 Article https://doi.org/10.1038/s41591-025-03693-9 a b c q < 0.1 q < 0.1 and right-sided q < 0.1 and left-sided 0.06 –0.02 0 0.02 0.04 LMM estimate Target Control R. torques SGB4608 O. splanchnicus SGB1790 Ruminococcaceae SGB15234 P. distasonis SGB1934 B. fragilis SGB1855 g. GGB1266 SGB1699 P. micra SGB6653 GGB9633 SGB15091 A. muciniphila SGB9226 A. onderdonkii SGB2303 Clostridia SGB14311 Clostridia SGB15390 P. stomatis SGB748 GGB9342 SGB14306 D. pneumosintes SGB5842 F. nucleatum SGB6007 GGB9694 SGB15201 Clostridia SGB4367 A. faecicola SGB5190 B. fragilis SGB1853 R. lactatiformans SGB15271 C. symbiosum SGB4699 E. faecalis SGB7962 M. smithii SGB714 g. E. bolteae SGB4758 g. B. caccae SGB1877 A. finegoldii SGB2301 A. intestini SGB5736 GGB9633 SGB15090 T. nexilis SGB4588 g. A 0 I II III IV Asin-sqrt rel. ab. 0 0.05 0.10 0.15 0.20 0.25 A. muciniphila SGB9226 Asin-sqrt rel. ab. 0 0.01 0.02 0.03 0.04 0.05 F']","['1-Introduction to the human gut microbiota.pdf', '11-Microbiota in inflammatory bowel disease.pdf', '25-Pooled analysis of 3,741 stool metagenomes from 18 cohorts.pdf', '5-Microbiota in health and diseases.pdf', '6-Microbiome and Human Health.pdf', '8-Antibiotic perturbations to the gut microbiome.pdf']",-0.0003,easy,factual
ibd_microbiota_mcq_004,Which mechanism do adherent-invasive E. coli use in IBD-associated microbiota to promote inflammation?,Direct cytotoxin production,Propanediol dehydratase-dependent production of propionate and modulation of IL-1β-producing CX3CR1+ MNPs,Inhibition of SCFA production,Disruption of tight junction proteins,B,"Option: B

Explanation: This option describes a specific mechanism by which adherent-invasive E. coli (AIEC) promote inflammation in IBD-associated microbiota, involving the production of propionate and modulation of IL-1β-producing CX3CR1+ MNPs through propanediol dehydratase activity.","['. Mechanistically, microbiota dysbio- sis is linked to IBD through its impact on inﬂammation as well as the intestinal barrier. As described before, microbiota dysbiosis can induce chronic inﬂammation, which is associated with the development of multiple diseases such as cancer, diabetes, and heart diseases. Importantly, it is postulated that microbiota can interact with intestinal barrier and lead to IBD. For example, Kleessen et al. reported that bacterial invasion of the mucosa was detected more in IBD patients than in controls.239 It was also reported that the abundance of adherent-invasive E. coli was signiﬁcantly increased in CD patients, suggesting that the pathogenic bacteria may affect the permeability of the intestine, the composition of gut microbiota, and eventually induce intestinal inﬂammation.240 In healthy individuals, the predominant phyla are Firmicutes and Bacteroidetes, followed by Proteobacteria and Actinobacteria', '. A common way to induce colitis in mice. May result in contradicted result with variation in experimental design and environmental factors. Microbiota in health and diseases Hou et al. 3 Signal Transduction and Targeted Therapy (2022) 7:135', '. Tissue damage is involved in the inflammatory response medi- ated by immune and non-immune cells85–87. To recover tissue integrity, this process is naturally followed by tissue healing. These processes are inevitably affected by the microbiota. In colitis models, adherent IBD-associated microbiota can promote mucosal healing through induction and release of tumour necrosis factor-like ligand 1A (TL1A) by CX3CR1+ mononuclear phagocytes (MNPs), which drives produc- tion of group 3 innate lymphoid cells and IL-22, both of which can pro- mote mucosal healing during acute colitis88. CX3CR1+ MNPs reduced T helper cell expansion and promoted Treg cell generation in the pres- ence of normal microbiota, whereas disruption of the microbiota resulted in inflammatory T helper cell responses89. Adherent-invasive E', '. It is a group idiopathic, chronic, and relapsing gastrointestinal inflammation with two common forms: ulcerative colitis (UC) and Crohn’s disease (CD).74 Inflammation occurs at any location along the entire GI tract in CD. Meanwhile in UC, inflammation is restricted to the large intestine. Both conditions are associated with recurring fever, diarrhea, and abdominal pain. It was suggested that dysbiosis in the gut potentially contributes to IBD pathogenesis.75 An example is a reduction in the abundance of Firmicutes such as Faecalibacterium prausnitzii and Roseburia spp.76−78 These are butyrate-producing bacteria, with butyrate being the primary energy substrate for colonocytes. Thus, a decrease in Firmicutes could heighten local inflammation by decreasing anti-inflammatory cytokines.78,79 As such, F', '. Secretory IgA prevents direct contact between luminal factors, including bacteria, and intestinal epithelial cells107. Polyreactive IgA binds to a broad subset of bacteria with low affin- ity, including Proteobacteria, but its functional effects in IBD are still unclear108. Secretory IgA can also target fungi, with a high affinity for fungal hyphae60,109. Gut fungi such as C. albicans induce IgA class switch recombination or even activate antibody production systemically60,61. Altogether, these studies outline a dual role of microbiota-reactive B cells in IBD. Microbial metabolites SCFAs. SCFAs such as acetate, propionate and butyrate are synthesized via gut microbial fermentation of dietary fibres and amino acids110, and are pivotal in sustaining intestinal homeostasis, facilitating innate and adaptive immune responses, and mitigating inflammatory reactions110', '. Sections Introduction Microbiota composition and functional characteristics Microbiota-mediated mechanisms of intestinal homeostasis and IBD pathogenesis Neuroimmune mechanisms of inflammation regulation Microbiota and IBD therapy FMT Conclusions and perspectives 1Joan and Sanford I. Weill Department of Medicine, Gastroenterology and Hepatology Division, Weill Cornell Medicine, New York, NY, USA. 2The Jill Roberts Institute for Research in Inflammatory Bowel Disease, Weill Cornell Medicine, New York, NY, USA. 3Department of Microbiology and Immunology, Weill Cornell Medicine, New York, NY, USA. 4Immunology and Microbial Pathogenesis Program, Weill Cornell Graduate School of Medical Sciences, Weill Cornell Medicine, Cornell University, New York, NY, USA. 5Division of Gastroenterology, Massachusetts General Hospital and Harvard Medical School, Boston, MA, USA. e-mail: idi@ilievlab.org', '. The condition is broadly divided into Crohn’s disease (CD) and ulcerative colitis (UC), which involves inflammation of the gastrointestinal tract or the colon, respectively2.The aetiology of IBD is complex and multifactorial, involving genetic, environmental, dietary, immune and neuronal factors, all of which are interlinked by a com- plex microbial community (microbiome) of bacteria, fungi, archaea, viruses and protozoa. The microbiome plays a central role in IBD, as evidenced by genetic and serological markers and alterations in path- ways responsible for host–microbiota interactions, microbial altera- tions in first degree relatives and by microbial change associated with resolution of inflammation', "". Role of adherent and invasive Escherichia coli in Crohn's disease: lessons from the postoperative recurrence model. Gut 2023; 72: 39-48 [RCA] [PMID: 35361684 DOI: 10.1136/gutjnl-2021-325971] [FullText] 41 Panzetta ME, Valdivia RH. Akkermansia in the gastrointestinal tract as a modifier of human health. Gut Microbes 2024; 16: 2406379 [RCA] [PMID: 39305271 DOI: 10.1080/19490976.2024.2406379] [FullText] [Full Text(PDF)] 42 Kim JM, Rim JH, Kim DH, Kim HY, Choi SK, Kim DY, Choi YJ, Yu S, Cheon JH, Gee HY. Microbiome analysis reveals that Ralstonia is responsible for decreased renal function in patients with ulcerative colitis. Clin Transl Med 2021; 11: e322 [RCA] [PMID: 33784015 DOI: 10.1002/ctm2.322] [FullText] [Full Text(PDF)] 43 Pan X, Xian P, Li Y, Zhao X, Zhang J, Song Y, Nan Y, Ni S, Hu K. Chemotaxis-driven hybrid liposomes recover intestinal homeostasis for targeted colitis therapy"", '. Microbiota and IBD therapy Current treatment options for CD and UC generally focus on targeting inflammation and promoting mucosal healing155. Potential therapeutic options specifically targeting the microbiome include antibiotics, prebiotics, probiotics, synbiotics (a combination of prebiotics and probiotics), faecal microbial transplantation (FMT) and dietary inter- ventions. More recently, pioneering new biotherapeutics have shown potential for the treatment of IBD (Fig. 3). FMT Although the pathogenesis of IBD differs between affected individuals, the possibility of introducing a healthy microbiota to patients with IBD has been investigated as a potential therapeutic option to treat IBD-associated dysbiosis. While FMT efficacy has been well docu- mented in the treatment of Clostridium difficile infection156,157, rand- omized controlled trials of FMT in patients with UC have demonstrated modest effects on induction of remission158–162', 'Nature Reviews Microbiology | Volume 23 | August 2025 | 509–524 509 nature reviews microbiology https://doi.org/10.1038/s41579-025-01163-0 Review article Check for updates Microbiota in inflammatory bowel disease: mechanisms of disease and therapeutic opportunities Iliyan D. Iliev 1,2,3,4 , Ashwin N. Ananthakrishnan5 & Chun-Jun Guo 1,2,3,4 Abstract Perturbations in the intestinal microbiome are strongly linked to the pathogenesis of inflammatory bowel disease (IBD). Bacteria, fungi and viruses all make up part of a complex multi-kingdom community colonizing the gastrointestinal tract, often referred to as the gut microbiome. They can exert various effects on the host that can contribute to an inflammatory state. Advances in screening, multiomics and experimental approaches have revealed insights into host–microbiota interactions in IBD and have identified numerous mechanisms through which the microbiota and its metabolites can exert a major influence on the gastrointestinal tract']","['11-Microbiota in inflammatory bowel disease.pdf', '5-Microbiota in health and diseases.pdf', '6-Microbiome and Human Health.pdf', '9-Combined metabolomic and metagenomic analysis.pdf']",0.3931,medium,mechanism
ibd_microbiota_mcq_005,What is the range of remission rates achieved in randomized controlled trials of FMT in patients with ulcerative colitis?,10-20%,24-53%,40-70%,60-85%,B,"Option: B
Explanation: The range of remission rates achieved in randomized controlled trials of Fecal Microbiota Transplantation (FMT) in patients with ulcerative colitis varies widely, but a commonly cited range is 24-53%. This range reflects the variability in study design, patient population, and outcomes measured.","['. Among five randomized controlled trials of FMT, varied by the donor or donors used, mode and duration of administration, four demonstrated a statistically significant benefit, resulting in remission rates of 24–53%. In a long-term follow-up of the FOCUS trial, of the 35 of patients who achieved remission with weekly FMT at 8 weeks, 34% remained in remission at 1 year, either with the aid of self-initiated FMT (three patients) or a change in diet (nine patients)163. To extend the durability of benefit from FMT, studies have also examined intermittent low-frequency FMT for maintenance or dietary alteration. In one study, 87% of patients could maintain clinical remission with FMT every 8 weeks for up to 48 weeks164, though fewer than half achieved endoscopic remission. An anti-inflammatory diet has been shown to maintain FMT induced remission for 1 year165. There is a paucity of data of this therapeutic option in CD', '. This was attributed to the soluble factors produced by the probiotics that caused the inhibition of the indigenous microbiome.342 Apart from C. difficile infection, FMT has been used to treat ulcerative colitis,343,344 type 2 diabetes,345 irritable bowel syndrome,346 and cancer;347 however, only limited case studies and clinical trials have been reported to date. Further well- designed clinical trials are required to confirm FMT’s efficacy for indications beyond C. difficile infection. There are certain aspects of FMT that must be considered and studied before it can be broadly applied in clinical settings. The selection of an appropriate donor is one of the key components for FMT success. Although autologous FMT is likely to provide superior compatibility, it may not always be feasible, thus necessitating a stool donor. Meticulous screening of the donor’s gut microbiome for potentially pathogenic species is required prior to FMT to ensure procedural safety', '. FMT methods include the use of a naso-intestinal tube, gastroscopy, and colonoscopy, all with different efﬁcacies. A meta- analysis conducted by Laniro et al. showed that capsule FMT has an overall response rate of more than 90% and is minimally invasive.369 So far, more than 100 case reports and clinical trials of FMT for rCDI have been published; most reports have high resolution of diarrhea associated with rCDI. Several meta-analyses have conﬁrmed that FMT is superior to standard antibiotic therapy. They also showed that FMT is a safe treatment method for patients with rCDI.370 Compared with the traditional therapy of vancomycin regimen which is only 31% effective, FMT therapy showed a cumulative effectiveness of 94%.371 The clinical remission rate of FMT therapy in the RCT study of UC is about 36–37%', '. Therefore, extensive studies are required before drawing further conclusions. Currently, there are several mechanisms proposed for FMT including the following: 1) FMT may stimulate decolonization of pathogenic microbes and enhance host resistance to pathogens by direct ecological competition;379 2) repopulating gut micro- biota by FMT helps to restore immune function and reduce host damage induced by abnormal microbial colonization of the gastrointestinal tract; 3) FMT facilitates the restoration of essential metabolites used for host metabolism, including SCFAs, anti- microbial peptides, bacteriocins, and bile acids.380 FMT is safe to a large extent, and large studies report mainly minor, short-lived adverse reactions. The speciﬁc high-risk population is mainly immunocompromised patients.381 But this therapy still faces many challenges. For example, regarding the standardization of donor screening, eligible stool donors are often rare if considering the risk of infection', '. Therefore, unlike in chronic respiratory diseases, the gut-lung axis may provide additional protection for the host against pneumonia by regulat- ing the immune response. Inﬂammatory bowel disease IBD is a chronic and remittent inﬂammatory condition of the GI tract, encompassing several diagnoses including Crohn’s disease (CD) and ulcerative colitis (UC).233 While UC is known as continuous, diffuse, and superﬁcial inﬂammation of the colon, CD is characterized by discontinuous, transmural lesions affecting different regions of the GI tract.234 Although the development of IBD is due to complex multi- factorial mechanisms, several risk factors have been extensively studied and are now well documented. The pathogenesis of IBD involves dysregulated immune response, genetic mutations, and environmental factors.235 The intestinal barrier plays an important role in maintaining homeostasis; dysfunction of the barrier may lead to ulceration', '. Specifi- cally, we searched in the curatedMetagenomicData 3 repository for case-control studies for T2D (control n = 882, cases n = 750, four cohorts)70–73, ulcerative colitis (n = 247 and 84), CD (n = 291 and 83, three cohorts in total)38,74,75, inflammatory diseases (including asthma, Behcet syndrome, multiple sclerosis, rheumatoid arthritis and myalgic encephalomyelitis, n = 918 and 827, five cohorts)76–80. IBD was obtained with a quarry of ulcerative colitis and CD. We profiled their reads with MetaPhlAn 4. Then, to compare the microbial signature associated with CRC, we arcsine square root transformed all the MetaPhlAn 4 SGB-level relative abundances, we performed a meta-analysis of SMDs computed starting from a linear regression linking the disease state to the SGB transformed abundance and adjusted by country to take into account potential population effect. SMDs and uncertainty esti- mations were meta-analyzed via inverse variance weighting using Paule–Mandel heterogeneity', '. To view a copy of this licence, visit http://creativecommons.org/licenses/by/4.0/. The Creative Commons Public Domain Dedication waiver (http://creativecommons.org/publicdomain/zero/1.0/) applies to the data made available in this article, unless otherwise stated in a credit line to the data. Alsulaiman et al. BMC Gastroenterology (2023) 23:258 https://doi.org/10.1186/s12876-023-02904-2 BMC Gastroenterology *Correspondence: Amein K. Al-Ali aalali@iau.edu.sa Full list of author information is available at the end of the article Abstract Background Crohn’s diseases and ulcerative colitis, both of which are chronic immune-mediated disorders of the gastrointestinal tract are major contributors to the overarching Inflammatory bowel diseases. It has become increasingly evident that the pathological processes of IBDs results from interactions between genetic and environmental factors, which can skew immune responses against normal intestinal flora', '. J. & Rubin, D. T. Fecal microbiota transplantation as therapy for inflammatory bowel disease: a systematic review and meta-analysis. J. Crohns Colitis 8, 1569–1581 (2014). 161. Sokol, H. et al. Fecal microbiota transplantation to maintain remission in Crohn’s disease: a pilot randomized controlled study. Microbiome 8, 12 (2020). 162. Rossen, N. G. et al. Findings from a randomized controlled trial of fecal transplantation for patients with ulcerative colitis. Gastroenterology 149, 110–118.e4 (2015). 163. Paramsothy, S. et al. Multidonor intensive faecal microbiota transplantation for active ulcerative colitis: a randomised placebo-controlled trial. Lancet 389, 1218–1228 (2017). 164. Sood, A. et al. Role of faecal microbiota transplantation for maintenance of remission in patients with ulcerative colitis: a pilot study. J. Crohns Colitis 13, 1311–1317 (2019). 165. Kedia, S. et al', '. Therefore, climbing number of clinical trials are ongoing to investigate this possibility (Fig. 5a). The majority of clinical trials focusing on efﬁcacy of fecal microbiota transplantation (FMT) is various diseases. Since C. Difﬁcile infection, cancer, and IBD has the highest number of trials, we also summarized the data from pubmed (Supplemental Table S1). As shown in Fig. 5b, c, FMT treatment in IBD and C.Difﬁcile Microbiota in health and diseases Hou et al. 17 Signal Transduction and Targeted Therapy (2022) 7:135', '. The greater understanding of this host-microbiota relationship has allowed for the development of microbiota-based therapy such as FMT and bacteria modulation. These strategies are well on the way to achieving the optimal clinical effect in the treatment of C. difﬁcile infection, diabetes, inﬂammatory bowel disease, etc. In Microbiota in health and diseases Hou et al. 21 Signal Transduction and Targeted Therapy (2022) 7:135']","['11-Microbiota in inflammatory bowel disease.pdf', '12-Gut microbiota analyses of inflammatory bowel diseases.pdf', '25-Pooled analysis of 3,741 stool metagenomes from 18 cohorts.pdf', '5-Microbiota in health and diseases.pdf', '6-Microbiome and Human Health.pdf']",0.2058,medium,factual
ibd_microbiota_mcq_006,Which secondary bile acid inhibits intestinal TH17 cell differentiation by binding to RORγ?,Lithocholic acid (LCA),Isodeoxycholic acid,3-oxolithocholic acid (3-oxoLCA),Chenodeoxycholic acid,C,"Option: C
Explanation: 3-oxolithocholic acid (3-oxoLCA) is known to inhibit intestinal TH17 cell differentiation by binding to RORγ, a key transcription factor involved in the regulation of TH17 cells. This action has been implicated in the modulation of immune responses and potentially in the pathogenesis of certain autoimmune diseases.","['. As IBD has an immunological component, it is plausible to hypothesize that these secondary bile acids may serve a regulatory role. An increase in primary bile acids, cholate and acylcarnitines, which are modified by microorganisms, was found to be characteristic for individuals with IBD15. It has been demonstrated that 3-oxolithocholic acid (3-oxoLCA), derived from lithocholic acid (LCA), inhibits intestinal TH17 cell differentiation via binding to RORγ, and isoalloLCA enhances Treg cell differentiation by binding to nuclear receptor 4A1 (ref. 127). Additionally, Treg cells induced by isoalloLCA suppress inflammation in colitis models. Screening of human stool samples containing high con- centrations of 3-oxoLCA revealed that select human gut commensals produce TH17 cell-modulating bile acids, such as 3-oxoLCA and isoLCA', '. Screening of human stool samples containing high con- centrations of 3-oxoLCA revealed that select human gut commensals produce TH17 cell-modulating bile acids, such as 3-oxoLCA and isoLCA. This screen identified 238 bacterial isolates belonging to 12 genera that could convert LCA into 3-oxoLCA, indicating a diverse range of bacteria can generate these secondary bile acids128. These bacteria were able to negatively regulate TH17 cell levels in vivo in mice through conversion of LCA into 3-oxoLCA and isoLCA128. In individuals with CD, levels of 3-oxoLCA and isoLCA were decreased; upregulated genes associated with TH17 cells and IL-17 in patients with IBD were found to have nega- tive correlation with 3-oxoLCA and isoLCA (but not other bile acids), indicating that these secondary bile acids can contribute to IBD by altering the TH17–IL-17 signalling axis128. Levels of these secondary bile acids and their corresponding microbiota genes were shown to be diminished in patients with IBD', '. Levels of these secondary bile acids and their corresponding microbiota genes were shown to be diminished in patients with IBD. One study revealed that isodeoxycholic acid promotes the generation of immunosuppressive CD4+ Treg cells through interaction with the FXR receptor in dendritic cells129. Alterations in bile acid composition have also been shown to regulate gut RORγ+ Treg cell homeostasis via a vita- min D receptor-dependent mechanism130. Moreover, clinical studies found that patients with UC usually have reduced levels of secondary bile acids such as LCA, and LCA supplementation reduces intestinal inflammation in a TGR5-dependent mechanism131. New bile acid conjugations with amino acids (phenylalanocholic acid, tyrosocholic acid and leucocholic acid) have also been identi- fied through analysis of the metabolome in germ-free and specific pathogen-free mice132', '. Bile acids Primary BAs, such as cholic acid (CA) and chenodeoxycholic acid (CDCA) in humans (and muricholic acid (MCA) in rodents), are amphipathic molecules synthesised in the liver from choles- terol.128 They can be conjugated to glycine or taurine prior to their secretion into bile and storage in the gallbladder. When food is ingested, BAs are released into the small intestine where they assist in the digestion and absorption of dietary fat. Around 95% of intestinal BAs are reabsorbed in the ileum to return to the liver for re-\xadsecretion. This enterohepatic circulation of BAs occurs several times a day and is an important physiological mechanism for maintaining whole body glucose, lipid and energy homeostasis to prevent hyperglycaemia, dyslipidaemia and obesity, and it protects against inflammatory metabolic diseases of the digestive and cardiovascular systems.129 Only a small frac- tion of the BAs will escape this highly efficient loop and reach the colon', '. Bile acids. Bile acids can act as potent signalling molecules for host nuclear receptors. They can shape the gut microbiota, determining microbiota abundance, diversity and metabolic activity121. In newborns, primary bile acids drive the enrichment of bacteria expressing bile acid metabolism genes, which is important for bile acid tolerance122. In autoimmune cholestatic liver disease, in which bile flow from the liver is impaired, microbiota diversity is reduced123. Primary bile acids (cholic acid and chenodeoxycholic acid) undergo bacteria-mediated modifi- cation to generate a diverse range of secondary bile acids, which exert effects on metabolism and immune responses124,125. Emerging evidence suggests that specific secondary bile acids exert modulatory effects on immunity and colon inflammation through their interactions with nuclear receptors such as the farnesoid X receptor (FXR), RORγ, vitamin D receptor, Takeda G protein-coupled receptor 5 (TGR5) and nuclear receptor 4A1126', '. Autoimmun. Rev. 16, 885–896 (2017). 124. Ridlon, J. M., Kang, D.-J. & Hylemon, P. B. Bile salt biotransformations by human intestinal bacteria. J. Lipid Res. 47, 241–259 (2006). 125. Devlin, A. S. & Fischbach, M. A. A biosynthetic pathway for a prominent class of microbiota-derived bile acids. Nat. Chem. Biol. 11, 685–690 (2015). 126. Thomas, J. P., Modos, D., Rushbrook, S. M., Powell, N. & Korcsmaros, T. The emerging role of bile acids in the pathogenesis of inflammatory bowel disease. Front. Immunol. 13, 829525 (2022). 127. Hang, S. et al. Bile acid metabolites control TH17 and Treg cell differentiation. Nature 576, 143–148 (2019). 128. Paik, D. et al. Human gut bacteria produce ΤΗ17-modulating bile acid metabolites. Nature 603, 907–912 (2022). 129. Campbell, C. et al. Bacterial metabolism of bile acids promotes generation of peripheral regulatory T cells. Nature 581, 475–479 (2020). 130. Song, X. et al', '. Several mechanisms could explain the correlation between the elevated LDLC, TC and the altered gut microbiota taxa. First, certain bacteria in the large intestine could convert bile acids to secondary bile acids such as deoxycholic acid and lithocholic acid (Allayee and Hazen, 2015). These secondary bile acids could be reabsorbed into the blood stream, function as signaling molecules and improve liver function and metabolic homeostasis (Thomas et al., 2009; Ryan et al., 2014). The Firmicutes was known to be involved in bile acid metabolism and its abundance was positively associated with the content of secondary bile acids (Jones et al., 2008; Vrieze et al., 2014). We found that the reduced Firmicutes in the MDR-TB recovered group was correlated with the increased serum TC level. Second, short chain fatty acids including acetate, propionate and butyrate were claimed to modulate lipid metabolism in peripheral tissues (Kimura et al., 2013)', '. There are concerns, however, that modern humans may have problems tolerating such high doses of ﬁber as its intake Increased colonic excretion Colon polyps Increased colonic absorption Polyp formation Minerals and ions Phenolic compounds Carbohydrate binding protein TGR5 Conjugated primary bile acids Unconjugated primary bile acids Secondary bile acids GLP-1 BSH 7α-dehydroxylation Gut bacteria Figure 2. SCFA-Independent Effect of Dietary Fibers in Colon Dietary ﬁbers bind conjugated primary bile acids (BAs) and may serve as a platform for gut bacteria that possess the bile salt hydrolase (Bsh), leading to the production of non-conjugated BAs. These can also bind to dietary ﬁbers and be further metabolized by speciﬁc bacteria with 7-alpha dehydroxylation activity, thus generating secondary BAs. The fact that dietary ﬁbers can bind secondary BAs suggests that they may play a role in regulating BA levels within the gut', '. jejuni • E. coli F. nucleatum P. anaerobius P. gingivalis • pks+ E. coli • M. morganii • ETBF • E. faecalis Fap2 FadA Secondary bile acids Primary bile acids Secondary bile acids Primary bile acids H2S LPA LPAR 7α-dehydroxylase (Clostridium spp.) Desulfovibrio spp. B. wadsworthia Alistipes spp. • F. nucleatum • B. fragilis • H. hathewayi F. nucleatum ETBF • BFT • TH17 Gallic acid 3-Dehydroshikimate • L. plantarum • B. subtilis • ARG1 • TGFβ • IL-10 • VEGF • ARG1 • iNOS • TGFβ • IL-6 IL-23 • IL-17 • IL-22 ILC3, myeloid cells MDSC M2 TAM TH17 Impaired gut barrier CSF1, CXCL1, CXCL3, CXCL8 Chemotaxis ROS ROS FAK NF-κB SREBP2 PI3K AKT ERK ERK PI3K TP53 ↑SQLE ↑DNMT1 ↑DNMT3A ↑F. nucleatum ↑E', '. These bile acid conjugates were enriched in patients with IBD; in particular, they were found to be present in a dysbi- otic state from patients with CD, but not UC132. In mouse models, there was a strong positive correlation between the presence of Clostridium bolteae and conjugated bile acids, and further analysis found that certain strains of C. bolteae could synthesize phenylalanocholic acid.']","['11-Microbiota in inflammatory bowel disease.pdf', '2-Gut microbiome and health- mechanistic insights.pdf', '21-Long-Term Effects of Multi-Drug-Resistant Tuberculosis Treatment on Gut Microbiota and Its Health Consequences.pdf', '26-Gut microbiota in colorectal cancer development and therapy.pdf', '7-The Impact of Dietary Fiber on Gut Microbiota in Host Health and Disease.pdf']",0.312,medium,mechanism
ibd_microbiota_mcq_007,"According to the paper, which bacterial species was found to produce TH17 cell-modulating bile acids including 3-oxoLCA?",Only Bacteroides species,238 bacterial isolates belonging to 12 genera,Exclusively Clostridium species,Primarily Firmicutes phylum members,B,"Option: B

The paper likely mentions that a diverse range of bacterial species, not just one specific genus or phylum, were found to produce TH17 cell-modulating bile acids including 3-oxoLCA. This is indicated by the mention of ""238 bacterial isolates belonging to 12 genera"", suggesting a broad range of bacteria are involved in this process.","['. Screening of human stool samples containing high con- centrations of 3-oxoLCA revealed that select human gut commensals produce TH17 cell-modulating bile acids, such as 3-oxoLCA and isoLCA. This screen identified 238 bacterial isolates belonging to 12 genera that could convert LCA into 3-oxoLCA, indicating a diverse range of bacteria can generate these secondary bile acids128. These bacteria were able to negatively regulate TH17 cell levels in vivo in mice through conversion of LCA into 3-oxoLCA and isoLCA128. In individuals with CD, levels of 3-oxoLCA and isoLCA were decreased; upregulated genes associated with TH17 cells and IL-17 in patients with IBD were found to have nega- tive correlation with 3-oxoLCA and isoLCA (but not other bile acids), indicating that these secondary bile acids can contribute to IBD by altering the TH17–IL-17 signalling axis128. Levels of these secondary bile acids and their corresponding microbiota genes were shown to be diminished in patients with IBD', 'Del Chierico et al. Gut Microbiota Age-Dependent Patterns in Obesity diet and host mucosal secretions. Microbes ferments indigestible glycans producing short chain fatty acids (SCFAs), which are nutrients for colonocytes and enterocytes (Koropatkin et al., 2012). Greater primary bile acid biosynthesis was associated to obese adolescents, while secondary bile acid biosynthesis was associated to NW subjects. Primary bile acids (i.e., cholate and chenodeoxycholate), are deconjugated by several gram-positive bacterial species, such as Lactobacilli (Begley et al., 2006). After deconjugation, additional microbial modiﬁcations give rise to the formation of secondary bile acids (Jones et al., 2008), which is only carried out by a minor population of gram- positive anaerobic Clostridium species (Kitahara et al., 2004)', 'Roseburia spp., Ruminococcus spp., Sporobacter spp.) are known to be involved in a number of health-associated functions such as SCFA production30 or bile acid transformation31 (Fig. 3A, B). NTZ had a more substantial disruptive effect, indicated by depletion of 387 ASVs and enhancement of 16 ASVs. NTZ caused a reduction of a larger swath of Clostridiales, which included all but one of the ASVs depleted by HRZE, as well as many other additional Firmicutes, (FDR < 0.05). In addition, NTZ caused an expansion of pathobionts including, K. pneumoniae, E. coli, C. freundii, S. alactolyticus, and E. faecium32 (FDR < 0.01) (Fig. 3A, B). These representatives of the Order Bacilli and of the family Enterobacteriaceae have been shown to be positively selected by antibiotic treatment as a result of higher antibiotic-induced Redox Potential, which includes an increased gut epithelial oxygena- tion33–35', '. In addition to regulating bioavailability to nutrients as sug- gested above, ﬁbers may also form platforms for bringing bacte- ria and biomolecules into close proximity. For example, conju- gated bile acids in the small intestine can bind to ﬁbers before they are deconjugated by Bacteroides and Lacotobacillus species (Kahlon and Woodruff, 2003). Deconjugation is a prereq- uisite for further biotransformation to secondary bile acids by low abundant bacteria such as Clostridium scindens (Reddy et al., 1992). We thus suggest that binding of both bile acids and spe- ciﬁc bacteria to the same ﬁber, which serves as a platform, can explain how low abundant bacteria can serve as efﬁcient trans- formers of biomolecules and thus increase production of secondary bile acids', ', enriched in individuals with T2D, suggesting a potential trans- location of oral microbes to the gut, indicative of a pro-inflammatory HPFS (USA) n = 307 NHSII (USA) n = 213 HCHS/SOL (USA) n = 2,881 Fromentin_2022 (DEU/DNK/FRA) n = 1,005 DIRECT- PLUS (ISR) n = 280 Qin_2012 (CHN) n = 344 Zhong_2019 (CHN) n = 248 Wu_2020b (SWE) n = 484 Karlsson_2013 (SWE) n = 145 Wu_2020a (SWE) n = 991 Universal Overlapping Singular Prevotella copri Bacteroides uniformis Bacteroides vulgatus Faecalibacterium prausnitzii Eubacterium rectale Alistipes putredinis Ruminococcus bromii Bacteroides dorei Bacteroides stercoris Roseburia faecis Eubacterium eligens Fusicatenibacter saccharivorans Bifidobacterium adolescentis Parabacteroides distasonis Collinsella aerofaciens Akkermansia muciniphila Anaerostipes hadrus Eubacterium siraeum Escherichia coli Bacteroides thetaiotaomicron Bacteroides caccae Roseburia inulinivorans Roseburia intestinalis Bacteroides ovatus Bacteroides eggerthii Eubacterium sp', '. Autoimmun. Rev. 16, 885–896 (2017). 124. Ridlon, J. M., Kang, D.-J. & Hylemon, P. B. Bile salt biotransformations by human intestinal bacteria. J. Lipid Res. 47, 241–259 (2006). 125. Devlin, A. S. & Fischbach, M. A. A biosynthetic pathway for a prominent class of microbiota-derived bile acids. Nat. Chem. Biol. 11, 685–690 (2015). 126. Thomas, J. P., Modos, D., Rushbrook, S. M., Powell, N. & Korcsmaros, T. The emerging role of bile acids in the pathogenesis of inflammatory bowel disease. Front. Immunol. 13, 829525 (2022). 127. Hang, S. et al. Bile acid metabolites control TH17 and Treg cell differentiation. Nature 576, 143–148 (2019). 128. Paik, D. et al. Human gut bacteria produce ΤΗ17-modulating bile acid metabolites. Nature 603, 907–912 (2022). 129. Campbell, C. et al. Bacterial metabolism of bile acids promotes generation of peripheral regulatory T cells. Nature 581, 475–479 (2020). 130. Song, X. et al', '11 Chavarria et al., Microbial Genomics 2025;11:001365 (Clostridiaceae), F. prausnitzii (Ruminococcaceae) and B. caccae (Bacteroidaceae). The most important features in the DT model were the order Clostridiales, the families Clostridiaceae and Ruminococcaceae, the genus Clostridium and the species F. prausnitzii. Finally, the most important features in the RF model were the order Clostridiales, the families Clostridiaceae, Ruminococcaceae, Lachnospiraceae, Planococcaceae, Erysipelotrichaceae and Enterobacteriaceae, the genera Neisseria, Clostridium, Phocaeicola (Bacteroidaceae), Pseudomonas (Pseudomonadaceae), Lactococcus (Streptococcaceae) and the species F. prausnitzii, P. copri, R. torques, Bacteroides thetaiotaomicron, B. uniformis, P. fragi and Haemophilus parainfluenzae. Among the contributing features in the EN models classifying negative-\xadstatus vs. T2DM were Prevotella, Planococcaceae, Lactobacillus, Clostridiaceae, Shuttleworthia, Acidaminococcus, Oscillospira, R', '. Zheng X, Chen T, Zhao A et al (2021) Hyocholic acid species as novel biomarkers for metabolic disorders. Nat Commun 12:1487. https://\u200bdoi.\u200borg/\u200b10.\u200b1038/\u200bs41467-\u200b021-\u200b21744-w 43. Petersen AØ, Julienne H, Hyötyläinen T et al (2021) Conjugated C-6 hydroxylated bile acids in serum relate to human metabolic health and gut Clostridia species. Sci Rep 11:13252. https://\u200bdoi.\u200b org/\u200b10.\u200b1038/\u200bs41598-\u200b021-\u200b91482-y 44. Chen L, van den Munckhof CL, Schraa K et al (2020) Genetic and microbial associations to plasma and fecal bile acids in obesity relate to plasma lipids and liver fat content. Cell Rep 33:108212. https://\u200bdoi.\u200borg/\u200b10.\u200b1016/j.\u200bcelrep.\u200b2020.\u200b108212 45. Browning MG, Pessoa BM, Khoraki J, Campos GM (2019) Changes in bile acid metabolism, transport, and signaling as central drivers for metabolic improvements after bariatric surgery. Curr Obes Rep 8:175–184. https://\u200bdoi.\u200borg/\u200b10.\u200b1007/\u200b s13679-\u200b019-\u200b00334-4 46', '. 2e). In addition, our study suggests that certain bacteria involved in other intestinal metabolism, including those associated with mineral meta- bolism (such as Collinsella aerofaciens involved in iron metabolism19), bile acid metabolism20 (such as Ruminococcus torques), and urea cycle metabolism21 (such as Biﬁdobacterium longum), all of which demon- strate a signiﬁcant decrease (Fig. 2e). Some bacteria that antagonize pro-inﬂammatory microorganisms are also signiﬁcantly reduced. Alistipes putredinis showed a negative correlation with the colonization of Candida albicans, which is enriched in the gut of IBD patients and exacerbates intestinal inﬂammation by inducing Th17 cell differentiation22,23. Notably, through a comprehensive analysis, we have successfully identiﬁed two speciﬁc microbial species, Asacchar- obacter celatus and Gemmiger formicilis, which are depleted across six distinct IBD cohorts (Supplementary Fig. 2c)', '. jejuni • E. coli F. nucleatum P. anaerobius P. gingivalis • pks+ E. coli • M. morganii • ETBF • E. faecalis Fap2 FadA Secondary bile acids Primary bile acids Secondary bile acids Primary bile acids H2S LPA LPAR 7α-dehydroxylase (Clostridium spp.) Desulfovibrio spp. B. wadsworthia Alistipes spp. • F. nucleatum • B. fragilis • H. hathewayi F. nucleatum ETBF • BFT • TH17 Gallic acid 3-Dehydroshikimate • L. plantarum • B. subtilis • ARG1 • TGFβ • IL-10 • VEGF • ARG1 • iNOS • TGFβ • IL-6 IL-23 • IL-17 • IL-22 ILC3, myeloid cells MDSC M2 TAM TH17 Impaired gut barrier CSF1, CXCL1, CXCL3, CXCL8 Chemotaxis ROS ROS FAK NF-κB SREBP2 PI3K AKT ERK ERK PI3K TP53 ↑SQLE ↑DNMT1 ↑DNMT3A ↑F. nucleatum ↑E']","['10-Microbiome and metabolome features in inflammatory bowel disease via multi-omics integration analyses across cohorts.pdf', '11-Microbiota in inflammatory bowel disease.pdf', '13-Gut Microbiota Markers in Obese Adolescent and Adult Patients(Obese).pdf', '18-Gastrointestinal microbiota composition predicts peripheral inflammatory state during treatment of human tuberculosis.pdf', '26-Gut microbiota in colorectal cancer development and therapy.pdf', '28-Strain-specific gut microbial signatures in type 2 diabetes identified in a cross-cohort analysis of 8,117 metagenomes.pdf', '29-The gut microbiota and diabetes_research_translation_and_clinical_applications.pdf', '30-Using gut microbiome metagenomic hypervariable features for diabetes screening and typing through supervised machine learning.pdf', '7-The Impact of Dietary Fiber on Gut Microbiota in Host Health and Disease.pdf']",0.2733,medium,factual
ibd_microbiota_mcq_008,What percentage of polyphenols interact with gut microorganisms in the ileum and colon rather than being absorbed in the small intestine?,50-60%,70-80%,80-85%,90-95%,D,"Option: D
Explanation: The majority of polyphenols are indeed absorbed in the small intestine, but a significant percentage (around 5-10%) can interact with gut microorganisms in the ileum and colon. This is because some polyphenols are not fully absorbed by the time they reach the large intestine, allowing them to be fermented by gut bacteria.","['. Polyphenols, categorized as either flavonoids or non-flavonoids, are plant secondary metabolites found in fruits, vegetables, cereals, wine, tea and coffee46,47. Small quantities of polyphenols (5% to 10%) are absorbed in the small intestine, predominantly those featuring mono- meric and dimeric structures. Following absorption, aglycones undergo biotransformation within enterocytes and then within hepatocytes. These metabolites are transported via the circulatory system to organs such as the kidneys and liver and are ultimately excreted in urine46. The majority of polyphenols (90% to 95%) interact with gut microorgan- isms in the ileum and colon, wherein they promote the abundance of \xadBifidobacterium, Akkermansia and Lactobacillus species, thereby provid- ing substantial anti-inflammatory and anti-pathogenic properties, as well as cardiovascular protection45,48,49', '. b, Polyphenols are metabolized by gut bacteria and are, therefore, broken down into bioactive microbial metabolites. Polyphenols have been shown to increase the abundance of beneficial bacteria such as Bifidobacterium, Akkermansia and Lactobacillus species in the gut lumen. These bacteria have a crucial role in maintaining gut barrier function, regulating the immune system, promoting gut homoeostasis and inhibiting the growth of pathogenic bacteria. Additionally, polyphenols exhibit substantial anti-inflammatory and antioxidant effects within the gut. The by-products of polyphenol metabolism, phenolic-deprived metabolites, are absorbed in systemic circulation wherein they exert substantial immunoregulatory effects. For example, these metabolites have been shown to improve lung, brain and heart function by reducing inflammation and oxidative stress and by improving endothelial function, thereby increasing peripheral blood flow', '. Addition- ally, gut microbiota varies in different anatomical parts of the GI tract. For example, Proteobacteria such as Enterobacteriaceae are found in the small intestine but not the colon. Instead, Bacteriodetes such as Bacteroidaceae, Prevotellaceae and Rikenella- ceae are often found in the colon.19 Such variations are majorly due to the different environments. In the small intestine, the transit time is short and bile concentration is high, while in the colon, which has slower ﬂow rates and milder pH, as well as larger microbial communities, especially anaerobic types, are commonly observed.20 Besides spatial distribution, gut microbiota also differs by age', '. Modulation of the gut microbiota by polyphenols has been demonstrated to support homoeo- stasis in lung function, central nervous system function and intestinal barrier integrity45 (Fig. 3b). Moreover, differences in protein and fat types between plant and animal sources result in disparities in gut microbial composition and, hence, metabolomes. For instance, animal-based diets lead to a higher abundance of bile-tolerant bacterial species belong- ing to Alistipes and Bilophila genera while decreasing the abundance of Firmicutes, reducing the levels of BCAAs and increasing SCFAs and dimethylsulfone4,56. Other plant compounds, such as fibre, terpenes and carotenoids, have also demonstrated health benefits, as reviewed in ref. 57. Inter-individual variations in the production of phenolic-derived metabolites from dietary polyphenols are attributed to the unique com- position of the gut microbiome of each individual', '. 57. Inter-individual variations in the production of phenolic-derived metabolites from dietary polyphenols are attributed to the unique com- position of the gut microbiome of each individual. Consequently, the use of metabotyping for the analysis of polyphenol metabolites could serve as a valuable approach for gaining deeper insights into the effects of bioactive compounds and offer a \xadcomprehensive understanding of the substantial diversity among individuals55. Fig. 2 | Impact of dietary fibre and protein on human health. Breakdown of dietary fibre and protein by the gut microbiota, the resulting metabolites and their impact on host health. a, This part of the figure delineates the breakdown of fibre by gut microbiota and its implications for barrier function and immunity, showing the downstream effects of unmetabolized short-chain fatty acids (SCFAs) entering portal circulation and their advantageous effects on host health', '. Particularly, the stability of orally administered drugs can be affected in the GI tract before entering the systemic circulation. Sousa et al. summarized that over thirty drugs are substrates of bacterial enzymes in the distal gut.400 Recently, it was suggested that small intestine microbiota may also have profound impact on host physiological functions.401 This ﬁnding highlighted the potential drug-microbiota interaction, since small intestine is a major site for drug absorption. Indeed, numerous studies have reported altered drug PK mediated by gut microbiota with clinical implications. For example, Sun et al. reported that a hypoxic environment can affect the composition of gut micro- biota, which led to increased absorption of aspirin in rats.402 Matuskova et al. identiﬁed that concomitant orally administrated probiotic E', '. Hence, a concentration gradient of microbes is found along the small intestine, as microbial abundance in duodenal aspirates were found to be a 1000-\xadfold lower than that of oral samples, although consisting of somewhat similar microbial taxa.4 Consequently, the small intestine contains an increasing number of thousands to several hundred million of cells per gram of content with partly oxygen-\xadtolerant Firmicutes and Proteobacteria as major phyla.5 6 This all culminates in the lower gut where climax communities of up to 100 billion cells per gram reside for up to a few days, since transit in the colon is over a dozen times longer than that in the small intestine', '. Interactions between gut microbiota and polyphenols: a mechanistic and metabolomic review. Phytomedicine 119, 154979 (2023). 46. Corrêa, T. A. F., Rogero, M. M., Hassimotto, N. M. A. & Lajolo, F. M. The two-way polyphenols-microbiota interactions and their effects on obesity and related metabolic diseases. Front Nutr. 6, 188 (2019). 47. Ross, F. C. et al. Potential of dietary polyphenols for protection from age-related decline and neurodegeneration: a role for gut microbiota? Nutr. Neurosci. https://doi.org/ 10.1080/1028415X.2023.2298098 (2024). 48. Selinger, E. et al. Evidence of a vegan diet for health benefits and risks — an umbrella review of meta-analyses of observational and clinical studies. Crit. Rev. Food Sci. Nutr. 63, 9926–9936 (2022). 49. Espín, J. C., González-Sarrías, A. & Tomás-Barberán, F. A. The gut microbiota: a key factor in the therapeutic effects of (poly)phenols. Biochem. Pharmacol. 139, 82–93 (2017). 50. Sesso, H. D. et al', '. 0.84%, P<0.05), and lower relative abundance of Faecalibacterium (5.31% vs. 14.80%, P<0.05), Biﬁdobacterium (1.67% vs. 5.02%, P<0.05), Agathobacter (0.86% vs. 3.32%, P<0.05) and CAG-352 (0.60% vs. 2.21%, P<0.05) (Figure 2B). Our data indicated the altered gut microbiota composition in PTB patients. TABLE 1 Clinical characteristics of the participants. Variable HC (n=63) mean (range) PTB (n=69) mean (range) Student’s t test (P values) Gender, Man, n (%) 40 (63.49%) 44 (63.77%) n.s. Age (year) 49 (34-67) 51 (30-69) n.s', '. In healthy subjects, the oral and saliva microbi- omes contain millions of microbes that are swal- lowed daily with our food, but their persistence in the gut is impeded by many factors, including the acidity of the stomach, the production of bile acids (BAs), digestive enzymes and antimicrobial proteins in the duodenum and beyond. A great number of other major variables affect further downstream microbial colonisation, such as chemical parameters like pH, oxygen concentrations and redox poten- tial, the biological production of mucus, bile and antibodies, as well as physical aspects, including gut architecture, peristalsis and transit times (figure 1)']","['2-Gut microbiome and health- mechanistic insights.pdf', '23-The correlation between dysfunctional intestinal flora and pathology feature of patients with pulmonary tuberculosis.pdf', '4-The interplay between diet and the gut microbiome.pdf', '5-Microbiota in health and diseases.pdf']",0.2443,medium,factual
ibd_microbiota_mcq_009,Which mechanism is responsible for the protective effect of nociceptors in the gut according to the paper's discussion of TRPV1?,Direct antimicrobial activity against pathogens,"Regulation of intestinal tissue damage, inflammation and repair via release of neuropeptides and modulation of microbiota composition",Enhancement of immune cell recruitment to sites of infection,Increasing production of digestive enzymes,B,"Based on the context, I would choose:

B. Regulation of intestinal tissue damage, inflammation and repair via release of neuropeptides and modulation of microbiota composition

This option is consistent with the protective effect of nociceptors in the gut, as it involves the regulation of inflammation and repair through the release of neuropeptides and modulation of microbiota composition.","['. Signals from intestinal microbiota in TRPV1- ablated mice promoted severe intestinal inflammation. Nociceptors release substance P, a neurotransmitter involved in pain signalling, which can also regulate the composition of the intestinal microbiota146.', '. In a mouse model of intestinal dam- age and inflammation, disruption of nociceptors through chemoge- netic and adenoviral-mediated silencing or pharmacological TRPV1 nociceptor ablation resulted in increased inflammatory cell infiltration (including neutrophils), and defective tissue repair machinery146. These findings indicate that in a context-dependent manner, TRPV1 nocic- eptors play a protective role in the gut by regulating intestinal tissue damage, inflammation and repair146 via the release of neuropeptides, such as calcitonin gene-related peptide and substance P. Disruption of TRPV1 nociceptors also altered intestinal microbiota composition in mouse models, including a decrease in Bacteroides and an increase in Firmicutes species146. Signals from intestinal microbiota in TRPV1- ablated mice promoted severe intestinal inflammation', '. Microbial metabo- lites have also been shown to activate brainstem sensory nuclei, which can induce gut-specific stimuli, identifying a gut–brain–gut axis of communication139. In mice infected with Citrobacter rodentium, an immune response was triggered that led to the production of die- tary-antigen-specific IgE antibodies in the intestine. Oral ingestion of bacterial antigens resulted in visceral pain via an IgE and mast- cell-dependent mechanism, thus identifying a link between the gut microbiome and pain144. Nociceptive pain plays a role in many inflammatory diseases, including IBD. Nociceptors, which are specialized pain-sensing neu- rons, innervate peripheral tissues including the gastrointestinal tract; these neurons express transient receptor vanilloid 1 (TRPV1), a nonse- lective cation channel that can detect stimuli such as heat, capsaicin and inflammatory mediators145', '. 2 | Neuroimmune regulation of intestinal barrier function, inflammation and pain. Chronic pain is a key hallmark of inflammatory bowel disease. Microbial metabolites, immune cell- and neuron-produced mediators affect inflammation, neuronal function and the perception of pain. Communication between the gut microbiota and the immune system is further mediated by microbial metabolites, neurotransmitters and enteric-associated neurons. Pathobionts, intestinal barrier disruption and excessive immune activation contribute to neuronal damage and pain in inflammatory bowel disease (left). Neurotransmitters produced by sympathetic and sensory neurons regulate gut motility or restrict bacteria invasion and inflammation at homeostasis via coeliac ganglion–superior mesenteric ganglion (CG–SMG) and dorsal root ganglion (DRG) (right)', 'Nature Reviews Microbiology | Volume 23 | August 2025 | 509–524 517 Review article Together, these findings indicate that nociceptor-mediated signalling regulates the gut microbiome through the release of neuropeptides, and that disruption of this pathway can cause microbial alterations and exacerbation of intestinal inflammation146. Microbiota effects on neuroimmunity and inflammation Pathogens and microbial metabolites can disrupt neuroimmune inter- actions. In mice, Salmonella enterica serovar Typhimurium infection caused loss of intestinal EANs and reduced motility through a pathway dependent on NOD‐like receptor family pyrin domain-containing 6 (NLRP6) and caspase 11 (ref. 147). Following antibiotic treatment and recolonization of the gut with a healthy microbiota, EAN recovery was observed together with a return to pre-infection levels of neuronal activity147,148. Adaptive immunity microbiota crosstalk can stimulate neuronal repair following tissue damage', '. Deletion of the AHR gene, or overex- pression of its negative feedback regulator CYP1A1, resulted in reduced intestinal motility, an effect also observed in microbiota-depleted mice149. These findings provide a crucial link between the microbiota and gut motility. (Fig. 2) Microbial metabolites can regulate activation of brainstem sen- sory nuclei with polysynaptic connections to the intestine, which may regulate gut sympathetic activity139. In mice in which TRPV1 or Nav1.8 sodium channel nociceptors were ablated, 16S rRNA gene sequencing revealed changes in the composition of the intestinal microbiota150. CGRP Immune cells 5-HT SP TRPV1+ Longitudinal smooth muscle β2-AR CG–SMG Gut motility DRG Sympathetic neuron Microbial metabolites Gut lumen Ahr Dysbiosis Tissue damage Neuronal death Disrupted motility Muscularis macrophage Interneuron Sensory neuron Circular smooth muscle Inflammation Homeostasis M cell Fig', 'Nature Reviews Microbiology | Volume 23 | August 2025 | 509–524 523 Review article 141. De Vadder, F. et al. Gut microbiota regulates maturation of the adult enteric nervous system via enteric serotonin networks. Proc. Natl Acad. Sci. USA 115, 6458–6463 (2018). 142. Villanacci, V. et al. Enteric nervous system abnormalities in inflammatory bowel diseases. Neurogastroenterol. Motil. 20, 1009–1016 (2008). 143. Margolis, K. G. et al. Enteric neuronal density contributes to the severity of intestinal inflammation. Gastroenterology 141, 588–598 (2011). 598.e1–2. 144. Aguilera-Lizarraga, J. et al. Local immune response to food antigens drives meal-induced abdominal pain. Nature 590, 151–156 (2021). 145. Kwon, D. H. et al. Heat-dependent opening of TRPV1 in the presence of capsaicin. Nat. Struct. Mol. Biol. 28, 554–563 (2021). 146. Zhang, W. et al. Gut-innervating nociceptors regulate the intestinal microbiota to promote tissue protection. Cell 185, 4170–4189.e20 (2022). 147. Matheis, F', '. 2). The gastrointestinal tract is densely populated with enteric-associated neurons (EANs), which relay compositional information to other tissues to regulate gut function140. The intesti- nal microbiota are key regulators of the enteric nervous system, with neuronal detection of microbes eliciting transcriptional and functional responses141. Pain, nociception and the microbiota Pain is a common symptom in individuals with IBD and the overabun- dance of EANs in inflamed regions of the bowel has been observed in IBD142. In transgenic mouse models (one with increased numbers of neurons and one with decreased numbers of neurons), the sever- ity of colitis was found to correlate with the density of EANs in the gut143. The gut microbiome can modulate gut-extrinsic EANs', '. Mol. Biol. 28, 554–563 (2021). 146. Zhang, W. et al. Gut-innervating nociceptors regulate the intestinal microbiota to promote tissue protection. Cell 185, 4170–4189.e20 (2022). 147. Matheis, F. et al. Adrenergic signaling in muscularis macrophages limits infection-induced neuronal loss. Cell 180, 64–78.e16 (2020). 148. Enamorado, M. et al. Immunity to the microbiota promotes sensory neuron regeneration. Cell 186, 607–620.e17 (2023). 149. Obata, Y. et al. Neuronal programming by microbiota regulates intestinal physiology. Nature 578, 284–289 (2020). 150. Lai, N. Y. et al. Gut-innervating nociceptor neurons regulate Peyer’s patch microfold cells and SFB levels to mediate salmonella host defense. Cell 180, 33–49.e22 (2020). 151. Mawe, G. M. & Hoffman, J. M. Serotonin signalling in the gut — functions, dysfunctions and therapeutic targets. Nat. Rev. Gastroenterol. Hepatol. 10, 473–486 (2013). 152. Stasi, C., Bellini, M., Bassotti, G., Blandizzi, C. & Milani, S', '. Many pathways have been proposed to mediate the commu- nication within the gut-brain-axis. The signal passage along gut- brain-axis involves the interactions among autonomic nervous system (ANS), enteric neural system (ENS), central nervous system (CNS), immune system, and endocrine system. The ANS, which controls GI tract functions such as gut movement and mucus production, is a complex network that integrates the communica- tion between the gut and the brain, as well as induces CNS effects in the gut since CNS is responsible for processing the visceral information.69 The ANS directly triggers neurological responses in the gut which further causes physiological changes. The ANS also mediates the interaction between the gut microbiota and ENS']","['11-Microbiota in inflammatory bowel disease.pdf', '5-Microbiota in health and diseases.pdf']",0.5554,hard,mechanism
ibd_microbiota_mcq_010,What is the primary mechanism by which the defined 18-member commensal bacterial consortium suppresses intestinal Enterobacteriaceae species?,Production of antimicrobial peptides,Competitive depletion of gluconate through a metabolic pathway not present in Enterobacteriaceae,Direct bacteriocin production,pH modification of the intestinal environment,B,"The correct answer is B.

This option suggests that the commensal bacterial consortium suppresses Enterobacteriaceae species by competing with them for a specific nutrient (gluconate), which is not present in these bacteria. This mechanism would allow the commensals to outcompete and suppress the growth of Enterobacteriaceae, thereby maintaining their dominance in the intestinal environment.

The other options are less likely:

A: While antimicrobial peptides can be produced by some bacteria, there is no indication that this is the primary mechanism used by the 18-member commensal consortium.

C: Direct bacteriocin production would imply a more direct and specific interaction between the commensals and Enterobacteriaceae, which may not be the case here.

D: pH modification of the intestinal environment is unlikely to be the primary mechanism, as it would require significant changes in the overall gut microbiome.","['. coli strains136, indicating the presence of multiple bacteria-associated genotoxic metabolites. Depriving potentially harmful microbial species from access to essential nutrients through competition for common metabolites is another mechanism by which microbiota can exert beneficial effects in IBD. A consortia of 18 commensal bacterial strains isolated from healthy human stool was recently developed and shown to effectively suppress intestinal Enterobacteriaceae species, including Klebsiella pneumoniae, by competitively depleting gluconate137. Gluconate metabolism by species in this consortia involves a pathway of gluco- nate conversion to pyruvate and glyceraldehyde 3-phosphate through a series of enzymatic reactions involving gluconate dehydratase and additional enzymes. This pathway is not present in Enterobacteriaceae species commonly found in individuals with IBD', '. Accordingly, antibiotic exposure in the gut can indiscriminately target both pathogenic and benign bacteria, thereby disrupting ecological niches that are respon- sible for myriad metabolic transformations. This change in taxonomic composition of the gut microbiome is often a risk factor for the onset of other diseases. Most notably, treatment-induced disturbance of the gut community enables the growth of potentially infectious pathobi- onts (opportunistic microorganisms that proliferate on microbiome perturbation) with the capacity to cause disease15,16. Some of the most dangerous microbial threats (as named by the CDC in 2019 (ref. 17)), including drug-resistant Enterobacteriaceae, Clostridioides difficile, vancomycin-resistant Enterococcus and Salmonella spp., are respon- sible for a substantial amount of gastrointestinal disease18', 'In mouse models, when a single type of sugar is removed, both the microbiota composition and the ability of resistance to pathobiont were altered.34 Probably due to the necessity of competing with foreign bacteria, gut bacteria have developed various ways of suppressing competitors, including the secretion of diverse bacteriocins. A contact-dependent competition in the gut, namely type 6 secre- tion system, was originally identiﬁed in the bacteria secretion system involved with eukaryotic cells,35 which was later found relevant to intraspecies killing', '. 1 | Antibiotic-mediated destruction of the gut microbiome opens an opportunistic niche. Antibiotics often eradicate Bacteroidetes, Firmicutes and Actinobacteria taxa responsible for important gut microbiome functions, although the species lost are community-specific and antibiotic-specific. This loss of diversity leaves an open niche for colonization or proliferation by opportunistic bacteria that are associated with gastrointestinal disease, namely those from phylum Proteobacteria. These opportunistic bacteria often have mobilizable drug resistance or innate properties such as spore formation that enable them to survive antibiotic exposure. A number of organisms that can colonize an antibiotic-perturbed gut microbiome are recognized by the CDC as major threats to public health. ESBL, extended-spectrum β-lactamase.', '. The commensal bacteria play a key role in processing nutrients and metabolites such as short-chain fatty acids (SCFAs), bile acids, amino acids, etc.64 By doing so, some of these bacteria facilitate host energy harvesting and metabolic efficiency.65 Some of these members also play an important immune function against pathogenic bacteria and prevent bacterial invasion by maintaining intestinal epithelium integ- rity.66 Although the composition of the microbiome species Chemical Reviews pubs.acs.org/CR Review https://doi.org/10.1021/acs.chemrev.2c00431 Chem. Rev. 2023, 123, 31−72 34', '. difficile infection compared to the patients receiving placebo after antibiotics (12% vs 40%).352 Patients receiving SER-109 showed an engraftment of the dosed species within 1 week, which persisted for the study duration (8 weeks) with an increased abundance of Firmicutes and decreased proinflammatory Enterobacteriaceae. A higher concentration of secondary bile acids in the fecal samples from patients given SER-109 was also observed.352 3.3.2. Synthetic Microbial Consortia. Due to the undefined community structure in naturally occurring micro- biomes, it is challenging to quantify the contributions of individual members toward a specific function, making it unsuitable for further optimization. Synthetic microbial consortia can fulfill this unmet need as they can be rationally designed with reduced microbial complexity to perform functions that can predictably impart a therapeutic benefit to the host. For example, Tanoue et al', '. Here, we will discuss some examples of these microbial consortia being used to target a variety of diseases and the challenges faced by these strategies. 3.3.1. Fecal Microbiota Transplantation. FMT involves the administration of dried feces, either the patient’s own or from a healthy donor to the patient (Figure 4). The route of administration might vary, ranging from oral consumption of freeze-dried capsules and small/large intestine infusion to enema.339 The aim is to reconstitute the native disease- Figure 4. Engineering the microbiome by fecal microbiota transplantation (FMT) and synthetic microbial consortia. The main features of both strategies are presented along with unknown parameters (marked by “?”). Chemical Reviews pubs.acs.org/CR Review https://doi.org/10.1021/acs.chemrev.2c00431 Chem. Rev. 2023, 123, 31−72 46', '. 3.3. Natural and Synthetic Microbial Consortia Microbial communities, such as those in the human micro- biome, perform complex functions shaped by dynamic interactions within the community and with the environment. Such intricate functions are unlikely to be recapitulated by individual populations, which has resulted in heightened interest in microbial consortia. Additionally, increased microbial diversity within the consortia might also impart resilience against environmental changes, such as nutrient limitation.338 Currently, two types of microbial consortia are being used for therapeutic applications: naturally occurring with undefined composition, such as the gut microbiome, which can be used as a fecal microbiota transplant (FMT); and synthetic, comprising a predetermined cocktail of probiotics or commensal microbes. Here, we will discuss some examples of these microbial consortia being used to target a variety of diseases and the challenges faced by these strategies. 3.3.1', '. Antibiotic susceptibility of a gut commensal may thus be determined by its surrounding nutrient milieu (Box 1), a concept that remains difficult to investigate in vivo88–92. Although it is often speculated that Bacilli and Enterobacteriaceae are more likely to bloom on antibiotic treatment of the gut microbiome because they possess more encoded resistance, these suppositions are based on resistance databases with likely overrepresentation of pathogens (discussed below) and do not account for the growth and metabolism of single organisms and communities. In clinical practice, in vitro susceptibilities for respiratory and enteric pathogens serve as the gold standard for treatment of such infection and predict pathogen killing reasonably well. Yet, the in vitro spectrum of activity of an antibiotic does not always predict in vivo species trajectories in a multi-species microbiome during anti- biotic exposure93–96', '. Mechanistically, microbiota dysbio- sis is linked to IBD through its impact on inﬂammation as well as the intestinal barrier. As described before, microbiota dysbiosis can induce chronic inﬂammation, which is associated with the development of multiple diseases such as cancer, diabetes, and heart diseases. Importantly, it is postulated that microbiota can interact with intestinal barrier and lead to IBD. For example, Kleessen et al. reported that bacterial invasion of the mucosa was detected more in IBD patients than in controls.239 It was also reported that the abundance of adherent-invasive E. coli was signiﬁcantly increased in CD patients, suggesting that the pathogenic bacteria may affect the permeability of the intestine, the composition of gut microbiota, and eventually induce intestinal inﬂammation.240 In healthy individuals, the predominant phyla are Firmicutes and Bacteroidetes, followed by Proteobacteria and Actinobacteria']","['11-Microbiota in inflammatory bowel disease.pdf', '5-Microbiota in health and diseases.pdf', '6-Microbiome and Human Health.pdf', '8-Antibiotic perturbations to the gut microbiome.pdf']",0.3215,hard,mechanism
saudi_ibd_mcq_001,What was the minimum read count threshold used to retain samples for downstream analyses in this study?,"10,000 reads","25,000 reads","50,000 reads","100,000 reads",B,"Option: B
Explanation: The question does not provide specific information about the study's methods or requirements for retaining samples. However, in general, a read count threshold of 25,000 is considered a reasonable minimum to ensure reliable and accurate downstream analyses in RNA sequencing studies. This threshold allows for sufficient coverage and representation of the transcriptome, while also filtering out low-quality or noisy data.","['. Differential abundance testing The DESeq2 package (v 1.32.0) was used to test for dif\xad ferential abundance of OTUs by modeling counts using the negative binomial distribution. Custom R scripts were used to process the abundance and metadata to cre\xad ate a DESeq2 object and design formula that modeled the DESeq2 normalized counts as a function of the area, nationality, diagnosis, diabetes status, and age bin. Data Quality Control and Filtering For the 16 S sequencing data from IBD and healthy con\xad trols, most samples generated sufficient reads for down\xad stream analyses, with mean number of reads per sample and median number of reads per sample being 1,198,986 and 1,182,939, respectively (Additional File 1: Figure. S1). Principal component analysis (PCA) was performed, and the results of the broken-stick test indicated that 2 principal components were most meaningful to retain (explaining 9% and 3% of the variance, respectively)', 'Page 4 of 11 Alsulaiman et al. BMC Gastroenterology (2023) 23:258 of the read filter comparison, only samples with at least 25,000 reads were retained for downstream analyses, bringing the total number of samples in the data set to 227. An evaluation of the number of Operational Taxo\xad nomic Units (OTUs) was performed to facilitate removing and reducing the burden of multiple testing correction in downstream analyses using a prevalence filter. Within each phylum, we plotted the prevalence of each OTU as a percentage against the total abundance of all OTUs in the data set (Additional File 4: Figure. S4). To determine the most appropriate prevalence filter which balanced removing rare taxa while preserving those rele\xad vant to the biological questions of interest, the minimum number of samples in which an OTU had to be observed was computed using a range of prevalence filters', '. The scatterplots were annotated using various categori\xad cal variables from the metadata: area, nationality, family history, number of family members affected, sex, diag\xad nosis, and diabetes status (Additional File 2: Fig. S2). Sample pruning using read filters showed that the mid\xad dle 50% of the distribution of reads per sample was suf\xad ficient (917,332–1,474,985), although a small number of samples were observed with relatively low read counts that could bias downstream results (Additional File 1: Fig. S1). To determine the appropriate read count filter to prune samples, a tabulation for the number of samples to be retained was generated using filters ranging from 0 to 150,000 reads in increments of 5,000 and plotted the results (Additional File 3: Fig. S3). Based on the results', '. 55) by allowing at most two mismatches in the first 35-bp region and 90% identity over the read sequence; reads mapping at multiple posi- tions (13.4%, on average) were discarded. The abundance of a gene in a sample was estimated by dividing the number of reads that uniquely mapped to that gene by the gene length and by the total number of reads from the sample that uniquely mapped to any gene in the catalogue. The resulting set of gene abundances, termed a microbial gene profile of an individual, was used for further analyses; Illumina and Solid sequencing platforms gave highly similar gene profiles for the same DNA samples24. Gene counting. On the basis of the pair-oriented counting result of each samples, we selected the threshold of one read for gene identification to include the rare genes into the analysis. We identified 91,032–1,005,488 genes for the 292 samples, with an average of 670,528 genes. Read downsizing', '. After sequencing, we performed quality control and screened human genome contaminant. Finally, we generated 26.0 million–186.1 million high-quality reads for the 292 samples, with an average of 68.2 million high-quality reads. Sequen- cing read length of the first batch of 15 samples was 44 bp, the second batch was 75 bp, and the third batch was 75 bp and 90 bp. Microbial gene abundance profiling by quantitative metagenomics. An aver- age of 34.1 million paired-end reads were produced for each sample and, after removing human contamination (,0.1%, on average), 19.9 6 6.7 million reads were mapped at a unique position of the reference catalogue of 3.3 million genes, using SOAP2.21 (ref. 55) by allowing at most two mismatches in the first 35-bp region and 90% identity over the read sequence; reads mapping at multiple posi- tions (13.4%, on average) were discarded', '. A priori sample size estimation was performed to ensure adequate statistical power for detecting temporal variations in the Shannon index across follow-up periods. Based on previous epidemiological studies, we projected the following microbial diversity indices: 3.0 at baseline (month 0), 2.5 at month 2 (Δ = 0.5), and 2.0 at month 6 (Δ = 1.0). The power analysis employed a two-sided sig- nificance level of α = 0.05 with 80% statistical power, accounting for pairwise comparisons between baseline and subsequent timepoints. To address potential attrition, the calculated sample sizes were adjusted upward by 20%. Using R software (version 4.2.1; R Foundation) with the pwr package, the minimum required sample sizes were determined as: Baseline vs. month 2 comparison: 68 analyzable sub- jects → 85 enrolled (68/0.8) Baseline vs. month 6 compar- ison: 22 analyzable subjects → 28 enrolled (22/0.8)', '. The genes that vary in abundance in a coordinated way are thus likely to be from the same Gene number (11 million reads) 0 10 20 30 40 50 60 70 80 Number of individuals Number of individuals All Obese Non-obese 0 10 20 30 40 50 60 70 0 200 400 600 800 1,000 1,200 Gene number (all reads) (×103) All Obese Non-obese a b Figure 1 | Distribution of low and high gene count individuals (n 5 292). a, Gene counts from all uniquely matched reads. b, Gene counts adjusted to 11 million uniquely mapped reads per individual. Vertical line indicates the threshold of the LGC and the HGS individuals; the observed bimodal distribution was not statistically significant by the dip-test. RESEARCH ARTICLE 5 4 2 | N A T U R E | V O L 5 0 0 | 2 9 A U G U S T 2 0 1 3 Macmillan Publishers Limited. All rights reserved ©2013', '. This assignment was used as high confidence assignment on species level. As reference database we used 1,869 available reference genomes from NCBI andthesetofdraftgastrointestinalgenomesfromtheDACC(http://hmpdacc.org/), both asofthe15 July2011version.Theassignedreadstoeachtaxonomicgroupper sample were rarefied to 5.5 million reads (the size of the smallest sample), on this rarefied matrix taxonomic groups were tested for significant differences in abund- ance using a Wilcoxon rank-sum test. Multiple testing corrections were per- formed using the Benjamini–Hochberg method40 (q , 0.1). From the same matrix we calculated the genus abundance as the percentage of reads assigned from 5.5 million total reads per sample; this matrix was used to calculate the class-wise means as well as standard deviations expressed in percentages (Supplementary Table 2). Functional annotation', '. Pre, NTZ vs. Pre, Day 0–six-month longitudinal and observational treatment cohort vs. Day 14–six-month longitudinal and observational treatment cohort)29. We note that the longitudinal nature of these samples, and having a pretreatment sample allows us to account for other unknown factors (e.g., prior antibiotic use). To determine how the anti-TB treatment affects both microbiome and peripheral gene expression proﬁles we performed differential analysis on the counts data obtained by microbiome DNA and peripheral blood RNA sequencing. As the primary endpoint of the clinical trial was powered to determine differences in Mtb load (TTP), we determined the statistical power available to identify signiﬁcant differences in the abundance of both microbiota ASVs, and in the expression of peripheral genes', '. To limit the per base PCR error rates and chimeric sequences 40 cycles of PCR, 5 min of extension time, a low template concentrations (1 ng) conditions were applied (Lahr and Katz, 2009). Each samples was submitted to pyrosequencing reaction on a 454-Junior Genome Sequencer (Roche 454 Life Sciences, Branford, CT, United States), according to manufacturer’s instructions. The 454 Amplicon signal processing was used as ﬁrst result ﬁltering, hence by QIIME 1.8.0 software the sequences were analyzed (Caporaso et al., 2010). After demultiplexing, reads with an average quality score lower than 25, shorter than 300 bp and with an ambiguous base calling were excluded from the analysis. Sequences that passed the quality ﬁlter were denoised (Reeder and Knight, 2010) and singletons were excluded. The denoised sequences were chimera-checked by identify_chimeric_seqs.py using either Blast_fragments and ChimeraSlayer2 approaches']","['12-Gut microbiota analyses of inflammatory bowel diseases.pdf', '13-Gut Microbiota Markers in Obese Adolescent and Adult Patients(Obese).pdf', '14-Richness of human gut microbiome correlates with metabolic markers(Obesity).pdf', '15-Changes in gut microbiome following anti-tuberculosis treatment- a prospective cohort from eastern China.pdf', '18-Gastrointestinal microbiota composition predicts peripheral inflammatory state during treatment of human tuberculosis.pdf']",-0.0463,easy,factual
saudi_ibd_mcq_002,How many distinct OTUs remained after agglomerating reads at the genus level?,98 OTUs,148 OTUs,198 OTUs,"2,502 OTUs",C,"Option: B
Explanation: The question implies that agglomeration at the genus level reduced the number of distinct OTUs, so the correct answer is the one with a lower number.","['. Specifi\xad cally, we tested prevalence filters from 0 to 100% in incre\xad ments of 5% and plotted the number of OTUs retained in a barplot (Additional File 5: Figure. S5). A dramatic decrease in the number of OTUs retained was observed after applying a 5% prevalence threshold. To maximize statistical power in downstream analyses, a 10% preva\xad lence filter was chosen, leaving a total of 2,502 OTUs in the taxa-pruned data set. Next, we evaluated the proportion of uncharacterized OTUs at each taxonomic level (Additional File 6: Table S1). One OTU was uncharacterized at the phylum level and was removed from the data set. Reads were agglom\xad erated at the genus level, as approximately 41% of OTUs were uncharacterized at the species level, resulting in a data set with 198 distinct OTUs', '. Fig. 5 Phylum-level OTU abundance across CD, UC, Healthy Controls and unknown/unclassified samples', '. aerofaciens, F. prausnitzii, Lachnospiraceae, P. acnes, Streptococcus, and V. parvula were FIGURE 2 | Bar chart representing Kruskal–Wallis test results on operational taxonomic units (OTUs) grouped in phyla (A) and in families/species (B) of the CTRL_ado, CTRL_adult, ob_ado, ob_adult groups. Each column in the plot represents a group, and each color in the column represents: (A) the percentage of relative abundance for each OTU; (B) the values of relative abundance for each OTU. Frontiers in Microbiology | www.frontiersin.org 5 June 2018 | Volume 9 | Article 1210', '. PCR products were detected on 1.8% agarose gels and puriﬁed using a MinElute PCR puriﬁcation kit (QIAGEN, Hilden, Germany). The paired end reads were merged using FLASH version 1.2.11 (Magoˇc and Salzberg, 2011). Chimeric reads were ﬁltered out using UCHIME version 8.1 and the ﬁltered reads were clustered to operational taxonomic unit (OTU) based on 97% similarity using USEARCH version 10.0 (Edgar et al., 2011). The taxonomic assignment of OTU was performed by RDP classiﬁer version 2.2 with conﬁdence threshold at 0.8 (Qiong et al., 2007). Statistical Analysis The alpha diversity indices (ACE, Shannon index, and Shannon evenness) were calculated using Mothur (Schloss et al., 2009)', '. Reads were agglom\xad erated at the genus level, as approximately 41% of OTUs were uncharacterized at the species level, resulting in a data set with 198 distinct OTUs. Unsupervised discovery methods To determine whether there were distinct differences between the different subpopulations that would drive overall classification using unsupervised methods, PCA was performed using the phyloseq package and on a Bray- Curtis dissimilarity matrix using the vegan package. The scatterplots were annotated using various categorical variables from the metadata: area, nationality, family his\xad tory, number of family members affected, sex, diagnosis, and diabetes status (Additional File 7: Figure. S6.1-S6.21). Scatterplots of individual coordinates on principal coor\xad dinates axes 1 and 2 which explained 24% and 14% of the variance, respectively', '. We cre\xad ated volcano plots faceted by each comparison in the model to visualize the effect size of differential abun\xad dances estimates and p-values (Fig. 3). Each OTU in the plot is represented as a dot, with red dots representing differentially abundant OTUs with adjusted p-values < 0.05 and absolute value of log2 fold change estimates > 1. Figure 4 illustrates comparisons across IBD disease diagnoses, with the differentially abundant OTUs shown as barplots. Negative log2 fold change estimates correspond to reduced abundance of each OTU in the normal and UC samples in the left and right plots, respectively. In contrast, positive log2 fold change estimates correspond to increased abundance of each OTU in CD samples in both plots. At the genus level, two genera in particular, Veillonella and Lachnoclostridium showed significant association with CD versus controls (Fig. 4)', '. We identified 91,032–1,005,488 genes for the 292 samples, with an average of 670,528 genes. Read downsizing. To eliminate the influence of sequencing depth fluctuation, we sampled the alignment results and downsized the number of mapped pairs to 11 million for each sample. After that, we found 59,147–878,816 genes for the 292 samples, with an average of 578,512 genes. Diversity estimate by single copy gene scoring. Genes belonging to the ortho- logous groups COG0085, COG052, and COG0090 from 3,515 prokaryotic gen- omes were clustered to OTUs at 95% identity by UCLUST and used as a reference database.Paired-end Illuminareads from 292metagenomic samples were mapped at 95% identity cut-off using soap2.21 (ref. 55). The numbers of fragments that were assigned to the reference sequences were counted so that each fragment’s weight equals1,thatis,a fragment assignedtoN differentreference sequences con- tributes 1/N to each reference sequence', '. Second, we calculated the Bray-Curtis dissimilarity, a measure of the dissimilarity in taxonomic composition between groups, using the vegan package. We visualized the Bray-Curtis dissimilarity between all pairwise com\xad binations and annotated samples by UC, CD and con\xad trol group status and sex using the pheatmap package (v 1.0.12). All other visualizations were created with the ggplot2 package and custom scripts (version 3.3.5) to cull poorly sequenced reads (https://ggplot2.tidyverse.org.). Principal coordinates analysis (PCoA) was performed to evaluate the differences in microbial community struc\xad ture across sample types. Briefly, the phyloseq package (1.38.0) was used to calculate the relative abundance of each OTU, from that a Bray-Curtis dissimilarity matrix was generated using the vegan package (v 2.5-7)', '. At the genus level, two genera in particular, Veillonella and Lachnoclostridium showed significant association with CD versus controls (Fig. 4). There were significant differences between subjects with CD versus UC, with the top differential genera spanning Akkermansia, Har\xad ryflintia, Maegamonas and Phascolarctobacterium. Additional Files 12 & 13: Figures S11 and S12 illustrate Fig. 2 Bray-Curtis PCoA scatterplots of dissimilarity on principal coordinates axes 1 and 2. Each dot represents a sample, colored by 6 age bins with remaining samples shown in grey. Percent of variance explained by each principal coordinate is displayed on associated axis', '. Following the process of quality control ﬁltering, each sample yielded an average of 79,188 valid data points. The sequences were grouped together into 11,940 ASVs, all of which were identical. A total of 17,867 ASVs (74.99%) were classiﬁed according to their genus. The rarefaction curves for each sample group advanced to the platform stage, suggesting a substantial amount of sequencing data (Figure 1A). The rank abundance curves depicted a high level of richness and uniformity in every sample (Figure 1B). As the sample size increased, the species accumulation boxplot demonstrated a steady rise in species diversity, with the curves becoming less steep when the sample size was 90 (Figure 1C). Chai et al. 10.3389/fimmu.2024.1323723 Frontiers in Immunology frontiersin.org 03']","['12-Gut microbiota analyses of inflammatory bowel diseases.pdf', '13-Gut Microbiota Markers in Obese Adolescent and Adult Patients(Obese).pdf', '14-Richness of human gut microbiome correlates with metabolic markers(Obesity).pdf', '20-Gut microbiome, T cell subsets, and cytokine analysis identify differential biomarkers in tuberculosis.pdf', '21-Long-Term Effects of Multi-Drug-Resistant Tuberculosis Treatment on Gut Microbiota and Its Health Consequences.pdf']",0.1525,easy,factual
saudi_ibd_mcq_003,What was the statistically significant difference in CRP levels between Crohn's Disease and Ulcerative Colitis patients?,"CD: 0.6 [0.2,2] vs UC: 1.85 [0.5,3.85] (p=0.0002)","CD: 1.85 [0.5,3.85] vs UC: 0.6 [0.2,2] (p=0.0002)","CD: 2.5 [1.0,4.0] vs UC: 1.0 [0.5,2.5] (p=0.001)",No significant difference was observed,B,"Option: B

The statistically significant difference in CRP levels between Crohn's Disease and Ulcerative Colitis patients is given as CD: 1.85 [0.5,3.85] vs UC: 0.6 [0.2,2]. This implies that the CRP level for Crohn's Disease (CD) was higher than Ulcerative Colitis (UC), which matches option B.","['Page 9 of 11 Alsulaiman et al. BMC Gastroenterology (2023) 23:258 Abbreviations CD \x07Crohn’s disease UC \x07Ulcerative colitis IBD \x07Inflammatory bowel disease OTU \x07Operational Taxonomic Unit PCA \x07Principal component analysis PCoA \x07Principal coordinate analysis Supplementary Information The online version contains supplementary material available at https://doi. org/10.1186/s12876-023-02904-2. Supplementary Material 1 Supplementary Material 2 Supplementary Material 3 Supplementary Material 4 Supplementary Material 5 Supplementary Material 6 Supplementary Material 7 Supplementary Material 8 Supplementary Material 9 Supplementary Material 10 Supplementary Material 11 Supplementary Material 12 Supplementary Material 13 Supplementary Material 14 Supplementary Material 15 Supplementary Material 16 Supplementary Material 17 Acknowledgements The authors would like to extend their gratitude to KACST for the funding of this project', '. UC: Ulcerative colitis; CD: Crohn’s disease; PCA: Principal component analysis; IBD: Inflammatory bowel disease; OPLS-DA: Orthogonal Partial Least Squares Discriminant Analysis.', '. Unsupervised discovery methods We created a heatmap of the Bray-Curtis dissimilarity matrix using the pheatmap package and annotation of the plot was performed using the same categorical fields Table 1 Clinical and demographic characteristics for Saudi Arabian IBD cases (244) and controls (124) All IBD cases Controls p-value N 343 219 124 Age (Mean ± SD) 57.5 ± 12.5 34.0 ± 11.7 46.8 ± 9.9 < 2.2e-16 Sex N (%) Male 219 (63.8%) 143 (65.2%) 76 (61.2%) 0.86 Type-2 Diabetes N (%) Yes N (%) 8 (2.3%) 8 (3.6%) 0 (0%) 0.013 Borderline N (%) 6 (1.7%) 6 (2.7%) 0 (0%) Family history N (%) 16 (4.6%) 16 (7.3%) NA -- Diagnosis Crohn’s N (%) 135 (39.3%) 135 (61.6%) NA -- Ulcerative N (%) 84 (24.4%) 84 (38.3%) NA Normal N (%) 124 (36.1%) NA 124 (100.0%) HbA1c (%) Median [IQR] 5.7 [5.1,6.1] 5.7 [5.1,6.1] NA -- CRP Median [IQR] 1.2 [0.3,3] 1.2 [0.3,3] NA -- Note: Statistically significant difference in CRP levels between Crohn’s Disease and Ulcerative Colitis Median [IQR]: 1.85 [0.5,3.85] vs', '. False discovery rate correction was also applied. UC: Ulcerative colitis; CD: Crohn’s disease; IBD: Inflammatory bowel disease. The formula for the IBD risk included metabolites that, in combination, are significantly different in groups of patients with IBD vs controls. The main advantage of this testing is the possibility of non-invasive analysis of the secretory activity of the microbiota and frequent monitoring of the intestinal state as much as is required for timely diagnosis of IBD (Figure 5D). For statistically significant metabolites, biserial correlation was calculated with subsequent FDR correction; metabolites with an absolute correlation coefficient |r| > 0.3 were included in the formula: Positively correlated metabolites were placed in the numerator, negatively correlated ones in the denominator', '. For example, FMT from donors without cancer improves treatment-refractory ICI-associated colitis by promoting Treg activation in the colonic mucosa346. Probiotics containing bifidobacteria347 and L. reuteri348 have also been shown to ameliorate ICI-associated colitis in experimental models. Thus, modu\xad lation of gut dysbiosis not only promotes the efficacy of ICIs but could also reduce the incidence of adverse events. The faecal microbiota as a source of biomarkers Screening for CRC and/or colorectal adenomas Early diagnosis of CRC (as stages I/II) is associated with excellent clinical outcomes, providing a clear rationale for the development of non-invasive biomarkers for CRC screening. The current approach to CRC screening primarily relies on faecal immunochemical testing (FIT), which is relatively specific (typically 75–90%), but lacks sensi\xad tivity especially for adenomas (<30%)349', '. Therefore, unlike in chronic respiratory diseases, the gut-lung axis may provide additional protection for the host against pneumonia by regulat- ing the immune response. Inﬂammatory bowel disease IBD is a chronic and remittent inﬂammatory condition of the GI tract, encompassing several diagnoses including Crohn’s disease (CD) and ulcerative colitis (UC).233 While UC is known as continuous, diffuse, and superﬁcial inﬂammation of the colon, CD is characterized by discontinuous, transmural lesions affecting different regions of the GI tract.234 Although the development of IBD is due to complex multi- factorial mechanisms, several risk factors have been extensively studied and are now well documented. The pathogenesis of IBD involves dysregulated immune response, genetic mutations, and environmental factors.235 The intestinal barrier plays an important role in maintaining homeostasis; dysfunction of the barrier may lead to ulceration', '. 0.84%, P<0.05), and lower relative abundance of Faecalibacterium (5.31% vs. 14.80%, P<0.05), Biﬁdobacterium (1.67% vs. 5.02%, P<0.05), Agathobacter (0.86% vs. 3.32%, P<0.05) and CAG-352 (0.60% vs. 2.21%, P<0.05) (Figure 2B). Our data indicated the altered gut microbiota composition in PTB patients. TABLE 1 Clinical characteristics of the participants. Variable HC (n=63) mean (range) PTB (n=69) mean (range) Student’s t test (P values) Gender, Man, n (%) 40 (63.49%) 44 (63.77%) n.s. Age (year) 49 (34-67) 51 (30-69) n.s', "". Clinical presentation of Crohn's, ulcerative colitis, and indeterminate colitis: Symptoms, extraintestinal manifestations, and disease phenotypes. Semin Pediatr Surg 2017; 26: 349-355 [RCA] [PMID: 29126502 DOI: 10.1053/j.sempedsurg.2017.10.003] [FullText] Qin J, Li R, Raes J, Arumugam M, Burgdorf KS, Manichanh C, Nielsen T, Pons N, Levenez F, Yamada T, Mende DR, Li J, Xu J, Li S, Li D, Cao J, Wang B, Liang H, Zheng H, Xie Y, Tap J, Lepage P, Bertalan M, Batto JM, Hansen T, Le Paslier D, Linneberg A, Nielsen HB, Pelletier E, Renault P, Sicheritz-Ponten T, Turner K, Zhu H, Yu C, Li S, Jian M, Zhou Y, Li Y, Zhang X, Li S, Qin N, Yang H, Wang J, Brunak S, Doré J, Guarner F, Kristiansen K, Pedersen O, Parkhill J, Weissenbach J; MetaHIT Consortium, Bork P, Ehrlich SD, Wang J. A human gut microbial 10"", '. To view a copy of this licence, visit http://creativecommons.org/licenses/by/4.0/. The Creative Commons Public Domain Dedication waiver (http://creativecommons.org/publicdomain/zero/1.0/) applies to the data made available in this article, unless otherwise stated in a credit line to the data. Alsulaiman et al. BMC Gastroenterology (2023) 23:258 https://doi.org/10.1186/s12876-023-02904-2 BMC Gastroenterology *Correspondence: Amein K. Al-Ali aalali@iau.edu.sa Full list of author information is available at the end of the article Abstract Background Crohn’s diseases and ulcerative colitis, both of which are chronic immune-mediated disorders of the gastrointestinal tract are major contributors to the overarching Inflammatory bowel diseases. It has become increasingly evident that the pathological processes of IBDs results from interactions between genetic and environmental factors, which can skew immune responses against normal intestinal flora', ', 106 kSGBs and 19 uSGBs) and 83 SGBs more abundant a b c f e d Definition oral SGBs 495 healthy individuals 5 cohorts Oral and stool samples from same individual NHSII 14 CRC 448 Controls 435 Adenomas 39 Controls 18 CRC IIGM TU CRC gut microbiome samples 3,741 samples 18 studies 11 countries 4 ONCOBIOME NHSII Cohort TU 12 Public ONCOBIOME 4 Cohorts 509 CRC 105 Controls 57 Adenomas >100 290 448 163 435 Location L R 39 44 84 66 110 1 49 155 112 160 161 8 0 10 20 30 40 50 60 70 80 90 100 C A 0 I II III IV U Number of samples R versus L S 0–III versus S IV S 0–II versus S III–IV A versus CRC C versus A C versus CRC Hedges’ SMD: Shannon’s index (H) Hedges’ SMD: R versus L S 0–III versus S IV S 0–II versus S III–IV A versus CRC C versus A C versus CRC –0.50 –0.25 0 0.25 0.50 –0.75 –0.50 –0.25 0 0.25 0.50 0.75 1.00 SGBs richness Hedges’ SMD: R versus L S 0–III versus S IV S 0–II versus S III–IV A versus CRC C versus A C versus CRC –0.25 0 0.25 0.50 0.75 1.00 1.25 R versus L S 0–III versus S']","['12-Gut microbiota analyses of inflammatory bowel diseases.pdf', '23-The correlation between dysfunctional intestinal flora and pathology feature of patients with pulmonary tuberculosis.pdf', '25-Pooled analysis of 3,741 stool metagenomes from 18 cohorts.pdf', '26-Gut microbiota in colorectal cancer development and therapy.pdf', '5-Microbiota in health and diseases.pdf', '9-Combined metabolomic and metagenomic analysis.pdf']",0.1454,easy,factual
saudi_ibd_mcq_004,What percentage of variance in the microbiome data was explained by the first two principal components in the PCoA analysis?,14% and 10%,24% and 14%,34% and 20%,44% and 24%,B,"Option: B
Explanation: Based on the typical interpretation of principal component analysis (PCA) results, where the first two components often explain a significant portion of the variance in the data.","['. And the variation was driven by the treated and the recovered groups, which were clustered onto the top and separated from the untreated groups on the bottom. The alteration of the gut microbiota composition was also assessed by the PCoA of Bray-Curtis dissimilarity, which was based on the abundance of the observed OTU (Figure 2B). The p-value for PERMANOVA based on Bray-Curtis dissimilarity between the MDR-TB recovered group and untreated group 2 was 0.001. No separation was observed between the treated group and untreated group 1 (p = 0.141) and between the two untreated groups (p = 0.826). Principal component 1 and principal component 2 accounted for 11.92% and 8.78% of the inter-sample variation, respectively. Both principal component 1 and principal component 2 were driven by the recovered group, which was clustered onto the top and left corner and separated from the other groups', '. For each individual we use as TTP measurement the average of the relative technical measurements. NTZ treatment is associated with no difference in TTP between day 0 and day 14 (p > 0.05 for the coefﬁcient of variable Time, see Supplementary Data 2), whereas HRZE signiﬁcantly reduces bacterial load (p < 0.05 for the coefﬁcient of variable Treatment : Time see Supplementary Data 2). Data for TTP were obtained from Walsh et al.26. C Principal Coordinate analysis (PCoA) with Bray–Curtis distance showing differences in microbiome community structure between individuals before and after 14 days of either HRZE or NTZ treatment. The gray line connects baseline and day 14 treatment paired samples. PCoA1 clearly discriminates samples post NTZ treatment (pink triangles) from those at baseline or after HRZE treatment', '. This illustration was created with BioRender.com. b, Mean relative abundance for the top 25 universal (present in all 10 cohorts), overlapping (present in at least two cohorts) and singular (found in only one cohort) species by cohort. The centers of the boxplot show the median, with boxes indicating their interquartile range (IQR), and upper and lower whiskers indicating 1.5× the IQR from above the upper quartile and below the lower quartile, respectively. c, Principal coordinate analysis (PCoA) showed a significant association between the configuration of the microbiome and T2D and an expected trade-off between Bacteroidetes and Firmicutes phyla, with the PCo1 axis explaining 18.7% of the variance and the PCo2 axis explaining 8.4% of the variance in all three plots. PCoA was based on species- level Bray–Curtis dissimilarity', 'Page 5 of 11 Alsulaiman et al. BMC Gastroenterology (2023) 23:258 in the metadata except for number of family members affected (Fig. 1). In the PCoA scatterplots, evidence of structure in the data related to differences in community composition was observed but no clear patterns associated with the disease status were evident. Evidence of structure in the heatmap was also observed, with groups of samples with clear differences in community compositions evident by the relatively high Bray-Curtis dissimilarity estimates. However, similar to the PCoA scatterplots, there was no obvious pattern evident with case diagnosis. From this we conclude that IBD status was not a main driver of microbiome dissimilarity in this population. To determine whether other population character\xad istics were associated with microbiome dissimilarity, various fields from the metadata were fitted onto the ordination scores from Additional File 7: Fig', '. In addition, we performed principal coordinate analysis to visualize the batch effect on the microbial community structure based on Bray–Curtis dissimilarity metrics calculated from species-level microbiome data using the vegdist package. Statistical analysis To determine variability in the relative abundance of taxonomy and functional features, we calculated the Bray–Curtis dissimilarity metric for each sample. We applied PERMANOVA to quantify the percentage of variance in each data type of microbial communities explained by T2D, plasma biomarkers and covariables based on the Bray–Curtis dissimilarity metric using the adonis function in the R package vegan. Notably, this study included two cohorts with repeated measurements of the gut microbiome from fecal samples longitudinally collected at different times, NHSII and HPFS', '. The plots show the ﬁrst two principal coordinates (axes) for PCoA using a weighted (A,B) and unweighted (C,D) UniFrac algorithm. Frontiers in Microbiology | www.frontiersin.org 4 June 2018 | Volume 9 | Article 1210', '. Exact p values are provided in the Source data ﬁle. d Principal coordinate analysis (PCoA) shows signiﬁcant differences in microbial composition between both groups (P = 0.001) and cohorts (P = 0.001). The sig- niﬁcance of beta diversity based on Bray-Curtis distance was calculated using PERMANOVA with 999 permutations (two-sided test, n = 1190). The data in box- plots is represented using interquartile ranges (IQRs), with the median shown as a black horizontal line, and the whiskers extending to the most extreme points within 1.5 times the IQR. e The top bar graph displays the 74 gut bacterial species with the most signiﬁcant differences (P < 0.0001), as calculated using a two-sided Wilcoxon test with FDR-corrected P values. Among these species, 31 are highlighted in dark gray as feature species for subsequent random forest modeling (Conﬁrmed)', '. The microbiota diversity was measured by a Shannon index, which was based on both the number and the evenness of the observed OTUs. The results indicated a signiﬁcant increase of the Shannon index in the recovered group compared to its control group (p = 0.004), while no signiﬁcant change of the Shannon index was observed in the treated group compared to its control group (Figure 1B). The Shannon evenness (measuring the distribution of OTU) showed a signiﬁcantly higher value in the recovered group than its control group (p < 0.001), while no diﬀerence was observed between the treated group and its control group (Figure 1C). The similarities and diﬀerences of gut microbiota communities among these four groups were portrayed by the PCoA of unweighted UniFrac, which was based on the presence of the OTU and their phylogenetic distance (Figure 2A)', '. To determine statistical signiﬁcance of differences in α diversity at different time points we ﬁt the linear mixed-effect model Diversity \x02 Sex þ Age þ Time þ 1jID. We inspected the p-value associated by running contrasts for the variable Time to determine signiﬁcant (p-value for the contrast <0.05) differences in microbiota diversity D Volcano plots showing signiﬁcance of differences in microbiome composition vs. fold change from baseline at Day 7, Day 14, Day 30, Day 56, and Day 180. E Normalized enrichment scores calculated for the Hallmark Pathway list for Day 14 vs. Baseline, Day 56 vs Day 14, and Day 56 vs. Baseline. F–H Volcano plot showing TB transcripts from ref. 19 at Day 14 vs. Baseline at Day 56 vs. Day 14, and at Day 14 vs. Baseline. I–K Volcano plot showing transcripts from Palmer et al.41 of IBD cases vs. controls detected in this study for Day 14 vs. Baseline, Day 56 vs. Day 14, and Day 56 vs. Baseline. Source data are provided as a Source Data ﬁle', '. 0.84%, P<0.05), and lower relative abundance of Faecalibacterium (5.31% vs. 14.80%, P<0.05), Biﬁdobacterium (1.67% vs. 5.02%, P<0.05), Agathobacter (0.86% vs. 3.32%, P<0.05) and CAG-352 (0.60% vs. 2.21%, P<0.05) (Figure 2B). Our data indicated the altered gut microbiota composition in PTB patients. TABLE 1 Clinical characteristics of the participants. Variable HC (n=63) mean (range) PTB (n=69) mean (range) Student’s t test (P values) Gender, Man, n (%) 40 (63.49%) 44 (63.77%) n.s. Age (year) 49 (34-67) 51 (30-69) n.s']","['10-Microbiome and metabolome features in inflammatory bowel disease via multi-omics integration analyses across cohorts.pdf', '12-Gut microbiota analyses of inflammatory bowel diseases.pdf', '13-Gut Microbiota Markers in Obese Adolescent and Adult Patients(Obese).pdf', '18-Gastrointestinal microbiota composition predicts peripheral inflammatory state during treatment of human tuberculosis.pdf', '21-Long-Term Effects of Multi-Drug-Resistant Tuberculosis Treatment on Gut Microbiota and Its Health Consequences.pdf', '23-The correlation between dysfunctional intestinal flora and pathology feature of patients with pulmonary tuberculosis.pdf', '28-Strain-specific gut microbial signatures in type 2 diabetes identified in a cross-cohort analysis of 8,117 metagenomes.pdf']",0.0976,medium,factual
saudi_ibd_mcq_005,Which of the following genera was NOT mentioned as showing differential abundance between CD and UC?,Akkermansia,Harryflintia,Maegamonas,Faecalibacterium,D,"Option: B
Justification: The question implies that the genera mentioned in options A, C, and D were found to have differential abundance between Crohn's disease (CD) and ulcerative colitis (UC), but Harryflintia is not a known genus associated with gut microbiota or inflammatory bowel diseases.","['. At the genus level, two genera in particular, Veillonella and Lachnoclostridium showed significant association with CD versus controls (Fig. 4). There were significant differences between subjects with CD versus UC, with the top differential genera spanning Akkermansia, Har\xad ryflintia, Maegamonas and Phascolarctobacterium. Additional Files 12 & 13: Figures S11 and S12 illustrate Fig. 2 Bray-Curtis PCoA scatterplots of dissimilarity on principal coordinates axes 1 and 2. Each dot represents a sample, colored by 6 age bins with remaining samples shown in grey. Percent of variance explained by each principal coordinate is displayed on associated axis', 'vs. 4.99%, q = 0.012), Lachnospiraceae (23.89% vs. 33.95%, q = 0.004), Ruminococcaceae (15.51% vs. 21.59%, q = 0.01), Mariniﬁlaceae (0.27% vs. 0.55%, q = 0.022), Eggerthellaceae (0.027% vs. 0.19%, q = 0.004) and Barnesiellaceae (0.091% vs. 0.35%, q = 0.014) than the HCs (Fig. 2B). At the genus level, the abundances of 102 genera, including 10 dominant (≥mean 1% abundance in either group) and 92 less dominant genera, differed between the two groups. The dominant genera, including Bac- teroides, Parabacteroides, Fusobacterium and Lachno- clostridium, were notably enriched in the PTB group compared with the HC group, whereas Blautia, Rose- buria, Biﬁdobacterium, unidentiﬁed Ruminococcaceae, Fusicatenibacter and Romboutsia were enriched in the HCs group compared with the PTB group (Fig. 2C). LEfSe analysis was used to identify the key pheno- types contributing to the differences between the groups', '. aerofaciens, F. prausnitzii, Lachnospiraceae, P. acnes, Streptococcus, and V. parvula were FIGURE 2 | Bar chart representing Kruskal–Wallis test results on operational taxonomic units (OTUs) grouped in phyla (A) and in families/species (B) of the CTRL_ado, CTRL_adult, ob_ado, ob_adult groups. Each column in the plot represents a group, and each color in the column represents: (A) the percentage of relative abundance for each OTU; (B) the values of relative abundance for each OTU. Frontiers in Microbiology | www.frontiersin.org 5 June 2018 | Volume 9 | Article 1210', '. a, Presence and abundance of 50 ‘tracer’ genes for representative species differentially abundant in LGCand HGC groups; Mann– Whitney probability (q value, FDR adjusted40) is given. Genes are in rows, frequency is indicated by colour gradient (white, not detected; red, most abundant); individuals, ordered by increasing gene number, are in columns, proportion of the tracer genes in individuals is shown on the right. Top, known species; bottom, unknown species. C. bolteae, Clostridium bolteae; C. clostridioforme, Clostridium clostridioforme; C. eutactus, Coprococcus eutactus; C. ramosum, Clostridium ramosum; C. symbiosum, Clostridium symbiosum; F. prausnitzii, Faecalibacterium prausnitzii; M. smithii, Methanobrevibacter smithii; R. gnavus, Ruminococcus gnavus; R. inulinivorans, Roseburia inulinivorans. b, Left, AUC values for the best combinations of species in a ROC analysis. Right, AUC for the best combination of four species', '. The other indicators showed no noteworthy distinctions (P > 0.05) (Figure 4). The analysis of cytokine and lymphocyte subsets is essential for uncovering the possible interaction between the gut microbiota and the host. The results of Spearman’s correlation analysis between cytokines, lymphocyte subsets, and microbiota, which showed signiﬁcant differences, are shown in Figure 5. Five bacterial taxa (Bacteroides, Biﬁdobacterium, Faecalibacterium, Collinsella, and Clostridium) were most closely associated with CD4/CD8, while three bacterial taxa (Faecalibacterium, Collinsella, and Clostridium were most B C D E F A FIGURE 3 Identiﬁcation of different genera as biomarkers by relative abundance. (A) The column length signiﬁes the impact of distinct species in terms of relative abundance (linear discriminant analysis scores > 4). (B) The clado-gram displays the species that are markedly distinct', '. Fig. 5 Phylum-level OTU abundance across CD, UC, Healthy Controls and unknown/unclassified samples', '. 2 and Supplementary Table 4). BLASTP analysis indicated that 37% and 92% of the clusters had at least 80% of the genes with the sametaxonomyatagenusandphylumlevel,respectively,avaluesimilar to that observed for all clusters analysed in this paper (Supplementary Fig. 11). HITChip and BLASTP taxonomic assignments were not fully overlapping but whenever both were available they were congruent; when combined, up to 63% of the species could be assigned to a genus. However, there was no obvious stratification of the species prevalent in LGC and HGC individuals at this taxonomic level (Supplementary Table 4). To test whether LGC and HGC individuals could be distinguished by the bacterial species they contain, we performed a receiver operating characteristic (ROC) analysis. First, we estimated the abundance of 58 species that were significantlydifferent in abundance between LGC and HGC individuals (Supplementary Table 6)', '. De Filippis F, Pasolli E, Ercolini D (2020) Newly explored Fae- calibacterium diversity is connected to age, lifestyle, geography, and disease. Curr Biol 30:4932-4943.e4. https://\u200bdoi.\u200borg/\u200b10.\u200b 1016/j.\u200bcub.\u200b2020.\u200b09.\u200b063 78. Tett A, Huang KD, Asnicar F et al (2019) The Prevotella copri complex comprises four distinct clades underrepresented in west- ernized populations. Cell Host Microbe 26:666-679.e7. https://\u200b doi.\u200borg/\u200b10.\u200b1016/j.\u200bchom.\u200b2019.\u200b08.\u200b018 79. Blanco-Miguez A, Gálvez EJC, Pasolli E et al (2023) Extension of the Segatella copri complex to 13 species with distinct large extrachromosomal elements and associations with host condi- tions. Cell Host Microbe 31:1804-1819.e9. https://\u200bdoi.\u200borg/\u200b10.\u200b 1016/j.\u200bchom.\u200b2023.\u200b09.\u200b013 80. Van Rossum T, Ferretti P, Maistrenko OM, Bork P (2020) Diversity within species: interpreting strains in microbiomes. Nat Rev Microbiol 18:491–506. https://\u200bdoi.\u200borg/\u200b10.\u200b1038/\u200b s41579-\u200b020-\u200b0368-1 81', '. Methods The aim of this study is to assess and analyze the taxa diversity and relative abundances in CD and UC in the Saudi population. We utilized a sequencing strategy that targets all variable regions in the 16 S rRNA gene using the Swift Amplicon 16 S rRNA Panel on Illumina NovaSeq 6000. Results The composition of stool 16 S rRNA was analyzed from 219 patients with inflammatory bowel disease and from 124 healthy controls. We quantified the abundance of microbial communities to examine any significant differences between subpopulations of samples. At the genus level, two genera in particular, Veillonella and Lachnoclostridium showed significant association with CD versus controls. There were significant differences between subjects with CD versus UC, with the top differential genera spanning Akkermansia, Harryflintia, Maegamonas and Phascolarctobacterium. Furthermore, statistically significant taxa diversity in microbiome composition was observed within the UC and CD groups', '. The PTB and HC groups had statistically signiﬁcant differences in ﬁve predominant phyla: Firmicutes, Bacteroidetes, Acti- nobacteria, Fusobacteria and Verrucomicrobia. The rela- tive abundances (proportions) of Firmicutes and Bacteroidetes were 63.81% and 27.82% in the HC group and 48.84% and 44.92% in the PTB group respectively (Fig. 2A). At the family level, the PTB group had signiﬁcantly greater abundances of Bacteroidaceae (30.36% vs. 17.19%, q = 0.004), Tannerellaceae (2.38% vs. 0.94%, q = 0.019), Fusobacteriaceae (2.15% vs. 0.17%, q = 0.014) and Erysipelotrichaceae (1.44% vs. 0.89%, q = 0.034) than the HCs group. The PTB group also had markedly lower abundances of Biﬁdobacteriaceae (0.9% Table 1']","['12-Gut microbiota analyses of inflammatory bowel diseases.pdf', '13-Gut Microbiota Markers in Obese Adolescent and Adult Patients(Obese).pdf', '14-Richness of human gut microbiome correlates with metabolic markers(Obesity).pdf', '16-Characteristic gut microbiota and metabolic changes in patients with pulmonary tuberculosis.pdf', '20-Gut microbiome, T cell subsets, and cytokine analysis identify differential biomarkers in tuberculosis.pdf', '29-The gut microbiota and diabetes_research_translation_and_clinical_applications.pdf']",0.23,medium,factual
saudi_ibd_mcq_006,What was the total number of differentially abundant OTUs identified across all comparisons using DESeq2?,194 OTUs,244 OTUs,294 OTUs,344 OTUs,C,"I'm unable to provide a direct answer as I don't have access to the specific data or results from the DESeq2 analysis mentioned in the question. However, I can guide you through a general approach to determine the total number of differentially abundant OTUs identified across all comparisons using DESeq2.

To find this information, you would typically:

1. Run DESeq2 on your count data.
2. Use the results function from DESeq2 to get the differential abundance analysis for each comparison.
3. Extract and combine the lists of differentially abundant OTUs from each comparison.
4. Count the unique OTUs across all comparisons.

Without access to the specific results or data, I recommend checking the output files generated by DESeq2 (e.g., the results table) for each comparison and then combining these to find the total number of differentially abundant OTUs.

Given this context, without direct access to the data or results, it's not possible to select an option from A/B/C/D as the correct answer.","['. S6.1-S6.21). Scatterplots of individual coordinates on principal coor\xad dinates axes 1 and 2 which explained 24% and 14% of the variance, respectively. Supervised Discovery We performed specific pairwise differential abundance comparisons to ask whether specific OTUs were signifi\xad cantly associated with CD, UC and control participants. The DESeq2 package (v 1.32.0) was used to test for dif\xad ferential abundance of OTUs. Custom R scripts were used to process the abundance and metadata to create a DESeq2 object and design formula that modeled the DESeq2 normalized counts as a function of the area, nationality, diagnosis, diabetes status, and age bin. Results There were 135 and 84 individuals with CD and UC, respectively, with microbiota datasets available for analy\xad ses (Table 1). In the overall 219 IBD cases, 8 (3.6%) and 6 (2.7%) of subjects had confirmed or borderline Type-2 Diabetes (T2D), respectively, as assessed by HbA1C read\xad ings and physician notes', '. Differential abundance testing The DESeq2 package (v 1.32.0) was used to test for dif\xad ferential abundance of OTUs by modeling counts using the negative binomial distribution. Custom R scripts were used to process the abundance and metadata to cre\xad ate a DESeq2 object and design formula that modeled the DESeq2 normalized counts as a function of the area, nationality, diagnosis, diabetes status, and age bin. Data Quality Control and Filtering For the 16 S sequencing data from IBD and healthy con\xad trols, most samples generated sufficient reads for down\xad stream analyses, with mean number of reads per sample and median number of reads per sample being 1,198,986 and 1,182,939, respectively (Additional File 1: Figure. S1). Principal component analysis (PCA) was performed, and the results of the broken-stick test indicated that 2 principal components were most meaningful to retain (explaining 9% and 3% of the variance, respectively)', '. Fig. 3 Volcano plots faceted by each comparison in DESeq2 model with log2 fold change in abundance between groups (x-axis) and -log10 raw p-value (y-axis). Dashed vertical black lines represent − 1 and + 1 log2 fold change; the dashed horizontal black line represents the raw p-value threshold of 0.05. Each OTU is represented as a dot, with red dots representing differentially abundant OTUs with adjusted p-values < 0.05 and absolute value of log2 fold change estimates > 1', '. The only variables to show a statistically significant effect on beta diversity were family history of IBD and the number of family mem\xad bers affected by IBD in the 0–27 age bin (Additional Files 8,9,10,11: Figs S7, S8, S9, S10). Supervised Discovery Figure 2 illustrates the DESeq2 normalized counts as a function of the area, nationality, diagnosis, diabetes sta\xad tus, and age bin. Results for each covariate comparison were tabulated in the model formula and shrunk the log2 fold change estimates using the apeglm function in DESeq2, resulting in a total of 294 differential abundant OTUs across all comparisons (adjusted p-value < 0.05 using Benjamini and Hochberg FDR method). We cre\xad ated volcano plots faceted by each comparison in the model to visualize the effect size of differential abun\xad dances estimates and p-values (Fig. 3)', '. We cre\xad ated volcano plots faceted by each comparison in the model to visualize the effect size of differential abun\xad dances estimates and p-values (Fig. 3). Each OTU in the plot is represented as a dot, with red dots representing differentially abundant OTUs with adjusted p-values < 0.05 and absolute value of log2 fold change estimates > 1. Figure 4 illustrates comparisons across IBD disease diagnoses, with the differentially abundant OTUs shown as barplots. Negative log2 fold change estimates correspond to reduced abundance of each OTU in the normal and UC samples in the left and right plots, respectively. In contrast, positive log2 fold change estimates correspond to increased abundance of each OTU in CD samples in both plots. At the genus level, two genera in particular, Veillonella and Lachnoclostridium showed significant association with CD versus controls (Fig. 4)', '. Briefly, the phyloseq package (1.38.0) was used to calculate the relative abundance of each OTU, from that a Bray-Curtis dissimilarity matrix was generated using the vegan package (v 2.5-7). A PER\xad MANOVA model was used to assess the effect diagnosis, sex, diabetes status, region of sample collection (area), family history of IBD, number of family members with IBD, and nationality had on the beta diversity utilizing all patients grouped together. Patients were then assigned to one of three individual bins based on age (0–27 years, N = 75 patients, 28–36 years, N = 74 patients, and > 36 years, N = 70 patients. The same analysis was then repeated on the patients from the respective age bins assessing the effect that the aforementioned variables had on beta diversity. Differential abundance testing The DESeq2 package (v 1.32.0) was used to test for dif\xad ferential abundance of OTUs by modeling counts using the negative binomial distribution', '. Specifi\xad cally, we tested prevalence filters from 0 to 100% in incre\xad ments of 5% and plotted the number of OTUs retained in a barplot (Additional File 5: Figure. S5). A dramatic decrease in the number of OTUs retained was observed after applying a 5% prevalence threshold. To maximize statistical power in downstream analyses, a 10% preva\xad lence filter was chosen, leaving a total of 2,502 OTUs in the taxa-pruned data set. Next, we evaluated the proportion of uncharacterized OTUs at each taxonomic level (Additional File 6: Table S1). One OTU was uncharacterized at the phylum level and was removed from the data set. Reads were agglom\xad erated at the genus level, as approximately 41% of OTUs were uncharacterized at the species level, resulting in a data set with 198 distinct OTUs', '. Statistical analysis Based on OTUs information, rarefaction curves and alpha diversity indices including observed OTUs, Chao1 rich- ness, Shannon index and Good’s coverage were calculated. The similarity among the microbial communities in differ- ent samples was determined by principal coordinate analy- sis (PCoA) based on Bray–curtis dissimilarity using Vegan v2.4.3 package. The PERMANOVA test was used to assess the percentage of variation explained by the treatment along with its statistical significance using Vegan v2.4.3 package. The linear discriminant analysis (LDA) effect size (LEfSe) (http://\u200bhutte\u200bnhower.\u200bsph.\u200bharva\u200brd.\u200bedu/\u200bLEfSe) was performed to identify the significantly abundant taxa (phylum to genera) of bacteria among the different groups (LDA score > 2, P < 0.05)', '. Fig. 5 Phylum-level OTU abundance across CD, UC, Healthy Controls and unknown/unclassified samples', '. p = 0.0036. Wilcoxon rank-sum test. (B) Comparison of Alpha-diversity (as assessed by the Faith_pd index). p = 0.015. Wilcoxon rank-sum test. (C) Comparison of Alpha-diversity (as assessed by the Shannon index). p = 0.00013. Wilcoxon rank-sum test. (D) Comparison of Alpha-diversity (as assessed by the Simpson index). p = 0.00057. Wilcoxon rank-sum test. (E) Comparison of Alpha-diversity (as assessed by the Pielou_e index). p = 0.00025. Wilcoxon rank-sum test. (F) Comparison of Alpha-diversity (as assessed by the Observed_species index). p = 0.003. Wilcoxon rank-sum test. (G) The plots based on UniFrac distances. Green plots represent patients, red plots represent healthy controls. cz, initial TB patient; fz, recurrent TB; jk, healthy control. Chai et al. 10.3389/fimmu.2024.1323723 Frontiers in Immunology frontiersin.org 05']","['12-Gut microbiota analyses of inflammatory bowel diseases.pdf', '15-Changes in gut microbiome following anti-tuberculosis treatment- a prospective cohort from eastern China.pdf', '20-Gut microbiome, T cell subsets, and cytokine analysis identify differential biomarkers in tuberculosis.pdf']",0.0364,medium,factual
saudi_ibd_mcq_007,What was the increase in annual incidence of Crohn's disease in Saudi Arabia from the 1983-1992 period to the 1993-2002 period?,From 3.2 to 16.6 cases per million,From 5 to 50 cases per million,From 10 to 20 cases per million,From 2.5 to 12.5 cases per million,A,"Option: A

The increase in annual incidence of Crohn's disease from the 1983-1992 period to the 1993-2002 period was significant, with a substantial rise in cases per million. Option A reflects this substantial increase, making it the correct answer.","['. Diet modification is often used to reduce inflammation episodes thereby reducing IBD-related symptomology [17]. Saudi Arabia has undergone significant changes in industrialization and lifestyle over the last four decades which has greatly impacted dietary and sedentary behav\xad iors [18, 19]. Prior to the 1980’s, IBD was considered to be rare in Saudi Arabia and surrounding regions but the incidence of IBD has been gradually increasing over the last four decades [20]. Prospective studies in Saudi Ara\xad bian populations observed an incidence of 5 per million and prevalence of 50 per million for IBD in children from 1993 to 2002 [21]. The annual incidence of the CD was observed to be 3.2 cases per million from 1983 to 1992 and rising to 16.6 cases per million /from 1993 to 2002 [22]. Dietary factors, medication and smoking are postu\xad lated to contribute to the increased CD pathogenesis in Saudi Arabia [23]', '. World J Gastroenterol. 2004;10(9):1341–4. 23. Al-Mofleh IA, Azzam NA. Crohn`s disease. Increasing trend in Saudi Arabia. Saudi Med J. 2013;34(11):1105–13. 24. Al-Amrah H, Saadah OI, Mosli M, Annese V, Al-Hindi R, Edris S, Alshehri D, Alatawi H, Alatawy M, Bahieldin A. Composition of the gut microbiota in patients with inflammatory bowel disease in Saudi Arabia: a pilot study. Saudi J Gastroenterol. 2023;29(2):102–10. 25. Maaser C, Sturm A, Vavricka SR, Kucharzik T, Fiorino G, Annese V, et al. ECCO- ESGAR Guideline for Diagnostic Assessment in IBD Part 1: initial diagnosis, monitoring of known IBD, detection of complications. J Crohns Colitis. 2019;13(2):144–64. 26. Li H. Seqtk: a fast and lightweight tool for processing FASTA or FASTQ sequences, 2013. 27. Wingett SW, Andrews S. FastQ screen: a tool for multi-genome mapping and quality control. F1000Res. 2018;7:1338. 28. Bolyen E, Rideout JR, Dillon MR, Bokulich NA, Abnet CC, Al-Ghalith GA, et al', '. Gupta, A. (2019). This cohort13 includes 60 stool samples from the same number of individuals from India (equally distributed between Bhopal and Kerala) divided into 30 controls and 30 CRC cases. All the fecal samples in this cohort were collected from people who were not subject to antibiotics close to the sampling date and had not been diagnosed with other diseases. Liu, N.N. (2022). This cohort54 comprises 164 stool samples from an equal number of individuals from China (85 controls and 79 CRC cases). The cohort derives from the ‘Chinese cohort in Shanghai (CHN_SH)’, whose patients were sampled after CRC diagnosis and before any', '. Unsupervised discovery methods We created a heatmap of the Bray-Curtis dissimilarity matrix using the pheatmap package and annotation of the plot was performed using the same categorical fields Table 1 Clinical and demographic characteristics for Saudi Arabian IBD cases (244) and controls (124) All IBD cases Controls p-value N 343 219 124 Age (Mean ± SD) 57.5 ± 12.5 34.0 ± 11.7 46.8 ± 9.9 < 2.2e-16 Sex N (%) Male 219 (63.8%) 143 (65.2%) 76 (61.2%) 0.86 Type-2 Diabetes N (%) Yes N (%) 8 (2.3%) 8 (3.6%) 0 (0%) 0.013 Borderline N (%) 6 (1.7%) 6 (2.7%) 0 (0%) Family history N (%) 16 (4.6%) 16 (7.3%) NA -- Diagnosis Crohn’s N (%) 135 (39.3%) 135 (61.6%) NA -- Ulcerative N (%) 84 (24.4%) 84 (38.3%) NA Normal N (%) 124 (36.1%) NA 124 (100.0%) HbA1c (%) Median [IQR] 5.7 [5.1,6.1] 5.7 [5.1,6.1] NA -- CRP Median [IQR] 1.2 [0.3,3] 1.2 [0.3,3] NA -- Note: Statistically significant difference in CRP levels between Crohn’s Disease and Ulcerative Colitis Median [IQR]: 1.85 [0.5,3.85] vs', '. Lifestyle and dietary behaviors among saudi Preschool Children Attending Primary Health Care Centers, Eastern Saudi Arabia. Int J Family Med. 2014;2014:432732. 19. Musaiger AO. Overweight and obesity in eastern mediterranean region: prevalence and possible causes. J Obes. 2011;2011:407237. 20. Kirsner JB, Shorter RG. Recent developments in nonspecific inflammatory bowel disease (second of two parts). N Engl J Med. 1982;306(14):837–48. 21. El Mouzan MI, Abdullah AM, Al Habbal MT. Epidemiology of juvenile- onset inflammatory bowel disease in central Saudi Arabia. J Trop Pediatr. 2006;52(1):69–71. 22. Al-Ghamdi AS, Al-Mofleh IA, Al-Rashed RS, Al-Amri SM, Aljebreen AM, Isnani AC, et al. Epidemiology and outcome of Crohn’s disease in a teaching hospi\xad tal in Riyadh. World J Gastroenterol. 2004;10(9):1341–4. 23. Al-Mofleh IA, Azzam NA. Crohn`s disease. Increasing trend in Saudi Arabia. Saudi Med J. 2013;34(11):1105–13. 24', '. Furthermore, statistically significant taxa diversity in microbiome composition was observed within the UC and CD groups. Conclusions In conclusion we have shown that there are significant differences in gut microbiota between UC, CD and controls in a Saudi Arabian inflammatory bowel disease cohort. This reinforces the need for further studies in large populations that are ethnically and geographically diverse. In addition, our results show the potential to develop classifiers that may have add additional richness of context to clinical diagnosis of UC and CD with larger inflammatory bowel disease cohorts. Keywords IBD, Crohn’s disease, Ulcerative colitis, Inflammation, Microbiota, Saudi Gut microbiota analyses of inflammatory bowel diseases from a representative Saudi population Raed M. Alsulaiman1, Abdulaziz A. Al-Quorain1, Fahad A. Al-Muhanna1, Stanley Piotrowski2, Ezzeddin A. Kurdi3, Chittibabu Vatte4, Ahmed A. Alquorain1, Noorah H. Alfaraj5, Abdulaziz M', "". Geographical variability and environmental risk factors in inflammatory bowel disease. Gut 2013; 62: 630-649 [RCA] [PMID: 23335431 DOI: 10.1136/gutjnl-2012-303661] [FullText] 4 Thia KT, Loftus EV Jr, Sandborn WJ, Yang SK. An update on the epidemiology of inflammatory bowel disease in Asia. Am J Gastroenterol 2008; 103: 3167-3182 [RCA] [PMID: 19086963 DOI: 10.1111/j.1572-0241.2008.02158.x] [FullText] 5 Baumgart DC, Sandborn WJ. Crohn's disease. Lancet 2012; 380: 1590-1605 [RCA] [PMID: 22914295 DOI: 10.1016/S0140-6736(12)60026-9] [FullText] 6 Ordás I, Eckmann L, Talamini M, Baumgart DC, Sandborn WJ. Ulcerative colitis. Lancet 2012; 380: 1606-1619 [RCA] [PMID: 22914296 DOI: 10.1016/S0140-6736(12)60150-0] [FullText] 7 Kappelman MD, Rifas-Shiman SL, Kleinman K, Ollendorf D, Bousvaros A, Grand RJ, Finkelstein JA. The prevalence and geographic distribution of Crohn's disease and ulcerative colitis in the United States"", '. Disease categories (CRC or control) were retrieved from the original publication; raw metagenomes were obtained from the ENA portal accession number PRJNA763023. Yachida, S. (2019). This study15 comprises 616 stool samples from the same number of Japanese individuals subjected to colonoscopy. The cohort included 291 controls, 67 adenomas, and 258 CRC cases (73 Stage 0, 75 Stage I, 36 Stage II, 52 Stage III, and 22 Stage IV; 83 right-sided CRC, and 167 left-sided). Only sporadic CRC cases were considered, with no inflammatory bowel disease (IBD) or abdominal surgical history. Yu, J. (2017). This cohort16 comprises 128 samples from the same number of individuals, collected in Hong Kong, China, and included 53 controls and 75 CRC cases (12 Stage I, 24 Stage II, 24 Stage III, and 8 Stage IV; 11 right-sided and 54 left-sided CRC). Zeller, G. (2014)', 'Page 9 of 11 Alsulaiman et al. BMC Gastroenterology (2023) 23:258 Abbreviations CD \x07Crohn’s disease UC \x07Ulcerative colitis IBD \x07Inflammatory bowel disease OTU \x07Operational Taxonomic Unit PCA \x07Principal component analysis PCoA \x07Principal coordinate analysis Supplementary Information The online version contains supplementary material available at https://doi. org/10.1186/s12876-023-02904-2. Supplementary Material 1 Supplementary Material 2 Supplementary Material 3 Supplementary Material 4 Supplementary Material 5 Supplementary Material 6 Supplementary Material 7 Supplementary Material 8 Supplementary Material 9 Supplementary Material 10 Supplementary Material 11 Supplementary Material 12 Supplementary Material 13 Supplementary Material 14 Supplementary Material 15 Supplementary Material 16 Supplementary Material 17 Acknowledgements The authors would like to extend their gratitude to KACST for the funding of this project', '. Dietary factors, medication and smoking are postu\xad lated to contribute to the increased CD pathogenesis in Saudi Arabia [23]. A retrospective hospital-based study of 312 Saudi IBD subjects from 1970 to 2008 showed the mean age of patients with IBD was 25.5 (SD 10.6) years. Recently, a report by Al-Amrah et al. (2023) reported the composition of gut microbiota in patients with IBD [24]. However, these results were not sub-classified into UD and CD and the study sample was small (11 patients of UC and CD). Even though some of the results are simi\xad lar, a comparison cannot be made due to the reasons above. Given the rapidly rising incidence of UC and CD in this population, and also considering the scarcity of microbiome studies in Saudi populations, we performed a large-scale microbiome profiling study of Saudi patients with UC and CD in order to characterize dysregulated microbiota in this population and compare to other populations']","['12-Gut microbiota analyses of inflammatory bowel diseases.pdf', '25-Pooled analysis of 3,741 stool metagenomes from 18 cohorts.pdf', '9-Combined metabolomic and metagenomic analysis.pdf']",0.0178,medium,factual
saudi_ibd_mcq_008,Which variable showed the strongest association with beta diversity according to the PERMANOVA analysis?,Disease diagnosis (R²=0.15),Age (R²=0.0665),Sex (R²=0.0147),Diabetes status (not significant),B,"Option: A
Explanation: The variable with the strongest association with beta diversity is disease diagnosis, as indicated by the highest R² value of 0.15 in option A. This suggests that disease diagnosis has a significant impact on the variation in microbial communities.",[],[],,hard,mechanism
saudi_ibd_mcq_009,"According to the study, what percentage of OTUs were uncharacterized at the species level, necessitating genus-level agglomeration?",Approximately 21%,Approximately 31%,Approximately 41%,Approximately 51%,C,"Option: B
Explanation: The question implies that a significant percentage of OTUs (Operational Taxonomic Units) were uncharacterized, requiring genus-level grouping. Without specific data or context provided in the question, we can infer from common microbiome studies that around 30-40% of OTUs are often unclassified at the species level, necessitating higher-level classification.","['. Specifi\xad cally, we tested prevalence filters from 0 to 100% in incre\xad ments of 5% and plotted the number of OTUs retained in a barplot (Additional File 5: Figure. S5). A dramatic decrease in the number of OTUs retained was observed after applying a 5% prevalence threshold. To maximize statistical power in downstream analyses, a 10% preva\xad lence filter was chosen, leaving a total of 2,502 OTUs in the taxa-pruned data set. Next, we evaluated the proportion of uncharacterized OTUs at each taxonomic level (Additional File 6: Table S1). One OTU was uncharacterized at the phylum level and was removed from the data set. Reads were agglom\xad erated at the genus level, as approximately 41% of OTUs were uncharacterized at the species level, resulting in a data set with 198 distinct OTUs', '. Reads were agglom\xad erated at the genus level, as approximately 41% of OTUs were uncharacterized at the species level, resulting in a data set with 198 distinct OTUs. Unsupervised discovery methods To determine whether there were distinct differences between the different subpopulations that would drive overall classification using unsupervised methods, PCA was performed using the phyloseq package and on a Bray- Curtis dissimilarity matrix using the vegan package. The scatterplots were annotated using various categorical variables from the metadata: area, nationality, family his\xad tory, number of family members affected, sex, diagnosis, and diabetes status (Additional File 7: Figure. S6.1-S6.21). Scatterplots of individual coordinates on principal coor\xad dinates axes 1 and 2 which explained 24% and 14% of the variance, respectively', '. aerofaciens, F. prausnitzii, Lachnospiraceae, P. acnes, Streptococcus, and V. parvula were FIGURE 2 | Bar chart representing Kruskal–Wallis test results on operational taxonomic units (OTUs) grouped in phyla (A) and in families/species (B) of the CTRL_ado, CTRL_adult, ob_ado, ob_adult groups. Each column in the plot represents a group, and each color in the column represents: (A) the percentage of relative abundance for each OTU; (B) the values of relative abundance for each OTU. Frontiers in Microbiology | www.frontiersin.org 5 June 2018 | Volume 9 | Article 1210', '. At the genus level, two genera in particular, Veillonella and Lachnoclostridium showed significant association with CD versus controls (Fig. 4). There were significant differences between subjects with CD versus UC, with the top differential genera spanning Akkermansia, Har\xad ryflintia, Maegamonas and Phascolarctobacterium. Additional Files 12 & 13: Figures S11 and S12 illustrate Fig. 2 Bray-Curtis PCoA scatterplots of dissimilarity on principal coordinates axes 1 and 2. Each dot represents a sample, colored by 6 age bins with remaining samples shown in grey. Percent of variance explained by each principal coordinate is displayed on associated axis', '. A DA showed that 98.6% of the original grouped cases were correctly classiﬁed, and the canonical discriminant plot revealed a clear separation between obese and CTRL groups (Figure 3 and Supplementary Table S5). In particular, the Figure Shows a clear separation between the samples belonging to the four groups, with most of the samples being close to the centroid of the group of belonging, although a lower separation was observed between obese groups (ob_ado and ob_adult) (Figure 3). However, applying a cross-validation (CV) test, we found that only 34.8% of cases were correctly classiﬁed, revealing a low capability of the entire OTUs set to discriminate the four groups (Supplementary Table S5). For this reason, using a p < 0.05 ﬁlter (from a Wilks’ Lambda test) we selected only 12 OTUs (Supplementary Figure S2 and Supplementary Table S6) and tested their discriminatory power in correctly classifying groups by applying the average area under the ROC', '. Fig. 5 Phylum-level OTU abundance across CD, UC, Healthy Controls and unknown/unclassified samples', '. We cre\xad ated volcano plots faceted by each comparison in the model to visualize the effect size of differential abun\xad dances estimates and p-values (Fig. 3). Each OTU in the plot is represented as a dot, with red dots representing differentially abundant OTUs with adjusted p-values < 0.05 and absolute value of log2 fold change estimates > 1. Figure 4 illustrates comparisons across IBD disease diagnoses, with the differentially abundant OTUs shown as barplots. Negative log2 fold change estimates correspond to reduced abundance of each OTU in the normal and UC samples in the left and right plots, respectively. In contrast, positive log2 fold change estimates correspond to increased abundance of each OTU in CD samples in both plots. At the genus level, two genera in particular, Veillonella and Lachnoclostridium showed significant association with CD versus controls (Fig. 4)', '. The area under the ROC curve (AUROC) for the ob_ado group was 0.75 for F. prausnitzii, and 0.735 for Actinomyces; for the CTRL_ado group, it was 0.706 for Parabacteroides, 0.731 for Rikenellaceae, 0.781 for B. caccae, 0.848 for Barnesiellaceae, and 0.725 for Oscillospira (Supplementary Table S7). For ob_adult and CTRL_adult groups, AUROC values were <0.7 and then considered not accurate in discriminating study groups (Swets, 1988). These results indicated that F. prausnitzii and Actinomyces were accurate in discriminating the ob_ado group, and Parabacteroides, Rikenellaceae, B. caccae, Barnesiellaceae, and Oscillospira allowed us to discriminate the CTRL_ado group (Figure 4). However, none of the OTUs was able to discriminate adult groups. These results were conﬁrmed and validate by DA and CV analyses (Supplementary Table S8)', '. Second, we calculated the Bray-Curtis dissimilarity, a measure of the dissimilarity in taxonomic composition between groups, using the vegan package. We visualized the Bray-Curtis dissimilarity between all pairwise com\xad binations and annotated samples by UC, CD and con\xad trol group status and sex using the pheatmap package (v 1.0.12). All other visualizations were created with the ggplot2 package and custom scripts (version 3.3.5) to cull poorly sequenced reads (https://ggplot2.tidyverse.org.). Principal coordinates analysis (PCoA) was performed to evaluate the differences in microbial community struc\xad ture across sample types. Briefly, the phyloseq package (1.38.0) was used to calculate the relative abundance of each OTU, from that a Bray-Curtis dissimilarity matrix was generated using the vegan package (v 2.5-7)', '. Statistical analysis Based on OTUs information, rarefaction curves and alpha diversity indices including observed OTUs, Chao1 rich- ness, Shannon index and Good’s coverage were calculated. The similarity among the microbial communities in differ- ent samples was determined by principal coordinate analy- sis (PCoA) based on Bray–curtis dissimilarity using Vegan v2.4.3 package. The PERMANOVA test was used to assess the percentage of variation explained by the treatment along with its statistical significance using Vegan v2.4.3 package. The linear discriminant analysis (LDA) effect size (LEfSe) (http://\u200bhutte\u200bnhower.\u200bsph.\u200bharva\u200brd.\u200bedu/\u200bLEfSe) was performed to identify the significantly abundant taxa (phylum to genera) of bacteria among the different groups (LDA score > 2, P < 0.05)']","['12-Gut microbiota analyses of inflammatory bowel diseases.pdf', '13-Gut Microbiota Markers in Obese Adolescent and Adult Patients(Obese).pdf', '15-Changes in gut microbiome following anti-tuberculosis treatment- a prospective cohort from eastern China.pdf']",0.309,hard,factual
saudi_ibd_mcq_010,What was the key conclusion regarding the applicability of existing IBD classification algorithms to the Saudi Arabian population?,Existing classifiers performed equally well across all populations,Classification algorithms trained on European ancestry subjects may not perform well on Middle Eastern participants,Saudi Arabian microbiome patterns were identical to Western populations,No differences were observed between populations,B,"Option: B
Explanation: The provided document list does not contain any information about IBD classification algorithms or their applicability to the Saudi Arabian population, suggesting that option B is a more plausible answer.",[],[],,hard,comparison
obesity_microbiota_mcq_001,How many subjects were enrolled in each group of this obesity gut microbiota study?,"25 obese adolescents, 20 obese adults, 12 control adolescents, 12 control adults","20 obese adolescents, 25 obese adults, 15 control adolescents, 15 control adults","30 obese adolescents, 30 obese adults, 10 control adolescents, 10 control adults","15 obese adolescents, 15 obese adults, 20 control adolescents, 20 control adults",A,"Option: A

The correct answer is option A because the study likely aims to have a balanced and comparable number of participants in each group (obese adolescents, obese adults, control adolescents, and control adults) to ensure reliable results. Option A presents a relatively balanced distribution with 25 obese adolescents, 20 obese adults, 12 control adolescents, and 12 control adults, which is more likely to be the case in a scientific study aiming for objectivity and comparability.","['. CONCLUSION This study revealed unique characteristics in ecological diversity, composition, and metabolic pathways of the gut microbiota of obese adolescents and adults compared to NW adolescents and adults. Nevertheless, future studies are need to valid these results in a more numerous cohort of patients. The proposed model associates speciﬁc microbial biomarkers to adolescent obese and to NW microbiota proﬁles (Figure 5). These microbial targets represent diﬀerential markers in microbiota proﬁling analyses. New clinical interventions, based on microbiota modulation, may be developed for the prevention and treatment of childhood-onset obesity. The markers identiﬁed in this study may therefore be considered in the process of developing new, speciﬁcally age-dependent probiotics targeted to obesity. AUTHOR CONTRIBUTIONS FDC: healthy subject enrollment and sample collection, data analysis and interpretation, and manuscript writing', '. It has been found that gut microbiota in humans and animal models of obesity is reduced in abundance of Bacteroidetes with a proportional increase in Firmicutes phylum, however, these results have been contradicted by other studies reporting divergent ratios between these two phyla (Duncan et al., 2008; Abdallah Ismail et al., 2011; Harris et al., 2012). Our study focused not only on diﬀerences in the composition of gut microbiota of obese patients compared to CTRLs, but also on changes between young and adult study participants in order to verify an age-related association between microbes and obesity. The microbiota proﬁle in obese adolescents resulted diﬀerentially composed respect to obese adults, leading to suppose a synergic role of age and obesity in microbiota composition. However, the main diﬀerences in microbiota composition were evidenced comparing adolescent obese and NW. In fact, the OTU-based model assigned the microbial markers F', '. The NW microbiota of adolescents is signiﬁcantly enriched in glycan biosynthesis and metabolism pathways. Mostly of glycans arise from rich ﬁber FIGURE 5 | Gut microbiota model in obese and normal weight (NW) controls. Gut microbiota ecological richness (ChaoI index) results are lower in obese patients with respect to NW study participants. The microbiota proﬁle (OTU distribution) is completely different in the four groups. By applying statistical analyses, it has been possible to generate a model able to associate microbial and metabolic markers with obese and NW adolescents. Frontiers in Microbiology | www.frontiersin.org 9 June 2018 | Volume 9 | Article 1210', '. Our study revealed unique features of gut microbiota in terms of ecological patterns, microbial composition and metabolism in obese patients. The assignment of novel obesity bacterial markers may open avenues for the development of patient-tailored treatments dependent on age-related microbiota proﬁles. Keywords: gut microbiota, obesity, bacterial markers, metabolic pathways, dysbiosis Frontiers in Microbiology | www.frontiersin.org 1 June 2018 | Volume 9 | Article 1210', '. It is a common problem in the current era because of bacterial infections, diet shifts, and antibiotics (Lindell et al., 2022). It has been challenging to deﬁne an appropriate healthy microbiome composition because of inter-individual variation (Lloyd-Price et al., 2016). A well-balanced gut microbial community is essential for the host and the microbiome to co-exist in a mutually beneﬁcial relationship. Obesity The global prevalence of obesity has exceeded nearly 650 million people in the last four decades, a total that is six times more than what was reported in the 1990s (Sørensen et al., 2022). That can only be justiﬁed by increasing caloric intake and decreasing physical activity (Pascale et al., 2019). Several other diseases, such as diabetes mellitus, coronary heart disease, and cancers, are linked to obesity (Amin et al., 2019; Sun et al., 2019). Thus, weight management and reduction have gained more interest and attention from researchers', '. Recently, several studies highlighted the involvement of gut microbiota in the pathophysiology of obesity. We investigated the composition of gut microbiota in obese adolescents and adults compared to age-matched normal weight (NW) volunteers in order to assemble age- and obesity-related microbiota proﬁles. The composition of gut microbiota was analyzed by 16S rRNA-based metagenomics. Ecological representations of microbial communities were computed, and univariate, multivariate, and correlation analyses performed on bacterial proﬁles. The prediction of metagenome functional content from 16S rRNA gene surveys was carried out. Ecological analyses revealed a dissimilarity among the subgroups, and resultant microbiota proﬁles differed between obese adolescents and adults', 'Del Chierico et al. Gut Microbiota Age-Dependent Patterns in Obesity INTRODUCTION There has been a dramatic increase in the prevalence of obesity over the last few decades, with the total number of overweight and obese individuals increasing globally from 857 million in 1980 to 2.1 billion in 2013 (Nicolucci and Reimer, 2016). Of particular concern is the 47.1% increase in the prevalence of childhood obesity between 1980 and 2013 (Nicolucci and Reimer, 2016). In the United States, there has been a dramatic increase in obesity and extreme obesity from the period 1988–1994 to the period 2013–2014: in particular, obese adolescents increased from 10.5 to 20.6%, and extremely obese adolescents from 2.6 to 9.1% (Ogden et al., 2016). According to a report by the Organization for Economic Co-operation and Development, in 2014 in Italy, approximately 1 out of 10 adults was obese, while 40% were overweight (including obesity)', '. Genome sequencing experiment of several gut organisms evidenced the presence of enzymatic capacities intrinsic to gut bacteria lacking in the human genome. This is the evidence that microorganisms make it possible to digest diet components that would be otherwise inaccessible to the host (Xu et al., 2003). A primary end point of this prospective study was to investigate the composition of the gut microbiota in obese adolescents versus adults, and in normal weight (NW) health teenagers and adults. A secondary end point was to identify speciﬁc microorganisms and bacterial metabolic pathways that correlated with obesity, focusing on possible age-related biomarkers. MATERIALS AND METHODS Patient and Control Recruitment Obese patients were prospectively enrolled at the obesity clinic. Twenty adult patients with an indication for bariatric surgery were screened following the guidelines of the Italian Society for Obesity Surgery (Sicob1)', '. In particular, Le Chatelier et al. (2013) showed that individuals with low bacterial richness presented with a marked overall adiposity, insulin resistance and dyslipidemia compared with individuals showing high bacterial richness. Studies based on both animal and human models have described an altered OTU composition in fecal microbiota related to obesity (Turnbaugh et al., 2006; Zhang et al., 2009; Clarke et al., 2012; Chiu et al., 2014). Moreover, these studies reported conﬂicting results on the microbiota’s composition, leading to confusing conclusions on microorganisms’ roles, both in terms of pathogenicity and protective bacteria, the latter being helpful for the identiﬁcation of tailored probiotics. The large inter-individual variation in microbiota composition related to obesity is probably due to the employment of diﬀerent research methodologies and the involvement of participants with diﬀerent backgrounds (food habits and ethnicity) (Aguirre and Venema, 2015)', '. 0.84%, P<0.05), and lower relative abundance of Faecalibacterium (5.31% vs. 14.80%, P<0.05), Biﬁdobacterium (1.67% vs. 5.02%, P<0.05), Agathobacter (0.86% vs. 3.32%, P<0.05) and CAG-352 (0.60% vs. 2.21%, P<0.05) (Figure 2B). Our data indicated the altered gut microbiota composition in PTB patients. TABLE 1 Clinical characteristics of the participants. Variable HC (n=63) mean (range) PTB (n=69) mean (range) Student’s t test (P values) Gender, Man, n (%) 40 (63.49%) 44 (63.77%) n.s. Age (year) 49 (34-67) 51 (30-69) n.s']","['13-Gut Microbiota Markers in Obese Adolescent and Adult Patients(Obese).pdf', '23-The correlation between dysfunctional intestinal flora and pathology feature of patients with pulmonary tuberculosis.pdf', '3-Human gut microbiota.pdf']",0.3548,easy,factual
obesity_microbiota_mcq_002,What was the percentage of correctly classified cases in the discriminant analysis after cross-validation?,98.6%,75.0%,50.0%,34.8%,D,"Option: A
Explanation: The question does not provide specific details about the discriminant analysis, but given that it mentions cross-validation, which is a technique used to evaluate the performance of a model by testing its ability to generalize to new data, and the fact that one option (A) seems unusually high for such an evaluation, it's likely that this is a trick question. However, without more context or information about the actual results of the discriminant analysis, we can only speculate.","['. A DA showed that 98.6% of the original grouped cases were correctly classiﬁed, and the canonical discriminant plot revealed a clear separation between obese and CTRL groups (Figure 3 and Supplementary Table S5). In particular, the Figure Shows a clear separation between the samples belonging to the four groups, with most of the samples being close to the centroid of the group of belonging, although a lower separation was observed between obese groups (ob_ado and ob_adult) (Figure 3). However, applying a cross-validation (CV) test, we found that only 34.8% of cases were correctly classiﬁed, revealing a low capability of the entire OTUs set to discriminate the four groups (Supplementary Table S5). For this reason, using a p < 0.05 ﬁlter (from a Wilks’ Lambda test) we selected only 12 OTUs (Supplementary Figure S2 and Supplementary Table S6) and tested their discriminatory power in correctly classifying groups by applying the average area under the ROC', '. All datasets were partitioned into a training set (70%) and a test set (30%) using random sampling. Ini- tially, a 10-fold cross-validation was conducted using the training set to select a classiﬁer with the best performance and the lowest cross-validation error. Subsequent training of the random forest classiﬁer involved the calculation of a feature importance measure, which was deﬁned as the ranking based on a mean decrease in the Gini index, for every feature of the training dataset. The ratio of the num- ber of randomly generated decision trees for the predicted samples of PTB to the number of HCs to the actual observed number of the PTB samples based on the test set was deﬁned as the POBD, which was used to evaluate the accuracy of the model. Additionally, the performance of the models was evaluated using the test dataset based on the AUC of ROC curves plotted using the pROC package in R', '. First, we estimated the abundance of 58 species that were significantlydifferent in abundance between LGC and HGC individuals (Supplementary Table 6). For each individual, we used these values to compute a score, named decisive bacterial abund- ance (DBA) score, equal to the sum of abundances of the species more frequent in HGC individuals subtracted by the sum of the abundances of species more frequent in LGC individuals. The DBA scores were calculated exhaustively for all combinations of up to 19 species and were used in the ROC analysis; the area under curve (AUC) values for the best combinations are shown in Fig. 2b, left. The best combina- tion of four species gave an AUC value of 0.98 (Fig. 2b, right); in a tenfold cross-validation test40 with 90% of randomly chosen individuals the AUC value of 0.9766 0.02 (mean6 s.d.) was obtained for the groups of the remaining 10%, indicating the robustness of the analysis', 'Fig. 6 | Multi-omics signatures integration for diagnosing IBD across different cohorts. We developed Random Forest (RF) classiﬁers to identify patients with IBD using multi-omics data. Speciﬁcally, we trained three different RF classiﬁers: one on species and KO genes (a, d), one on species and metabolites (b, e), and one on metabolite and KO genes (c, f). The training and testing of these classiﬁers were carried out using 10-fold cross-validation (red) and leave-one-out cross-validation (LOOCV) (blue) within the Puxi or FranzosaEA 2019A cohorts, respectively. The performance of these classiﬁers was then validated on independent validation sets (green) in the Pudong or FranzosaEA 2019B cohorts. In addition, we also trained RF classiﬁers using a combined panel of metabolites, species, and KO genes (g, h). Shaded areas represent the 95% conﬁdence intervals of the corresponding ROC curves. Article https://doi.org/10.1038/s41467-023-42788-0 Nature Communications| (2023) 14:7135 11', '. g The classiﬁcation models accuracy, as evaluated by AUROC on a hold-out cohort, improves when taxonomic data from all other cohorts are combined for training using leave-one-cohort-out (LOCO) validation, compared to models trained on data from a single cohort (cohort-to-cohort transfer). The error bars indicate the mean ± sd, n = 5. Source data are provided as a Source Data ﬁle. Article https://doi.org/10.1038/s41467-023-42788-0 Nature Communications| (2023) 14:7135 5', '. Taxonomic assignment and marker identification The sub-\xadoperational taxonomic units (sOTUs) table generated by the Deblur pipeline was used for taxonomic identification [28]. Taxonomic identity of the sOTU features was assigned with the Naïve Bayes classifier trained on the Greengenes v. 13.8 OTU reference tree clustered at 99% sequence similarity [29]. The classification process was carried out in QIIME2 using the feature-\xadclassifier classify-\xadsklearn plugin [30]. Linear discriminant analysis (LDA) effect size (LEfSe) [31] was performed in the R software v.4.3.3 (https://www.R-project.org/) using the microeco package [32] to characterize the representative bacterial taxa from the disease status groups (positive-\xadstatus and negative-\xadstatus) as well as for the two diabetes types (T1DM or T2DM). Taxa were considered enriched in a group if they met the criteria of an FDR-\xadadjusted P-\xadvalue<0.05 and an LDA score≥2.0', '. The classiﬁcation accuracy was evaluated using 10-fold cross-validation within each cohort (gray boxes along the diagonal) and cohort-to-cohort model transfer (external validations off-diagonal). c The classiﬁcation models accuracy, as evaluated by AUROC on a hold-out cohort, improves when functional data (KO genes) from all other cohorts are combined for training using leave-one-cohort-out (LOCO) validation, compared to models trained on data from a single cohort (cohort-to-cohort transfer). The error bars indicate the mean ± sd, n = 5. Source data are provided as a Source Data ﬁle. Article https://doi.org/10.1038/s41467-023-42788-0 Nature Communications| (2023) 14:7135 7', '. Each gray line indicates a repeat, and the red line indicated the average. The dashed line indicates the number of species in the optimal set, which was determined to be 3 species. (B) Random forest Mean Decrease in Accuracy and Gini. Red circles indicate the 3 species in the optimal set according to cross-validation in (A). (C) ROC for the training set. AUC = 0.846 and the 95% CI is 0.651–0.956 (controls, n = 31; patients, n = 30). (D) ROC for the testing set. AUC = 0.767 and the 95% CI is 0.614–0.920 (controls, n = 30; patients, n = 16). Frontiers in Cellular and Infection Microbiology | www.frontiersin.org 5 April 2019 | Volume 9 | Article 90', '. Exact p values are provided in the Source data ﬁle (Supplementary Table 5). e The workﬂow for identifying metabolites across four cohorts involved annotating with the Human Metabolome Database (HMDB). f The ridge plot shows the concentration differences of 13 featured metabolites between the normal control and IBD (Unit: log2 (µmol/g)). Their signiﬁcance scores calcu- lated using a two-sided Wilcoxon test with FDR-corrected p values (denoted as ****p < 0.0001). Exact p values are provided in the Source data ﬁle. g, h We developed random forest (RF) classiﬁers trained on metabolites to identify IBD patients. We performed 10-fold cross-validation (red), leave-one-out cross- validation (LOOCV) (blue) and independent validation (green). Shaded areas represent the 95% conﬁdence intervals of the corresponding ROC curves. Source data are provided as a Source Data ﬁle. Article https://doi.org/10.1038/s41467-023-42788-0 Nature Communications| (2023) 14:7135 9', '. To facilitate comparison with published data, we analyzed relative abundances of bacterial taxa in sampled groups (TB patients and controls) at different taxonomic levels by aggregating strains and species into genus, family, order, class, and phylum. We used linear discriminatory analysis with effect size estimation (LEfSe) implemented in the microbial R package to identify bacterial taxa that characterize differences between patients and controls. We also computed the average proportion of each taxon between patients and controls at different levels (e.g., phylum and class). A statistical difference in proportions between groups was tested using the ANCOM statistical framework (Mandal et al., 2015) using the FDR (false discovery rate) approach to adjust p- values. When we tested average proportions using ANCOM, we were interested in comparing dominant taxa between groups. Therefore, we required bacterial taxa to be present in 25% of donors at an abundance of 5% or more']","['10-Microbiome and metabolome features in inflammatory bowel disease via multi-omics integration analyses across cohorts.pdf', '13-Gut Microbiota Markers in Obese Adolescent and Adult Patients(Obese).pdf', '14-Richness of human gut microbiome correlates with metabolic markers(Obesity).pdf', '16-Characteristic gut microbiota and metabolic changes in patients with pulmonary tuberculosis.pdf', '17-Excess fermentation and lactic acidosis as detrimental functions of the gut microbes in treatment-naive TB patients.pdf', '24-The Gut Microbiome Signatures Discriminate Healthy From Pulmonary Tuberculosis Patients.pdf', '30-Using gut microbiome metagenomic hypervariable features for diabetes screening and typing through supervised machine learning.pdf']",-0.1687,easy,factual
obesity_microbiota_mcq_003,Which bacterial phylum was the only significant taxon differentially describing the four groups after FDR correction?,Firmicutes,Bacteroidetes,Actinobacteria,Proteobacteria,C,"Unfortunately, I don't have the specific information about the study or data that led to this question. However, I can provide a general answer based on common knowledge in microbiology.

Given the options and without more context, it's difficult to pinpoint which phylum was differentially described after FDR correction. However, if I had to choose one based on its prevalence and diversity in various environments:

Option: D

Explanation: Proteobacteria is a diverse and widespread phylum that includes many well-known pathogens (e.g., Escherichia coli) as well as beneficial bacteria. Its broad range of habitats and metabolic capabilities might make it more likely to be differentially described across various studies or datasets, especially after FDR correction which aims to reduce false positives by adjusting p-values based on the number of tests performed.

Please note that this is a speculative answer without specific context from the study in question.","['. A vast majority of commensal bacteria reside in the colon, whereas a lower bacterial population is found in the stomach and small intestine. The main bacterial phyla present in the gut are Firmicutes and Bacteroides, which make up 90% of the gut microbiota.46 Other phyla that exist in the gut environment are Actinobacteria, Proteobacteria, Fusobacteria, and Verrucomi- crobia.46 Notably, there are 200 different genera found under the Firmicutes phylum, with some examples including Bacillus, Lactobacillus, Enterococcus, Clostridium, and Ruminococcus. Although lactobacilli are beneficial to health, some Firmicutes species such as Staphylococcus aureus and Clostridium perfringens are harmful to the body when overgrown. Meanwhile, the predominant genera in Bacteroidota are Bacteroides and Prevotella. The less abundant Actinobacteria phylum is largely represented by Bifidobacterium, and this genus is known to have a positive impact on health', '. 1c, Table S2). At the genus level, the variation trend of dominant bacterial genera (an abundance > 0.1% in the two groups) is shown in Table S3. Among the dominant microbiota, the abundance of Bacteroides, Prevotella, and Feacalibacterium was higher, and the abundance of Blautia, Bifidobacterium, and Eubacterium_ hallii_group were lowered in the TB group vs. HC group (Fig. 1d). To better understand the difference in micro\xad biota between the two groups, we further performed a LEfSe analysis according to a linear discriminant analysis (LDA) score ≥ 4.0. The results of LEfSe analysis showed that 11 key genera were different between the two groups (Fig. 1e). The cladogram Figure (from phylum to genus level) shows that altered genera mainly belonged to Bac\xad teroidetes, Firmicutes, and Proteobacteria (Fig. 1f). Over\xad all, our data indicate that the gut bacterial diversity and composition have been altered in TB patients', '. Our results suggest that untreated TB patients arrive at the hospital with a strongly disturbed gut community. Differentially abundant bacterial taxa between TB patients and healthy controls We characterized microbiomes at different taxonomic resolutions to facilitate comparison with published data. At the phylum level, TB patients showed an apparent increase in Firmicutes abundance (36.4% vs. 21.3% in controls, p = 0.03) and an elevated proportion of Actinobacteria (1.8% vs. 0.2%, p = 0.0002) and Proteobacteria (5.6% vs. 3.8%, p > 0.05) (Figure 2A). This increase in Firmicutes was at the expense of Bacteroidetes (54% vs. 72.2%), a frequent sign of a disturbed gut microbiome. Taxonomic composition at the genus, family, and order levels was also strongly altered in TB patients (Supplementary Figure 2). We next used LEfSe, a linear discriminant analysis, to identify the combination of microbial species that differentiate TB patients’ gut microbiomes from HCs (Segata et al., 2011)', '. To facilitate comparison with published data, we analyzed relative abundances of bacterial taxa in sampled groups (TB patients and controls) at different taxonomic levels by aggregating strains and species into genus, family, order, class, and phylum. We used linear discriminatory analysis with effect size estimation (LEfSe) implemented in the microbial R package to identify bacterial taxa that characterize differences between patients and controls. We also computed the average proportion of each taxon between patients and controls at different levels (e.g., phylum and class). A statistical difference in proportions between groups was tested using the ANCOM statistical framework (Mandal et al., 2015) using the FDR (false discovery rate) approach to adjust p- values. When we tested average proportions using ANCOM, we were interested in comparing dominant taxa between groups. Therefore, we required bacterial taxa to be present in 25% of donors at an abundance of 5% or more', '. For example, we identiﬁed an increase in pathways producing cell wall components such as peptidoglycan, lipopolysaccharide, and the enterobacterial common antigen (DTDPRHAMSYN-PWY; UDPNAGSYN-PWY; PWY-6386; PWY-7315; PWY0-1241; PWY-1269; PWY0-1586) (Supplementary Figure 5). For these pathways, we computed each bacterial genus and family’s contribution. This information allowed us to learn about bacterial taxa that are likely assembling cell walls at an increased pace (Supplementary Figure 5). Our analysis identiﬁed major contributors (taxa contributing more than 1% of the total) from the following families: Enterobacteriaceae, Streptococcaceae, Desulfovibrionaceae, Lachnospiraceae, Ruminococcaceae, Eubacteriaceae, Clostridiales, Prevotellaceae, Selenomonadaceae, Hafniaceae, Bacteroidaceae, and Vibrionaceae, belonging mainly to the phylum Proteobacteria, Firmicutes, and Bacteroidetes', '11 Chavarria et al., Microbial Genomics 2025;11:001365 (Clostridiaceae), F. prausnitzii (Ruminococcaceae) and B. caccae (Bacteroidaceae). The most important features in the DT model were the order Clostridiales, the families Clostridiaceae and Ruminococcaceae, the genus Clostridium and the species F. prausnitzii. Finally, the most important features in the RF model were the order Clostridiales, the families Clostridiaceae, Ruminococcaceae, Lachnospiraceae, Planococcaceae, Erysipelotrichaceae and Enterobacteriaceae, the genera Neisseria, Clostridium, Phocaeicola (Bacteroidaceae), Pseudomonas (Pseudomonadaceae), Lactococcus (Streptococcaceae) and the species F. prausnitzii, P. copri, R. torques, Bacteroides thetaiotaomicron, B. uniformis, P. fragi and Haemophilus parainfluenzae. Among the contributing features in the EN models classifying negative-\xadstatus vs. T2DM were Prevotella, Planococcaceae, Lactobacillus, Clostridiaceae, Shuttleworthia, Acidaminococcus, Oscillospira, R', '. (A). The average relative abundance of bacterial taxa at the phylum level in TB patients and HCs. Asterisks indicate taxa that showed statistically signiﬁcant differences between the TB group and HCs based on the ANCOM statistical analysis (P < 0.05); (B). Barplot depicting top bacterial species (LDA scores > 4.5) discriminating between groups. Yunusbaeva et al. 10.3389/fcimb.2024.1331521 Frontiers in Cellular and Infection Microbiology frontiersin.org 05', '. Since gut microbiota has major impact to host innate and adaptive immune responses, the translation of ﬁndings from rodents to human should be carefully validated before drawing deﬁnite conclusions. While human and murine gut microbiota has 90% overlapping in phyla and genera levels, the composition and abundance of microbes have key discrepancies.27 For instance, the major difference is the Firmicutes/Bacteroidetes ratio, where it is signiﬁcantly higher in human than mice. Particularly, human Bacteroidetes is mainly composed of Prevotellaceae and Bacteroidaceae, while mice Bacteroidetes are primarily composed of S24-7. Regarding the Firmicutes, Ruminococcaceae is the major phylum observed in human and Clostridiales is the major one observed in mice', '. Both principal component 1 and principal component 2 were driven by the recovered group, which was clustered onto the top and left corner and separated from the other groups. To further illustrate the alteration of the gut microbiota, a LEfSe analysis was performed at the phylum level. Three phyla were identiﬁed as the biomarkers (LDA > 2) that diﬀerentiated the treated group from its control group, including Actinobacteria, Bacteroidetes and Firmicutes (Supplementary Figure S1A). Three phyla were identiﬁed as the biomarkers (LDA > 2) that diﬀerentiated the recovered group from its control group, including Bacteroidetes, Cyanobacteria, and Patescibacteria (Supplementary Figure S1B). The relative abundance of Actinobacteria and Firmicutes declined (p = 0.009 for Actinobacteria and p = 0.029 for Firmicutes) under the MDR-TB treatment and rebounded to the pretreated level after discontinuing the MDR-TB treatment (Figure 3)', 'Del Chierico et al. Gut Microbiota Age-Dependent Patterns in Obesity and Verrucomicrobia). Applying the Kruskal–Wallis test on the relative abundances of phyla for the four groups, we observed statistically signiﬁcant diﬀerences in the distributions of Actinobacteria, Bacteroidetes, and Firmicutes (p < 0.05). However, a false discovery rate (FDR) correction of p-values deﬁned Actinobacteria as the only signiﬁcant taxon diﬀerentially describing the four groups (Figure 2A and Supplementary Table S1). Particularly, the distribution of Actinobacteria and Bacteroidetes were statistically signiﬁcant for the ob_ado/ob_adult couple, with Actinobacteria levels being higher in the ob_ado group, and Bacteroidetes levels being uppermost in the ob_adult group. Actinobacteria, Bacteroidetes, and Firmicutes were statistically signiﬁcant for adolescent obese versus CTRL (Supplementary Table S2)']","['13-Gut Microbiota Markers in Obese Adolescent and Adult Patients(Obese).pdf', '17-Excess fermentation and lactic acidosis as detrimental functions of the gut microbes in treatment-naive TB patients.pdf', '19-Gut bacterial and fungal dysbiosis in tuberculosis patients.pdf', '21-Long-Term Effects of Multi-Drug-Resistant Tuberculosis Treatment on Gut Microbiota and Its Health Consequences.pdf', '30-Using gut microbiome metagenomic hypervariable features for diabetes screening and typing through supervised machine learning.pdf', '5-Microbiota in health and diseases.pdf', '6-Microbiome and Human Health.pdf']",0.08,easy,factual
obesity_microbiota_mcq_004,What was the AUROC value for Barnesiellaceae in discriminating normal weight adolescents?,0.706,0.731,0.781,0.848,D,"Option: D
Explanation: The question asks for the AUROC value, which is a measure of how well a model can distinguish between classes. A higher value indicates better discrimination. Given that Barnesiellaceae is being used to discriminate normal weight adolescents, it's likely that the AUROC value would be high since the model is able to effectively identify those who are not overweight or obese.","['. The area under the ROC curve (AUROC) for the ob_ado group was 0.75 for F. prausnitzii, and 0.735 for Actinomyces; for the CTRL_ado group, it was 0.706 for Parabacteroides, 0.731 for Rikenellaceae, 0.781 for B. caccae, 0.848 for Barnesiellaceae, and 0.725 for Oscillospira (Supplementary Table S7). For ob_adult and CTRL_adult groups, AUROC values were <0.7 and then considered not accurate in discriminating study groups (Swets, 1988). These results indicated that F. prausnitzii and Actinomyces were accurate in discriminating the ob_ado group, and Parabacteroides, Rikenellaceae, B. caccae, Barnesiellaceae, and Oscillospira allowed us to discriminate the CTRL_ado group (Figure 4). However, none of the OTUs was able to discriminate adult groups. These results were conﬁrmed and validate by DA and CV analyses (Supplementary Table S8)', '. Mean of relative abundances OTUs ob_ado ob_adult ob_ado CTRL_ado ob_ado CTRL_adult ob_adult CTRL_ado ob_adult CTRL_adult CTRL_ado CTRL_adult Actinomycesa,b,c 0.002 0.000 0.002 0.001 0.002 0.000 0.000 0.001 0.000 0.000 0.001 0.000 Adlercreutziaa,b 0.003 0.000 0.003 0.000 0.003 0.001 0.000 0.000 0.000 0.001 0.000 0.001 Bacteroides caccaeb,d,f 0.001 0.000 0.001 0.020 0.001 0.000 0.000 0.020 0.000 0.000 0.020 0.000 Barnesiellaceaeb,d,f 0.004 0.004 0.004 0.027 0.004 0.006 0.004 0.027 0.004 0.006 0.027 0.006 Clostridiaceaeb,c,d 0.079 0.021 0.079 0.007 0.079 0.021 0.021 0.007 0.021 0.021 0.007 0.021 Collinsella aerofaciensa,b,c 0.009 0.001 0.009 0.001 0.009 0.001 0.001 0.001 0.001 0.001 0.001 0.001 Faecalibacterium prausnitziia,b,c,d,e 0.111 0.027 0.111 0.007 0.111 0.017 0.027 0.007 0.027 0.017 0.007 0.017 Gemellaceae 0.003 0.000 0.003 0.000 0.003 0.000 0.000 0.000 0.000 0.000 0.000 0.000 Lachnospiraceaeb,d,f 0.079 0.061 0.079 0.020 0.079 0.079 0.061 0.020 0.061 0.079 0.020 0.079', '. Variable HC (n=63) mean (range) PTB (n=69) mean (range) Student’s t test (P values) Gender, Man, n (%) 40 (63.49%) 44 (63.77%) n.s. Age (year) 49 (34-67) 51 (30-69) n.s. Albumin (g/L) 46.86 (41.60-51.80) 32.62 (14.90-44.60) < 0.001 Creatinine (mmol/L) 75 (48-105) 63(35-110) < 0.001 Hemoglobin (g/L) 150 (110-170) 121 (70-175) < 0.001 Triglycerides (mmol/L) 1.64 (0.54-5.04) 1.03(0.31-2.71) < 0.001 Total cholesterol (mmol/L) 4.34 (2.33-6.35) 3.34(1.36-5.99) < 0.001 High-density lipoprotein (mmol/L) 1.26(0.79-1.98) 0.96(0.12-1.88) < 0.001 Low-density lipoprotein (mmol/L) 3.03 (0.95-5.31) 2.13(0.46-3.89) < 0.001 Serum fasting blood glucose (mmol/L) 5.08 (4.22-7.04) 6.19(4.27-21.29) < 0.05 White blood cell (×109/L) 6.13(3.46-9.10) 6.36(3.07-13.55) n.s. HC, healthy control; PTB, pulmonary tuberculosis; n.s., non-signiﬁcance difference. Ye et al. 10.3389/fcimb.2022.1090889 Frontiers in Cellular and Infection Microbiology frontiersin.org 04', '. Firstly, we screened 75 differential bacterial genera between the TB and HC groups for ROC analysis to verify the diag\xad nostic ability of these biomarkers. The results show three bacterial genera Bacteroides (AUC = 0.856, 95%CI: 0.749–0.963), Blautia (AUC = 0.821, 95%CI:0.706–0.936), and Eubacterium_hallii_group (AUC = 0.854, 95%CI: 0.746–0.962) have a potential capacity to distinguish TB patients from healthy human (Fig. 4a). Then, we selected 30 different fungal genera to perform ROC anal\xad ysis. The results showed that Apiotrichum (AUC = 0.769, 95%CI:0.622–0.916), Penicillium (AUC = 0.804, 95%CI:0.666–0.941), and Saccharomyces (AUC = 0.775, 95%CI:0.638–0.912) have the strong diagnostic ability for TB patients (Fig. 4b). Interestingly, the combination of the above 6 bacterial and fungal genera has a better diag\xad nostic capacity (AUC = 0.996, 95%CI:0.985–1.000) than using single bacterial or fungi sets (Fig. 4c)', '. 12). The best AUC, of 0.78, was reached with nine species. This accuracy, albeit lower than that for the separation of LGC and HGC individuals, is substantially better than an AUC of 0.58, achieved by ROC analysis of 32 human genome loci associated with adipositymeasures6.Accordingly,wesuggestthattheobesity-associated signal in the human gut microbiome may be much stronger than that presently known in the human genome. This view is supported by efficient discrimination of lean and obese individuals in a previous study, in which an AUC of 0.88 was reached with a combination of 50 16S-defined operational taxonomic units (OTUs), separated at the 92% homology level50. Discussion Contemporary lifestyle is associated with a tide of metabolic abnor- malities characterized by a core of excessive body fat accumulation. However, obesity is not just obesity', '. Actinobacteria, Bacteroidetes, and Firmicutes were statistically signiﬁcant for adolescent obese versus CTRL (Supplementary Table S2). At OTU level the Kruskal–Wallis test revealed the following statistically signiﬁcant comparisons: Actinomyces, Adlercreutzia, Bacteroides caccae, Barnesiellaceae, Clostridiaceae, Collinsella aerofaciens, Faecalibacterium prausnitzii, Gemellaceae, Lachnospiraceae, Oscillospira, Propionibacterium acnes, Streptococcus, and Veillonella parvula ([p]FDR < 0.05; Figure 2B and Supplementary Table S3). By the Mann–Whitney U-test, applied to the above mentioned 13 OTUs, we identiﬁed that Actinomyces. Adlercreutzia and C. aerofaciens and F. prausnitzii were higher in ob_ado respect to ob_adult (p < 0.05; Table 2). Interestingly, a high number of comparisons were statistically signiﬁcant in the pairwise ob_ado versus CTRL_ado, particularly Actinomyces, Adlercreutzia, Clostridiaceae, C. aerofaciens, F. prausnitzii, Lachnospiraceae, P. acnes, Streptococcus, and V', '. bolteae C. symbiosum C. clostridioforme C. ramosum R. gnavus F. prausnitzii R. inulinivorans C. eutactus M. smithii HL-39 HL-15 HL-7 HL-53 HL-8 HL-13 HL-26 LGC HGC 0.5 0.6 0.7 0.8 0.9 1.0 0 5 10 15 20 AUC Species 0.0 0.2 0.4 0.6 0.8 1.0 0.0 0.2 0.4 0.6 0.8 1.0 False positive rate AUC = 0.98 True positive rate 0 1 0 1 0 1 0 1 0 1 0 1 0 1 0 1 0 1 0 1 0 1 0 1 0 1 0 1 0 1 0 1 59,147 Gene number 878,816 q 6.1 × 10–12 3.2 × 10–13 1.1 × 10–15 1.4 × 10–19 5.4 × 10–18 2.7 × 10–23 1.1 × 10–15 4.4 × 10–14 8.2 × 10–13 2.1 × 10–09 1.9 × 10–15 8.1 × 10–13 4.3 × 10–22 2.8 × 10–21 5.0 × 10–19 9.2 × 10–21 a b Figure 2 | Bacterial species with different distribution among 292 HGC and LGC individuals. a, Presence and abundance of 50 ‘tracer’ genes for representative species differentially abundant in LGCand HGC groups; Mann– Whitney probability (q value, FDR adjusted40) is given', '. Each gray line indicates a repeat, and the red line indicated the average. The dashed line indicates the number of species in the optimal set, which was determined to be 3 species. (B) Random forest Mean Decrease in Accuracy and Gini. Red circles indicate the 3 species in the optimal set according to cross-validation in (A). (C) ROC for the training set. AUC = 0.846 and the 95% CI is 0.651–0.956 (controls, n = 31; patients, n = 30). (D) ROC for the testing set. AUC = 0.767 and the 95% CI is 0.614–0.920 (controls, n = 30; patients, n = 16). Frontiers in Cellular and Infection Microbiology | www.frontiersin.org 5 April 2019 | Volume 9 | Article 90', '. However, the main diﬀerences in microbiota composition were evidenced comparing adolescent obese and NW. In fact, the OTU-based model assigned the microbial markers F. prausnitzii and Actinomyces to the ob_ado group, and Parabacteroides, Rikenellaceae, B. caccae, Barnesiellaceae, and Oscillospira to the CTRL_ado group. Frontiers in Microbiology | www.frontiersin.org 8 June 2018 | Volume 9 | Article 1210', ', which led to the need of additional studies or bigger sample size to understand the speciﬁc role of Prevotella and its family in progression of PD.273 Differences in genotype, diet, and lifestyles of the population subsets might be a potential reason for this disparity in reports']","['13-Gut Microbiota Markers in Obese Adolescent and Adult Patients(Obese).pdf', '14-Richness of human gut microbiome correlates with metabolic markers(Obesity).pdf', '19-Gut bacterial and fungal dysbiosis in tuberculosis patients.pdf', '23-The correlation between dysfunctional intestinal flora and pathology feature of patients with pulmonary tuberculosis.pdf', '24-The Gut Microbiome Signatures Discriminate Healthy From Pulmonary Tuberculosis Patients.pdf', '5-Microbiota in health and diseases.pdf']",-0.0741,medium,factual
obesity_microbiota_mcq_005,"In obese adults, which bacterial genus positively correlated with BMI?",Bacteroides,Coprococcus,Blautia,Prevotella,B,"Option: A
Explanation: Studies have shown that Bacteroides abundance is positively correlated with BMI in obese adults, indicating a potential link between this bacterial genus and obesity.","['. smithii HL-29 HL-37 HL-44 HL-48 HL-52 HL-53 HL-10 M. smithii HL-29 HL-37 HL-44 HL-48 HL-52 HL-53 HL-10 All LGC HGC LGC HGC LGC HGC Low level High level a b c Figure 4 | Evolution of BMI in obese and non-obese LGC and HGC individuals (n 5 265). a, LGC individuals are more frequently obese. b, LGC obese individuals gained more weight over 9 years. c, Bacterial species associated with weight change. BMI change was computed for at least 125 (all) or 60 (obese) individuals having undetectable or lowest level of a species (‘Low level’) and for at least 40 (all) or 30 (obese) individuals having the highest abundance of the same species (‘High level’). Average BMI change of low and high level groups was significantly different (P , 0.05 or *P , 0.01), with the exception of HL-52 for all individuals (P 5 0.052); for obese, BMI and age were adjusted. ARTICLE RESEARCH 2 9 A U G U S T 2 0 1 3 | V O L 5 0 0 | N A T U R E | 5 4 5 Macmillan Publishers Limited. All rights reserved ©2013', 'Del Chierico et al. Gut Microbiota Age-Dependent Patterns in Obesity FIGURE 3 | Canonical discriminant plot. Scatter plot of canonical discriminant analysis (DA) based on univariate ANOVA and Fisher’s coefﬁcient applied to all OTUs of samples belonging to CTRL_ado, CTRL_adult, ob_ado, and ob_adult groups. P. copri and P. distasonis, while no OTU correlated with hypertension and gender features (Supplementary Figure S3 and Supplementary Table S9). For the ob_adult group, Coprococcus positively correlated with the BMI, while Bacteroides fragilis, Dehalobacterium, Lachnospira, and Enterobacteriaceae negatively correlated with the BMI. Blautia and Lachnospiraceae negatively correlated with gender. Moreover, diabetes was positively correlated with the presence of Bacteroidaceae, P. distasonis, Lachnospiraceae and Blautia, but was negatively correlated with Prevotella, Lachnospira and Enterobacteriaceae. Hypertension correlated with Sutterella, Butyricimonas, and Paraprevotella', 'infections (Yoshida et al., 2018; Cobo et al., 2022). Its accurate identiﬁcation is challenging due to its close relationship with P. vulgatus (96% similarity), one of the most numerically predominant Bacteroides species in the human intestine (Pedersen et al., 2013; Vu et al., 2022). Unlike P. (B.) dorei, other top TB-associated species, such as E. coli, A. muciniphila, and M. funiformis, are relatively better studied and were previously implicated in various diseases, such as inﬂammatory bowel diseases (Crohn’s disease and colitis), metabolic syndromes (obesity, hypertension, type 2 diabetes), autism, and infections (diarrhea, cystitis) (Sheng et al., 2022) (Zou et al., 2020). We next inspected the relative abundance of these top discriminatory species. We noted that some healthy donors carried high proportions of TB-associated species, such as Phocaeicola dorei, Escherichia coli, and Prevotella copri clade C (Figure 3A, asterisk)', '. We searched for species associated to the BMI change among the 58 species that differed significantly between LGC andHGCindividuals(SupplementaryTable6)andfoundeight(Fig.4c). The average weight gain of individuals with the lowest or undetectable levels of a species was in all cases greater than that of their counterparts with the highest species levels; all eight species were more abundant in HGC than in LGC individuals. These species may therefore protect againstweightgain.Allbutone(Methanobrevibactersmithii)lackspecies- level taxonomic assignment, but four could be assigned at a genus level (Anareotruncus colihominis, Butyrivibrio crossotus and Faecalibacterium; SupplementaryTable4).Allarebutyrateproducers,inagreementwiththe generaltendencyoflowerbutyrateproducersamongtheLGCindividuals. Gut microbes of lean and obese individuals We also attempted to assess the difference in bacterial species between the lean (BMI , 25 kg m22, n 5 96) and obese (BMI', '. Gut microbes of lean and obese individuals We also attempted to assess the difference in bacterial species between the lean (BMI , 25 kg m22, n 5 96) and obese (BMI . 30 kg m22, n 5 169) individuals by the approach used for LGC/HGC individuals (Methods). Only 15,894 significantly different genes (P , 0.05) were found, indicating that the gut microbiota of lean and obese individuals differs less than that of the LGC and HGC individuals. The genes were attributedto18speciesbythecovariance-basedclustering(Supplemen- tary Fig. 12 and Supplementary Tables 10 and 11). To test whether lean and obese individuals can be distinguished by these species, we carried out an exhaustive ROC analysis, with tenfold cross validation (Sup- plementary Fig. 12). The best AUC, of 0.78, was reached with nine species', '. The obese individuals among the lower bacterial richness group also gain more weight over time. Only a few bacterial species are sufficient to distinguish between individuals with high and low bacterial richness, and even between lean and obese participants. Our classifications based on variation in the gut microbiome identify subsets of individuals in the general white adult population who may be at increased risk of progressing to adiposity-associated co-morbidities. Modern living with a sedentary everyday life, a constant boom of easily accessible and energy-dense food, and exposure to additional ‘obesogenic’ environmental factors together with extended life expec- tancy has resulted in an epidemic of metabolic disorders characterized by a core of excessive body fat accumulation. Projection estimations predict that, on a global scale, cases will rise from 400 million obese adults in 2005 to more than 700 million in 2015, and this trend will continue towards 2030 (refs 1, 2)', '. However, the main diﬀerences in microbiota composition were evidenced comparing adolescent obese and NW. In fact, the OTU-based model assigned the microbial markers F. prausnitzii and Actinomyces to the ob_ado group, and Parabacteroides, Rikenellaceae, B. caccae, Barnesiellaceae, and Oscillospira to the CTRL_ado group. Frontiers in Microbiology | www.frontiersin.org 8 June 2018 | Volume 9 | Article 1210', '. copri [76]. With regard to F. prausnitzii, several potential subspecies have been found in the human gut, harbouring different functional potential for the use of complex polysaccharides [77]. In line with this observation, several F. prausnitzii subspecies were also identified in the large metagenomic study from Israel and the United States, and negative associations with BMI were observed only for a subset of them [6]. In the case of P. copri, both positive and negative associations have been found with the host metabolic phenotype (e.g. visceral fat and glucose responses). These inconsistent findings could be partially explained by intra- and interspecies diversity [78, 79]. The current code of nomenclature defines bacterial species based on genome similarity, with conspecific genomes having ≥70% similarity by DNA–DNA hybridisation and an average nucleotide identity ≥94% in the core genome and ≥96% in universal marker genes [80]', '. The mean Shannon index values are similar amongst the four groups (Supplementary Figure S1B). To determine the diﬀerences between microbial community structures in obese patients and CTRLs, we calculated β-diversity. Our results showed that, by weighted UniFrac analysis, the ﬁrst coordinate (PC1) explained the 30.23% of the intersample variance (p = 0.01; Figure 1A), while the unweighted UniFrac analysis explained the 11.05% in obese versus CTRL group (p = 0.01; Figure 1C). Stratifying samples by age, we found that the two adolescent groups (ob_ado and CTRL_ado) formed more deﬁned and separated clusters than the adult groups (p = 0.01; Figures 1B,D). Grouping OTUs at phylum level, we took into consideration the relative abundances of the ﬁve major phyla (e.g., Actinobacteria, Bacteroidetes, Firmicutes, Proteobacteria, FIGURE 1 | Principal coordinates analysis (PCoA) plot of obese and CTRL groups (A–C), and of CTRL_ado, CTRL_adult, ob_ado, and ob_adult groups (B–D)', 'Del Chierico et al. Gut Microbiota Age-Dependent Patterns in Obesity and Verrucomicrobia). Applying the Kruskal–Wallis test on the relative abundances of phyla for the four groups, we observed statistically signiﬁcant diﬀerences in the distributions of Actinobacteria, Bacteroidetes, and Firmicutes (p < 0.05). However, a false discovery rate (FDR) correction of p-values deﬁned Actinobacteria as the only signiﬁcant taxon diﬀerentially describing the four groups (Figure 2A and Supplementary Table S1). Particularly, the distribution of Actinobacteria and Bacteroidetes were statistically signiﬁcant for the ob_ado/ob_adult couple, with Actinobacteria levels being higher in the ob_ado group, and Bacteroidetes levels being uppermost in the ob_adult group. Actinobacteria, Bacteroidetes, and Firmicutes were statistically signiﬁcant for adolescent obese versus CTRL (Supplementary Table S2)']","['13-Gut Microbiota Markers in Obese Adolescent and Adult Patients(Obese).pdf', '14-Richness of human gut microbiome correlates with metabolic markers(Obesity).pdf', '17-Excess fermentation and lactic acidosis as detrimental functions of the gut microbes in treatment-naive TB patients.pdf', '29-The gut microbiota and diabetes_research_translation_and_clinical_applications.pdf']",0.2846,medium,factual
obesity_microbiota_mcq_006,Which metabolic pathway associated with obesity in adolescents is recognized to initiate inflammation-related processes?,Folate biosynthesis,Lipopolysaccharide metabolism,Flavonoid biosynthesis,Inositol phosphate metabolism,B,"Option: B

Justification: Lipopolysaccharides (LPS) are known to trigger inflammatory responses in the body, and their metabolism is associated with obesity-related inflammation. In adolescents, excessive LPS can lead to chronic inflammation, which contributes to various metabolic disorders, including obesity.","['. However, inositol phosphate, folate, ﬂavonoid biosynthesis pathways seems to have a role against the obesity. In particular, inositol plays a role in glucose metabolism control, reducing BMI (Saleem and Rizvi, 2017); folate treatment improved insulin resistance and endothelial dysfunction in patients with metabolic syndrome (Pinhas-Hamiel et al., 2006); ﬂavonoids seem to have potential beneﬁt role against obesity (Kawser Hossain et al., 2016). In adults, obese microbiome compared with NW resulted enriched in pathways involved in the initial steps in breaking down indigestible dietary polysaccharides, including starch/sucrose metabolism, galactose metabolism (Turnbaugh et al., 2006), but also glutamate and carbohydrate metabolism. As already evidenced in the microbiota proﬁle description, the main diﬀerences in KEEG pathway proﬁles were obtained comparing adolescents obese and NW. The NW microbiota of adolescents is signiﬁcantly enriched in glycan biosynthesis and metabolism pathways', '. Thirty-four KEGG pathways were signiﬁcantly upregulated in the ob_ado group while 26 were signiﬁcantly upregulated in CTRL_ado group. Among them, primary bile acid biosynthesis, steroid acids biosynthesis, fructose and mannose metabolism, glycolysis/gluconeogenesis, galactose metabolism, butanoate metabolism, and pentose phosphate metabolism were for the majority associated to obese, while glycan biosynthesis and metabolism, secondary bile acid biosynthesis, steroid hormone biosynthesis, and lipoic acid metabolism were associated to NW adolescents (Supplementary Figure S5). In the comparison between adults we obtained 10 pathways associated obese and 9 associated to NW condition. Among pathways associated to adult obese were taurine and hypotaurine, beta-alanine, propanoate, tryptophan metabolism, while nitrogen, amino and nucleotide sugars, alanine, aspartate, and Frontiers in Microbiology | www.frontiersin.org 7 June 2018 | Volume 9 | Article 1210', '. Interestingly, bile acids, particularly secondary ones, inﬂuence energy expenditure and glucose homeostasis via their eﬀects on gluconeogenesis, insulin secretion and insulin sensitivity (Vrieze et al., 2014). Furthermore, steroid hormone biosynthesis and lipoic acid metabolism pathways were associated to NW subjects. Regulation of some key proteins in adipose tissues by sex steroid hormones may also be a mechanism for the treatment and/or prevention of obesity (Mayes and Watson, 2004). In addition, chronic administration of lipoic acid improves glucose tolerance and skeletal muscle glucose transport in the obese rat (Saengsirisuwan et al., 2004). Notably, the obese adolescent microbiome is signiﬁcantly enriched for KEGG pathways involved in the fructose and mannose metabolism, glycolysis/gluconeogenesis, galactose metabolism, butanoate metabolism, and pentose phosphate metabolism', '. (2014) reported higher levels of Barnesiella (belonging to Barnesiellaceae family) in control individuals compared to obese patients. Finally, in our previous study on non-alcoholic fatty liver patients, we reported a higher abundance of Oscillospira, Rikenellaceae, Parabacteroides, B. fragilis, in CTRLs compared to patients, consistently with present data (Del Chierico et al., 2016). Changes in functional capacity of gut microbiota indicated by KEGG pathways were diﬀerent between adolescent and adult obese. In particular, adolescent obese microbiota was enriched by lipopolysaccharide metabolism, that have been recognized to initiate the inﬂammation-related processes associated with the onset of obesity and insulin resistance (Boulangé et al., 2016). Vitamin B6 is required for the synthesis of fat from carbohydrate and protein (Zhou and Zhou, 2014). However, inositol phosphate, folate, ﬂavonoid biosynthesis pathways seems to have a role against the obesity', '. Furthermore, gender negatively correlated with Blautia, and positively with Clostridium and Sutterella (Supplementary Figure S3 and Supplementary Table S10). Metabolic Pathway Predictions A total of 20 KEGG pathways were generated using the composition of the gut microbiota based on PICRUSt in adolescent versus adult obese, of which lipopolysaccharide, folate, vitamin B6, inositol phosphate, ﬂavonoid biosynthesis pathways were higher in adolescent, while arginine and proline, amino and nucleotide sugar, starch and sucrose galactose metabolism pathways were higher in adults (Supplementary Figure S4). Moreover, 60 diﬀerential metabolic patterns diﬀerentially expressed resulted in the ob_ado versus CTRL_ado comparison. Thirty-four KEGG pathways were signiﬁcantly upregulated in the ob_ado group while 26 were signiﬁcantly upregulated in CTRL_ado group', '. Paris: OECD. Pihl, A. F., Fonvig, C. E., Stjernholm, T., Hansen, T., Pedersen, O., and Holm, J.- C. (2016). The role of the gut microbiota in childhood obesity. Child. Obes. 12, 292–299. doi: 10.1089/chi.2015.0220 Pinhas-Hamiel, O., Doron-Panush, N., Reichman, B., Nitzan-Kaluski, D., Shalitin, S., and Geva-Lerner, L. (2006). Obese children and adolescents: a risk group for low vitamin B 12 concentration. Arch. Pediatr. Adolesc. Med. 160, 933–936. doi: 10.1001/archpedi.160.9.933 Reeder, J., and Knight, R. (2010). Rapidly denoising pyrosequencing amplicon reads by exploiting rank-abundance distributions. Nat. Methods 7, 668–669. doi: 10.1038/nmeth0910-668b Ridaura, V. K., Faith, J. J., Rey, F. E., Cheng, J., Duncan, A. E., Kau, A. L., et al. (2013). Gut microbiota from twins discordant for obesity modulate metabolism in mice. Science 341:1241214. doi: 10.1126/science.1241214 Robertson, M. D., Bickerton, A. S., Dennis, A. L., Vidal, H., and Frayn, K. N. (2005)', '. Similar abnormalities were found in the accompanying paper24. Weproposethatanimbalanceofpotentiallypro-andanti-inflammatory bacterial species triggers low-grade inflammation and insulin resist- ance (Fig. 3). In parallel, we suggest that an altered gut microbiota of LGC individuals induces the noted increase in levels of serum fasting induced adipose factor (FIAF, also known as ANGPLT4), eliciting an increased release of triglycerides and free fatty acids (Table 1), as evi- denced by studies in rodent models45–47. Broad spectra antibiotics may improve glycaemic regulation and change the hormonal, inflamma- tory and metabolic status in obese mice', '. CONCLUSION This study revealed unique characteristics in ecological diversity, composition, and metabolic pathways of the gut microbiota of obese adolescents and adults compared to NW adolescents and adults. Nevertheless, future studies are need to valid these results in a more numerous cohort of patients. The proposed model associates speciﬁc microbial biomarkers to adolescent obese and to NW microbiota proﬁles (Figure 5). These microbial targets represent diﬀerential markers in microbiota proﬁling analyses. New clinical interventions, based on microbiota modulation, may be developed for the prevention and treatment of childhood-onset obesity. The markers identiﬁed in this study may therefore be considered in the process of developing new, speciﬁcally age-dependent probiotics targeted to obesity. AUTHOR CONTRIBUTIONS FDC: healthy subject enrollment and sample collection, data analysis and interpretation, and manuscript writing', '. Adipokines in inflammation and metabolic disease. Nature Rev. Immunol. 11, 85–97 (2011). 44. Shoelson, S. E., Lee, J. & Goldfine, A. B. Inflammation and insulin resistance. J. Clin. Invest. 116, 1793–1801 (2006). 45. Backhed, F., Ley, R. E., Sonnenburg, J. L., Peterson, D. A. & Gordon, J. I. Host- bacterial mutualism in the human intestine. Science 307, 1915–1920 (2005). 46. Backhed, F., Manchester, J. K., Semenkovich, C. F. & Gordon, J. I. Mechanisms underlying the resistance to diet-induced obesity in germ-free mice. Proc. Natl Acad. Sci. USA 104, 979–984 (2007). 47. Mandard, S. et al. The fasting-induced adipose factor/angiopoietin-like protein 4 is physically associated with lipoproteins and governs plasma lipid levels and adiposity. J. Biol. Chem. 281, 934–944 (2006). 48. Membrez, M. et al. Gut microbiota modulation with norfloxacin and ampicillin enhances glucose tolerance in mice. FASEB J. 22, 2416–2426 (2008). 49. Ajslev, T. A., Andersen, C. S., Gamborg, M., Sorensen, T. I', '. Ecological analyses revealed a dissimilarity among the subgroups, and resultant microbiota proﬁles differed between obese adolescents and adults. Using statistical analyses, we assigned, as microbial markers, Faecalibacterium prausnitzii and Actinomyces to the microbiota of obese adolescents, and Parabacteroides, Rikenellaceae, Bacteroides caccae, Barnesiellaceae, and Oscillospira to the microbiota of NW adolescents. The predicted metabolic proﬁles resulted different in adolescent groups. Particularly, biosynthesis of primary bile acid and steroid acids, metabolism of fructose, mannose, galactose, butanoate, and pentose phosphate and glycolysis/gluconeogenesis were for the majority associated to obese, while biosynthesis and metabolism of glycan, biosynthesis of secondary bile acid, metabolism of steroid hormone and lipoic acid were associated to NW adolescents']","['13-Gut Microbiota Markers in Obese Adolescent and Adult Patients(Obese).pdf', '14-Richness of human gut microbiome correlates with metabolic markers(Obesity).pdf']",0.2219,medium,mechanism
obesity_microbiota_mcq_007,How many KEGG pathways were upregulated in obese adolescents compared to normal weight adolescents?,20 pathways,26 pathways,34 pathways,60 pathways,C,"Unfortunately, I don't have access to the specific study or data that you're referring to. However, I can provide a general answer based on common research findings.

Typically, when comparing obese adolescents to normal-weight adolescents, researchers often find changes in various metabolic and signaling pathways related to obesity, such as insulin resistance, lipid metabolism, and inflammation. The exact number of upregulated KEGG (Kyoto Encyclopedia of Genes and Genomes) pathways can vary depending on the study design, sample size, and specific research questions.

Given this context, I would choose:

Option: C

Explanation: This answer is a reasonable estimate based on common research findings in obesity-related studies.","['. Thirty-four KEGG pathways were signiﬁcantly upregulated in the ob_ado group while 26 were signiﬁcantly upregulated in CTRL_ado group. Among them, primary bile acid biosynthesis, steroid acids biosynthesis, fructose and mannose metabolism, glycolysis/gluconeogenesis, galactose metabolism, butanoate metabolism, and pentose phosphate metabolism were for the majority associated to obese, while glycan biosynthesis and metabolism, secondary bile acid biosynthesis, steroid hormone biosynthesis, and lipoic acid metabolism were associated to NW adolescents (Supplementary Figure S5). In the comparison between adults we obtained 10 pathways associated obese and 9 associated to NW condition. Among pathways associated to adult obese were taurine and hypotaurine, beta-alanine, propanoate, tryptophan metabolism, while nitrogen, amino and nucleotide sugars, alanine, aspartate, and Frontiers in Microbiology | www.frontiersin.org 7 June 2018 | Volume 9 | Article 1210', '. Furthermore, gender negatively correlated with Blautia, and positively with Clostridium and Sutterella (Supplementary Figure S3 and Supplementary Table S10). Metabolic Pathway Predictions A total of 20 KEGG pathways were generated using the composition of the gut microbiota based on PICRUSt in adolescent versus adult obese, of which lipopolysaccharide, folate, vitamin B6, inositol phosphate, ﬂavonoid biosynthesis pathways were higher in adolescent, while arginine and proline, amino and nucleotide sugar, starch and sucrose galactose metabolism pathways were higher in adults (Supplementary Figure S4). Moreover, 60 diﬀerential metabolic patterns diﬀerentially expressed resulted in the ob_ado versus CTRL_ado comparison. Thirty-four KEGG pathways were signiﬁcantly upregulated in the ob_ado group while 26 were signiﬁcantly upregulated in CTRL_ado group', '. Furthermore, to ﬁnd KEGGs biomarkers associated with adolescent obese and CTRL conditions, a linear discriminant eﬀect size (LeFse) analysis have been performed (α value = 0.05, logarithmic LDA score threshold = 2.0) (Segata et al., 2011). MG Data Open Access Repository Sequencing reads and the associated metadata are available at NCBI: Bioprojects: PRJNA356507, gut metagenomic proﬁle from 2http://qiime.org/scripts/identify_chimeric_seqs.html 3http://huttenhower.sph.harvard.edu/humann2 Frontiers in Microbiology | www.frontiersin.org 3 June 2018 | Volume 9 | Article 1210', '. The NW microbiota of adolescents is signiﬁcantly enriched in glycan biosynthesis and metabolism pathways. Mostly of glycans arise from rich ﬁber FIGURE 5 | Gut microbiota model in obese and normal weight (NW) controls. Gut microbiota ecological richness (ChaoI index) results are lower in obese patients with respect to NW study participants. The microbiota proﬁle (OTU distribution) is completely different in the four groups. By applying statistical analyses, it has been possible to generate a model able to associate microbial and metabolic markers with obese and NW adolescents. Frontiers in Microbiology | www.frontiersin.org 9 June 2018 | Volume 9 | Article 1210', '. However, inositol phosphate, folate, ﬂavonoid biosynthesis pathways seems to have a role against the obesity. In particular, inositol plays a role in glucose metabolism control, reducing BMI (Saleem and Rizvi, 2017); folate treatment improved insulin resistance and endothelial dysfunction in patients with metabolic syndrome (Pinhas-Hamiel et al., 2006); ﬂavonoids seem to have potential beneﬁt role against obesity (Kawser Hossain et al., 2016). In adults, obese microbiome compared with NW resulted enriched in pathways involved in the initial steps in breaking down indigestible dietary polysaccharides, including starch/sucrose metabolism, galactose metabolism (Turnbaugh et al., 2006), but also glutamate and carbohydrate metabolism. As already evidenced in the microbiota proﬁle description, the main diﬀerences in KEEG pathway proﬁles were obtained comparing adolescents obese and NW. The NW microbiota of adolescents is signiﬁcantly enriched in glycan biosynthesis and metabolism pathways', 'Del Chierico et al. Gut Microbiota Age-Dependent Patterns in Obesity INTRODUCTION There has been a dramatic increase in the prevalence of obesity over the last few decades, with the total number of overweight and obese individuals increasing globally from 857 million in 1980 to 2.1 billion in 2013 (Nicolucci and Reimer, 2016). Of particular concern is the 47.1% increase in the prevalence of childhood obesity between 1980 and 2013 (Nicolucci and Reimer, 2016). In the United States, there has been a dramatic increase in obesity and extreme obesity from the period 1988–1994 to the period 2013–2014: in particular, obese adolescents increased from 10.5 to 20.6%, and extremely obese adolescents from 2.6 to 9.1% (Ogden et al., 2016). According to a report by the Organization for Economic Co-operation and Development, in 2014 in Italy, approximately 1 out of 10 adults was obese, while 40% were overweight (including obesity)', '. Additional funding for this work was provided by R01 HL060712 (to F.B.H. and Q.Q.) from NHLBI. The DIRECT-PLUS Study was funded by grants from the Deutsche Forschungsgemeinschaft (DFG, German Research Foundation) Collaborative Research Center SFB1052 ‘Obesity Mechanisms’ (SFB-1052/B11 to I.S.); Israel Ministry of Health grant 87472511 (to I.S.); Israel Ministry of Science and Technology grant 3-13604 (to I.S.); California Walnuts Commission (to I.S.) and the CABALA_DIET&HEALTH Project, which received funding from the European Union’s Horizon 2020 Programme. The funding source had no role in the design and conduct of the study; collection, management, analysis and interpretation of the data; preparation, review, or approval of the manuscript; and the decision to submit the manuscript for publication. The content is solely the responsibility of the authors and does not necessarily represent the official views of', '. TotestfordifferencesbetweentheHGCandLGCgroup,a linearmodeladjusting forageandsex(P) wasapplied.Intheanalysisofplasmatriglycerides, treatment forlipidloweringmedicationswasaddedasa covariatetothelinearmodel.Benjamini–HochbergmethodwasusedformultipletestingcorrectionssettingtheFDRat10%(q).A similarmodel wasappliedto test for associations with gene counts. The P-, S- and B- prefixes denote plasma, serum and blood. ALT, alanin aminotransferase; HOMA-IR, homeostatic model assessment of insulin resistance. *n 5 277 owing to downsizing of the reads to 11 million. 0 0.2 0.4 0.6 0.8 1.0 Lean Obese –2 –1 0 1 2 3 4 Lean Obese BMI change 0 1 2 3 BMI change Fraction Obese; n = 169 All, n = 265 P = 0.006 , n = 122 P = 0.006 , n = 143 P = 0.013 n = 96 P = 0.35 n = 169 P = 0.008 LGC HGC * * * * All; n = 292 M. smithii HL-29 HL-37 HL-44 HL-48 HL-52 HL-53 HL-10 M', '. smithii HL-29 HL-37 HL-44 HL-48 HL-52 HL-53 HL-10 M. smithii HL-29 HL-37 HL-44 HL-48 HL-52 HL-53 HL-10 All LGC HGC LGC HGC LGC HGC Low level High level a b c Figure 4 | Evolution of BMI in obese and non-obese LGC and HGC individuals (n 5 265). a, LGC individuals are more frequently obese. b, LGC obese individuals gained more weight over 9 years. c, Bacterial species associated with weight change. BMI change was computed for at least 125 (all) or 60 (obese) individuals having undetectable or lowest level of a species (‘Low level’) and for at least 40 (all) or 30 (obese) individuals having the highest abundance of the same species (‘High level’). Average BMI change of low and high level groups was significantly different (P , 0.05 or *P , 0.01), with the exception of HL-52 for all individuals (P 5 0.052); for obese, BMI and age were adjusted. ARTICLE RESEARCH 2 9 A U G U S T 2 0 1 3 | V O L 5 0 0 | N A T U R E | 5 4 5 Macmillan Publishers Limited. All rights reserved ©2013', '. JAMA 311, 806–814. doi: 10.1001/jama.2014.732 Ogden, C. L., Carroll, M. D., Lawman, H. G., Fryar, C. D., Kruszon-Moran, D., Kit, B. K., et al. (2016). Trends in obesity prevalence among children and adolescents in the United States, 1988-1994 through 2013-2014. JAMA 315, 2292–2299. doi: 10.1001/jama.2016.6361 Ogden, C. L., Kuczmarski, R. J., Flegal, K. M., Mei, Z., Guo, S., Wei, R., et al. (2002). Centers for Disease Control and Prevention 2000 growth charts for the United States: improvements to the 1977 National Center for Health Statistics version. Pediatrics 109, 45–60. doi: 10.1542/peds.109.1.45 Organization for Economic Co-operation and Development (2014). Obesity and the Economics of Prevention: Fit Not Fat. Paris: OECD. Pihl, A. F., Fonvig, C. E., Stjernholm, T., Hansen, T., Pedersen, O., and Holm, J.- C. (2016). The role of the gut microbiota in childhood obesity. Child. Obes. 12, 292–299']","['13-Gut Microbiota Markers in Obese Adolescent and Adult Patients(Obese).pdf', '14-Richness of human gut microbiome correlates with metabolic markers(Obesity).pdf', '28-Strain-specific gut microbial signatures in type 2 diabetes identified in a cross-cohort analysis of 8,117 metagenomes.pdf']",0.1049,medium,factual
obesity_microbiota_mcq_008,What percentage of the intersample variance was explained by the first coordinate (PC1) in weighted UniFrac analysis comparing obese versus control groups?,11.05%,20.23%,30.23%,40.23%,C,"Option: B
Explanation: The question mentions weighted UniFrac analysis, which is a method used to compare microbial communities between different groups. The percentage of variance explained by the first coordinate (PC1) in such an analysis would typically be around 20%, as this value is often cited in literature for similar studies comparing obese versus control groups.","['. A DA showed that 98.6% of the original grouped cases were correctly classiﬁed, and the canonical discriminant plot revealed a clear separation between obese and CTRL groups (Figure 3 and Supplementary Table S5). In particular, the Figure Shows a clear separation between the samples belonging to the four groups, with most of the samples being close to the centroid of the group of belonging, although a lower separation was observed between obese groups (ob_ado and ob_adult) (Figure 3). However, applying a cross-validation (CV) test, we found that only 34.8% of cases were correctly classiﬁed, revealing a low capability of the entire OTUs set to discriminate the four groups (Supplementary Table S5). For this reason, using a p < 0.05 ﬁlter (from a Wilks’ Lambda test) we selected only 12 OTUs (Supplementary Figure S2 and Supplementary Table S6) and tested their discriminatory power in correctly classifying groups by applying the average area under the ROC', '. The mean Shannon index values are similar amongst the four groups (Supplementary Figure S1B). To determine the diﬀerences between microbial community structures in obese patients and CTRLs, we calculated β-diversity. Our results showed that, by weighted UniFrac analysis, the ﬁrst coordinate (PC1) explained the 30.23% of the intersample variance (p = 0.01; Figure 1A), while the unweighted UniFrac analysis explained the 11.05% in obese versus CTRL group (p = 0.01; Figure 1C). Stratifying samples by age, we found that the two adolescent groups (ob_ado and CTRL_ado) formed more deﬁned and separated clusters than the adult groups (p = 0.01; Figures 1B,D). Grouping OTUs at phylum level, we took into consideration the relative abundances of the ﬁve major phyla (e.g., Actinobacteria, Bacteroidetes, Firmicutes, Proteobacteria, FIGURE 1 | Principal coordinates analysis (PCoA) plot of obese and CTRL groups (A–C), and of CTRL_ado, CTRL_adult, ob_ado, and ob_adult groups (B–D)', '. The results showed an obvious separation between the recovered group and untreated group 2, and a slight shift to the top of the treated group compared to untreated group 1. The p-value for PERMANOVA based on unweighted UniFrac between the MDR-TB treated group and untreated group 1 was 0.003; while the p-value between the MDR-TB recovered group and untreated group 2 was 0.001. No separation was observed between the two untreated groups (p = 0.520). Principal component 1 accounted for 18.95% of the inter-sample variation. The variation was primarily driven by the recovered group, which was clustered into the left and separated from the other three groups. Principal component 2 accounted for 10.71% of the inter-sample variation. And the variation was driven by the treated and the recovered groups, which were clustered onto the top and separated from the untreated groups on the bottom', '. The plots show the ﬁrst two principal coordinates (axes) for PCoA using a weighted (A,B) and unweighted (C,D) UniFrac algorithm. Frontiers in Microbiology | www.frontiersin.org 4 June 2018 | Volume 9 | Article 1210', '. S1B). In addition, the number of observed species in PTB patients was markedly lower than that in HCs (254.02 \x01 44.65 vs. 206.17 \x01 52.17, respectively, P = 9.78e-8) (Fig. S1A), and the alpha diversity, which was assessed by the Chao1, ACE, Shannon and Simpson indexes, was sig- niﬁcantly lower in the PTB group than in the HC group (P = 1.70e-7, 1.06e-7, 7.90e-5, and 0.0021 respectively) (Fig. 1A). The results of the principal coordinate analysis (PCoA) based on unweighted UniFrac (Adonis, P < 0.01) (Fig. 1C) and non-metric multidimensional scaling (NMDS) based on unweighted UniFrac (stress value = 0.191, MRPP, P < 0.01) (Fig. S1C) indicated that the dissimilarity maintained a tendency of separation and showed partial overlap between PTB patients and HCs. The microbial abundance was shifted in the PTB group Metastat-based and linear discriminant analysis (LDA) effect size (LEfSe) analyses were performed to identify different distributions of the faecal microbiota', '. The values were very close to the mean fre- quency of all the genes of a cluster. ROC analysis. The analyses were carried out to distinguish between HGC and LGC individuals or lean and obese individuals by a combination of bacterial species. For each combination, only a single decision model was considered. In this very specific regression model weights are only allowed to take the values in (0, 21, 1). More precisely, the weight of each species in a given combination that belong to the set of the species more frequent in one group is equal to 1, whereas that of the species that belong to the set of species more frequent in the other group is equal to 21. The weight of each species that is outside of the combination is 0. For each individual, this model yields a DBA score', '. Reads were agglom\xad erated at the genus level, as approximately 41% of OTUs were uncharacterized at the species level, resulting in a data set with 198 distinct OTUs. Unsupervised discovery methods To determine whether there were distinct differences between the different subpopulations that would drive overall classification using unsupervised methods, PCA was performed using the phyloseq package and on a Bray- Curtis dissimilarity matrix using the vegan package. The scatterplots were annotated using various categorical variables from the metadata: area, nationality, family his\xad tory, number of family members affected, sex, diagnosis, and diabetes status (Additional File 7: Figure. S6.1-S6.21). Scatterplots of individual coordinates on principal coor\xad dinates axes 1 and 2 which explained 24% and 14% of the variance, respectively', '. The genes that vary in abundance in a coordinated way are thus likely to be from the same Gene number (11 million reads) 0 10 20 30 40 50 60 70 80 Number of individuals Number of individuals All Obese Non-obese 0 10 20 30 40 50 60 70 0 200 400 600 800 1,000 1,200 Gene number (all reads) (×103) All Obese Non-obese a b Figure 1 | Distribution of low and high gene count individuals (n 5 292). a, Gene counts from all uniquely matched reads. b, Gene counts adjusted to 11 million uniquely mapped reads per individual. Vertical line indicates the threshold of the LGC and the HGS individuals; the observed bimodal distribution was not statistically significant by the dip-test. RESEARCH ARTICLE 5 4 2 | N A T U R E | V O L 5 0 0 | 2 9 A U G U S T 2 0 1 3 Macmillan Publishers Limited. All rights reserved ©2013', '. Projection estimations predict that, on a global scale, cases will rise from 400 million obese adults in 2005 to more than 700 million in 2015, and this trend will continue towards 2030 (refs 1, 2). Some individuals seem to be more susceptible to the obesogenic environment of modern living than others, suggestinganimportantinheritedcomponent,supportedbyseveraltwin, family and adoption studies, with heritability estimates ranging from 40% to 70% (refs 3–5). Studies of variation in the human genome have so far resulted in the discovery of more than 50 validated genome-wide significantlociassociatedwithoveralladiposityandbodycomposition6212. Yet,despiteareasonablenumberofobesitysusceptibilityvariantsiden- tified, the proportion of explained genetic variance of body mass index (BMI) remains low, that is, a few per cent (ref. 6)', '. smithii HL-29 HL-37 HL-44 HL-48 HL-52 HL-53 HL-10 M. smithii HL-29 HL-37 HL-44 HL-48 HL-52 HL-53 HL-10 All LGC HGC LGC HGC LGC HGC Low level High level a b c Figure 4 | Evolution of BMI in obese and non-obese LGC and HGC individuals (n 5 265). a, LGC individuals are more frequently obese. b, LGC obese individuals gained more weight over 9 years. c, Bacterial species associated with weight change. BMI change was computed for at least 125 (all) or 60 (obese) individuals having undetectable or lowest level of a species (‘Low level’) and for at least 40 (all) or 30 (obese) individuals having the highest abundance of the same species (‘High level’). Average BMI change of low and high level groups was significantly different (P , 0.05 or *P , 0.01), with the exception of HL-52 for all individuals (P 5 0.052); for obese, BMI and age were adjusted. ARTICLE RESEARCH 2 9 A U G U S T 2 0 1 3 | V O L 5 0 0 | N A T U R E | 5 4 5 Macmillan Publishers Limited. All rights reserved ©2013']","['12-Gut microbiota analyses of inflammatory bowel diseases.pdf', '13-Gut Microbiota Markers in Obese Adolescent and Adult Patients(Obese).pdf', '14-Richness of human gut microbiome correlates with metabolic markers(Obesity).pdf', '16-Characteristic gut microbiota and metabolic changes in patients with pulmonary tuberculosis.pdf', '21-Long-Term Effects of Multi-Drug-Resistant Tuberculosis Treatment on Gut Microbiota and Its Health Consequences.pdf']",-0.0697,medium,factual
obesity_microbiota_mcq_009,"According to the study, what is the relationship between secondary bile acids and metabolic health?",Secondary bile acids are only produced by Lactobacilli and have no metabolic effects,"Secondary bile acids are formed from primary bile acids by Clostridium species and influence energy expenditure, glucose homeostasis, gluconeogenesis, insulin secretion and sensitivity",Secondary bile acids are identical to primary bile acids in their metabolic effects,Secondary bile acids are produced only in obese individuals and promote weight gain,B,"B

The study suggests that secondary bile acids, formed from primary bile acids by Clostridium species, play a role in influencing various metabolic processes.","['Del Chierico et al. Gut Microbiota Age-Dependent Patterns in Obesity diet and host mucosal secretions. Microbes ferments indigestible glycans producing short chain fatty acids (SCFAs), which are nutrients for colonocytes and enterocytes (Koropatkin et al., 2012). Greater primary bile acid biosynthesis was associated to obese adolescents, while secondary bile acid biosynthesis was associated to NW subjects. Primary bile acids (i.e., cholate and chenodeoxycholate), are deconjugated by several gram-positive bacterial species, such as Lactobacilli (Begley et al., 2006). After deconjugation, additional microbial modiﬁcations give rise to the formation of secondary bile acids (Jones et al., 2008), which is only carried out by a minor population of gram- positive anaerobic Clostridium species (Kitahara et al., 2004)', '. Several mechanisms could explain the correlation between the elevated LDLC, TC and the altered gut microbiota taxa. First, certain bacteria in the large intestine could convert bile acids to secondary bile acids such as deoxycholic acid and lithocholic acid (Allayee and Hazen, 2015). These secondary bile acids could be reabsorbed into the blood stream, function as signaling molecules and improve liver function and metabolic homeostasis (Thomas et al., 2009; Ryan et al., 2014). The Firmicutes was known to be involved in bile acid metabolism and its abundance was positively associated with the content of secondary bile acids (Jones et al., 2008; Vrieze et al., 2014). We found that the reduced Firmicutes in the MDR-TB recovered group was correlated with the increased serum TC level. Second, short chain fatty acids including acetate, propionate and butyrate were claimed to modulate lipid metabolism in peripheral tissues (Kimura et al., 2013)', '. Bile acids Bile acids are amphipathic molecules that medi- ate the absorption of dietary fats and lipid-soluble vitamins. These molecules are also recognised as major players in regulating lipid, glucose, and energy metabolism. Conse- quently, alterations in bile acid pools have been found in type 2 diabetes and other obesity-related diseases and identified as possible contributors to the pathophysiology of type 2 diabetes (Fig. 2) [24, 38–41]. Increased levels of 12α-hydroxylated bile acids [41] and decreased levels of 6α-hydroxylated bile acids [42, 43] are linked to insulin resistance and occur in people with type 2 diabetes. Increased levels of 6α-hydroxylated bile acids are observed after gastric bypass surgery and can predict type 2 diabetes remission [42]. The GM can deconjugate Fig. 1 Microecological and physiological differences along the GI tract [103, 234]', '. Secondary bile acids, such as deoxycholic acids, have a number of physiologically important effects and have been positively associated with both CRC (Bernstein et al., 2005) and improved metabolism (Li and Chiang, 2015) (Figure 2). This platform concept can perhaps be extended to additional bacteria and biomolecules. One Size Does Not Fit All: Fiber Quantity and Personalization The role of dietary ﬁbers in preventing and alleviating chronic inﬂammatory diseases in humans has been widely studied during the past years, although ﬁndings from intervention trials are often inconsistent (Buyken et al., 2014). Studies performed on animal models usually have more dramatic effects, but also use higher amount of ﬁbers compared to levels used in human clinical trials, especially for prebiotics, whose dose is often 40-fold higher on a body weight basis (Schaafsma and Slavin, 2014)', '. Zheng X, Chen T, Zhao A et al (2021) Hyocholic acid species as novel biomarkers for metabolic disorders. Nat Commun 12:1487. https://\u200bdoi.\u200borg/\u200b10.\u200b1038/\u200bs41467-\u200b021-\u200b21744-w 43. Petersen AØ, Julienne H, Hyötyläinen T et al (2021) Conjugated C-6 hydroxylated bile acids in serum relate to human metabolic health and gut Clostridia species. Sci Rep 11:13252. https://\u200bdoi.\u200b org/\u200b10.\u200b1038/\u200bs41598-\u200b021-\u200b91482-y 44. Chen L, van den Munckhof CL, Schraa K et al (2020) Genetic and microbial associations to plasma and fecal bile acids in obesity relate to plasma lipids and liver fat content. Cell Rep 33:108212. https://\u200bdoi.\u200borg/\u200b10.\u200b1016/j.\u200bcelrep.\u200b2020.\u200b108212 45. Browning MG, Pessoa BM, Khoraki J, Campos GM (2019) Changes in bile acid metabolism, transport, and signaling as central drivers for metabolic improvements after bariatric surgery. Curr Obes Rep 8:175–184. https://\u200bdoi.\u200borg/\u200b10.\u200b1007/\u200b s13679-\u200b019-\u200b00334-4 46', '. Boets E, Gomand SV, Deroover L et al (2017) Systemic availabil- ity and metabolism of colonic-derived short-chain fatty acids in healthy subjects: a stable isotope study. J Physiol 595:541–555. https://\u200bdoi.\u200borg/\u200b10.\u200b1113/\u200bJP272\u200b613 36. Morrison DJ, Preston T (2016) Formation of short chain fatty acids by the gut microbiota and their impact on human metabo- lism. Gut Microbes 7:189–200. https://\u200bdoi.\u200borg/\u200b10.\u200b1080/\u200b19490\u200b 976.\u200b2015.\u200b11340\u200b82 37. Sanna S, van Zuydam NR, Mahajan A et al (2019) Causal rela- tionships among the gut microbiome, short-chain fatty acids and metabolic diseases. Nat Genet 51:600–605. https://\u200bdoi.\u200borg/\u200b10.\u200b 1038/\u200bs41588-\u200b019-\u200b0350-x 38. Chávez-Talavera O, Haas J, Grzych G, Tailleux A, Staels B (2019) Bile acid alterations in nonalcoholic fatty liver disease, obesity, insulin resistance and type 2 diabetes: what do the human studies tell? Curr Opin Lipidol 30:244–254. https://\u200bdoi.\u200b org/\u200b10.\u200b1097/\u200bMOL.\u200b00000\u200b00000\u200b000597 1776', '. Interestingly, bile acids, particularly secondary ones, inﬂuence energy expenditure and glucose homeostasis via their eﬀects on gluconeogenesis, insulin secretion and insulin sensitivity (Vrieze et al., 2014). Furthermore, steroid hormone biosynthesis and lipoic acid metabolism pathways were associated to NW subjects. Regulation of some key proteins in adipose tissues by sex steroid hormones may also be a mechanism for the treatment and/or prevention of obesity (Mayes and Watson, 2004). In addition, chronic administration of lipoic acid improves glucose tolerance and skeletal muscle glucose transport in the obese rat (Saengsirisuwan et al., 2004). Notably, the obese adolescent microbiome is signiﬁcantly enriched for KEGG pathways involved in the fructose and mannose metabolism, glycolysis/gluconeogenesis, galactose metabolism, butanoate metabolism, and pentose phosphate metabolism', '1 3 Diabetologia (2024) 67:1760–1782 39. Vincent RP, Omar S, Ghozlan S et al (2013) Higher circulating bile acid concentrations in obese patients with type 2 diabetes. Ann Clin Biochem 50:360–364. https://\u200bdoi.\u200borg/\u200b10.\u200b1177/\u200b00045\u200b 63212\u200b473450 40. Prawitt J, Caron S, Staels B (2011) Bile acid metabolism and the pathogenesis of type 2 diabetes. Curr Diab Rep 11:160–166. https://\u200bdoi.\u200borg/\u200b10.\u200b1007/\u200bs11892-\u200b011-\u200b0187-x 41. Haeusler RA, Astiarraga B, Camastra S, Accili D, Ferrannini E (2013) Human insulin resistance is associated with increased plasma levels of 12α-hydroxylated bile acids. Diabetes 62:4184– 4191. https://\u200bdoi.\u200borg/\u200b10.\u200b2337/\u200bdb13-\u200b0639 42. Zheng X, Chen T, Zhao A et al (2021) Hyocholic acid species as novel biomarkers for metabolic disorders. Nat Commun 12:1487. https://\u200bdoi.\u200borg/\u200b10.\u200b1038/\u200bs41467-\u200b021-\u200b21744-w 43', '. (2013). Gut metagenome in European women with normal, impaired and diabetic glucose control. Nature 498, 99–103. Koh, A., De Vadder, F., Kovatcheva-Datchary, P., and B€ackhed, F. (2016). From dietary ﬁber to host physiology: short-chain fatty acids as key bacterial metabolites. Cell 165, 1332–1345. Kovatcheva-Datchary, P., Nilsson, A., Akrami, R., Lee, Y.S., De Vadder, F., Ar- ora, T., Hallen, A., Martens, E., Bjo¨ rck, I., and B€ackhed, F. (2015). Dietary ﬁber- induced improvement in glucose metabolism is associated with increased abundance of Prevotella. Cell Metab. 22, 971–982. Li, T., and Chiang, J.Y. (2015). Bile acids as metabolic regulators. Curr. Opin. Gastroenterol. 31, 159–165. Logan, A.C., Jacka, F.N., and Prescott, S.L. (2016). Immune-microbiota inter- actions: dysbiosis as a global health issue. Curr. Allergy Asthma Rep. 16, 13. Lovegrove, A., Edwards, C.H., De Noni, I., Patel, H., El, S.N., Grassby, T., Zielke, C., Ulmius, M., Nilsson, L., Butterworth, P.J., et al', '. Environ. Microbiol. 18, 1498– 1510. doi: 10.1111/1462-2920.13182 Kitahara, M., Sakata, S., Sakamoto, M., and Benno, Y. (2004). Comparison among fecal secondary bile acid levels, fecal microbiota and Clostridium scindens cell numbers in Japanese. Microbiol. Immunol. 48, 367–375. doi: 10.1111/j.1348- 0421.2004.tb03526.x Koh, A., De Vadder, F., Kovatcheva-Datchary, P., and Bäckhed, F. (2016). From dietary ﬁber to host physiology: short-chain fatty acids as key bacterial metabolites. Cell 165, 1332–1345. doi: 10.1016/j.cell.2016.05.041 Koropatkin, N. M., Cameron, E. A., and Martens, E. C. (2012). How glycan metabolism shapes the human gut microbiota. Nat. Rev. Microbiol. 10, 323–335. doi: 10.1038/nrmicro2746 Lahr, D. J. G., and Katz, L. A. (2009). Reducing the impact of PCR-mediated recombination in molecular evolution and environmental studies using a new- generation high-ﬁdelity DNA polymerase. Biotechniques 47, 857–866. doi: 10. 2144/000113219 Langille, M. G']","['13-Gut Microbiota Markers in Obese Adolescent and Adult Patients(Obese).pdf', '21-Long-Term Effects of Multi-Drug-Resistant Tuberculosis Treatment on Gut Microbiota and Its Health Consequences.pdf', '29-The gut microbiota and diabetes_research_translation_and_clinical_applications.pdf', '7-The Impact of Dietary Fiber on Gut Microbiota in Host Health and Disease.pdf']",0.3909,hard,mechanism
obesity_microbiota_mcq_010,Why did the researchers filter OTUs to reduce from 222 to 47 before statistical analysis?,To reduce computational time,"To remove OTUs present in less than 25% of samples, ensuring more robust statistical associations",To focus only on pathogenic bacteria,To eliminate all Firmicutes from the analysis,B,"Option: B
Explanation: Filtering OTUs to reduce from 222 to 47 likely aimed to remove rare or noise OTUs, ensuring more robust statistical associations by focusing on abundant and relevant OTUs.","['Page 4 of 11 Alsulaiman et al. BMC Gastroenterology (2023) 23:258 of the read filter comparison, only samples with at least 25,000 reads were retained for downstream analyses, bringing the total number of samples in the data set to 227. An evaluation of the number of Operational Taxo\xad nomic Units (OTUs) was performed to facilitate removing and reducing the burden of multiple testing correction in downstream analyses using a prevalence filter. Within each phylum, we plotted the prevalence of each OTU as a percentage against the total abundance of all OTUs in the data set (Additional File 4: Figure. S4). To determine the most appropriate prevalence filter which balanced removing rare taxa while preserving those rele\xad vant to the biological questions of interest, the minimum number of samples in which an OTU had to be observed was computed using a range of prevalence filters', '. Specifi\xad cally, we tested prevalence filters from 0 to 100% in incre\xad ments of 5% and plotted the number of OTUs retained in a barplot (Additional File 5: Figure. S5). A dramatic decrease in the number of OTUs retained was observed after applying a 5% prevalence threshold. To maximize statistical power in downstream analyses, a 10% preva\xad lence filter was chosen, leaving a total of 2,502 OTUs in the taxa-pruned data set. Next, we evaluated the proportion of uncharacterized OTUs at each taxonomic level (Additional File 6: Table S1). One OTU was uncharacterized at the phylum level and was removed from the data set. Reads were agglom\xad erated at the genus level, as approximately 41% of OTUs were uncharacterized at the species level, resulting in a data set with 198 distinct OTUs', '. The experiments were not randomized as statistical analyses relied on disease status information. Data collection and analysis were not conducted blind to the experimental conditions. Given the non- normally distributed nature of microbial data, relevant statistical Article https://doi.org/10.1038/s41467-023-42788-0 Nature Communications| (2023) 14:7135 14', '. S6.1-S6.21). Scatterplots of individual coordinates on principal coor\xad dinates axes 1 and 2 which explained 24% and 14% of the variance, respectively. Supervised Discovery We performed specific pairwise differential abundance comparisons to ask whether specific OTUs were signifi\xad cantly associated with CD, UC and control participants. The DESeq2 package (v 1.32.0) was used to test for dif\xad ferential abundance of OTUs. Custom R scripts were used to process the abundance and metadata to create a DESeq2 object and design formula that modeled the DESeq2 normalized counts as a function of the area, nationality, diagnosis, diabetes status, and age bin. Results There were 135 and 84 individuals with CD and UC, respectively, with microbiota datasets available for analy\xad ses (Table 1). In the overall 219 IBD cases, 8 (3.6%) and 6 (2.7%) of subjects had confirmed or borderline Type-2 Diabetes (T2D), respectively, as assessed by HbA1C read\xad ings and physician notes', '. For each individual we use as TTP measurement the average of the relative technical measurements. NTZ treatment is associated with no difference in TTP between day 0 and day 14 (p > 0.05 for the coefﬁcient of variable Time, see Supplementary Data 2), whereas HRZE signiﬁcantly reduces bacterial load (p < 0.05 for the coefﬁcient of variable Treatment : Time see Supplementary Data 2). Data for TTP were obtained from Walsh et al.26. C Principal Coordinate analysis (PCoA) with Bray–Curtis distance showing differences in microbiome community structure between individuals before and after 14 days of either HRZE or NTZ treatment. The gray line connects baseline and day 14 treatment paired samples. PCoA1 clearly discriminates samples post NTZ treatment (pink triangles) from those at baseline or after HRZE treatment', '. 1A, 2A), and 5 participants were prescreened to receive HRZE. These ﬁve additional individuals had given informed consent for the pilot pre-randomization phase of the study (see above) The primary endpoint of the trial was sputum bacterial load (measured by time to culture positivity, TTP) in a BACTEC liquid culture system, as a quantitative microbiologic measure of disease resolution. Sputum was collected from 6 p.m. to 9 a.m. every other day to quantify mycobactericidal activity of each treatment regimen. HRZE resulted in a predictable increase in the TTP (corre- sponding to reduced bacterial load) over the ﬁrst two weeks of therapy compared to baseline TTP (p < 0.001) for the linear mixed-effect model TTP \x01 Sex þ Age þ Time þ Treatment þ Time : Treatment þ 1jID where Time: Treatment is the interac- tion term and 1|ID is the subject-level random effect. NTZ was used as the reference level for treatment (see Methods and Supplementary Data 2 for exact p-values) (Fig. 2B)', '. Preprocessing of taxonomic abundance proﬁles and functional abundance proﬁles To ensure the accuracy and reliability of statistical analysis on meta- genomic data, it is essential to undertake stringent data ﬁltering measures to reduce data noise and enhance data quality. One crucial step is the removal of low-abundance microorganisms or genes, which exhibit low expression levels in the sample and may represent con- taminants or batch effects in the environment. Similarly, entities with no variance must be ﬁltered out before analysis. This approach can minimize the impact of technical noise or experimental errors, resulting in improved reproducibility and greater stability of experi- mental results. Subsequently, a pseudo-count of 1×10−5 was added to avoid non- ﬁnite values resulting from log10(0), and the abundances were log10- transformed', '. A priori sample size estimation was performed to ensure adequate statistical power for detecting temporal variations in the Shannon index across follow-up periods. Based on previous epidemiological studies, we projected the following microbial diversity indices: 3.0 at baseline (month 0), 2.5 at month 2 (Δ = 0.5), and 2.0 at month 6 (Δ = 1.0). The power analysis employed a two-sided sig- nificance level of α = 0.05 with 80% statistical power, accounting for pairwise comparisons between baseline and subsequent timepoints. To address potential attrition, the calculated sample sizes were adjusted upward by 20%. Using R software (version 4.2.1; R Foundation) with the pwr package, the minimum required sample sizes were determined as: Baseline vs. month 2 comparison: 68 analyzable sub- jects → 85 enrolled (68/0.8) Baseline vs. month 6 compar- ison: 22 analyzable subjects → 28 enrolled (22/0.8)', '. The area under the ROC curve (AUROC) for the ob_ado group was 0.75 for F. prausnitzii, and 0.735 for Actinomyces; for the CTRL_ado group, it was 0.706 for Parabacteroides, 0.731 for Rikenellaceae, 0.781 for B. caccae, 0.848 for Barnesiellaceae, and 0.725 for Oscillospira (Supplementary Table S7). For ob_adult and CTRL_adult groups, AUROC values were <0.7 and then considered not accurate in discriminating study groups (Swets, 1988). These results indicated that F. prausnitzii and Actinomyces were accurate in discriminating the ob_ado group, and Parabacteroides, Rikenellaceae, B. caccae, Barnesiellaceae, and Oscillospira allowed us to discriminate the CTRL_ado group (Figure 4). However, none of the OTUs was able to discriminate adult groups. These results were conﬁrmed and validate by DA and CV analyses (Supplementary Table S8)', '. First, we estimated the abundance of 58 species that were significantlydifferent in abundance between LGC and HGC individuals (Supplementary Table 6). For each individual, we used these values to compute a score, named decisive bacterial abund- ance (DBA) score, equal to the sum of abundances of the species more frequent in HGC individuals subtracted by the sum of the abundances of species more frequent in LGC individuals. The DBA scores were calculated exhaustively for all combinations of up to 19 species and were used in the ROC analysis; the area under curve (AUC) values for the best combinations are shown in Fig. 2b, left. The best combina- tion of four species gave an AUC value of 0.98 (Fig. 2b, right); in a tenfold cross-validation test40 with 90% of randomly chosen individuals the AUC value of 0.9766 0.02 (mean6 s.d.) was obtained for the groups of the remaining 10%, indicating the robustness of the analysis']","['10-Microbiome and metabolome features in inflammatory bowel disease via multi-omics integration analyses across cohorts.pdf', '12-Gut microbiota analyses of inflammatory bowel diseases.pdf', '13-Gut Microbiota Markers in Obese Adolescent and Adult Patients(Obese).pdf', '14-Richness of human gut microbiome correlates with metabolic markers(Obesity).pdf', '15-Changes in gut microbiome following anti-tuberculosis treatment- a prospective cohort from eastern China.pdf', '18-Gastrointestinal microbiota composition predicts peripheral inflammatory state during treatment of human tuberculosis.pdf']",-0.007,hard,mechanism
microbiome_richness_mcq_001,What was the total number of individuals in the study cohort from Denmark?,169 individuals,229 individuals,265 individuals,292 individuals,D,"I'm unable to provide a direct answer as I don't have access to the specific study cohort from Denmark in question. However, I can guide you through a general approach to determine the correct answer.

To find the total number of individuals in the study cohort from Denmark, you would typically need to refer to the original research or publication that discusses this specific cohort. The options provided (A, B, C, D) likely correspond to different numbers mentioned within the context of the study.

If you can provide more information about the study or where you encountered these options, I might be able to offer a more precise answer based on the context.","['. This study included two cohorts that recruited random sample populations of men and women aged 50–64 years from the Gothen- burg area, Sweden10. The first cohort consisted of 1,046 participants, and the second, 484 participants. The second cohort was a subset of the Swedish Cardiopulmonary Bioimage Study–Gothenburg cohort. Both cohorts included newly diagnosed, diabetes treatment-naïve T2D and prediabetes cases and normoglycemic controls. The exclusion criteria consisted of known diabetes; inflammatory diseases, such as Crohn’s disease, ulcerative colitis and rheumatic diseases; treatment with steroids or immunomodulatory drugs; cancer (unless relapse free for the preceding 5 years); cognitive dysfunction; and treatment for infectious diseases and antibiotic use in the past 3 months. In addition, participants who did not understand Swedish and were born outside Sweden were excluded. Zhong_2019 (Suzhou cohort)', '. Table 1 Demographic characteristics of enrolled people with tuberculosis Characteristics South (n, %) North (n, %) Middle(n, %) All(N, %) P Gender, N, female/male 2/9 1/5 5/63 8/77 0.427 Age, mean (SD), year 55.18 (16.95) 46.33 (19.60) 38.78 (11.92) 41.44 (14.23) 0.0008 BMI, mean (SD), kg/m2 20.86 (2.31) 21.67 (1.37) 21.18 (3.06) 21.27 (2.87) 0.860 Farmer, n (%) 1 (9.09) 1 (16.67) 6 (8.82) 8 (9.41) 0.625 Local, n (%) 11 (100.00) 6 (100.00) 26 (38.24) 43 (50.59) 0.000 BCG vaccination, n (%) 9 (100.00) 4 (80.00) 67 (98.53) 80 (94.11) 0.795 Bacteriological positive, n (%) 6 (66.67) 4 (66.67) 48 (70.59) 58 (68.23) 0.854 Comorbidity condition Hypertension, n (%) 2 (18.18) 1 (16.67) 5 (7.35) 8 (9.41) 0.427 Diabetes type II, n (%) 2 (18.18) 1 (16.67) 8 (11.76) 11 (12.94) 0.808 Smoking, n (%) 5 (45.45) 1 (16.67) 52 (76.47) 58 (68.24) 0.002 Drinking', '. Individuals with type-2 diabetes at the day of examina- tion were excluded. In total, 292 non-diabetic individuals were included in the protocol. All had North European ethnicity. At the time of the current physical examination, 96 (33%) of study volunteers were lean with BMI , 25 kg m22, 27 (9%) were overweight with BMI between 25 and 30kgm22, and 169 (58%) were obesewithBMI.30 kg m22,accordingtoWorldHealthOrganizationdefinitions52. The study was approved by the local Ethical Committees of the Capital Region of Denmark (HC-2008-017), and was in accordance with the principals of the Decla- ration of Helsinki. All individuals gave written informed consent before participa- tion in the study. Phenotyping. The participants were examined on two different dates, approxi- mately 14 days apart. On the first day, participants were examined in the morning after an overnight fast', '. The exclusion criteria included chronic inflammatory disease, antibiotic treatment during the preceding 3 months, and type 1 diabetes. This study collected data on disease history, medication use and smoking habits, and performed anthropometric measurements. Qin_2012 (Shenzhen cohort). We included the publicly available sequence data from this study and obtained additional data on bio- markers and medication use from the authors. The Shenzhen cohort recruited 368 female and male individuals with a mean age of 50 years with T2D, prediabetes or normoglycemic status in Shenzhen, China6. Participants who received antibiotic treatment in the 2 months before sample collection were excluded from this study. Wu_2020. Our study included sequence data stored at a public reposi- tory. The original authors transferred phenotypic and biomarker data to us. This study included two cohorts that recruited random sample populations of men and women aged 50–64 years from the Gothen- burg area, Sweden10', '. In addition, participants who did not understand Swedish and were born outside Sweden were excluded. Zhong_2019 (Suzhou cohort). Our study included sequence data stored at a public repository, and additional data on biomarkers and medication use in the Suzhou cohort that were obtained from the authors. The Suzhou cohort recruited community-dwelling men and women (mean age, 62 years) in Suzhou, consisting of 97 normoglycemic participants, 80 prediabetes participants and 77 T2D patients11. All of', '. This study has some limitations: The sample size could be bigger to establish a stronger statement regarding this study’s conclusion, although the size used here is in line with other similar conducted studies (11, 15). Future studies must include various populations with a bigger sample size to generalize the ﬁndings. Participants were not matched by age and gender. However, when we analyzed the differences in these two parameters between case and control, we found that age was signiﬁcantly different. We, therefore, adjusted for age in some of our statistical models. In addition, the healthy group was sampled at a different time than the TB patients and some of the differences between the cohorts may be explained by batch effects associated with these differences. Another limitation of our study is that while we have control data from the microbiome, we did not collect metabolome or cytokines information for healthy controls', 'Data availability statement The data presented in the study are deposited in the BioProject repository, accession number is PRJNA901399. The link for data can be found below: https://www.ncbi.nlm.nih.gov/ bioproject/901399. Ethics statement The studies involving human participants were reviewed and approved by Afﬁliated Dongyang Hospital of Wenzhou Medical University, Zhejiang, China. The patients/participants provided their written informed consent to participate in this study. Author contributions Study concept and design: XL, YL; Specimen collection: LW, SY, QD; Analysis and interpretation of data and statistical analysis: SL, SY, XW, XJ; Drafting the manuscript: XL, SY, YW. The authors thank the GUHE Info technology, Co., Ltd., (Hangzhou, China) for expert technical advice. All authors contributed to the article and approved the submitted version. Funding This work was supported by grants from National Science and Technology Major Project (No', ', which led to the need of additional studies or bigger sample size to understand the speciﬁc role of Prevotella and its family in progression of PD.273 Differences in genotype, diet, and lifestyles of the population subsets might be a potential reason for this disparity in reports', '. (2019) Feng, Q. (2015) Yu, J. (2017) Zeller, G. (2014) Wirbel, J. (2019) Yachida, S. (2019) Vogtmann, E. (2016) Thomas, A.M. (2019) This study Cohort 2 Cohort 5 Cohort 6 Cohort 4 Cohort 3 Cohort 1 Liu, N.N. (2022) Obón-Santacana, M. (2022) Yang, J. (2020) Yang, Y', '. To facilitate comparison with published data, we analyzed relative abundances of bacterial taxa in sampled groups (TB patients and controls) at different taxonomic levels by aggregating strains and species into genus, family, order, class, and phylum. We used linear discriminatory analysis with effect size estimation (LEfSe) implemented in the microbial R package to identify bacterial taxa that characterize differences between patients and controls. We also computed the average proportion of each taxon between patients and controls at different levels (e.g., phylum and class). A statistical difference in proportions between groups was tested using the ANCOM statistical framework (Mandal et al., 2015) using the FDR (false discovery rate) approach to adjust p- values. When we tested average proportions using ANCOM, we were interested in comparing dominant taxa between groups. Therefore, we required bacterial taxa to be present in 25% of donors at an abundance of 5% or more']","['14-Richness of human gut microbiome correlates with metabolic markers(Obesity).pdf', '15-Changes in gut microbiome following anti-tuberculosis treatment- a prospective cohort from eastern China.pdf', '17-Excess fermentation and lactic acidosis as detrimental functions of the gut microbes in treatment-naive TB patients.pdf', '22-Metabolic and immune consequences of antibiotic related microbiome alterations during first-line tuberculosis treatment in Bamako, Mali.pdf', '23-The correlation between dysfunctional intestinal flora and pathology feature of patients with pulmonary tuberculosis.pdf', '25-Pooled analysis of 3,741 stool metagenomes from 18 cohorts.pdf', '28-Strain-specific gut microbial signatures in type 2 diabetes identified in a cross-cohort analysis of 8,117 metagenomes.pdf', '5-Microbiota in health and diseases.pdf']",-0.2071,easy,factual
microbiome_richness_mcq_002,What percentage of genes that differed significantly between LGC and HGC could be assigned to known bacterial genomes?,8.5%,15.8%,23.4%,40.2%,A,"The correct answer is B.

This question requires a specific knowledge of the study mentioned in the provided text, which discusses the comparison of gene expression between LGC (Low Grade Cervical Cancer) and HGC (High Grade Cervical Cancer). The question specifically asks about the percentage of genes that differed significantly between these two types of cancer that could be assigned to known bacterial genomes.

Without access to the specific study or data, I can only provide a general answer based on common practices in such studies. Typically, when comparing gene expression between different conditions or samples, researchers often use bioinformatics tools to identify and annotate genes with known functions or origins. If a significant proportion of genes that differed between LGC and HGC could be assigned to known bacterial genomes, it would suggest a substantial impact of bacterial presence on the cancer's gene expression profile.

Given this context, option B (15.8%) seems like a plausible answer, as it is not too high or too low compared to what might be expected in such studies. However, without access to the specific data or study, I can only provide a general justification based on common practices in bioinformatics and genomics research.

Option: B","['. 2 and Supplementary Table 4). BLASTP analysis indicated that 37% and 92% of the clusters had at least 80% of the genes with the sametaxonomyatagenusandphylumlevel,respectively,avaluesimilar to that observed for all clusters analysed in this paper (Supplementary Fig. 11). HITChip and BLASTP taxonomic assignments were not fully overlapping but whenever both were available they were congruent; when combined, up to 63% of the species could be assigned to a genus. However, there was no obvious stratification of the species prevalent in LGC and HGC individuals at this taxonomic level (Supplementary Table 4). To test whether LGC and HGC individuals could be distinguished by the bacterial species they contain, we performed a receiver operating characteristic (ROC) analysis. First, we estimated the abundance of 58 species that were significantlydifferent in abundance between LGC and HGC individuals (Supplementary Table 6)', '. gnavus35, associated with IBD36,37 and found to be more frequent in LGC individuals. However, a vast majority (.90%) of the 120,723 genes with signifi- cantly differing abundances between the LGC and HGC gene indivi- duals could not be assigned to a known bacterial genome. These genes must also belong to bacterial species that are present at different abun- dancesinthetwogroupsofindividuals.Wethusattemptedtoclusterthe genes from the same species using a gene abundance-based approach. We proposed that the genes of a given bacterial species should be present at a similar abundance in an individual but should display large variations across a cohort, as species abundance is known to vary immensely among individuals (10–10,000-fold)22', 'species.Wetestedthishypothesisforthe10,225taxonomicallyassigned genes that differ significantly between LGC and HGC individuals, by computing the Spearman correlation coefficients for each gene with all the other genes and grouping those that were correlated above a given threshold. A large majority (8,125; 79.4%) clustered into only 8 groups that included the 9 most highly represented species shown in Fig. 2 (Clostridium bolteae and C. clostridioforme genes were in the same group). The specificity and the sensitivity of clustering were very high (average of 97.8% and 91.8%, respectively, for 7 homogeneous groups), indicatingthatthe approachisefficient and can beusedtocluster all the significantly different genes. In total, 76,564 genes (63% of 120,723) were grouped into 1,440 clusters of two or more genes at a threshold of rho . 0.85, used to favour the specificity of clustering', '. Next, we studied the specific species that were differentially abun- dant between LGC and HGC individuals. In this approach, we identi- fied the genes that were significantly different between the LGC and HGC individuals by the Wilcoxon rank-sum test, comparing 204 (70% oftotal) randomlychosenindividuals30times.Wesimilarlycompared 126 ‘extreme’ individuals, containing ,400,000 genes or .600,000 genes. A total of 120,723 genes were found in all 60 tests at P , 0.0001 and were analysed further. We searched for genes from the same species by comparison with all sequenced genomes (Supplementary Materials). At a threshold of 95% identity (the species-level cut-off23) over at least 90% of the gene length, 10,225 genes (8.5%) were assigned to a total of 97 genomes representing some 73 species (Supplementary Table 3). However, a vast majority (93.4%) belonged to only 9 species, which varied signi- ficantly in abundance between the LGC and HGC individuals, as illustrated in Fig', '. a, Presence and abundance of 50 ‘tracer’ genes for representative species differentially abundant in LGCand HGC groups; Mann– Whitney probability (q value, FDR adjusted40) is given. Genes are in rows, frequency is indicated by colour gradient (white, not detected; red, most abundant); individuals, ordered by increasing gene number, are in columns, proportion of the tracer genes in individuals is shown on the right. Top, known species; bottom, unknown species. C. bolteae, Clostridium bolteae; C. clostridioforme, Clostridium clostridioforme; C. eutactus, Coprococcus eutactus; C. ramosum, Clostridium ramosum; C. symbiosum, Clostridium symbiosum; F. prausnitzii, Faecalibacterium prausnitzii; M. smithii, Methanobrevibacter smithii; R. gnavus, Ruminococcus gnavus; R. inulinivorans, Roseburia inulinivorans. b, Left, AUC values for the best combinations of species in a ROC analysis. Right, AUC for the best combination of four species', '. First, we estimated the abundance of 58 species that were significantlydifferent in abundance between LGC and HGC individuals (Supplementary Table 6). For each individual, we used these values to compute a score, named decisive bacterial abund- ance (DBA) score, equal to the sum of abundances of the species more frequent in HGC individuals subtracted by the sum of the abundances of species more frequent in LGC individuals. The DBA scores were calculated exhaustively for all combinations of up to 19 species and were used in the ROC analysis; the area under curve (AUC) values for the best combinations are shown in Fig. 2b, left. The best combina- tion of four species gave an AUC value of 0.98 (Fig. 2b, right); in a tenfold cross-validation test40 with 90% of randomly chosen individuals the AUC value of 0.9766 0.02 (mean6 s.d.) was obtained for the groups of the remaining 10%, indicating the robustness of the analysis', '. These observations point to the capacity of our clustering method to group genes not only of bacteria but also of mobile and promiscuous elements, and indicate a potential source of false positives, as regards grouping of genes from a single species. Identification of all the catalogue genes that co-vary by abundance with the tracer genes could probably help to differentiate clusters that represent bacterial species from those that originate from promiscuous genetic elements, as the former should include substantially more genes than the latter (species encode mostly .500 genes while the promiscuous genetic elements encode generally ,100). Such systematic ana- lysis is, however beyond the scope of the current work. (2) Abundance covariance of the genes of each cluster was computed across all individuals of our cohort and also across the French cohort from the accompany- ing manuscript24', '. Area under the ROC Curve (AUC) (cz, 80.74%) >AUC (jk, 78.96%) > AUC (fz, 71.74%). (E) Kyoto Encyclopedia of Genes and Genomes pathway of the enrichment. (F) The interactions of the microorganisms. The line between nodes shows positive correlations (red lines) or negative correlations (green lines). Each dot is a different color, representing a different genus of bacteria. The size of the node is directly linked to the average relative abundance of the genus within the enriched population. Chai et al. 10.3389/fimmu.2024.1323723 Frontiers in Immunology frontiersin.org 06', '. (A). The average relative abundance of bacterial taxa at the phylum level in TB patients and HCs. Asterisks indicate taxa that showed statistically signiﬁcant differences between the TB group and HCs based on the ANCOM statistical analysis (P < 0.05); (B). Barplot depicting top bacterial species (LDA scores > 4.5) discriminating between groups. Yunusbaeva et al. 10.3389/fcimb.2024.1331521 Frontiers in Cellular and Infection Microbiology frontiersin.org 05', '. For example, we identiﬁed an increase in pathways producing cell wall components such as peptidoglycan, lipopolysaccharide, and the enterobacterial common antigen (DTDPRHAMSYN-PWY; UDPNAGSYN-PWY; PWY-6386; PWY-7315; PWY0-1241; PWY-1269; PWY0-1586) (Supplementary Figure 5). For these pathways, we computed each bacterial genus and family’s contribution. This information allowed us to learn about bacterial taxa that are likely assembling cell walls at an increased pace (Supplementary Figure 5). Our analysis identiﬁed major contributors (taxa contributing more than 1% of the total) from the following families: Enterobacteriaceae, Streptococcaceae, Desulfovibrionaceae, Lachnospiraceae, Ruminococcaceae, Eubacteriaceae, Clostridiales, Prevotellaceae, Selenomonadaceae, Hafniaceae, Bacteroidaceae, and Vibrionaceae, belonging mainly to the phylum Proteobacteria, Firmicutes, and Bacteroidetes']","['14-Richness of human gut microbiome correlates with metabolic markers(Obesity).pdf', '17-Excess fermentation and lactic acidosis as detrimental functions of the gut microbes in treatment-naive TB patients.pdf', '20-Gut microbiome, T cell subsets, and cytokine analysis identify differential biomarkers in tuberculosis.pdf']",0.1552,easy,factual
microbiome_richness_mcq_003,How many bacterial species clusters were sufficient to achieve near-perfect discrimination between LGC and HGC individuals?,2 species,4 species,9 species,18 species,B,"Unfortunately, I don't have the specific information about the study or research that you're referring to regarding bacterial species clusters and their ability to discriminate between LGC (Low Genetic Contribution) and HGC (High Genetic Contribution) individuals. However, given the nature of such studies which often involve complex genetic analysis and microbial profiling for discrimination purposes, it's plausible that a smaller number of carefully selected species could be sufficient for near-perfect discrimination.

Given this context, I would lean towards:

Option: A

Explanation: This is because using only 2 species might provide a balance between specificity and sensitivity in the discrimination process, assuming these species are well-chosen based on their genetic markers or other relevant characteristics.","['. 2 and Supplementary Table 4). BLASTP analysis indicated that 37% and 92% of the clusters had at least 80% of the genes with the sametaxonomyatagenusandphylumlevel,respectively,avaluesimilar to that observed for all clusters analysed in this paper (Supplementary Fig. 11). HITChip and BLASTP taxonomic assignments were not fully overlapping but whenever both were available they were congruent; when combined, up to 63% of the species could be assigned to a genus. However, there was no obvious stratification of the species prevalent in LGC and HGC individuals at this taxonomic level (Supplementary Table 4). To test whether LGC and HGC individuals could be distinguished by the bacterial species they contain, we performed a receiver operating characteristic (ROC) analysis. First, we estimated the abundance of 58 species that were significantlydifferent in abundance between LGC and HGC individuals (Supplementary Table 6)', '. First, we estimated the abundance of 58 species that were significantlydifferent in abundance between LGC and HGC individuals (Supplementary Table 6). For each individual, we used these values to compute a score, named decisive bacterial abund- ance (DBA) score, equal to the sum of abundances of the species more frequent in HGC individuals subtracted by the sum of the abundances of species more frequent in LGC individuals. The DBA scores were calculated exhaustively for all combinations of up to 19 species and were used in the ROC analysis; the area under curve (AUC) values for the best combinations are shown in Fig. 2b, left. The best combina- tion of four species gave an AUC value of 0.98 (Fig. 2b, right); in a tenfold cross-validation test40 with 90% of randomly chosen individuals the AUC value of 0.9766 0.02 (mean6 s.d.) was obtained for the groups of the remaining 10%, indicating the robustness of the analysis', '. These observations point to the capacity of our clustering method to group genes not only of bacteria but also of mobile and promiscuous elements, and indicate a potential source of false positives, as regards grouping of genes from a single species. Identification of all the catalogue genes that co-vary by abundance with the tracer genes could probably help to differentiate clusters that represent bacterial species from those that originate from promiscuous genetic elements, as the former should include substantially more genes than the latter (species encode mostly .500 genes while the promiscuous genetic elements encode generally ,100). Such systematic ana- lysis is, however beyond the scope of the current work. (2) Abundance covariance of the genes of each cluster was computed across all individuals of our cohort and also across the French cohort from the accompany- ing manuscript24', '. gnavus35, associated with IBD36,37 and found to be more frequent in LGC individuals. However, a vast majority (.90%) of the 120,723 genes with signifi- cantly differing abundances between the LGC and HGC gene indivi- duals could not be assigned to a known bacterial genome. These genes must also belong to bacterial species that are present at different abun- dancesinthetwogroupsofindividuals.Wethusattemptedtoclusterthe genes from the same species using a gene abundance-based approach. We proposed that the genes of a given bacterial species should be present at a similar abundance in an individual but should display large variations across a cohort, as species abundance is known to vary immensely among individuals (10–10,000-fold)22', 'species.Wetestedthishypothesisforthe10,225taxonomicallyassigned genes that differ significantly between LGC and HGC individuals, by computing the Spearman correlation coefficients for each gene with all the other genes and grouping those that were correlated above a given threshold. A large majority (8,125; 79.4%) clustered into only 8 groups that included the 9 most highly represented species shown in Fig. 2 (Clostridium bolteae and C. clostridioforme genes were in the same group). The specificity and the sensitivity of clustering were very high (average of 97.8% and 91.8%, respectively, for 7 homogeneous groups), indicatingthatthe approachisefficient and can beusedtocluster all the significantly different genes. In total, 76,564 genes (63% of 120,723) were grouped into 1,440 clusters of two or more genes at a threshold of rho . 0.85, used to favour the specificity of clustering', '. Forty-six genera differed significantly in abundance between the HGC and LGC individuals (Supplementary Table 2). Although Bacteroides, Parabacteroides, Ruminococcus (spe- cifically R. torques and R. gnavus), Campylobacter, Dialister, Porphy- romonas, Staphylococcus and Anaerostipes were more dominant in LGC, 36 genera, including Faecalibacterium, Bifidobacterium, Lacto- bacillus, Butyrivibrio, Alistipes, Akkermansia, Coprococcus and Metha- nobrevibacter, were significantly associated with HGC. For 33 of these, genera probes were present on the HITChip and their abundance was determined (Supplementary Table 2); the correlation with read map- ping was very high (Pearson’s r of 0.85 and 0.90 in HGC and LGC individuals, respectively). At the phylum level, this phylogenetic shift resulted in a higher abundance of Proteobacteria and Bacteroidetes in LGC individuals versus increased populations of Verrucomicrobia, Acti- nobacteriaandEuryarchaeotainHGCindividuals(SupplementaryFig.4)', '. The values were very close to the mean fre- quency of all the genes of a cluster. ROC analysis. The analyses were carried out to distinguish between HGC and LGC individuals or lean and obese individuals by a combination of bacterial species. For each combination, only a single decision model was considered. In this very specific regression model weights are only allowed to take the values in (0, 21, 1). More precisely, the weight of each species in a given combination that belong to the set of the species more frequent in one group is equal to 1, whereas that of the species that belong to the set of species more frequent in the other group is equal to 21. The weight of each species that is outside of the combination is 0. For each individual, this model yields a DBA score', '. a, Presence and abundance of 50 ‘tracer’ genes for representative species differentially abundant in LGCand HGC groups; Mann– Whitney probability (q value, FDR adjusted40) is given. Genes are in rows, frequency is indicated by colour gradient (white, not detected; red, most abundant); individuals, ordered by increasing gene number, are in columns, proportion of the tracer genes in individuals is shown on the right. Top, known species; bottom, unknown species. C. bolteae, Clostridium bolteae; C. clostridioforme, Clostridium clostridioforme; C. eutactus, Coprococcus eutactus; C. ramosum, Clostridium ramosum; C. symbiosum, Clostridium symbiosum; F. prausnitzii, Faecalibacterium prausnitzii; M. smithii, Methanobrevibacter smithii; R. gnavus, Ruminococcus gnavus; R. inulinivorans, Roseburia inulinivorans. b, Left, AUC values for the best combinations of species in a ROC analysis. Right, AUC for the best combination of four species', '. Next, we studied the specific species that were differentially abun- dant between LGC and HGC individuals. In this approach, we identi- fied the genes that were significantly different between the LGC and HGC individuals by the Wilcoxon rank-sum test, comparing 204 (70% oftotal) randomlychosenindividuals30times.Wesimilarlycompared 126 ‘extreme’ individuals, containing ,400,000 genes or .600,000 genes. A total of 120,723 genes were found in all 60 tests at P , 0.0001 and were analysed further. We searched for genes from the same species by comparison with all sequenced genomes (Supplementary Materials). At a threshold of 95% identity (the species-level cut-off23) over at least 90% of the gene length, 10,225 genes (8.5%) were assigned to a total of 97 genomes representing some 73 species (Supplementary Table 3). However, a vast majority (93.4%) belonged to only 9 species, which varied signi- ficantly in abundance between the LGC and HGC individuals, as illustrated in Fig', '. Analyses of the 50 genes from the clusters with known taxonomic assignment have shown that they are present on cognate genomes only and on all cognate genomes (Supplementary Table 5). By extra- polation, we suggest that the same holds true for unknown groups and that the cluster genes can be used as tracers for the species they derive from. Average abundance of the tracer genes was thus equated to the average abundance of the cognate species. Distribution of unknown species across LGC and HGC individuals of the cohort was clearly biased (Fig. 2a, lower part, and Supplemen- tary Fig. 10). Genes for 10 of the species and the Bacteroides genus were present on the metagenomic arrays (Methods); in all cases the HGC/LGC bias found by sequencing was also detected by the arrays (Fig. 2 and Supplementary Table 4)']",['14-Richness of human gut microbiome correlates with metabolic markers(Obesity).pdf'],0.3329,easy,factual
microbiome_richness_mcq_004,"At what phylum level, what shift was observed in LGC versus HGC individuals?","Higher Firmicutes in LGC, higher Bacteroidetes in HGC","Higher Proteobacteria and Bacteroidetes in LGC, higher Verrucomicrobia and Actinobacteria in HGC","Higher Actinobacteria in LGC, higher Proteobacteria in HGC",Equal distribution of all phyla in both groups,B,"A

The question is asking about a shift in the phylum level between two groups (LGC and HGC). The correct answer, Option A, suggests that there was a shift towards higher Firmicutes in LGC and higher Bacteroidetes in HGC. This implies a change in the relative abundance of these two phyla between the two groups.","['. Forty-six genera differed significantly in abundance between the HGC and LGC individuals (Supplementary Table 2). Although Bacteroides, Parabacteroides, Ruminococcus (spe- cifically R. torques and R. gnavus), Campylobacter, Dialister, Porphy- romonas, Staphylococcus and Anaerostipes were more dominant in LGC, 36 genera, including Faecalibacterium, Bifidobacterium, Lacto- bacillus, Butyrivibrio, Alistipes, Akkermansia, Coprococcus and Metha- nobrevibacter, were significantly associated with HGC. For 33 of these, genera probes were present on the HITChip and their abundance was determined (Supplementary Table 2); the correlation with read map- ping was very high (Pearson’s r of 0.85 and 0.90 in HGC and LGC individuals, respectively). At the phylum level, this phylogenetic shift resulted in a higher abundance of Proteobacteria and Bacteroidetes in LGC individuals versus increased populations of Verrucomicrobia, Acti- nobacteriaandEuryarchaeotainHGCindividuals(SupplementaryFig.4)', '. A vast majority of commensal bacteria reside in the colon, whereas a lower bacterial population is found in the stomach and small intestine. The main bacterial phyla present in the gut are Firmicutes and Bacteroides, which make up 90% of the gut microbiota.46 Other phyla that exist in the gut environment are Actinobacteria, Proteobacteria, Fusobacteria, and Verrucomi- crobia.46 Notably, there are 200 different genera found under the Firmicutes phylum, with some examples including Bacillus, Lactobacillus, Enterococcus, Clostridium, and Ruminococcus. Although lactobacilli are beneficial to health, some Firmicutes species such as Staphylococcus aureus and Clostridium perfringens are harmful to the body when overgrown. Meanwhile, the predominant genera in Bacteroidota are Bacteroides and Prevotella. The less abundant Actinobacteria phylum is largely represented by Bifidobacterium, and this genus is known to have a positive impact on health', 'Del Chierico et al. Gut Microbiota Age-Dependent Patterns in Obesity and Verrucomicrobia). Applying the Kruskal–Wallis test on the relative abundances of phyla for the four groups, we observed statistically signiﬁcant diﬀerences in the distributions of Actinobacteria, Bacteroidetes, and Firmicutes (p < 0.05). However, a false discovery rate (FDR) correction of p-values deﬁned Actinobacteria as the only signiﬁcant taxon diﬀerentially describing the four groups (Figure 2A and Supplementary Table S1). Particularly, the distribution of Actinobacteria and Bacteroidetes were statistically signiﬁcant for the ob_ado/ob_adult couple, with Actinobacteria levels being higher in the ob_ado group, and Bacteroidetes levels being uppermost in the ob_adult group. Actinobacteria, Bacteroidetes, and Firmicutes were statistically signiﬁcant for adolescent obese versus CTRL (Supplementary Table S2)', '. 1c, Table S2). At the genus level, the variation trend of dominant bacterial genera (an abundance > 0.1% in the two groups) is shown in Table S3. Among the dominant microbiota, the abundance of Bacteroides, Prevotella, and Feacalibacterium was higher, and the abundance of Blautia, Bifidobacterium, and Eubacterium_ hallii_group were lowered in the TB group vs. HC group (Fig. 1d). To better understand the difference in micro\xad biota between the two groups, we further performed a LEfSe analysis according to a linear discriminant analysis (LDA) score ≥ 4.0. The results of LEfSe analysis showed that 11 key genera were different between the two groups (Fig. 1e). The cladogram Figure (from phylum to genus level) shows that altered genera mainly belonged to Bac\xad teroidetes, Firmicutes, and Proteobacteria (Fig. 1f). Over\xad all, our data indicate that the gut bacterial diversity and composition have been altered in TB patients', '. The PTB and HC groups had statistically signiﬁcant differences in ﬁve predominant phyla: Firmicutes, Bacteroidetes, Acti- nobacteria, Fusobacteria and Verrucomicrobia. The rela- tive abundances (proportions) of Firmicutes and Bacteroidetes were 63.81% and 27.82% in the HC group and 48.84% and 44.92% in the PTB group respectively (Fig. 2A). At the family level, the PTB group had signiﬁcantly greater abundances of Bacteroidaceae (30.36% vs. 17.19%, q = 0.004), Tannerellaceae (2.38% vs. 0.94%, q = 0.019), Fusobacteriaceae (2.15% vs. 0.17%, q = 0.014) and Erysipelotrichaceae (1.44% vs. 0.89%, q = 0.034) than the HCs group. The PTB group also had markedly lower abundances of Biﬁdobacteriaceae (0.9% Table 1', '. (A). The average relative abundance of bacterial taxa at the phylum level in TB patients and HCs. Asterisks indicate taxa that showed statistically signiﬁcant differences between the TB group and HCs based on the ANCOM statistical analysis (P < 0.05); (B). Barplot depicting top bacterial species (LDA scores > 4.5) discriminating between groups. Yunusbaeva et al. 10.3389/fcimb.2024.1331521 Frontiers in Cellular and Infection Microbiology frontiersin.org 05', '. The most highly represented phyla in the gastric mucosa under normal conditions are Proteobacteria, Firmicutes (recently renamed to Bacillota36), Bacteroidetes (recently renamed to Bacteroidota36), Actinobacteria, and Fusobacte- ria.37−39 The gastric juice has a diverse microbial community that differs from the gastric mucosa. The dominating phyla in gastric juice are Firmicutes, Actinobacteria, and Bacteroidetes, whereas Proteobacteria and Firmicutes are dominant in the gastric mucosa.37,40,41 Furthermore, bacteria found in the oral cavity and duodenum such as Veillonella, Lactobacillus, and Clostridium can transiently colonize the stomach.40,42 Unsurprisingly, H. pylori is the predominant bacterium in the stomach of H. pylori-infected patients,43 and most H', '. The less abundant Actinobacteria phylum is largely represented by Bifidobacterium, and this genus is known to have a positive impact on health. Under the Proteobacteria phylum, some well-known pathogens include Enterobacter, Helicobacter, Shigella, Salmonella, and Escherichia coli. The composition of the gut microbiota changes at three stages in life: from birth to weaning; from weaning to obtaining a normal diet; and finally, during old age', '. The increased level of LDLC and TC was associated with the altered gut bacteria as shown in Figure 4. The LDLC level was negatively associated with Verrucomicrobia (r = −0.437, p = 0.006), Akkermansia (r = −0.437, p = 0.006) and Streptococcus (r = −0.341, p = 0.036), and it was positively associated with Adlercreutzia (r = 0.342, p = 0.036), Clostridioides (r = 0.392, p = 0.015), Fusicatenibacter (r = 0.389, p = 0.016), Lachnospiraceae ND3007 group (r = 0.406, p = 0.012), Prevotellaceae NK3B31 group (r = 0.358, p = 0.027), Eubacterium xylanophilum group (r = 0.361, p = 0.026) and Eubacterium ruminantium group (r = 0.405, p = 0.012)', '. Both principal component 1 and principal component 2 were driven by the recovered group, which was clustered onto the top and left corner and separated from the other groups. To further illustrate the alteration of the gut microbiota, a LEfSe analysis was performed at the phylum level. Three phyla were identiﬁed as the biomarkers (LDA > 2) that diﬀerentiated the treated group from its control group, including Actinobacteria, Bacteroidetes and Firmicutes (Supplementary Figure S1A). Three phyla were identiﬁed as the biomarkers (LDA > 2) that diﬀerentiated the recovered group from its control group, including Bacteroidetes, Cyanobacteria, and Patescibacteria (Supplementary Figure S1B). The relative abundance of Actinobacteria and Firmicutes declined (p = 0.009 for Actinobacteria and p = 0.029 for Firmicutes) under the MDR-TB treatment and rebounded to the pretreated level after discontinuing the MDR-TB treatment (Figure 3)']","['13-Gut Microbiota Markers in Obese Adolescent and Adult Patients(Obese).pdf', '14-Richness of human gut microbiome correlates with metabolic markers(Obesity).pdf', '16-Characteristic gut microbiota and metabolic changes in patients with pulmonary tuberculosis.pdf', '17-Excess fermentation and lactic acidosis as detrimental functions of the gut microbes in treatment-naive TB patients.pdf', '19-Gut bacterial and fungal dysbiosis in tuberculosis patients.pdf', '21-Long-Term Effects of Multi-Drug-Resistant Tuberculosis Treatment on Gut Microbiota and Its Health Consequences.pdf', '6-Microbiome and Human Health.pdf']",0.2186,medium,factual
microbiome_richness_mcq_005,What was the average number of paired-end reads produced per sample and how many uniquely mapped to the gene catalogue?,19.9 ± 6.7 million uniquely mapped from 34.1 million total,34.1 ± 6.7 million uniquely mapped from 19.9 million total,68.2 ± 12.0 million uniquely mapped from 34.1 million total,11.0 ± 2.0 million uniquely mapped from 26.0 million total,A,"Option: A

